2025-08-01,620600,Diana Sting Κάλτσα Ανδρική Βαμβακερή Μαύρη,3.37
2025-08-01,720525,Carroten Magic Tan & Protect Αντηλιακό Γαλάκτωμα Spray SPF30 200ml,9.73
2025-08-01,654017,Tesori Body Cream White Musk 300ml,9.80
2025-08-01,716008,Bioten Supreme Hyaluronic Body Lotion 250ml,3.54
2025-08-01,707630,Nivea Men Gel Ξυρίσματος Sensitive Cooling 200ml,3.78
2025-08-01,720961,Nivea Sun Protect & Bronze Oil SPF30 200ml,9.60
2025-08-01,653631,Syoss Oleo Βαφή Φυσικό Ξανθό 7-10,5.79
2025-08-01,704793,Wella Flex Λακ Εxtra Όγκος Πολύ Δυνατό 250ml,3.42
2025-08-01,709522,Gillette Fusion Power Ανταλλακτικά 4τεμ,20.97
2025-08-01,716466,Bioten Bodyshape Αντικυτταριδικό Gel 200ml,6.58
2025-08-01,719522,Durex Play Λιπαντικό Perfect Glide 50ml,9.99
2025-08-01,706819,Clean & Clear Scrub 150ml,3.29
2025-08-01,705343,L'OREAL Excellence Cream No 1 Μαύρο 48ml,5.84
2025-08-01,756889,Beauty Formula Scrub Προσώπου Αγγούρι Αβοκάντο 150ml,3.67
2025-08-01,704578,L'OREAL Styling Studio Line Special FX Radical Gel 150ml,7.99
2025-08-01,774803,Got2b Mousse Curls 250ml,5.73
2025-08-01,620249,BIC Vivant Καλσόν Ελαστικό Μελί 40D XLarge,4.20
2025-08-01,620073,BIC Molas Καλσόν Ελαστικό Μελί 20D XLarge,3.36
2025-08-01,702868,Elvive Conditioner Growth Booster Κατά της Τριχόπτωσης 150ml,6.30
2025-08-01,756047,Nivea Cellular Ορός Επιπλέον Ογκου Filler Expert 30ml,11.75
2025-08-01,706439,Nivea Radiance Νερό Ντεμακιγιάζ Waterproof 125ml,3.07
2025-08-01,710133,Designer Σπέυ Σώματος Freshness Our Way 100ml,2.48
2025-08-01,706397,Nivea Νερό Καθαρισμού Skin Glow 1400ml,4.00
2025-08-01,701213,L'oreal Κρέμα Ημέρας Daily UV Vitamin C Glow 40ml,5.89
2025-08-01,775870,Dove Αφρόλουτρο Nour Care 400ml,2.65
2025-08-01,771303,Head & Shoulders 2in1 Citrus Fresh 330ml,5.81
2025-08-01,717429,Αxe Αποσμητικό Σώματος Stick Dark Temptation 50ml,3.00
2025-08-01,526069,Cover Ανατομικοί Πάτοι Παπουτσιών Νο 41-46,4.50
2025-08-01,702695,Elvive Conditioner Bond Repair 150ml,6.30
2025-08-01,620320,Diana Casual Τερλίκι Λεπτές Μαύρες 5/2τεμ,2.75
2025-08-01,716576,Hellenia Ταινίες Αποτρίχωσης 50τεμ,1.69
2025-08-01,771200,HD Conditioner Διφασικό Σπρεύ Για Ξηρά Ταλαιπωρημένα Μαλλιά 150ml,5.29
2025-08-01,720088,Ambre Solaire Γαλάκτωμα Sensitive Advanced Kids SPF50+ 150ml,9.40
2025-08-01,710102,Gillette After Shave Splash Refreshing Arctic Ice 100ml,6.39
2025-08-01,706097,Nivea Derma Skin Clear Νυχτερινό Απολέπ. Κατά Των Πόρων 40ml,4.58
2025-08-01,620318,Pro Κάλτσες Γυναικείες Τερλίκι 3τεμ,2.50
2025-08-01,718487,Luxurius Pink Orchid Κρέμα Σώματος 280ml,8.20
2025-08-01,706066,Garnier Vitamin C Νερό Ντεμακιγιάζ 400ml,3.89
2025-08-01,702447,Gliss Conditioner Spray Aqua Revive 200ml,4.31
2025-08-01,765011,Syoss Oleo Βαφή Μαλλιών Καστανό Ανοιχτό Έντονο Χάλκινο Νο. 5-77,5.79
2025-08-01,762025,Oral-B IO Ultimate Clean Black Ανταλλακτικά,15.99
2025-08-01,720194,Ambre Solaire Sensitive Advanced Kids SPF50+ 150ML,9.80
2025-08-01,606320,Always Discreet Boutique Large Pants 8τεμ,10.29
2025-08-01,702525,Elvive Μάσκα Δράση Αργινίνης 680ml,10.66
2025-08-01,526171,Ringpoint Κορδόνια Φαρδιά Λευκά 150cm,4.12
2025-08-01,717862,STR8 Κολώνια Red Code 100ml,9.73
2025-08-01,703802,Zan Sot Αερόβουρτσα Τετράγωνη Μικρή,4.89
2025-08-01,704975,Flipper Gel Hard 250gr,2.92
2025-08-01,705634,Men Perfect N60 Φυσικό Καστανό Μεσαίο,9.55
2025-08-01,621173,Diana T-Shirt Ανδρικό Λευκό (S-M-L-XL-XXL),7.94
2025-08-01,710108,Axe After Shave Africa 100ml,9.48
2025-08-01,621500,BIC Azola Κάλτσα Γυναικεία Σοσόνι Διάφορα Χρώματα Σετ 3τεμ,4.77
2025-08-01,719401,Duo Προφυλακτικά Extra Thin 12 Τεμ,9.73
2025-08-01,765384,Koleston Βαφή Μαλλιών Νο 6/0 50ml,6.53
2025-08-01,765655,Garnier Color Sensation No 4.15 Παγωμένο Σοκολατί 40ml,3.53
2025-08-01,704774,Wella Flex Λακ Βαμμένα Μαλλιά Δυνατό 250ml,3.42
2025-08-01,705499,L'OREAL Excellence Cream No 9 Ξανθό Πολύ Ανοιχτό 48ml,5.84
2025-08-01,716987,Carnaby Viso Blue Αποτριχωτική Κρέμα Προσώπου 60ml,6.19
2025-08-01,716986,Carnaby Magic Blond Ξανθηντική Κρέμα 30gr,10.33
2025-08-01,705593,L'OREAL Excellence Cream No 5 Καστανό Ανοιχτό 48ml,5.84
2025-08-01,620032,BIC Mibas Καλτσάκι 3/4 20D Μαύρο Σετ 2τεμ,1.69
2025-08-01,706534,Garnier Επιθέματα Pimple Patches Hydrocolloid 22τεμ,9.99
2025-08-01,702871,Fructis Mask Keratin Sleek Λάμψη 370ml,5.39
2025-08-01,702869,Elvive Όρος Growth Booster 102ml,10.66
2025-08-01,706483,Bioten Κρέμα Hyaluronic Gold Uv Spf 50+ 50ml,10.07
2025-08-01,718000,Echo Κρέμα Urea hand Foot 5% 75ml,1.74
2025-08-01,734001,Taft Λακ Μαλλιών Aloe Boost 250ml,4.64
2025-08-01,704061,Wellaflex 7 in 1 Λόσιον Όγκου 100ml,4.55
2025-08-01,709185,Gillette Sensor 3 Sensitive Δώρο 8 Ανταλλακτικά Λαβή,7.54
2025-08-01,771415,Pantene Σαμπουάν Απαλά & Μεταξένια 625ml,5.03
2025-08-01,706432,Nivea Κρέμα Νυκτός Αντιρυτιδική Q10 Power 50ml,9.45
2025-08-01,606272,Sani Fresh Pants Εσώρουχα Ακράτειας Ν.2 Medium 14τεμ,8.78
2025-08-01,765063,Excellence Nudes 5u Βαφή Μαλλιών Καστανό Ανοιχτό 50ml,6.34
2025-08-01,706386,Liposan Sun Protect SPF50 4-8gr,3.36
2025-08-01,702797,Garnier Botanic Therapy Μάσκα Μαλλιών Rice Water & Starch Rituals 340ml,4.97
2025-08-01,720109,Ambre Solaire Αντιηλιακή Προσώπου SFP50+ 40ml,8.57
2025-08-01,706381,Syoss Treatment Serum Intense Plex 100ml,5.87
2025-08-01,716380,Dove Λοσιόν Σώματος Shea Butter 400ml,5.39
2025-08-01,702710,Gliss 4in1 Μάσκα Μαλλιών Bond Building Nourishment 400ml,5.76
2025-08-01,704036,Schwarzkopf Taft Λακ Μαλλιών Ultra HL4 250ml,4.64
2025-08-01,704031,Schwarzkopf Taft Λακ Power Cashmere HL5 250ml,4.64
2025-08-01,704000,Schwarzkopf Taft Styling Gel V12,5.45
2025-08-01,756043,Nivea Ορός Cellural Luminous Anti Age & Spot Serum 2 in 1 30ml,14.35
2025-08-01,701205,Mea Natura Gel Καθαρισμού Pomegranate 150ml,2.64
2025-08-01,701204,Colgate Οδοντόκρεμα Max White Radiance 75ml,7.04
2025-08-01,765056,Syoss Oleo Βαφή Μαλλιών Νο5-10 Καστανό Ανοιχτό,5.79
2025-08-01,706132,Liposan Hyaluron Lip Moisture 4-8gr,3.34
2025-08-01,716574,Hellenia Oliva Ρολέτα 100ml,1.62
2025-08-01,720093,Ambre Solaire Αντηλιακό Sensitive Antiage SPF50+ 50ml,8.57
2025-08-01,701190,Carroten Αντιλιακό Λάδι Σπρέυ SPFO 6 150m,6.98
2025-08-01,705029,Excellence Βαφή Μαλλιών Καθαρό Υπερ Ξανθό,5.84
2025-08-01,724083,Maybelline Μανό Fast Gel 11 Red Punch 40ml,4.04
2025-08-01,718485,Luxurius Icing Sugar Κρέμα Σώματος 280ml,8.20
2025-08-01,653158,New Wave Ultra Effect Go Matt Clay 75ml,6.98
2025-08-01,765022,HD Color Σετ Βαφής Μαλλιών Ν7 Ξανθό,4.15
2025-08-01,765027,HD Color Σετ Βαφής Μαλλιών Ν8 Ξανθό Ανοικτό,4.15
2025-08-01,703012,Zan Sot Klamer Κομμωτηρίου,1.49
2025-08-01,611046,Hansaplast Sensitive Επιθέματα 1mx8cm 10τεμ,4.01
2025-08-01,762024,Oral-B IO Ultimate Clean Ανταλλακτικά 2τεμ,15.99
2025-08-01,717034,Valley Sweet Almond Αποσμητικό Σώματος Σπρέι 100ml,2.41
2025-08-01,706169,Nivea Q10 Energy Κρέμα Ύπνου Ανάπλασης Ενέργειας 50ml,8.75
2025-08-01,756212,Nivea Men Active Age Κρέμα Προσώπου Για Ρυτίδες SPF 15 50ml,11.21
2025-08-01,756425,Nivea Cellular Lumin 630 Κρέμα Ημέρας Κατά Των Κηλίδων 40ml,13.74
2025-08-01,719092,Durex Naturals Λιπαντικό Gel Ενυδατικό 100ml,13.00
2025-08-01,709022,Gillette Fusion Manual Ξυριστική Μηχανή Με 2 Ανταλλακτικά,16.99
2025-08-01,606870,Slipad Pants Εσώρουχα Ακράτειας X-Large 10τεμ,7.48
2025-08-01,526264,Pedag Πάτοι Αποσμητικοί One Sisze,6.87
2025-08-01,716499,Nivea Aloe Hydration Body Lotion 250ml,3.74
2025-08-01,716197,Valley Body Milk Coconut 300ml,3.71
2025-08-01,720629,Piz Buin Tan & Protect Λάδι SPF30 150ml,8.79
2025-08-01,755136,Fa Αντρικό Αφρόλουτρο Sport Double Power- Power Boost 250ml,1.45
2025-08-01,756003,Nivea Cellular Anti-Age Eye Cream 15ml,11.00
2025-08-01,620734,Diana Ottima Σοσόνι Ελαστικό Ματ 15Den,1.55
2025-08-01,621627,Diana Σλιπ Γυναικείο Tai S-M.L.XL Μαύρο ή Λευκό,6.33
2025-08-01,716146,Vaseline Intensive Care Hand & Nail 75ml,2.44
2025-08-01,720306,Nivea Sun Protect & Bronze SPF30 200ml,10.40
2025-08-01,771567,Mea Natura Olive Strength & Softness Σαμπουάν Για Ξηρά 300ml,2.53
2025-08-01,719054,Hansaplast Elastic Kit Περιποίηση Πληγών,13.14
2025-08-01,765594,Garnier Color Sensation No 7-0 Ξανθό 40ml,3.53
2025-08-01,720146,Ambre Solaire Aντηλιακό Γαλάκτωμα After Sun 200ml,6.86
2025-08-01,756923,Johnson's Face Wipes Dry 25pcs,2.25
2025-08-01,704770,Wella Flex Αφρός Πολύ Δυνατός 200ml,3.52
2025-08-01,703528,Iris Βούρτσα Ν.2119,3.81
2025-08-01,621052,BIC Avigliano Κάλτσα Unisex Μαύρη Σετ 2,3.55
2025-08-01,704455,L'OREAL Elnett Satin Spray Δυνατό Κράτημα 400ml,9.99
2025-08-01,702874,Botanic Therapy Όρος Μαλλιών Revaval Θρέψη 120ml,4.78
2025-08-01,756069,L'oreal Κρέμα Προσώπου Revitalift Υαλουρονικό 50ml,13.83
2025-08-01,702842,Gliss Conditioner Full Hair Σπρέι Wonder 200ml,4.31
2025-08-01,710132,Tesori Κολώνια Royal Oud 100ml,10.95
2025-08-01,823944,My Style Ανδρικό T-Shirt 3 Pack,13.59
2025-08-01,709174,Gillette Venus Fig Ανταλλακτικά 3τεμ,14.99
2025-08-01,765080,Garnier Olia Βαφή Μαλλιών Χωρίς Αμμωνία Ν7.0 Ξανθό 50ml,5.76
2025-08-01,765075,Olia Βαφή Μαλλιών Χωρίς Αμμωνία Νο 1.0 Βαθύ Μαύρο 60ml,5.76
2025-08-01,765069,Olia Βαφή Μαλλιών Χωρίς Αμμωνία Νο 6.60 Έντονο Κόκκινο 60ml,5.76
2025-08-01,706398,Nivea Q10 Dual Acti Ορός Κατά Των Ρυτίδων 30ml,10.86
2025-08-01,765060,Excellence Reds Βαφή Μαλλιών 5UR Φυσικό Κόκκινο 50ml,6.34
2025-08-01,771364,Syoss Σαμπουάν Intense Plex 440ml,2.81
2025-08-01,720115,Luxurious Sun Care Αντιηλιακό Silk Cover SPF50 75ml,7.91
2025-08-01,705034,Koleston Βαφή Μαλλιών Νο 4-1 Καφέ 50ml,6.53
2025-08-01,709093,Gillette Mach III Ξυραφάκια Charcoal Μηχανή +2 Ανταλλακτικά,12.99
2025-08-01,620321,Diana Casual Τερλίκι Λεπτή Λευκή 5/2τεμ,2.75
2025-08-01,765036,Palette Βαφή Μαλλιών Intensive Color Creme No12.21 Κατάξανθο,3.75
2025-08-01,719039,Durex Sensitive Προφυλακτικά Άνετη Εφαρμογή 12τεμ,11.05
2025-08-01,702659,Pantene Μάσκα Μαλλιών Για Μπούκλες 300ml,6.18
2025-08-01,724068,Maybelline Tatto Brow 36h Medium Brown 05,8.61
2025-08-01,716103,Bioten Κρέμα Σώματος Skin Nutries Aloe & Hemp Oil 250ml,3.78
2025-08-01,601187,Always Σερβιέτες Platinum Ultra Night 64τεμ,16.54
2025-08-01,775417,Nivea Men Ντους Gel Sensitive Pro 500ml,2.73
2025-08-01,765013,Syoss Oleo Βαφή Μαλλιών Καστανό Σοκολάτι Νο. 4-86,5.79
2025-08-01,762259,Aim Οδοντόβουρτσα White Now Shiny Μαλακή,2.74
2025-08-01,620532,Diana Τερλίκι Λευκό 2τεμ,3.14
2025-08-01,706058,Diadermine Cleanser Washgel Micellar Purifying 150ml,3.11
2025-08-01,705020,L'OREAL Excellence Βαφή Μαλλιών Ξανθό Ανοιχτό Ψυχρό Ν.8.11,6.34
2025-08-01,705019,L'OREAL Excellence Βαφή Μαλλιών Ξανθό Ψυχρό Ν.7.11,6.34
2025-08-01,709285,Gillette Proglide Manual Flexball Ξυριστική Μηχανή (+ 2 Ανταλλακτικά),18.99
2025-08-01,756498,Liposan Vanilla Butter Cream 4-8gr,3.26
2025-08-01,701114,L'OREAL Men Expert Carbon Protect Αποσμητικό Spray 150ml,5.75
2025-08-01,755533,Noxzema Hydration Αφρόλουτρο 750ml,3.06
2025-08-01,702313,Syoss Oleo Intense Βαφή Μαλλιών Ξανθό Ανοιχτό Μπεζ 8-05,5.79
2025-08-01,756010,Nivea Hyaluron Cellular Filler Κρέμα Ημέρας SPF30 50ml,11.70
2025-08-01,720708,Piz Buin Κρέμα Προσώπου Sensitive SPF50+ 50ml,7.34
2025-08-01,706199,Diadermine Miceller Νερό Ντεμακιγιάζ 400ml,4.34
2025-08-01,719627,Hansaplast Junior Frozern Strips 20τεμ,3.36
2025-08-01,611633,Zewa Υγρά Μαντήλια Fresh To Go Protection 10τεμ,1.42
2025-08-01,710917,Sweet Candry Coconut Dream Eau De Toillette 100ml,11.73
2025-08-01,720459,Mea Natura Pomegranate Gel Απολέπισης Προσώπου 100ml,2.35
2025-08-01,716852,Aroma Κρέμα Χεριών Bio Honey & Yogurt 200ml,2.78
2025-08-01,703809,Zan Sot Klamer Χταποδάκι Classic Πολύ Μεγάλο,2.30
2025-08-01,710844,Old Spice Whitewater Λοσιόν Για Μετά Το Ξύρισμα 100ml,11.97
2025-08-01,720015,Nivea Sun Anti Age Κρέμα Προσώπου SPF50 50ml,9.00
2025-08-01,620816,Diana Starlyn Καλσόν 15D Καραμελέ (S-M-L),3.23
2025-08-01,620405,Diana Calzino 15D Καλτσάκι Καραμελέ/Πέπερ O/S,1.85
2025-08-01,720528,Carroten Αντηλιακό Λάδι Σώματος Spray Summer Dreams SPF6 200ml,7.48
2025-08-01,771556,Mea Natura Olive Vitality & Shine Σαμπουάν 300ml,2.53
2025-08-01,775130,Mea Natura Olive Wellness & Revival Ντους 300ml,2.08
2025-08-01,765406,Koleston Βαφή Μαλλιών Νο9/0 50ml,6.53
2025-08-01,765341,Koleston Βαφή Μαλλιών Νο 10/0 50ml,6.53
2025-08-01,765598,Garnier Color Sensation No 6.35 Ζεστό Καφέ 40ml,3.53
2025-08-01,754708,Taft Power Gel Super Glue 150ml,3.86
2025-08-01,706955,Πινέλα Μακιγιάζ,2.13
2025-08-01,662528,L'OREAL Magic Retouch Spray Κάλυψης Μαύρο 75ml,10.27
2025-08-01,715125,Karavaki Men 3in1 Ocean Force Αναζωογονητικός Καθαρισμός 550ml,2.92
2025-08-01,706498,L'oreal Revitalift Vitamin C Λοσιόν 180gr,5.17
2025-08-01,602404,Carefree Normal Fresh Σερβιετάκια 20τεμ.,1.25
2025-08-01,720256,Ambre Solaire Αντηλιακό Hydra 24 Spray SPF 50+ 150ml,9.15
2025-08-01,705079,Syoss Color Βαφή Μαλλιών Νο 1-1 Μαύρο 50ml,5.36
2025-08-01,709186,Gillete Sensor 3+ Comfort (Δωρό 8 Ανταλλακτικές Λαβές),7.54
2025-08-01,709183,Gillette Mach3 Δώρο 6 Ανταλλακτικά Λαβή & Stand,15.19
2025-08-01,719056,Hansaplast Second Skin Regular 6τεμ,4.99
2025-08-01,762072,Colgate Στοματικό Διάλυμα Total Gum Care 500ml,4.00
2025-08-01,771414,Pantene Σαμπουάν Αναδόμηση & Προστασία 625ml,5.03
2025-08-01,710134,Designer Σπρέυ Σώματος Freshness Daisee 100ml,2.48
2025-08-01,710153,Designer Σπέυ Σώματος Freshness Savore 150ml,3.22
2025-08-01,754036,Feel Good! Pomade Extreme Hold 100ml,4.28
2025-08-01,702811,Elvive Glyco Gloss Περιποίηση Λάμψης 200ml,8.07
2025-08-01,765081,Garnier Olia Βαφή Μαλλιών Χωρίς Αμμωνία Ν5.0 Aνοιχτό Καστανό 50ml,5.76
2025-08-01,765074,Olia Βαφή Μαλλιών Χωρίς Αμμωνία Νο 10.1 Kατάξανθο Σαντρέ 60ml,5.76
2025-08-01,765077,Olia Βαφή Μαλλιών Χωρίς Αμμωνία Νο 1.10 Μαύρο Μπλέ 60ml,5.76
2025-08-01,765073,Olia Βαφή Μαλλιών Χωρίς Αμμωνία Νο 3.00 Καστανό Σκούρο 60ml,5.76
2025-08-01,710128,L'oreal Men Expert Barber Club Cream 50ml,13.96
2025-08-01,702795,Bright Serum Revel Niacinam 30ml,14.00
2025-08-01,720113,Luxurious Αντιηλιακό Προσώπου SPF50 & Σώματος SPF30 50ml,11.12
2025-08-01,702750,TRESemme Μάσκα Μαλλιών Biotin Για Ταλιπωρημένα Μαλλιά 440ml,6.99
2025-08-01,702748,Garnier Fructis Hairfood Μάσκα Μαλλιών Watermelon 400ml,5.39
2025-08-01,702712,Gliss 4in1 Μάσκα Μαλλιών Bond Building Regeneration 400ml,5.76
2025-08-01,702724,Gliss Conditioner Σπρέι Colour Perfection 200ml,4.31
2025-08-01,704030,Schwarzkopf Taft Ultimate HL6 250ml,4.64
2025-08-01,702689,Elvive Hydra Κρέμα Νύχτας Hyaluronic 200ml,7.31
2025-08-01,701207,L'oreal Αντιγηραντική Κρέμα Mex Vitalift 50ml,17.73
2025-08-01,765037,Palette Κρέμα Βαφή Μαλλιών No.9.1 Ξανθό Πολύ Ανοιχτό Σαντρε,3.75
2025-08-01,705344,Excellence Creme Καστανό Σκούρο Βαφή Μαλλιών Ν.3,5.84
2025-08-01,717389,STR8 Game Eau De Toilette 100ml,9.73
2025-08-01,620319,Lotus Κάλτσα Ανδρική Βαμβακερή Κοφτή,3.45
2025-08-01,720092,Ambre Solaire Αντηλιακό Σπρ. Sensitive Adv. Kids SPF50+ 270ml,12.36
2025-08-01,756033,L'oreal Revitalift Κρέμα Προσώπου Vitamin C 50ml,13.91
2025-08-01,706092,Bioten Serum Προσώπου Calcium 30ml,10.08
2025-08-01,765020,HD Color Σετ Βαφής Μαλλιών Ν10.1 Κατάξανθο Σαντρέ,4.15
2025-08-01,765025,HD Color Σετ Βαφής Μαλλιών Ν4 Καστανό,4.15
2025-08-01,765029,HD Color Σετ Βαφής Μαλλιών Ν.8.1 Ανοικτό Σαντρέ,4.15
2025-08-01,717195,STR8 Ντους Gel Red Code 400ml,2.57
2025-08-01,720050,Nivea Sun Trigger SPR SPF 30 Pr. + Br. 270ml,11.19
2025-08-01,754024,Mastic Origins Body Scrub Wild Mandarin 300ml,9.49
2025-08-01,724142,Maybelline Μάσκαρα Lash Sensational Sky High Blister,16.62
2025-08-01,762851,Colgate Plax Charcoal Στοματικό Διάλυμα 500ml,4.00
2025-08-01,662413,STR8 Ντους Gel Fr34k 400ml,2.41
2025-08-01,705023,L'OREAL Excellence Βαφή Μαλλιών Κατανό Ανοιχτό Ψυχρό Ν.5.11,6.34
2025-08-01,724022,Maybelline SS Matte Ink Κραγιόν 65 Seduce,15.32
2025-08-01,620949,Feel Good! Καλτσάκια 20D Μαύρο 2 ζευγάρια,1.30
2025-08-01,620970,Feel Good! Καλσόν 20D Κάραμελ XL,1.72
2025-08-01,706488,Feel Good! Body Milk Βανίλια 250ml,2.50
2025-08-01,606862,Slipad Πάνες Ενηλίκων Νο 3 Large 11τεμ,7.34
2025-08-01,701130,Nivea After Sun Λοσιόν Sensitive 175ml,7.15
2025-08-01,621140,Diana Classic Σλιπ Γυναικείο Tai Σετ 2τεμ,7.72
2025-08-01,653585,Syoss Oleo Βαφή Ξανθό Σοκολατί 6-80,5.79
2025-08-01,774779,Syoss Invisible Κερί 100ml,4.89
2025-08-01,716570,Hellenia Aloe Vera Αποτριχωτικές Ταινίες Σώματος 20τεμάχια,3.95
2025-08-01,716387,Valley Body Milk Vanilla 300ml,3.71
2025-08-01,710417,Nivea Men Protect & Care After Shave 2 σε 1 100ml,9.76
2025-08-01,717063,B.U. Eau De Toilette Absolute Me 50ml,11.21
2025-08-01,720457,Mea Natura Pomegranate Αντιγηραντική & Αντιρυτιδική Κρέμα 50ml,5.51
2025-08-01,710183,Axe After Shave Black 100ml,9.48
2025-08-01,653597,Syoss Oleo Βαφή Ξανθό Σκούρο 6-10,5.79
2025-08-01,620397,Diana Starlyn 15D Καλσόν Καραμελέ (XL-XXL),3.41
2025-08-01,720165,Nivea Sun Caring Lotion SPF30 200ml,9.74
2025-08-01,703225,Πινέλο Βαφής Μαλιών Β' Ν.211/1115,0.65
2025-08-01,709487,Gillette Venus Swirl Μηχανή & 1 Ανταλλακτικό,15.37
2025-08-01,720960,Nivea Sun Protect & Bronze Oil SPF20 200ml,9.05
2025-08-01,716029,Dove Restoring Coconut Λοσιον 250ml,4.19
2025-08-01,765630,Garnier Color Sensation No 8.0 Φωτεινό Ξανθό Ανοιχτό 40ml,3.53
2025-08-01,706262,Nivea Essentials Θρεπτική Κρέμα Ημέρας SPF15 50ml,4.46
2025-08-01,710401,Nivea Men After Shave Balsam 100ml,9.98
2025-08-01,710714,STR8 Original After Shave Lotion 100ml,6.54
2025-08-01,654213,Zan Sot Αφρόχτενο Μικρό Μονόχρωμο,1.74
2025-08-01,621054,BIC Avigliano Κάλτσα Unisex Μικτή Σετ 2,3.55
2025-08-01,710757,STR8 Κολώνια Original 100ml,9.73
2025-08-01,754782,Got2b Molding Gentleman Πηλός 100ml,5.76
2025-08-01,706536,Liposan Mango Blister 4-8gr,3.26
2025-08-01,718006,Nivea Soft Uv SPF 15 100ml,5.49
2025-08-01,711069,Oral-B Οδοντόβουρτσα Deep Clean 2τεμ,2.52
2025-08-01,706499,Garnier Κρέμα Προσώπου Vitamin C Spf 50+ 75ml,6.50
2025-08-01,706484,Bioten Eye Serum Hyalurοnic Gold 15ml 97% Natural,9.98
2025-08-01,720280,Ambre Solaire Αντηλιακό Hydra 24 Spray SPF 30+ 150ml,9.15
2025-08-01,710161,Jean Marc X-Black Men Κολώνια 100ml,11.99
2025-08-01,720239,Carroten Sun Protection Flu Light SPD50+ 50ml,8.98
2025-08-01,702863,HD Sea Salt Hair Texturizer 160ml,6.80
2025-08-01,754037,Got2B Gentleman Πηλός Texture 100ml,5.76
2025-08-01,702837,Pantene Μάσκα Μαλλιών Ενυδάτωση & Λάμψη 300ml,6.98
2025-08-01,702821,Pantene Κρέμα Mαλλιών Μήκος Χωρίς Όρια 230ml,3.59
2025-08-01,514214,Blador Καθαριστικό Λεπίδων Blue 400ml,1.75
2025-08-01,706429,Nivea Κρέμα Ημέρας Αντιρυτιδική Q10 Power 50ml,9.45
2025-08-01,710144,Designer Σπρέυ Σώματος Freshness Xalien 100ml,2.48
2025-08-01,754035,Feel Good! Pomade Extra Hold 100ml,4.09
2025-08-01,710130,Tesori Κολώνια Karma 100ml,10.95
2025-08-01,716405,Dove Body Lotion Σώματος Light Care 400ml,5.39
2025-08-01,706384,L'oreal Bright Revel Κρέμα Προσώπου UV Fluid 50ml,14.00
2025-08-01,720200,Luxurious Suncare Monoi Oil 200ml,10.91
2025-08-01,775850,Dove Αφρόλουτρο Gentle Pamper 450ml,2.35
2025-08-01,754034,Wellaflex Gel Spray μαλλιών Full Boost 150ml,4.40
2025-08-01,702696,Nivea Men 2σε1 Luminous Power Serum 30ml,13.43
2025-08-01,706134,Clean & Clear Σαπούνι Καθαρισμού Προσώπου 150ml,4.18
2025-08-01,706103,Garnier Serum Charcoal 30ml,5.99
2025-08-01,771182,Pantene Pre Styler 5 σε 1 Miracle 200ml,8.87
2025-08-01,620301,Pro Κάλτσες Ανδρικές Αθλητικές 5τεμ,4.50
2025-08-01,704003,HD Λακ Πολύ Δυνατό Κράτημα Non-Aerosol 200ml,4.94
2025-08-01,719034,Scholl Επιθέματα Για Φουσκάλες Mix 5τεμ,5.70
2025-08-01,719026,Durex Προφυλακτικά Surprise 40τεμ,26.66
2025-08-01,765028,HD Color Σετ Βαφής Μαλλιών Ν6.88 Σοκολατί,4.15
2025-08-01,719863,Scholl Αποσμητικό Spray Ποδιών 150ml,6.08
2025-08-01,620259,BIC Ankle Socquette Καλτσάκι 15D Μαύρο,2.88
2025-08-01,701145,L'Oreal Mex Thermic Resist Σπρέι 150ml,5.75
2025-08-01,710860,Old Αφρόλουτρο Spice Shower Gel Restart 400ml,2.79
2025-08-01,710470,Tesori Body Cream Hammam 300ml,9.80
2025-08-01,710138,Gillette After Shave Balm Sensitive Protection 100ml,6.39
2025-08-01,724036,Maybelline Fit Me Matte Fdt 105 Ivory Bl,15.99
2025-08-01,526168,Ringpoint Κορδόνια Στρογγυλά Χονδρά Μαύρα 75cm,2.31
2025-08-01,526170,Ringpoint Κορδόνια Φαρδιά Μαύρα 150cm,4.12
2025-08-01,756259,Diadermine Κρέμα Lift + Superfiller Ματιών 15ml,9.35
2025-08-01,706337,Nivea Q10 Plus C Αντιρυτιδική Κρέμα Ημέρας Ανάπλασης Ενυδατική 50ml,8.75
2025-08-01,620526,Diana Κάλτσα Ανδρική Βαμβακερή Sous Bas,3.17
2025-08-01,710915,Sweet Candy Strawberry Kiss Eau De Toillette 100ml,11.73
2025-08-01,754005,L'OREAL Elnett Satin Spray Κανονικό Κράτημα 400ml,9.99
2025-08-01,754180,L'OREAL Elnett Satin Hairspray Extra Fort 200ml,6.99
2025-08-01,620096,Diana Boxer Ανδρικό Βαμβακερό Ελαστικό Μαύρο (S-M-L-XL),8.93
2025-08-01,621361,Diana Σλιπ Γυναικείο Easy Minis S-M-L-XL,6.56
2025-08-01,620176,BIC Medias Καλσόν Μελί 15D Large,2.62
2025-08-01,703224,Πινέλο Βαφής Α' Μαλλιών Ν.64,1.16
2025-08-01,703222,Siorfanne Μπωλ Βαφής,1.11
2025-08-01,706196,Diadermine Expert Rejuvenation Κρέμα Ημέρας 50ml,10.50
2025-08-01,765342,Koleston Βαφή Μαλλιων Νο12/0 50ml,6.53
2025-08-01,765383,Koleston Βαφή Μαλλιών Νο55/46 50ml,6.53
2025-08-01,765249,Palette Κρέμα Βαφή Μαλλιών N6.60 Ξανθό Σκούρο Χρυσό Σοκολατί,3.75
2025-08-01,620143,Bic Vivant Καλσόν Ελαστικό Μελί 40D Large,4.20
2025-08-01,720287,Nivea Sun Carotene Lotion SPF6 200ml,7.10
2025-08-01,754580,L'OREAL Styling Studio Line Style Remix Κρέμα Διαμ/σης 150ml,7.99
2025-08-01,720175,Piz Buin In Sun Lotion SP15 200ml,8.08
2025-08-01,720415,Nivea Sun Deep Tanning Oil SPF6 200ml,7.39
2025-08-01,709154,Gillette Fusion Proglide Flexball Power Ξυριστική Μηχανή & 1 αντ/κό,20.99
2025-08-01,704801,Got2b Gel Μαλλιών Spiking Glues 150ml,5.73
2025-08-01,706401,Liposan Strawberry 4-8gr,3.26
2025-08-01,711071,Aim Οδοντόρβουτσα White system Μέτρια 2τεμ,4.01
2025-08-01,775928,Septona Dermasoft Αφρόλουτρο Cotton 400ml,1.89
2025-08-01,711063,Oral b Οδοντόβουρτσα Pro Clean Advanced 40M 1τεμ,1.82
