2025-06-12,317400,Αλλατίνη Μπέικιν Πάουντερ 3x20gr,0.55
2025-06-12,217156,Υάδες Κουρκουμάς Bio Σε Βάζο 55gr,1.97
2025-06-12,217118,My Kouzina Ρίγανη 80gr,2.56
2025-06-12,243102,Φλώρα Καλαμποκέλαιο 2lt,6.10
2025-06-12,222187,Rio Mare Φιλέτο Σκουμπρί Με Ελαιόλαδο 120gr,3.58
2025-06-12,207254,Maille Μουστάρδα Dijon 215gr,3.07
2025-06-12,222904,Portola Καλαμαράκια Σε Άλμη 370gr (ΣΤΡΑΓΓ.ΒΑΡΟΣ 222gr),5.34
2025-06-12,233706,Misko Κανελλόνια Σε Κουτί 250gr,1.35
2025-06-12,230001,3αλφα Ρύζι Γλασσέ 500gr,1.92
2025-06-12,236751,Akis Trofino Καλαμποκάλευρο 500gr,1.10
2025-06-12,234084,Misko Σπαγγέτι Πρωτεΐνης 400gr,1.93
2025-06-12,206075,Bonduelle Μανιτάρια Τεμαχισμένα 200gr,1.99
2025-06-12,217634,Kollectiva Πάπρικα Καπνιστή 45gr,2.32
2025-06-12,234423,De Cecco Linguine 500gr,1.72
2025-06-12,241464,Χρυσελιά Ελαιόλαδο Κλασικό 4lt,27.50
2025-06-12,243000,Nutria Αραβοσιτέλαιο 1lt,2.20
2025-06-12,207954,Brava Μουστάρδα Απαλή Βαρελάκι 500gr,2.45
2025-06-12,315011,Γιώτης Φρουι Ζελέ Ρόδι Χωρίς Ζάχαρη 14-5gr,1.41
2025-06-12,316555,Γιώτης Σιρόπι Σοκολάτα 350gr,2.54
2025-06-12,230026,Agrino Quick Deli Basmati 250g,2.20
2025-06-12,232857,Άροσις Βιολογικά Φασόλια Μέτρια Καστοριάς 500gr,4.29
2025-06-12,217946,Συνεργασία Ρίγανη Σε Σακουλάκι 100gr,2.36
2025-06-12,330964,Σταφίδα Ξανθιά Σουλτανίνα Σαιγιίου 200gr,2.64
2025-06-12,275122,Natreen Γλυκαντικό Βάζο 70gr,4.56
2025-06-12,230028,Agrino Quick Deli Λευκή & Κόκκινη Κινόα 250gr,2.40
2025-06-12,208074,Kyknos Σάλτσα Barbeque 560gr,3.07
2025-06-12,217724,Υάδες Κανέλα Κευλάνης Τριμμένη ΒΙΟ 30gr,1.88
2025-06-12,242003,Μινέρβα Νίκη Πυρηνέλαιο 2lt,8.50
2025-06-12,233108,Melissa Κριθαράκι Μέτριο 1kg,1.39
2025-06-12,227015,Kyknos Κέτσαπ Hot Πλαστική Φιάλη Top Down 560gr,2.60
2025-06-12,235070,Condito Σάλτσα Χωρίς Γλουτένη Napoliten 350gr,2.16
2025-06-12,337413,Γιώτης Κουβερτούρα Πλάκα 3x125gr,5.41
2025-06-12,207409,Hellmann's Μουστάρδα Πικάντικη 500gr,3.53
2025-06-12,213052,Knorr Πουρές Με Γάλα 291gr,3.65
2025-06-12,234016,Barilla Ζυμαρικά Penne Tricolore 500gr,1.64
2025-06-12,314351,Γιώτης Τρούφα Σοκολάτα Ζαχαροπλαστικής 100gr,2.26
2025-06-12,280178,Reeva Instant Noodles Koτόπουλο 60gr,0.60
2025-06-12,110053,Condito Κετσαπομαγιονέζα Χωρίς Γλουτένη 435ml,2.68
2025-06-12,230040,Ben's Original Ρύζι Jasmine 500gr,3.05
2025-06-12,275450,Canderel Γλυκαντικό σε δισκία 120τεμ,3.39
2025-06-12,217729,Health Trade Κουρκουμάς Σκόνη Bio 100gr,1.99
2025-06-12,225432,Heinz Baked Beans 415gr,1.96
2025-06-12,651367,Άροσις Ρεβίθια Μικρόσπερμα Γρεβενών 500gr,2.71
2025-06-12,211009,Knorr Ζωμός Λαχανικών 6 κύβοι 3lt,1.37
2025-06-12,235006,Ben's Original Σάλτσα Γλυκόξινη 450gr,3.27
2025-06-12,228000,Μακεδονική Κομπόστα Κοκτέιλ Φρούτων 822gr,3.68
2025-06-12,208170,Hellmann's Caesar Dressing 6/250ml,2.54
2025-06-12,233064,Melissa Κοράλι Ριγέ Με Κόκκινη Φακή 400gr,2.07
2025-06-12,330474,Hungry Not Ξηροί Καρποί Μix Protein 180gr,3.16
2025-06-12,110173,Condito The Green Line Mayo Veagan Sauce 280gr,3.24
2025-06-12,312458,Γιώτης Creme 250gr,1.52
2025-06-12,226710,Ομοσπονδία Τοματοπολτός 28-30% 70gr,0.59
2025-06-12,207036,Kyknos Μουστάρδα Απαλή Πλαστική Φιάλη 500gr,2.79
2025-06-12,233327,Melissa Σπαγγέτι Με Σπανάκι 400gr,1.22
2025-06-12,247004,Νέα Φυτίνη Παραδοσιακή 800gr,5.55
2025-06-12,226573,Ο Μπαξές Τοματοπολτός Διπλής Συμπύκνωσης 140gr,0.72
2025-06-12,203407,Best Price Lemon Dressing 330ml,0.34
2025-06-12,315024,Γιώτης Φρουί Ζελέ Μπανάνα 200gr,1.69
2025-06-12,232009,3αλφα Ρεβύθια Χονδρά 500gr,3.37
2025-06-12,234091,Melissa Στριφτό Με Παντζάρι 400gr,1.22
2025-06-12,208186,Condito Caesar's Dressing Χωρίς Γλουτένη 330gr,2.88
2025-06-12,217107,My Kouzina Γαρίφαλο Ολόκληρο Φάκελος 15gr,0.77
2025-06-12,315046,My Kouzina Ζελέ Ανανά 200gr,1.27
2025-06-12,651404,Geisha Τόνος Σε Ηλιέλαιο 2Χ160gr (Στρ.Βαρ 210gr),6.34
2025-06-12,222983,Trata Σαρδέλλες Τομάτας 100gr,1.99
2025-06-12,240101,Χρυσελιά Εξαιρετικό Παρθένο Ελαιόλαδο 3lt,34.85
2025-06-12,109278,Τρυφωνίδης Αντζούγιες Φιλέτο FAO37 Easy Open 50gr,1.95
2025-06-12,232114,Ωμέγα Special Φασόλια Γίγαντες Εγχώρια 500gr,4.58
2025-06-12,230002,3αλφα Ρύζι Νυχάκι 500gr,2.01
2025-06-12,222010,Trata Salad Pocket Σολομός 170gr,2.92
2025-06-12,208112,Heinz Soja Sauce 150ml,2.55
2025-06-12,280617,Oriental Express Noodls Multi Pack 375gr,3.39
2025-06-12,280608,Blue Dragon Σως Σόγιας 150ml,1.85
2025-06-12,230460,Agrino Ρύζι Λαίς Καρολίνα Για Ριζότο Ελλάδος 1kg,4.59
2025-06-12,659428,Ήλιος Κανέλλα Ξύλο Φάκελλο 50gr,2.30
2025-06-12,234147,Barilla Ζυμαρικά Casarecce 500gr,2.25
2025-06-12,280167,El Sabor Τορτίγιες Πολύσπορες 20cm 320gr 8τεμ,2.32
2025-06-12,241102,Άλτις Κλασικό Ελαιόλαδο 2lt,14.50
2025-06-12,247145,Μινερβίνη Με Βούτυρο Γάλακτος 400gr,3.74
2025-06-12,230459,Agrino Ρύζι Φάνσυ Για Γεμιστά Ελλάδος 1kg,4.47
2025-06-12,280188,Maggi Asia Γλυκόξυνη Σάλτσα 355gr,3.48
2025-06-12,235804,Fytro Πλιγούρι 500gr,2.27
2025-06-12,234142,Barilla Ταλιατέλες Με Αυγά Ν129 450gr,3.25
2025-06-12,232120,Family Farm Φασόλια Μέτρια Λαμίας 500gr,2.50
2025-06-12,110273,Hellmann's Μαγιονέζα Top Down 430ml,3.56
2025-06-12,208457,Hellmann's Σάλτσα Barbeque Μέλι 250ml,2.83
2025-06-12,226011,Kyknos Χυμός Τομάτας 390ml,1.10
2025-06-12,217919,My Kouzina Κάρυ 40gr,1.61
2025-06-12,233313,Melissa Tortellini Ολικής Άλεσης Με Τυρί 250gr,2.10
2025-06-12,280643,Oriental Express Νούντλς Ποτ Κοτόπουλο & Πράσινο Κρεμμύδι 85gr,1.50
2025-06-12,280668,Oriental Express Νούντλς Πάπια Πεκίνου 87gr,0.99
2025-06-12,317600,ΑΝΑΤΟΛΗ Αμμωνία σε Φάκελλο 30gr,0.50
2025-06-12,226254,Biofarma Βιολογικός Τοματοπολτός 360gr,3.01
2025-06-12,316557,Γιώτης Σιρόπι Βύσσινο 350gr,2.54
2025-06-12,235039,Barilla Σάλτσα Pesto Genovese 90g,2.69
2025-06-12,202135,Kalamata Papadimitriou Κρέμα Βαλσάμικο Πορτοκάλι Λεμόνι 250ml,3.32
2025-06-12,330728,Snack Break Παπάγια Αποξηραμένη Εκτός Ε.Ε. 180gr,2.34
2025-06-12,330583,My Gusto Φιστίκι Κέλυφος Ψημένο Αλατισμένο Τιμή Κιλού,5.00
2025-06-12,217207,ΑΝΑΤΟΛΗ Θυμάρι Γυάλινο 65gr,2.08
2025-06-12,235536,Barilla Pesto Με Βασιλικό Vegan 195gr,3.19
2025-06-12,233170,Πέλλα Γη Χυλοπίτες 500gr,1.79
2025-06-12,232048,Family Farm Φασόλια Γίγαντες 500gr,5.75
2025-06-12,236028,Schar Μείγμα Αλεύρων Για Ψωμί Χωρίς Γλουτένη 1kg,5.33
2025-06-12,235047,Ben's Original Σάλτσα Γλυκόξινη Χωρίς Ζάχαρη 440gr,3.27
2025-06-12,275220,Γιώτης Sweet & Balance Γλυκαντικό Stevia Σκόνη 80gr,4.61
2025-06-12,227914,"17" Κέτσαπ 250gr,1.44
2025-06-12,244303,Sanola Ηλιέλαιο 2lt,4.91
2025-06-12,227294,Heinz Bio Κέτσαπ Top Down 580gr,3.13
2025-06-12,330612,Εύπορη Γη Χουρμάδες Απύρηνοι Αποξηραμένοι Εκτός Ε.Ε. Φάκελος 250gr,1.83
2025-06-12,231038,Ήλιος Κριθαράκι Λαχανικών 500gr,1.98
2025-06-12,330593,Snack Break Βερίκοκα Αποξηραμένα Εκτός Ε.Ε. 180gr,2.07
2025-06-12,222003,Flokos Θράψαλο Σε Πικάντικη Σάλτσα 160gr,3.67
2025-06-12,232407,Agrino Φασόλια Μαυρομάτικα 500gr,2.69
2025-06-12,110035,Hellmann's Real Mayonnaise 250ml,2.22
2025-06-12,207023,Kalamata Papadimitriou Μουστάρδα Πικάντικη Squeeze 300gr,2.47
2025-06-12,211309,Maggi Ζωμός Λαχανικών 6 κύβοι 3lt,1.15
2025-06-12,211097,Knorr Βιολογικός Ζωμός Κότας 6 κύβοι,1.77
2025-06-12,315016,Γιώτης Φρουι Ζελέ Ροδάκινο Οικογενειακή Συσκευασία 200gr,1.69
2025-06-12,280624,Oriental Express Noodles Ρυζιού Πλατιά Χωρίς Γλουτένη 225gr,3.08
2025-06-12,271427,Γιώτης Άνθος Αραβοσίτου Στιγμής Μπισκότο 70gr,0.99
2025-06-12,206919,Εδέμ Καλαμπόκι Γλυκό Οικογενειακή Συσκευασία 3x170gr,3.88
2025-06-12,280755,Oriental Express Noodles Μοσχαράκι Με Πιπέρι 87gr,0.99
2025-06-12,110030,Kyknos Μαγιονέζα Vegan Γυάλινο Βάζο 250ml,2.55
2025-06-12,110013,Kraft Μαγιονέζα 185ml,1.41
2025-06-12,204751,Gaea Ελιές Καλαμών Χωρίς Κουκούτσι Σακουλάκι 150gr,3.21
2025-06-12,211007,Knorr Ζωμός Βοδινού 24 κύβοι,3.95
2025-06-12,228015,Delmonte Κομπόστα Φρουτοσαλάτα 420gr,2.24
2025-06-12,225124,Zanae Κεφτεδάκια 280gr,3.59
2025-06-12,227036,Hellmann's Κετσαπ Στέβια 520gr,3.41
2025-06-12,206068,Bonduelle Ρεβύθια 80gr 2τεμ,2.28
2025-06-12,230201,Family Farm Ρύζι Νυχάκι Μακεδονίας 500gr,2.26
2025-06-12,315045,My Kouzina Κρέμα Καραμελέ 112gr,0.98
2025-06-12,204007,Εδέμ Αγγουράκι Άνθος 105gr,1.60
2025-06-12,234304,Misko Ματσάτα Χρυσή Σειρά 500gr,1.29
2025-06-12,234302,Misko Σπαγγετίνη Χρυσή Σειρά Νο 10 500gr,1.18
2025-06-12,659082,Ήλιος Βανίλια Κασετίνα 0.3gr 30τεμ,4.84
2025-06-12,330204,Super Berries Cranberries Χωρίς Ζάχαρη 180gr,2.94
2025-06-12,244002,Μινέρβα Ηλιέλαιο 2lt,5.40
2025-06-12,227001,Kyknos Κέτσαπ 330gr,1.75
2025-06-12,234093,Misko Κοχύλι 500gr,1.16
2025-06-12,268009,Γιώτης Κουβερτούρα Γάλακτος 2x125gr,3.79
2025-06-12,211055,Knorr Asia Chips Γαρίδας Κλασικάς 73gr,1.79
2025-06-12,210087,Knorr Pasta Snack Pot Mac & Cheese 62gr,1.32
2025-06-12,330075,My Gusto Picanto Κίνας Τιμή Κιλού,2.36
2025-06-12,241107,Άλτις Ελαιόλαδο Κλασσικό Δοχείο 3lt,34.95
2025-06-12,110838,My Gusto Μαγιονέζα 940gr,5.14
2025-06-12,204739,Gaea Λιαστές Τομάτες Σε Ηλιέλαιο Τιμή Κιλού,2.29
2025-06-12,234617,ΜΑΚΒΕΛ Λαζανάκι 500gr,1.23
2025-06-12,230109,Ωμέγα Special Ρύζι Νυχάκι Εγχώριο 500gr,1.81
2025-06-12,230411,Agrino Ρύζι Σουπέ Γλασσέ Για Σούπες Και Γλυκά Ελλάδος 1kg,3.85
2025-06-12,337398,Nestle Dessert Κουβερτούρα Γάλακτος Χωρίς Γλουτένη 170gr,3.28
2025-06-12,230427,Agrino Ρύζι Basmati 10' Σακουλάκι 500gr,3.56
2025-06-12,257010,Royal Ζάχαρη Καστανη Sticks 50τεμ,1.19
2025-06-12,222980,Trata Τόνος Με Φακές Beluga & Κολοκύθα 140gr,2.58
2025-06-12,236076,Caputo Αλεύρι Pizzeria 1kg,2.47
2025-06-12,207470,My Gusto Μουστάρδα Απαλή 250gr,0.60
2025-06-12,651946,Άλτις Ελιές Γεμιστές Με Πιπεριά 510gr,4.75
2025-06-12,230056,3αλφα Ρύζι Άγριο Parboiled 500gr,3.27
2025-06-12,236006,Μύλοι Αγ. Γεωργίου Αλεύρι Βρώμης 900gr,3.40
2025-06-12,240001,Μινέρβα Χωριό Έξτρα Παρθένο Κορωνέικο 1lt,8.10
2025-06-12,271176,Οlia Bio Σνακ Kαλαμποκιού Βιολογικά 50gr,1.01
2025-06-12,108010,Σολωμός Πίκλες Σε Άλμη Τιμή Κιλού,0.60
2025-06-12,217928,My kouzina Κανέλα Τριμμένη 35g,1.26
2025-06-12,226070,Vivi Verde Τομάτες Αποφλοιωμένες Biologico 400gr,1.59
2025-06-12,222438,My Gusto Καλαμάρι Σε Φυσικό Χυμό 370gr,4.39
2025-06-12,243705,My Kouzina Αραβοσιτέλαιο 5lt,10.99
2025-06-12,211021,Knorr Asia Τσιπς Γαρίδας Με Μπαχαρικά 75gr,1.82
2025-06-12,230751,Uncle Ben's Original Ρύζι Parboiled 10 Λεπτά Ισπανίας 1kg,5.45
2025-06-12,112310,Ήλιδα Ελιές Άμφισσας Φάκελος 250gr,2.29
2025-06-12,233002,Melissa Μακαρόνια Νο 3 500gr,1.02
2025-06-12,201010,Ήρα Αλάτι Ψιλό Οικογενειακή Συσκευασία 3x500gr,2.27
2025-06-12,211108,Knorr Κύβοι Λαχανικών Με Λιγότερο Αλάτι 6lt,2.15
2025-06-12,225936,Paliria Γίγαντες Γιαχνί Σε Σάλτσα Κρεμμυδιού & Ντομάτας 200gr,2.62
2025-06-12,275306,Fytro Ζάχαρη Ακατέργαστη 500gr,1.87
2025-06-12,316577,Γιώτης Σιρόπι Καραμέλα 350gr,2.61
2025-06-12,271425,Γιώτης Άνθος Αραβοσίτου Φράουλα Στιγμής 62gr,1.05
2025-06-12,230403,Agrino Ρύζι Φίνο Nυχάκι Ελλάδος 500gr,2.15
2025-06-12,228205,Kyknos Κομπόστα Βύσσινο 425gr,3.38
2025-06-12,227043,Heinz Κέτσαπ Top Down 250gr,1.55
2025-06-12,234092,Barilla Collezione Fusilli Bucati Corti 500gr,2.62
2025-06-12,330717,Εύπορη Γη Κράνμπερι Αποξηραμένο Εκτός Ε.Ε. Φάκελος 250gr,2.44
2025-06-12,235042,Primo Gusto Σάλτσα Pesto Mediterraneo 190gr,3.59
2025-06-12,232564,Biodynamic Φακές Κόκκινες Βιο 500gr,3.26
2025-06-12,217781,ΑΝΑΤΟΛΗ Γαρύφαλλο Ολόκληρο Φακελάκι 15gr,1.45
2025-06-12,112001,Xenia Ελιές Καλαμών Βάζο 360gr,3.06
2025-06-12,330562,Sunsweet Δαμάσκηνα Αποξηραμένα Απύρηνα 500gr,9.10
2025-06-12,233694,Misko Μισκοτίνη Νο10 500gr,1.15
2025-06-12,240093,My Kouzina Εξαιρετικό Παρθένο Ελαιόλαδο 3lt,19.15
2025-06-12,330795,Όλα Bio Organic Καρύδι Βραζιλίας 100gr,3.49
2025-06-12,280095,Maggi Magic Asia Noodles Duck Cup 63gr,1.59
2025-06-12,280602,Oriental Express Κρέμα Καρύδας 400ml,2.78
2025-06-12,234350,Misko Σπαγγέτι Νο 6 1kg,1.56
2025-06-12,314000,Γιώτης Τρούφα Σοκολάτα Γάλακτος Ζαχαροπλαστικής 100gr,2.26
2025-06-12,315050,Mac Magic Ζελέ Άρωμα Κεράσι Χωρίς Ζάχαρη 14-5gr,1.24
2025-06-12,222693,Altura Σαρδέλες Πικάντικες 125g (Στραγγισμένο βάρος 90g),1.36
2025-06-12,247041,Νέα Φυτίνη Μαγειρικό Λίπος Με Άρωμα Βουτύρου 400gr,3.35
2025-06-12,330556,Snack Break Κάσιους Ψημένο Ανάλατο 55gr,1.64
2025-06-12,235215,Knorr Σάλτσα Καρμπονάρα Οικογενειακή Συσκευασία 88gr,4.47
2025-06-12,234556,Misko Τριβελάκι Ολικής Άλεσης 500gr,1.29
2025-06-12,233037,Melissa Ρυζάκι 500gr,1.02
2025-06-12,235116,Kyknos Κέτσαπ Πλαστική Φιάλη Χωρίς Ζάχαρη 550gr,3.28
2025-06-12,241260,My Kouzina Κλασικό Ελαιόλαδο 1lt,8.95
2025-06-12,234421,De Cecco Spaghetti No 12 500gr,1.72
2025-06-12,236203,Γιώτης Φαρίνα Πορτοκάλι 500gr,1.49
2025-06-12,206926,Kyknos Αρακάς Ψιλός 400gr,2.11
2025-06-12,207049,Condito Μουστάρδα Χωρίς Ζάχαρη & 65% Λιγότερο Αλάτι 500gr,3.22
2025-06-12,232021,My Kouzina Φάβα 500gr,1.70
2025-06-12,210007,Knorr Μανιταρόσουπα 85gr,2.44
2025-06-12,207032,Kalamata Μουστάρδα Απαλή Squeeze 520gr,3.73
2025-06-12,330676,My Gusto Στραγάλι Αφράτο Ψητό Ανάλατο Εισαγωγής 200gr,1.65
2025-06-12,244101,Sol Ηλιέλαιο 1lt,3.30
2025-06-12,217208,ΑΝΑΤΟΛΗ Mix 4 Πιπεριών Φάκελος 40gr,2.31
2025-06-12,227032,My Gusto Κέτσαπ Πλαστική Φιάλη 490gr,2.10
2025-06-12,313101,Γιώτης Ζελατίνη Σε Φύλλα 10gr,1.33
2025-06-12,228002,Delmonte Κομπόστα Ανανάς Σε Σιρόπι 570gr,3.67
2025-06-12,330627,My Gusto Αμύγδαλο Ψημένο Ανάλατο Δοχείο 200gr,5.59
2025-06-12,235131,Cook At Home Σάλτσα Γαριδομακαρονάδα 250gr,3.45
2025-06-12,280737,Maggi Noodles Saucy Cup Teriyaki 75gr,1.80
2025-06-12,242010,Κόρη Πυρηνέλαιο 1lt,5.80
2025-06-12,228101,Ο Μπαξές Κομπόστα Ανανάς Σε Φέτες 565gr (Στραγ. Βάρος 340gr),2.86
2025-06-12,234653,Melissa Πέννες Ριγέ Πρωτεΐνης 400gr,1.60
2025-06-12,233836,Ανδρίτσαινα Χυλοπίτες Χωριάτικες 500gr,1.90
2025-06-12,222257,Trata Τόνος Καπνιστός Με Ρίγανη & Λεμόνι 160gr,2.79
2025-06-12,314455,Easy Bake Μείγμα Muffin Βανίλια 500gr,3.80
2025-06-12,232035,3αλφα Φακές Ψιλές Λάρισας 500gr,2.72
2025-06-12,217726,Υάδες Κανέλα Κεϋλάνης Ξύλο Bio Σακουλάκι 20gr,1.51
2025-06-12,330861,Ola Bio Σπόροι Chia Βιο 350gr,3.70
2025-06-12,330781,Βοστίτσα Μαύρη Σταφίδα ΠΟΠ Βιολογική 200gr,2.15
2025-06-12,230029,Agrino Quick Deli Ταμπουλέ & Κινόα 250gr,2.40
2025-06-12,275024,Ζωγράφος Σιρόπι Αγαύης Βιολογικό 350gr,4.58
2025-06-12,210006,Knorr Κοτόσουπα Με Φιδέ 69gr,2.34
2025-06-12,112039,Xenia Ελιές Πράσινες Σε Φέτες 40% Λιγότερο Αλάτι 300gr,2.23
2025-06-12,211004,Knorr Ζωμός Κότας 6 κύβοι 3lt,1.37
2025-06-12,234014,Barilla Ζυμαρικά Tortellini Με Κρέας & Τυρί 250gr,3.44
2025-06-12,330631,My Gusto Ηλιόσπορος Ψημένος Ανάλατος Δοχείο 110gr,1.02
2025-06-12,208191,Hellmann's Σάλτσα Κοτόπουλου 250ml,2.84
2025-06-12,280187,Μaggi Asia Σάλτσα Τικκα Massala 340gr,3.48
2025-06-12,233123,Μελίσσα Χρυσή Επιλογή Λαζάνια 500gr,2.33
2025-06-12,233111,ΜΑΚΕΒΕΛ Τορτελίνια Με Τυρί 250gr,2.22
2025-06-12,235129,Cook At Home Σάλτσα Για Κοτόπουλο Αλα Κρεμ 260gr,3.45
2025-06-12,217927,My kouzina Μοσχοκάρυδο Τριμμένο 40g,2.31
2025-06-12,217892,Ήλιος Κάρυ Γυάλινο 30gr,1.82
2025-06-12,208014,"17" French Dressing 250gr,2.08
2025-06-12,230712,Uncle Ben's Original Ρύζι Καστανό Ισπανίας Parboiled 500gr,3.29
2025-06-12,112312,Ήλιδα Ελιές Καλαμών Φάκελος 250gr,2.98
2025-06-12,206105,Xenia Καλαμπόκι Γλυκό Κονσέρβα 340gr,1.97
2025-06-12,330561,Sunsweet Δαμάσκηνα Απύρηνα 250gr,5.54
2025-06-12,202150,Χωριό Ξίδι Κόκκινο 2x350ml,1.47
2025-06-12,211076,Knorr Κύβοι Κοτόπουλο Με Λιγότερο Αλάτι 6lt,2.15
2025-06-12,234051,ΜΑΚΒΕΛ Πένες Ριγέ 500gr,1.15
2025-06-12,225436,Ο Μπαξές Φασόλια Μέτρια Γιαχνί 280gr,1.45
2025-06-12,202558,My Gusto Ξίδι Βαλσάμικο Λευκό 500ml,2.40
2025-06-12,234215,Χυλοπίτες Της Κυρά Γεωργίας 500gr,1.84
2025-06-12,234741,Misko Σουσαμάκι 500gr,1.10
2025-06-12,233924,Βλάχα Τραχανάς Γλυκός Σταρένιος 500gr,2.90
2025-06-12,235169,Misko Σάλτσα Πιπεριές & Ελιές 500gr,3.22
2025-06-12,231002,Ben's Original Ρύζι Κινέζικο Σε 2' Λεπτά 220gr,2.45
2025-06-12,110028,Kyknos Μαγιονέζα Light Γυάλινο Βάζο 420ml,3.01
2025-06-12,208326,Hellmann's Σάλτσα Avocado 250ml,2.75
2025-06-12,234025,Misko Τορτελίνι Με Τυρί & Ντομάτα 250gr,2.25
2025-06-12,201251,Fytro Υποκατάστατο Άλατος 250gr,2.55
2025-06-12,651284,Fytro Σόγια Κιμας 400gr,3.35
2025-06-12,331762,El Sabor Nacho Chips Natural 225gr,1.98
2025-06-12,225025,Bonduelle Ρεβύθια Σε Άλμη 310gr Στραγγιστό Βάρος 265gr,2.30
2025-06-12,217157,Υάδες Τζίντζερ Bio Σε Βάζο 40gr,1.94
2025-06-12,233104,Mέλισσα Χρυσή Επιλογή Πέννες Ριγέ 500gr,1.15
2025-06-12,217895,Ήλιος Πάπρικα Καπνιστή Γυάλινο 35gr,2.50
2025-06-12,222728,Geisha Σαρδέλες Σε Ηλιέλαιο 125gr Στρ.Βάρος 88gr,1.69
2025-06-12,201048,Αλάτι Θαλασσινό Βράχων Κυθήρων 250gr,4.50
2025-06-12,232566,Σιτώ Φακές Ελικώνα 500gr,2.18
2025-06-12,315057,Γιώτης Φρούι Ζελέ Ροδάκινο Χωρίς Ζάχαρη 14-5gr,1.41
2025-06-12,275041,Canderel Γλυκαντικό Σε Σκόνη 80gr,4.50
2025-06-12,227009,Hellmann's Κέτσαπ Top Down 272-55gr,1.80
2025-06-12,210015,Knorr Pasta Snack Pot Creamy Pesto 68gr,1.32
2025-06-12,330653,My Gusto Αμύγδαλο Ωμό Ελληνικό 200gr,4.52
2025-06-12,232702,Φασόλια Μέτρια Ελληνικής Γης Βοίου 5kg Τιμή Κιλού,1.85
2025-06-12,233172,Πέλλα Γη Χυλοπιτάκι 500gr,1.73
2025-06-12,202027,ΠΑΝ Βαλσαμικό Ξίδι με Ρόδι 250ml,3.30
2025-06-12,651319,Ωμέγα Special Φασόλια Μέτρια Εισαγωγής 500gr,2.05
2025-06-12,222240,Rio Mare Φιλέτο Τόνου Με Λάδι Έλιας 180gr,5.54
2025-06-12,234031,Barilla Ζυμαρικά Bucatini No9 500gr,1.74
2025-06-12,235160,Kyknos Σάλτσα Πίτσας BBQ 210gr,1.16
2025-06-12,235159,Barilla Σάλτσα Πίτσας 400gr,3.02
2025-06-12,275026,Slim Fix Γλυκαντικό Υγρό Με Stevia 500ml,10.57
2025-06-12,275419,Sweet'n Low Γλυκαντικό Σε Stick 40gr 100τεμ,3.96
2025-06-12,232551,Άροσις Φασόλια Μέτρια Λάρισας 500gr,3.33
2025-06-12,232701,Ρεβύθια Χονδρά Ελληνικής Γης Βοίου Ποιότητας Α 5kg Τιμή Κιλού,2.58
2025-06-12,244705,My Kouzina Ηλιέλαιο 5lt,9.65
2025-06-12,204039,Εδέμ Αγγουράκι Μέτριο 355gr,2.93
2025-06-12,257011,Royal Ζάχαρη Λευκή Sticks 50τεμ,1.08
2025-06-12,330843,Almanda Κάσιους Ωμό Σε Πλαστικό Δοχείο 250gr,5.31
2025-06-12,317010,Γιώτης Μαγιά Στιγμής Άνθος 21gr (3x7gr),0.81
2025-06-12,234149,Barilla Ζυμαρικά Penne Από Κόκκινες Φακές 250gr,4.08
2025-06-12,234613,ΜΑΚΒΕΛ Παστίτσιο Νο2 500gr,1.23
2025-06-12,280718,Cardinal Panko Bread Crumbs 200gr,3.25
2025-06-12,335103,Bonomi Σαβαγιάρ 200gr,2.52
2025-06-12,112009,Xenia Ελιές Πράσινες Σε Φέτες 355gr,2.82
2025-06-12,217625,ΑΝΑΤΟΛΗ Μύλος Μαύρο Πιπέρι 45gr,3.88
2025-06-12,221941,Dakor Corned Beef 198gr,4.32
2025-06-12,234085,Misko Πέννες Ριγέ Πρωτεΐνης 400gr,1.93
2025-06-12,222011,Flokos Σκουμπρι Φιλέτο Καπνιστό 150gr,4.04
2025-06-12,110031,Οι Γουμένισσες Μουσταρδομαγιονέζα Vegan 270gr,2.42
2025-06-12,275478,Isostevia Stevia Υγρή 60ml,2.20
2025-06-12,337433,Γιώτης Σοκολάτα Φράουλα Σε Σταγόνες 100gr,2.05
2025-06-12,112006,Xenia Πιπεριά Κόκκινη Ψητή 450gr (στρ.βάρος 350gr),3.24
2025-06-12,330271,Χαίτογλου Κινόα 500gr,5.33
2025-06-12,217155,Υάδες Κανέλα Κεϋλάνης Bio Σε Βάζο 40gr,2.13
2025-06-12,280629,Old El Paso Tortillas Σίτου 8τεμ 326gr,2.77
2025-06-12,234615,ΜΑΚΒΕΛ Ζυμαρικά Ολικής Άλεσης Νο6 500gr,1.32
2025-06-12,330677,My Gusto Σταφίδα - Στραγάλι Εισαγωγής 200gr,1.83
2025-06-12,313106,Γιώτης Ζελατίνη Σκόνη Κουτί 30gr,1.99
2025-06-12,202130,ΠΑΝ Βαλσαμικό Ξίδι Με Μέλι 250ml,3.31
2025-06-12,312453,Easy Bake Μείγμα Για Pizza 500gr,1.88
2025-06-12,235152,Kyknos Σάλτσα Τομάτας Πικάντικη 350gr,2.88
2025-06-12,233112,Barilla Intergrale Tortiglioni Ολικής Άλεσης 500gr,2.04
2025-06-12,225852,Paliria On Your Side Ρεβύθια 200gr,3.20
2025-06-12,211053,Knorr Κύβοι Για Όσπρια 12τεμ 6lt,2.14
2025-06-12,280040,Oriental Express Panko Φρυγανιά Παναρίσματος 200gr,2.64
2025-06-12,110839,My Gusto Μαγιονέζα 235gr,1.68
2025-06-12,221147,My Gusto Λάντσιον Μητ 200gr,2.28
2025-06-12,217214,ΑΝΑΤΟΛΗ Μιξ Για Κοτόπουλα Μεταλλικό 55gr,2.03
2025-06-12,660948,Biovita Κάσιους Εισαγωγής 150gr,3.96
2025-06-12,233385,Melissa Σπαγγέτι Χωρίς Γλουτένη 400gr,3.27
2025-06-12,222254,Trata Τόνος Καπνιστός 80gr 3τεμ,4.66
2025-06-12,280169,Oriental Express Φύλλα Nori Για Sushi 5 Φύλλα 14gr,2.64
2025-06-12,232047,"3" Άλφα Φακές Ψιλές Έτοιμα Φυσικά 180gr,2.56
2025-06-12,217096,Ηλιος Ξυνό 50gr,1.05
