2025-08-01,198028,Τομάτες Ελληνικές Ποιότητα Α΄ Τιμή Κιλού,0.44
2025-08-01,198993,Κρεμμύδια Ξερά Ξανθά Ελληνικά Ποιότητα Α,0.11
2025-08-01,198151,Αγγουράκια Ελληνικά Τιμή Κιλού,0.23
2025-08-01,192321,Καρότα Ελληνικά Τιμή Κιλού,0.09
2025-08-01,198027,Κολοκύθια Ελληνικά Τιμή Κιλού,0.17
2025-08-01,198187,Κρεμμύδια Κόκκινα Ξερά Μέτρια Ελληνικά Ποιότητα Α,0.16
2025-08-01,198329,Πατάτες Εγχώριες Τιμή Κιλού,0.72
2025-08-01,198026,Αγγούρια Ελληνικά Το Τεμάχιο,0.45
2025-08-01,198061,Νεκταρίνια Εγχώρια Ποιότητα Α' ΤΙμή Κιλού,0.47
2025-08-01,198023,Πιπεριές Φλωρίνης Ελληνικές Ποιότητα Α΄ Τιμή Κιλού,0.36
2025-08-01,192066,Τοματίνια Βελανίδια Ελληνικά Ποιότητα Α',1.25
2025-08-01,198132,Μήλα Στάρκιν Εγχώρια Ποιότητα Α' Τιμή Κιλού,0.57
2025-08-01,198274,Αχλάδια Κρυστάλλια Ελληνικά Ποιότητα Α΄Τιμή Κιλού,0.34
2025-08-01,198060,Ροδάκινα Εγχώρια Ποιότητα Α΄Τιμή Κιλού,0.69
2025-08-01,198117,Πορτοκάλια Βαλέντσια Α' Εγχώρια Τιμή Κιλού,0.27
2025-08-01,198037,Μελιτζάνες Φλάσκες Ελληνικές Τιμή Κιλού,0.52
2025-08-01,198039,Πιπεριές Πράσινες Ελληνικές Ποιότητα Α΄Τιμή Κιλού,0.51
2025-08-01,198042,Πιπεριές Ξανθές Ελληνικές Ποιότητα Α΄Τιμή Κιλού,0.29
2025-08-01,198085,Μπανάνες Dole Εισαγωγής Τιμή Κιλού,1.85
2025-08-01,192045,Τομάτα Δράμας Πετρούσα Ποιότητα Α΄,0.53
2025-08-01,192041,Μπανάνες Εισαγωγής Τιμή Κιλού,1.59
2025-08-01,198040,Πιπεριές Κέρατο Ελληνικές Ποιότητα Α΄ Τιμή Κιλού,0.40
2025-08-01,198056,Πεπόνι Εγχώριο Τιμή Κιλού,1.46
2025-08-01,198030,Τομάτες Κομιντόρια Ελληνικά Ποιότητα Α΄ Τιμή Κιλού,0.26
2025-08-01,198095,Μήλα Σμίθ Ελληνικά Ποιότητα Α΄Τιμή Κιλού,0.67
2025-08-01,198299,Κεράσια Εγχώρια Τιμή Κιλού,2.03
2025-08-01,198024,Μαρούλι Τιμή Τεμαχίου,0.69
2025-08-01,198805,Αβοκάντο Ωριμασμένο Εισαγωγής Τιμή Κιλού,1.47
2025-08-01,198029,Τομάτες Τσαμπί Ελληνικές Ποιότητα Α΄ Τιμή Κιλού,1.57
2025-08-01,198013,Κρεμμυδάκια Φρέσκα Ελληνικά Τιμή Κιλού,0.39
2025-08-01,192377,Velvita Νεκταρίνια Εγχώρια,0.47
2025-08-01,192376,Velvita Ροδάκινα Τιμή Κιλού,0.56
2025-08-01,198694,Μήλα Fuji Ελληνικά,0.81
2025-08-01,198003,Μαιντανός Ελληνικός Ποιότητα Α΄ 100gr,0.62
2025-08-01,198183,Σκόρδο Εισαγωγής Τεμάχιο,0.69
2025-08-01,198618,Ροδάκινα Πλατύκαρπα Ποιότητα Α,0.42
2025-08-01,198231,Λεμόνια Εισαγωγής Ποιότητα Α Τιμή Κιλού,2.70
2025-08-01,198070,Βερύκοκα Πρώιμα Εγχώρια Τιμή Κιλού,3.19
2025-08-01,198001,Άνηθος Ελληνικός Ποιότητα Α 80gr,0.69
2025-08-01,198156,Μπρόκολο Ελληνικό Τιμή Κιλού,1.64
2025-08-01,198038,Μελιτζάνες Τσακώνικες Ελληνικές Τιμή Κιλού,0.44
2025-08-01,198705,Πατάτες Κύπρου Συσκευασμένες Ποιότητα Α΄ Τιμή Κιλού,4.80
2025-08-01,198791,Καρότα Συσκευασμένα Εγχώρια 500gr,0.50
2025-08-01,198223,Πατάτες Συσκευασμένες Ελληνικές Ποιότητα Α΄ Τιμή Κιλού,2.97
2025-08-01,198014,Πράσο Ελληνικό Τιμή Κιλού,0.56
2025-08-01,198452,Πορτοκάλια Βαλέντσια Δίχτυ Χυμού Τιμή Κιλού,2.18
2025-08-01,198546,Dole Βιολογικές Μπανάνες Εισαγωγής Συσκευασία,2.19
2025-08-01,192355,Μύρτιλο Εισαγωγής 125gr,2.49
2025-08-01,198424,Μύρτιλα Εγχώρια 125gr,2.49
2025-08-01,198012,Παντζάρια Ελληνικά Τιμή Κιλού,0.28
2025-08-01,198448,Καρπούζι Ατομικό Εγχώριο,2.89
2025-08-01,192429,Μπαρμπά Στάθης Σαλάτα Δροσάτη 200gr,1.79
2025-08-01,198395,Λάϊμς Εισαγωγής Ποιότητα Α,0.39
2025-08-01,198331,Πιπεριές Κόκκινες Ελληνικές Ποιότητα Α΄Τιμή Κιλού,0.86
2025-08-01,192054,Φρεσκούλης Σαλάτα Ιταλική Iceberg- Μαρούλι- Ραντίτσιο 200gr,1.65
2025-08-01,198009,Σπανάκι Ελληνικό Τιμή Κιλού,0.62
2025-08-01,198016,Φασολάκια Μπαρμπούνια Ελληνικά Τμή Κιλού,0.82
2025-08-01,198242,Μπανάνα Chiquita Εισαγωγής Τιμή Κιλού,2.19
2025-08-01,198178,Γλυκοπατάτες Κόκκινες Εισαγωγής Ποιότητα Α΄(Τιμή Κιλού),1.29
2025-08-01,192445,Μπαρμπα Στάθης Σαλάτα Κλασσική 250gr,2.39
2025-08-01,198263,Άισμπεργκ Ελληνικό Τιμή Κιλού,0.92
2025-08-01,198002,Σέλινο Ελληνικό Ποιότητα Α΄ Τιμή Κιλού,0.20
2025-08-01,192028,Καρπούζι Τιμή Κιλού,4.05
2025-08-01,198146,Κολοκύθια Στρογγυλά Ελληνικά Τιμή Κιλού,0.90
2025-08-01,198272,Νεκταρίνια Λευκόσαρκα Εγχώρια Ποιότητας Α' Τιμή Κιλού,0.51
2025-08-01,198879,My Fresco Σαλάτα Φάρμα 200gr,1.63
2025-08-01,198077,Βανίλιες Εγχώριες Ποιότητα Α,0.90
2025-08-01,198096,Μήλα Γκόλντεν Ελληνικά Ποιότητα Α΄ Τιμή Κιλού,0.72
2025-08-01,192479,Velvita Gold Νεκταρίνια Εγχώρια Τιμή Κιλού,0.56
2025-08-01,198041,Πιπεριές Καυτερές Ελληνικές Ποιότητα Α΄ Τιμή Κιλού,0.19
2025-08-01,198529,Καρότα Βιολογικά Ελληνικά Συσκευασμένα,2.19
2025-08-01,198044,Ροδάκινα Λευκόσαρκα Εγχώρια Ποιότητα Α',0.81
2025-08-01,198644,Πιπεριές Ανάμεικτες Ελληνικές Ποιότητα Α΄ Τιμή Συσκευασίας,2.87
2025-08-01,198676,Τοματίνια Βελανίδια Ελληνικά Ποιότητα Α' 250gr,1.99
2025-08-01,198207,Άρωμα Κρεμμυδάκι Φρέσκο Ματσάκι Εγχώριο 140gr,1.34
2025-08-01,198330,Πιπεριές Κίτρινες Ελληνικές Ποιότητα Α,0.86
2025-08-01,192112,Φρεσκούλης Σαλάτα Λάχανο-Καρότο 300gr,1.58
2025-08-01,198881,My Fresco Σαλάτα Φαντασία 100gr,1.19
2025-08-01,198902,My Fresco Σαλάτα Εξοχική 160gr,1.51
2025-08-01,198514,Βιολογικά Αγγούρια Ελληνικά Συσκευασία,2.62
2025-08-01,198179,Μανιτάρια Φρέσκα Εισαγωγής 500gr,2.55
2025-08-01,192010,Μανιτάρια Φρέσκα Εισαγωγής 250gr,1.57
2025-08-01,198726,Τοματίνια Βιολογικά Ελληνικά 250gr,2.99
2025-08-01,198147,Δυόσμος Ελληνικός 50gr Ματσάκι,1.19
2025-08-01,198153,Καλαμπόκι Φρέσκο,1.29
2025-08-01,192230,Σαλάτα Γαλλική Σε Γλαστράκι,0.99
2025-08-01,198083,Ανανάς Εισαγωγής Τιμή Κιλού,2.52
2025-08-01,198810,Πιπεριές Πορτοκαλί Ελληνικές Ποιότητα Α΄ Τιμή Κιλού,0.90
2025-08-01,198393,Τοματίνια Plum Πετρούσα Δράμας 500gr,3.99
2025-08-01,198036,Κουνουπίδι Ελληνικό Τιμή Κιλού,2.48
2025-08-01,198933,Μπάρμπα Στάθης Σαλάτα Τραγανή Λάχανο & Καρότο300gr,1.79
2025-08-01,192477,Velvita Gold Ροδάκινα Εγχώρια Τιμή Κιλού,0.63
2025-08-01,198067,Κεράσια Lux Εγχώρια Τιμή Κιλού,2.46
2025-08-01,198713,Σταφύλια Prime Εγχώρια Τιμή Κιλού,3.90
2025-08-01,198645,Σκόρδα Εισαγωγής Συσκευασία 3τεμ,1.79
2025-08-01,198925,Πορτοκάλια Ποιότητα Α΄Δίχτυ Έγχωρια Τιμή Κιλού,3.24
2025-08-01,198034,Λάχανο Ελληνικό Ποιότητα Α΄ Τιμή Κιλού,1.56
2025-08-01,198937,Μπάρμπα Στάθης Σαλάτα Ιταλική 140gr,1.89
2025-08-01,198477,Μανιτάρια Πλευρώτους Ελληνικά 500gr,2.75
2025-08-01,192469,Μπάρμπα Στάθης Σαλάτα Δροσερή 400gr,2.98
2025-08-01,192365,Μάνγκο Ωριμασμένο Εισαγωγής Συσκευασία 2τεμ,4.19
2025-08-01,198229,Καρπούζι Άσπορο Εγχώριο,2.19
2025-08-01,198959,Μπάρμπα Στάθης Σαλάτα Μαρουλένια 200gr,2.19
2025-08-01,204806,Αγρόκηπος Παντζάρια Πέλλας Σακούλα 500gr,2.15
2025-08-01,192038,Lucia Κεράσια 250gr Εγχώρια,3.39
2025-08-01,198434,Κρεμμύδια Κόκκινα Ξερά Συσκευασμένα Ποιότητα Α΄Τιμή Κιλού,1.39
2025-08-01,192181,Φρεσκούλης Ιταλική Οικογενειακή 425gr,2.98
2025-08-01,198290,Σέλερυ Ελληνικό Τιμή Κιλού,1.04
2025-08-01,198526,Βιολογικά Πεπόνι Εγχώριο,2.26
2025-08-01,661089,Φρεσκούλης Σαλάτα Καπριτσιόζα 160gr,1.72
2025-08-01,198604,Λόλα Κόκκινη Ελληνική Ποιότητα Α΄ Το Τεμάχιο,0.99
2025-08-01,198362,Ξυλάγγουρο Τιμή Κιλού,0.82
2025-08-01,198530,Πατάτες Βιολογικές Ελληνικές Δίχτυ Τιμή Κιλού,4.29
2025-08-01,198500,Τομάτες Βιολογικές Ελληνικές Συσκευασμένες,5.03
2025-08-01,192293,Τοματίνια Τσαμπί,2.88
2025-08-01,198163,Τζίντζερ Εισαγωγής Τιμή Κιλού,1.05
2025-08-01,198359,Σμέουρα Εγχώρια 125gr,3.30
2025-08-01,198502,Κολοκύθια Βιολογικά Ελληνικά Συσκευασμένα Τιμή Κιλού,2.52
2025-08-01,192134,Μανιτάρια Φρέσκα 400gr Εγχώρια,2.87
2025-08-01,192303,Πατάτες Μυρτώ Συσκευασμένες Ελληνικές Ποιότητα Α Δίχτυ Τιμή Κιλού,4.95
2025-08-01,198289,Σέσκουλα Εγχώρια,0.44
2025-08-01,198109,Αχλάδια Κοντούλες Ποιότητα Α΄Τιμή Κιλού,0.68
2025-08-01,198508,Μήλα Στάρκιν Βιολογικά Ελληνικά Συσκευασία,4.90
2025-08-01,198506,Κρεμμύδια Βιολογικά Ξερά Ελληνικά Δίχτυ Τιμή Κιλού,4.50
2025-08-01,192095,Μπάρμπας Στάθης Σαλάτα Σπανάκι 500gr,3.78
2025-08-01,198007,Ραδίκια Ιταλικά Ελληνικά Τιμή Κιλού,1.93
2025-08-01,198008,Χόρτα Άγρια Τιμή Κιλού,1.99
2025-08-01,198534,Πιπεριές Φλωρίνης Βιολογικές Ελληνικές Συσκευασία,1.98
2025-08-01,198246,Βατόμουρα Συσκευασία 125gr,3.30
2025-08-01,198488,Πατάτες Νάξου Συσκευασμένες Ελληνικές Ποιότητα Α,6.27
2025-08-01,198171,Ρόκα Ελληνική Ποιότητα Α 100gr,0.99
2025-08-01,198772,Μανιτάρια Φρέσκα Γίγας Εισαγωγής 500gr,3.09
2025-08-01,204807,Αγρόκηπος Καλαμπόκι Γλυκό 400gr,3.26
2025-08-01,198655,Lucia Τομάτα Baby Ελληνική Ποιότητα Α' Συσκευασία 500gr,3.60
2025-08-01,198087,Μάνγκο Εισαγωγής Τιμή Κιλού,2.69
2025-08-01,198756,Χουρμάδες Εισαγωγής 250gr,3.71
2025-08-01,198656,Καρπούζι Βιολογικό Ατομικό Εγχώριο,3.73
2025-08-01,192024,Lucia Τοματίνια Ελληνικά Ποιότητα Α' 250gr,1.99
2025-08-01,198257,Πατάτες Ραγού Mini Συσκευασμένες Εισαγωγής Ποιότητα Α,3.60
2025-08-01,198035,Λάχανο Κόκκινο Ελληνικό Ποιότητα Α΄ Τιμή Κιλού,0.99
2025-08-01,192218,Αλλιόν Σκόρδο Φρέσκο Ψιλοκομμένο 100gr,2.45
2025-08-01,192572,Αβοκάντο Εισαγωγής Συσκευασία Τιμή Κιλού,7.34
2025-08-01,192194,Πεπόνι Ανανάς Εγχώριο Τιμή Κιλού,2.49
2025-08-01,192062,Ραπανάκια Εγχώρια 125gr Συσκευασία,0.97
2025-08-01,198517,Ακτινίδια Βιολογικά Ελληνικά Τιμή Κιλού,5.99
2025-08-01,198516,Βιολογικά Πορτοκάλια Βαλέντσια Εγχώρια,4.28
2025-08-01,192441,Πατάτες Κύπρου Επιλεγμένες Για Τηγάνι Δίχτυ Τιμή Κιλού,5.07
2025-08-01,198212,Ρόδι Εισαγωγής Τιμή Κιλού,1.89
2025-08-01,198046,Κρεμμύδια Στιφάδο Ελληνικά Ποιότητα Α΄ Δίχτυ Τιμή Κιλού,1.12
2025-08-01,198916,Μανιτάρια Porto Bello Εισαγωγής 500gr,3.48
2025-08-01,198010,Αντίδια Ελληνικά Τιμή Κιλού,1.69
2025-08-01,198398,Μπανάνες Dole Baby,2.34
2025-08-01,192335,Τομάτες Today's Τύπου Ελιά Ελληνικές 500gr,4.89
2025-08-01,192523,Φρεσκούλης Σαλάτα Γεύμα COBB Με Κοτόπουλο 280gr,4.45
2025-08-01,198716,Σταφύλια Κόκκινα Ασπέρμα Τιμή Κιλού,3.98
2025-08-01,192232,Σαλάτα Λόλα Σε Γλαστράκι,0.99
2025-08-01,198947,Μανιτάρια Brown Εισαγωγής Συσκευασία 500gr,3.25
2025-08-01,198504,Πιπεριές Βιολογικές Ελληνικές Συσκευασία,1.87
2025-08-01,198164,Πεπόνι Αργίτικο Εγχώριο,2.46
2025-08-01,192470,Μπάρμπα Στάθης Σαλάτα Ιταλική Οικογενειακή Συσκευασία 320gr,3.46
2025-08-01,192602,Φρουτοσαλάτα Εποχής 200gr,2.79
2025-08-01,198681,Μαϊντανός Ελληνικός Συσκευασία 80gr,0.99
2025-08-01,198769,Βασιλικός Ελληνικός Κουτί 25gr,1.99
2025-08-01,198804,Λόλα Double Mix Ζωντανή Ρίζα,1.89
2025-08-01,198133,Φινόκιο,0.84
2025-08-01,192324,Άρωμα Δυόσμος Γλαστράκι Μεγάλο,2.65
2025-08-01,192603,Φρουτοσαλάτα Mix 200gr,2.79
2025-08-01,192286,Άνηθος Συσκευασμένος Εγχώριος 80gr,0.99
2025-08-01,198408,Γκρέιπ Φρουτ Κόκκινο Εισαγωγής Ποιότητα Α,0.72
2025-08-01,192261,Κόλιανδρο Κουτί 25gr Εγχώριο,1.99
2025-08-01,192471,Μπάρμπα Στάθης Σαλάτα Φριζάτη 240gr,2.54
2025-08-01,198438,Μανιτάρια Πλευρώτους Βιολογικά Συσκευασία 400gr,2.99
2025-08-01,198774,Άρωμα Δυόσμος Ελληνικός Κουτί 25gr,1.99
2025-08-01,192081,Μανιτάρια Πλευρώτους Φιλέτο Ελληνικά 500gr,4.25
2025-08-01,198234,Άρωμα Σέλινο Εγχώριο Συσκευασία 80gr,0.99
2025-08-01,198089,Σταφύλια Σταφίδα Ποιότητα Α' Τιμή Κιλού,3.59
2025-08-01,204037,Αγρόκηπος Κολοκύθα Στον Ατμό 400gr,3.27
2025-08-01,192408,Μπάρμπα Στάθης Σπανάκι 250gr,2.23
2025-08-01,198928,Θυμάρι Εισαγωγής Κουτί 25gr,1.99
2025-08-01,198260,Σελινόριζα Εισαγωγής Τιμή Κιλού,1.78
2025-08-01,198082,Καρύδα Εισαγωγής Το Τεμάχιο,1.19
2025-08-01,198308,Πεπόνι Punto Εγχώριο,1.79
2025-08-01,198204,Γκρέιπ Φρουτ Κίτρινα Εισαγωγής,0.74
2025-08-01,198883,Άρωμα Σχοινόπρασο Chives 25gr Εγχώριος Τιμή Τεμαχίου,1.89
2025-08-01,330793,Rapunzel Χουρμάδες Με Κουκούτσι Bio Σκαφάκι 250gr,2.97
2025-08-01,198108,Αχλάδια Κόσια Εγχώρια Ποιότητα Α΄ Τιμή Κιλού,0.27
2025-08-01,198503,Μελιτζάνες Φλάσκες Βιολογικές Ελληνικές Συσκευασμένες Τιμή Κιλού,3.99
2025-08-01,198456,Ανανάς By Air Εισαγωγής Τιμή κιλού,11.17
2025-08-01,198766,Δενδρολίβανο Ελληνικό Κουτί 25gr,1.99
2025-08-01,198256,Αχλάδια Φέτελ Εισαγωγής Ποιότητα Α΄ Τιμή Κιλού,1.20
2025-08-01,217159,Δυόσμος Vevi Σακουλάκι 40gr,1.60
2025-08-01,198267,Σταφύλια Αττική Εγχώρια Ποιότητα Α' Τιμή Κιλού,2.08
2025-08-01,192029,Πατάτες Συσκευασμένες Χίου Ποιότητα Α΄ Δίχτυ Τιμή Κιλού,4.47
2025-08-01,198447,Καρπούζι Κίτρινο Εγχώριο,4.92
2025-08-01,192107,Βιολογική Σαλάτα Gran Mix 125gr,3.99
2025-08-01,192449,My Greek Pickles Φρέσκο Βιολογικό Ξινoλάχανο 250gr,3.99
2025-08-01,198486,Κινέζικο Λάχανο Τιμή Κιλού,4.49
2025-08-01,192494,Lucia's Κεράσια Εγχώρια 750gr,9.90
2025-08-01,198169,Ραντίτσιο Εισαγωγής,1.75
2025-08-01,192138,Διρφύς Μανιτάρια Λεντινούλα Αποξηραμένα 25gr,3.55
2025-08-01,198216,Ρέβα Εισαγωγής Τιμή Κιλού,2.85
2025-08-01,192212,Άρωμα Πιπερίες Shishito 300gr,3.25
2025-08-01,192674,Σταφύλια Mix Εγχώρια 500gr,2.99
2025-08-01,192166,Φρεσκούλης Σαλάτα Γεύμα Caprese 250gr,3.98
2025-08-01,192485,Σκόρδο Αποφλοιωμένο 60gr,2.35
2025-08-01,192291,Τοματίνια Mix 250gr,3.39
2025-08-01,134069,Σπάλα Χοιρινή Ελληνική Νωπή Άνευ Οστού,1.52
2025-08-01,133733,Λάπα Βοείου Ελληνική Νωπή Άνευ Οστού,3.10
2025-08-01,134061,Χοιρινός Λαιμός Ελληνικός Με Οστό,1.48
2025-08-01,137169,Πίνδος Φτερούγες Κοτόπουλο Ελληνικές Νωπές Τιμή Κιλού,0.29
2025-08-01,134001,Σουβλάκια Χοιρινά Ελληνικής Επεξεργασίας Μαριναρισμένα Νωπά Τιμή Κιλού,0.93
2025-08-01,133735,Σπάλα Βοείου Ελληνική Νωπή Άνευ Οστού,3.75
2025-08-01,133556,Σπαλομύτα Βοείου Ελληνική Νωπή Τιμή Κιλού,3.75
2025-08-01,134004,Χοιρινός Λαιμός Ολλανδίας Με Οστό Τιμή Κιλού,1.80
2025-08-01,137711,Άρτα Κοτόπουλο Ελληνικό Νωπό Xύμα,5.08
2025-08-01,133741,Ελιά Βοείου Ελληνική Νωπή Άνευ Οστού,3.75
2025-08-01,137307,Σουβλάκι Μπούτι Κοτόπουλου Ελληνικό Νωπό Μαριναρισμένο,1.12
2025-08-01,133211,Στήθος Λάπα Βοείου Γερμανίας Άνευ Οστού,2.77
2025-08-01,137706,Αμβροσιάδης Μπούτι Κοτόπουλο Νωπό Ελληνικό Τιμή Κιλού,1.64
2025-08-01,133228,Τουρτουγκίτα Ποντίκι Βοείου Γερμανίας Άνευ Οστού,2.96
2025-08-01,133205,Ελιά Βοείου Γερμανίας Νωπή Άνευ Οστού Τιμή Κιλού,3.92
2025-08-01,137149,Πίνδος Φιλέτο Στήθος Κοτόπουλου Ελληνικό Νωπό,5.97
2025-08-01,134062,Μπριζόλα Χοιρινή Ελληνική Νωπή Με Οστό Χωρίς Δέρμα Τιμή Κιλού,2.80
2025-08-01,134203,Σπάλα Χοιρινή Ολλανδίας Νωπή Άνευ Οστού,1.90
2025-08-01,137705,Αμβροσιάδης Κοτόπουλο Νωπό Ελληνικό Τιμή Κιλού,5.08
2025-08-01,134068,Πανσέτα Χοιρινή Ελληνική Νωπή Με Οστό Άνευ Δέρματος,1.27
2025-08-01,137735,Πίνδος Κοπανάκι Κοτόπουλο Ελληνικό Νωπό Τιμή Κιλού,0.97
2025-08-01,133055,Φάρμα Ελασσόνας Κιμάς Βόειος Νωπός 400gr,4.04
2025-08-01,137078,Το Χωρικό Φιλέτο Στήθος Κοτόπουλο Νωπό Χωρίς Κόκκαλο,5.10
2025-08-01,134065,Μπούτι Χοιρινό Ελληνικό Νωπό Άνευ Οστού,1.81
2025-08-01,134010,Μπριζόλα Χοιρινή Ολλανδίας Νωπή Με Οστό,2.56
2025-08-01,137076,Το Χωρικό Μπούτι Κοτόπουλου Νωπό Τιμή Κιλού,1.70
2025-08-01,137717,Άρτα Φιλέτο Στήθος Κοτόπουλο Νωπό Εγχώριο Τιμή Κιλού,3.48
2025-08-01,133209,Σπάλα Βοείου Γερμανίας Νωπή Άνευ Οστού,3.92
2025-08-01,133800,Ελιά Βοείου Πολωνίας Νωπή Άνευ Οστού Τιμή Κιλού,6.95
2025-08-01,137718,Άρτα Φτερούγες Κοτόπουλου Νωπές Εγχώριες Τιμή Κιλού,0.29
2025-08-01,133734,Στήθος Βοείου Ελληνικό Νωπό Χωρίς Οστό,6.20
2025-08-01,158501,Τσιπούρα Sparus Aurata Υδατοκαλλιέργειας Ελλάδος 0-4-0-8kg Τιμή Κιλού,6.29
2025-08-01,137832,Ελαιοπουλάκι Φιλέτο Μπούτι Κοτόπουλο Νωπό Δισκάκι 600gr,7.92
2025-08-01,137837,Ελαιοπουλάκι Φιλέτο Μπούτι Κοτόπουλο Δισκάκι 600gr -25%,5.94
2025-08-01,137147,Πίνδος Μπούτι Κοτόπουλο Ελληνικό Τιμή Κιλού,2.18
2025-08-01,133635,Συκώτι Βοείου Γερμανίας Νωπό,2.36
2025-08-01,134050,Χοιρινός Λαιμός Ολλανδίας Με Οστό Τιμή Κιλού,1.80
2025-08-01,133731,Μπούτι Βοείου Ελληνικό Νωπό Άνευ Οστού,4.00
2025-08-01,137719,Άρτα Φιλέτο Μπούτι Κοτόπουλο Νωπό Εγχώριο,2.31
2025-08-01,133702,Ελιά Σπάλα Μοσχάρι Γάλακτος Ολλανδίας Άνευ Οστού,4.37
2025-08-01,137146,Πίνδος Κοτόπουλο Ελληνικό Νωπό Τιμή Κιλού,7.05
2025-08-01,137960,Πίνδος Κοπανάκι Κοτόπουλο Μαριναρισμένο Ελληνικό Τιμή Κιλού,0.91
2025-08-01,134205,Μπούτι Χοιρινό Ολλανδίας Νωπό Άνευ Οστού Άνευ Δέρμα,1.99
2025-08-01,133994,Black Angus Ιρλανδίας Σπαλομπριζόλα Βοείου Άνευ Οστού Τιμή Κιλού,4.75
2025-08-01,133045,Meatka Μπιφτέκι Κοτόπουλου Ελληνικό Νωπό 600gr,4.91
2025-08-01,133801,Σπάλα Βοείου Πολωνίας Νωπή Άνευ Οστού,6.95
2025-08-01,138407,Mimikos Nuggets Κοτόπουλο Ελληνικά Δισκάκια Νωπά 480gr,5.64
2025-08-01,133231,Ποντίκι Βοείου Γερμανίας Νωπό Άνευ Οστού,3.45
2025-08-01,133056,Φάρμα Ελασσόνας Κιμάς Ανάμεικτος Νωπός 400gr,3.56
2025-08-01,133052,Μπιφτέκι Κοτόπουλο Νωπό Σε Δισκάκι Τιμή Κιλού,1.54
2025-08-01,134003,Πανσέτα Χοιρινή Ολλανδίας Νωπή Με οστό Άνευ Δέρματος,1.40
2025-08-01,137129,Αγγελάκης Ατομικό Ρολό Κοτόπουλο Xωρις Γλουτένη Νωπό Τιμή Κιλού,3.38
2025-08-01,134017,Φιλέτο Χοιρινό Ψαρονέφρι Ολλανδίας,4.98
2025-08-01,137742,Άρτα Κοπανάκι Νωπό Ελληνικό Τιμή Κιλού,0.97
2025-08-01,134537,Meatka Κεμπάπ Πολίτικο Ε.Ε. Δισκάκι 500gr,4.46
2025-08-01,138414,Mimikos Σνίτσελ Κοτόπουλο Ελληνικό Νωπό Δισκάκι 470gr,4.84
2025-08-01,134009,Κότσι Χοιρινό Ολλανδίας Νωπό Με Οστό Με Δέρμα,1.36
2025-08-01,137251,Mimikos Στήθος Φιλέτο Κοτόπουλο Ελληνικό Νωπό 650gr (+20% Δωρεάν Προϊόν),8.85
2025-08-01,133981,Peter's Farm Ελιά-Σπάλα Μοσχαράκι Γάλακτος Ολλανδίας,4.37
2025-08-01,137734,Πίνδος Φιλέτο Μπούτι Ελληνικό Νωπό Τιμή Κιλού,4.62
2025-08-01,102282,Μιχας Λουκάνικα Χοιρινά Τύπου Μυκόνου 400gr,2.00
2025-08-01,137893,Πίνδος Συκώτια Κοτόπουλου Ελληνικά Νωπά 500gr -20%,1.82
2025-08-01,137914,My Fresco Φιλέτο Μπούτι Κοτόπουλο Ελληνικό 700gr,6.08
2025-08-01,137820,Νιτσιάκος Σνίτσελ Ελληνικό Κοτόπουλο 390gr,3.81
2025-08-01,134547,Λαιμός Χοιρινός Ολλανδίας Άνευ Οστού Νωπός Τιμή Κιλού,1.86
2025-08-01,137915,My Fresco Κοπανάκι Κοτόπουλο Ελληνικό 650gr,4.40
2025-08-01,137911,My Fresco Μπούτι Κοτόπουλο Ελληνικό 725gr,3.12
2025-08-01,137833,Ελαιοπουλάκι Φιλέτο Στήθος Κοτόπουλο 600gr,8.50
2025-08-01,137167,Πίνδος Κοτόπουλο Ελεύθερης Βοσκής Ελληνικό Νωπό Τιμή Κιλού -10%,9.82
2025-08-01,133982,Peter'S Farm Μπριζόλες Κόντρα Μοσχαράκι Γάλακτος,8.76
