2025-06-12,411814,Λακωνία Φυσικός Χυμός Πορτοκάλι 250ml,0.68
2025-06-12,420348,La Trappe Quadrupel Μπύρα Φιάλη 330ml,3.78
2025-06-12,431516,Σκούρας Αρμύρα Λευκός Οίνος 750ml,13.41
2025-06-12,404082,Maioson Perrier Forever Lemonia 4x330ml,4.08
2025-06-12,420732,Craft Χωρίς Αλκοόλ Μπύρα Φιάλη 330ml,1.33
2025-06-12,431505,Ν.Λαζαρίδη Μαύρο Πρόβατο Λευκός Οίνος 750ml,13.89
2025-06-12,431747,Casarito Moscato D' Asti Λευκός Οίνος 375ml,5.70
2025-06-12,431753,Κτήμα Άλφα Ξινόμαυρο 750ml,18.10
2025-06-12,430910,Κτήμα Αβαντίς Lenga Λευκός Οίνος 750ml,15.41
2025-06-12,440110,Mini Chic Αφρώδης Ροζέ Οίνος 200ml,2.52
2025-06-12,420670,Mini Chic Lychee Αφρώδης Οίνος 200ml,2.48
2025-06-12,440912,Martini Asti Αφρώδης Λευκός Οίνος 750ml,11.60
2025-06-12,470301,Cutty Sark Whisky 700ml,20.23
2025-06-12,450029,Archers Woo Woo Cranberry 250ml,2.24
2025-06-12,403021,Maison Perrier Lemonjito 4x250ml,3.88
2025-06-12,402096,Fever Tree Pink Grapefruit Σόδα 200ml,1.52
2025-06-12,412063,Fuze Tea Ροδάκινο Με Εκχύλισμα Ιβίσκου 6x1.5 lt,11.13
2025-06-12,404267,Evian Μεταλλικό Νερό 6x1 lt,11.16
2025-06-12,420628,Pils Hellas Μπύρα Φιάλη 200ml 24τεμ,14.64
2025-06-12,431538,Μαύρο Πρόβατο Ροζέ Οίνος 750ml,14.50
2025-06-12,431445,Αγιωργίτικο Παπαϊωάννου Ερυθρός 750ml,8.72
2025-06-12,461425,Πλωμάρι Ούζο 200ml,4.08
2025-06-12,425401,Strongbow Μηλίτης Με Γεύση Gold Apple Φιάλη 330ml,1.50
2025-06-12,430987,Ημίγλυκος Ερυθρός Οίνος 750ml,4.08
2025-06-12,430197,Κτήμα Μιχαλάκη Μανδηλάρι Ροζέ Οίνος 750ml,6.44
2025-06-12,404265,Evian Μεταλλικό Νερό 1L,1.86
2025-06-12,411812,Λακωνία Νέκταρ 3 Φρούτων 1lt,1.32
2025-06-12,470006,MG Spirit Mojito 275ml,2.20
2025-06-12,431137,Μίγας Μαύρο Μοσχάτο Τυρνάβου Λευκός 750ml,7.30
2025-06-12,450301,Finlandia Vodka 700ml,17.54
2025-06-12,650439,Ζύθος Βαπ Μπύρα Κουτί 330ml 5+1 Δώρο,4.49
2025-06-12,430133,Apelia Ημίγλυκο Κόκκινο Κρασί 1-5 lt,6.01
2025-06-12,402468,Carabao Energy Drink Mixed Berry 330ml,1.29
2025-06-12,431502,Λήμνια Γη Λευκός Οίνος 750ml,9.52
2025-06-12,453016,Olmeca Τεκίλα Λευκή 35% 700ml,22.80
2025-06-12,453202,Jose Cuervo Tequila Κίτρινη 700ml,25.90
2025-06-12,442037,Metaxa 3* Cognac 700ml,14.13
2025-06-12,430441,Achaia Clauss Μαυροδάφνη Πατρών 375ml,4.55
2025-06-12,460945,Disaronno Amaretto Λικέρ 700ml,19.60
2025-06-12,420357,Kaiserdom Pilsener Premium Μπύρα Κουτί 1lt,3.90
2025-06-12,650437,Ζύθος Βαπ Μπύρα Κουτί 330ml,0.90
2025-06-12,430917,The Fallen Oak Κυρ-Γιάννη Ερυθρός Οίνος 750ml,13.60
2025-06-12,431245,Aria Μοσχάτο Τυρνάβου Λευκός Οίνος 750ml,6.05
2025-06-12,425007,The Locals Cocktail Silent Muse Gin 250ml,2.48
2025-06-12,452002,Bacardi Carta Blanca Ρούμι 1lt,26.47
2025-06-12,430191,Μπλε Τρακτέρ Κυρ Γιάννη Ερυθρός Οίνος 750ml,10.88
2025-06-12,411409,Aloe Vera Pineapple 500ml,1.71
2025-06-12,442015,Metaxa 5* 38% Cognac 200ml,5.44
2025-06-12,461048,Καλαϊτζή Τσίπουρο Χωρίς Γλυκάνισο 200ml,3.98
2025-06-12,430015,Κρητικός Μπουτάρη Λευκός Οίνος 750ml,6.70
2025-06-12,431456,Mostra Λευκός Οίνος 500ml,2.73
2025-06-12,411410,Aloe Vera Φράουλα Light 500ml,1.71
2025-06-12,461823,Ζέπος Ούζο Μυτιλήνης 500ml,6.54
2025-06-12,461139,Το Δεκαράκι Τσίπουρο 200ml,4.76
2025-06-12,431181,Ρωμέικο Λευκό Κρασί Σε Ασκό 5lt,12.10
2025-06-12,430360,Μικρός Βοριάς Λευκός Οίνος 750ml,8.80
2025-06-12,431468,Σαμαρόπετρα Κυρ Γιάννη Λευκός Οίνος 750ml,13.81
2025-06-12,431457,Mostra Ροζέ Οίνος 500ml,2.79
2025-06-12,430656,Απλά Λευκός Οίνος 750ml,11.65
2025-06-12,431645,Κτήμα Αβάντις Ροζέ Οίνος 750ml,7.80
2025-06-12,420307,Beck's Μπύρα Φιάλη 6x275ml,6.66
2025-06-12,431720,Κτήμα Άλφα Ροζέ Οίνος 750ml,21.01
2025-06-12,430064,Ψηλές Κορφές Λευκός Οίνος 750ml,7.88
2025-06-12,411677,Nestea Λεμόνι 500ml,1.37
2025-06-12,461948,Αγιονέρι Τσίπουρο 500ml,13.27
2025-06-12,431301,Κτήμα Χατζημιχάλη Πολυποικιλιακός Λευκός Οίνος 750ml,11.00
2025-06-12,460510,Τέττερης Λικέρ Τριαντάφυλλο 500ml,9.65
2025-06-12,430619,Σώκος Μαλαγουζιά Λευκός Οίνος 750ml,8.81
2025-06-12,430361,Ασπρολίθι Ρούβαλη Λευκός Οίνος 750ml,7.35
2025-06-12,440031,Chic Rasberry Αφρώδης Οίνος Ροζε 750ml,6.13
2025-06-12,453207,Jose Cuervo Tequila Silver 700ml,24.90
2025-06-12,420788,Pils Hellas Μπύρα Κουτί 0.0% 330ml 4τεμ,2.22
2025-06-12,431263,Calliga Blanc Λευκός Ημίξηρος Οίνος Demi Sec 750ml,6.13
2025-06-12,431258,Κτήμα Κόκκινος Petinos Ερυθρός Οίνος 750ml,10.70
2025-06-12,431252,Μαλαματίνα Μάλαμα Ρετσίνα 500ml,2.53
2025-06-12,431240,Kotsifali Βασίλισσες Ερυθρός Οίνος 750ml,8.50
2025-06-12,402382,Prime Ισοτονικό Ποτό Blue Rasberry 500ml,1.98
2025-06-12,420730,ΑΛΦΑ Μπύρα Sea Salt Κουτί 500ml 4τεμ,5.22
2025-06-12,404266,Evian Μεταλλικό Νερό 6x500ml,6.54
2025-06-12,451015,Bombay Sapphire Gin 700ml,23.60
2025-06-12,470944,Jameson Black Barrel Ουίσκυ 700ml,33.85
2025-06-12,420246,Άλφα Strong Μπύρα Lager Κουτί 4x500ml,6.56
2025-06-12,431182,Ρωμέικο Κόκκινο Κρασί Σε Ασκό 5lt,12.71
2025-06-12,430352,Ελληνικά Κελλάρια Μοσχοφίλερο Λευκός Οίνος 750ml,6.05
2025-06-12,402381,Prime Ισοτονικό Ποτό Ice Pop 500ml,1.98
2025-06-12,411021,Ηβη Energy 7 Φρουτοποτό 1lt,2.42
2025-06-12,431596,Γεροβασιλείου Ξινόμαυρο Ροζέ Οίνος 750ml,17.28
2025-06-12,452667,Havana Club Anejo Rum 3 Ετών 37-5% 700ml,18.25
2025-06-12,431495,Σκούρας Άκρες Ερυθρός Οίνος 750ml,8.07
2025-06-12,431492,Αβέρωφ Ροζέ Οίνος 750ml,9.73
2025-06-12,461826,Ζέπος Ούζο Μυτιλήνης 40% 2lt,21.91
2025-06-12,460334,Skinos Μαστίχα Λικέρ 350ml,9.74
2025-06-12,431467,Τέσσερις Λίμνες Κυρ Γιάννη 750ml,17.24
2025-06-12,420797,Άμστελ Retro Μπύρα Φιάλη 330ml 6τεμ,7.74
2025-06-12,420794,ΑΜΣΤΕΛ Retro Μπύρα Φιάλη 330ml,1.29
2025-06-12,420787,Α Τoda Madre Μπύρα Φιάλη 330ml,1.51
2025-06-12,451044,Tanqueray Gin & Tonic Κουτί 250ml,2.49
2025-06-12,420728,ΑΛΦΑ Μπίρα Sea Salt Κουτί 500ml,1.63
2025-06-12,420718,Νήσος 7 Μποφόρ Μπύρα Φιάλη 330ml,2.99
2025-06-12,430185,Lambrusco Rosato Οίνος Ροζέ Αφρώδης Ιταλίας 750ml,6.18
2025-06-12,650611,Vantana Ούζο 200ml,3.09
2025-06-12,431164,Νεράιδες Ημίγλυκος Λευκός Οίνος 750ml,8.68
2025-06-12,431458,Mostra Ερυθρός Οίνος 500ml,2.79
2025-06-12,412034,Voelker Χυμός Κομπούχα Bio 750ml,5.28
2025-06-12,431130,Μίγας Μαύρο Μοσχάτο Τυρνάβου Ροζέ 750ml,7.30
2025-06-12,431304,Κτήμα Χατζημιχάλη Πολυποικιλιακός Ερυθρός Οίνος 750ml,11.20
2025-06-12,461036,Τυρνάβου Βρυσσά Τσίπουρο Χωρίς Γλυκάνισο 700ml,12.97
2025-06-12,470701,Chivas Regal 12 Years Old Deluxe Whisky 700ml,32.80
2025-06-12,460031,Malibu Λικέρ 700ml,16.50
2025-06-12,412140,Powerade Blood Orange 500ml,1.48
2025-06-12,420717,Νήσος Αποκάλυψη Μπύρα Φιάλη 330ml,2.94
2025-06-12,411278,Sunsweet Χυμός Με Δαμάσκηνα 500ml,6.10
2025-06-12,431178,Apelia Ημίγλυκος Ερυθρός Οίνος Σε Ασκό 3 lt,10.85
2025-06-12,460016,Martini Bianco 1lt,12.34
2025-06-12,420830,Craft Lager Μπύρα Κουτί 330ml 5+1Δώρο,5.56
2025-06-12,460987,Cinzano Pro Spiritz 750ml,8.74
2025-06-12,451016,Gordon's Pink Gin 700ml,17.57
2025-06-12,430442,Achaia Clauss Μαυροδάφνη Πατρών 750ml,9.19
2025-06-12,450210,Absolut Vodka 500ml,14.84
2025-06-12,431330,Κτήμα Χατζημιχάλη Μαλαγουζιά Δρυός Λευκός Οίνος 750ml,14.88
2025-06-12,431461,Κ.Λαζαρίδη Αμέθυστος Λευκός Οίνος 750ml,14.10
2025-06-12,450027,The Locals Mojito Gin Κουτί 250ml,1.74
2025-06-12,460067,Κατσαρός Λεμοντσέλο Λικέρ 700ml,14.55
2025-06-12,430196,Κτήμα Μιχαλάκη Κρητικός Ερυθρός Οίνος 750ml,3.88
2025-06-12,430604,Χνάρια Λευκός Οίνος 750ml,6.36
2025-06-12,411014,Ηβη Νέκταρ Πορτοκάλι-Μήλο-Βερύκοκο 1lt,1.96
2025-06-12,431401,Κτήμα Χρυσοχόου Άσπρο Από Μαύρο Xinomavro Λευκός Οίνος 750ml,9.51
2025-06-12,420912,Bud Μπύρα Αμερικής Φιάλη 330ml,1.95
2025-06-12,430705,Ν. Λαζαρίδη Ροζέ Οίνος 750ml,15.52
2025-06-12,431751,Κτήμα Άλφα Λευκός Οίνος 750ml,20.81
2025-06-12,461422,Ούζο Πλωμαρίου Ισίδωρου Αρβανίτη 500ml,9.17
2025-06-12,460338,Skinos Μαστίχα Λικέρ 700ml,19.21
2025-06-12,450122,Smirnoff North Vodka 700ml,16.73
2025-06-12,411280,Βιοαγρός Χυμός Κράνμπερι Bio 750ml,7.10
2025-06-12,431403,Κτήμα Γ. Παλυβού Πέτρινες Πλαγίες Λευκό 750ml,14.79
2025-06-12,420570,Franziskaner Weiss Μπύρα Φιάλη 500ml,2.88
2025-06-12,431506,Κτήμα Ν. Λαζαρίδη Μαύρο Πρόβατο Ερυθρός Οίνος 750ml,16.33
2025-06-12,431595,Γεροβασιλείου Viognier Λευκός Οίνος 750ml,21.84
2025-06-12,461169,Τσιλιλή Τσίπουρο 40% 200ml,4.15
2025-06-12,470973,Famous Grouse Smoky Black Ουίσκι 700ml,22.30
2025-06-12,431752,Κτήμα Άλφα Ερυθρός Οίνος 750ml,28.80
2025-06-12,470352,Tullamore Dew Ουίσκυ Ιρλανδίας 700ml,20.70
2025-06-12,430916,Κτήμα Αβαντίς Syrah Ερυθρός Οίνος 750ml,14.10
2025-06-12,425204,Breezer Passion Fruit Mango 275ml,2.16
2025-06-12,402466,Carabao Energy Drink Πράσινο Μήλο 330ml,0.90
2025-06-12,431257,Κτήμα Κόκκινος Naoussa Xinomavro Οίνος 750ml,16.53
2025-06-12,440030,Chic Lychee Αφρώδης Οίνος Λευκός 750ml,6.13
2025-06-12,430857,Καραμολέγκος 34 Λευκός Οίνος 750ml,40.92
2025-06-12,470007,MG Spirit Gin Tonic 275ml,2.20
2025-06-12,461189,Αποστολάκη Τσίπουρο Χωρίς Γλυκάνισο 200ml,4.69
2025-06-12,450202,Absolut Vodka 1lt,25.40
2025-06-12,470931,Teacher's Ουίσκυ 700ml,18.53
2025-06-12,461985,Ramazzotti Sambuca (Ιταλία) 700ml,17.84
2025-06-12,431497,Γεροβασιλείου Ξηρός Λευκός 750ml,16.99
2025-06-12,650454,Bushmills Ουίσκι 700ml,21.55
2025-06-12,411339,Nutri Valley 9 Φρούτα 1lt,1.99
2025-06-12,402469,Carabao Energy Drink Orange 330ml,0.90
2025-06-12,430205,Markou Pixie Κρασί Ροζέ Ημίξηρος 750ml,9.99
2025-06-12,403022,Maison Perrier Citrus Fizz 4x250ml,3.88
2025-06-12,461083,Κατσαρού Ούζο Legendary 700ml,9.99
2025-06-12,460512,Marie Brizard Λικέρ Triple Sec 700ml,13.73
2025-06-12,470014,MG Spirit Vodka Passion 275ml,2.20
2025-06-12,430038,Whispering Angel Provence Ροζέ 750ml,28.99
2025-06-12,431132,Samartzis Δύο Ποτάμια Λευκός Οίνος 750ml,9.50
2025-06-12,461201,Ηδωνικό Τσίπουρο Με Γλυκάνισο 700ml,15.75
2025-06-12,431462,Κ.Λαζαρίδη Αμέθυστος Ροζέ Οίνος 750ml,14.10
2025-06-12,412141,Omg Bubble Tea Peach 270ml,2.94
2025-06-12,411343,Nestea Ροδάκινο Zero Sugar 500ml,1.49
2025-06-12,411342,Nestea Λεμόνι Zero Sugar 500ml,1.49
2025-06-12,431264,Βαλές Κούπα Λαζαρίδη Ροζέ Οίνος 750ml,6.12
2025-06-12,430204,Λυραράκη Βιδιανό Βασίλισσες Λευκός 750ml,9.50
2025-06-12,430175,Χαρλαύτης Πεταλούδες Ροζέ Ξηρός Οίνος 750ml,11.26
2025-06-12,430605,Χνάρια Ερυθρός Οίνος 750ml,6.36
2025-06-12,431177,Apelia Ερυθρός Οίνος Σε Ασκό 3 lt,10.42
2025-06-12,431404,Παλυβού Βυσσινόκηπος Ροζέ Οίνος 750ml,12.64
2025-06-12,461302,Veto Ούζο 700ml,10.19
2025-06-12,430657,Απλά Ροζέ Οίνος 750ml,13.25
2025-06-12,431500,Nico Lazaridi Chateau Ερυθρός Οίνος 750ml,17.48
2025-06-12,420824,Craft Lager Μπύρα Φιάλη 330ml,1.37
2025-06-12,430672,Αγιωργίτικο Ερυθρό Κρασί σε Ασκό 3lt,10.74
2025-06-12,461243,Γάτσιος Τσίπουρο Χωρίς Γλυκάνισο 700ml,12.18
2025-06-12,430358,Μικρός Βοριάς Ερυθρός Οίνος 750ml,8.86
2025-06-12,453010,El Jimador Τεκίλα Λευκή 700ml,25.34
2025-06-12,460096,Τέττερης Μαστίχα Λικέρ Χίου 500ml,10.78
2025-06-12,460940,Jagermeister Λικέρ 700ml,20.00
2025-06-12,451010,Greenall'S Gin 700ml,18.67
2025-06-12,430697,Μέγα Σπήλαιο Μοσχάτο Λευκός Οίνος 750ml,8.80
2025-06-12,470442,Dimple Golden Selection Ουίσκι 700ml,35.80
2025-06-12,440002,Cair Αφρώδης Οίνος Demi Sec 750ml,11.93
2025-06-12,440001,Cair Αφρώδης Οίνος Brut 750ml,12.87
2025-06-12,431496,Κτήμα Βιβλία Χώρα Βιολογικός Ερυθρός Οίνος 750ml,20.20
2025-06-12,430213,Μέγα Σπήλαιο Λευκός Sauvignon Ξηρός Οίνος 750ml,11.41
2025-06-12,430184,Gancia Prosecco Αφρώδης Οίνος Ροζέ 750ml,13.85
2025-06-12,431105,Βολτες Λευκός Οίνος 750ml,7.44
2025-06-12,412062,Fuze Tea Λεμόνι Με Εκχύλισμα Λουίζας 6x1.5 lt,11.13
2025-06-12,453017,Olmeca Τεκίλα Κίτρινη 35% 700ml,24.20
2025-06-12,431671,Μαντινεία Τσέλεπου Λευκός Οίνος 750ml,12.84
2025-06-12,430028,Κτήμα Θεόπετρα Λευκός Οίνος 750ml,14.45
2025-06-12,158245,Aloe Vera Queen's Χυμός Με Γεύση Φράουλα 500ml,1.70
2025-06-12,470016,Plantation Grand Reserve Ρούμι 700ml,23.87
2025-06-12,431185,Ρωμέικο Ροζέ Κρασί Σε Ασκό 5lt,12.42
2025-06-12,431308,Κτήμα Χατζημιχάλη Cabernet Sauvignon Ερυθρός Οίνος 750ml,18.40
2025-06-12,431302,Κτήμα Χατζημιχάλη Πολυποικιλιακός Ροζέ 750ml,11.00
2025-06-12,431309,Κτήμα Χατζημιχάλη Chardonnay Λευκός Οίνος 750ml,14.00
2025-06-12,461150,Τσιλιλή Τσίπουρο Με Γλυκάνισο 200ml,4.55
2025-06-12,452101,Captain Morgan Rum 700ml,20.42
2025-06-12,461163,Ρωμέικο Τσίπουρο Χωρίς Γλυκάνισο 200ml,3.48
2025-06-12,450701,Ursus Roter Vodka Based 700ml,16.23
2025-06-12,430208,Μέγα Σπήλαιο Ρόζε Οίνος 750ml,13.02
2025-06-12,460072,Skinos Med Mastiha Spirit 250ml,2.90
2025-06-12,431219,Κτήμα Σέμελη Piccolo Mondo Λευκός Ημίγλυκος Οίνος 750ml,7.33
2025-06-12,451036,Hendrick's Gin 700ml Δώρο Δοσομετρητής,38.41
2025-06-12,425012,Metaxa Cognac 5* Orange 700ml,17.51
2025-06-12,460890,Marie Brizard Grenadine 700ml,5.20
2025-06-12,431106,Βόλτες Ροζέ Οίνος 750ml,7.44
2025-06-12,425010,Tanqueray Gin 0.0% Alcohol Free 700ml,21.50
2025-06-12,461564,Μπαμπατζίμ Τσίπουρο Χωρίς Γλυκάνισο 700ml,14.89
2025-06-12,451042,Bulldog Gin 700ml,26.68
2025-06-12,452016,Plantation Ρούμι Dark Original 700ml,22.51
2025-06-12,431524,Ν.Λαζαρίδη Μαγικό Βουνό Λευκός Οίνος 750ml,20.39
2025-06-12,430000,L'Esprit Du Lac Ροζέ Οίνος 750ml,16.77
2025-06-12,470019,Citadelle Τζιν 700ml (+Δώρο Ποτήρι),28.70
2025-06-12,430016,Κτήμα Γεροβασιλείου Chardonnay 750ml,26.93
2025-06-12,470018,Citadelle Gin 700ml,28.70
2025-06-12,451120,Beefeater Pink Gin 700ml,18.60
2025-06-12,431632,Κτήμα Θεοδωρακάκου Κυδωνίτσα Bio Λευκός Οίκος 750ml,10.45
2025-06-12,431311,Κτήμα Χατζημιχάλη Alfega Λευκός Οίνος 750ml,13.40
2025-06-12,460409,Southern Comfort Λικέρ 700ml,19.85
2025-06-12,461205,Βαρβαγιάννη Πράσινο Ούζο 700ml,13.39
2025-06-12,431754,Gancia Moscato D' Asti Αφρώδης Λευκός Οίνος 750ml,11.20
2025-06-12,461002,"12" Ούζο 350ml,5.97
2025-06-12,430913,Κτήμα Αβαντίς Sauvignon Blanc 750ml,13.05
2025-06-12,460347,Mastic Tears Λικέρ 500ml,14.16
2025-06-12,460721,Drambuie Λικέρ 700ml,29.49
2025-06-12,650615,Vantana Ούζο 700ml,9.32
2025-06-12,460401,Jack Daniel’s Tennessee Honey 700ml,27.80
2025-06-12,402494,Hell Energy Drink Zero White Peach 250ml,0.82
2025-06-12,420753,Νήσος Easy Ipa Μπίρα Φιάλη 330ml,3.16
2025-06-12,451048,Beefeater Gin 0.0% 700ml,17.52
2025-06-12,420747,La Goudale Biere Μπίρα Φιάλη 750ml,7.55
2025-06-12,430206,Κτήμα Αβάντις Μαλαγουζιά Λευκο Οίνος 750ml,14.76
2025-06-12,420738,Fischer Tradition Μπίρα Φιάλη 660ml,4.49
2025-06-12,442012,Alexander Μπράντυ 3* 34% 700ml,17.01
2025-06-12,412088,Rabenhorst Χυμός Κράνμπερρυ 330ml,3.98
2025-06-12,431243,Κτήμα Μιχαλάκη Κοτσιφάλι Ερυθρός Οίνος 750ml,6.43
2025-06-12,460003,Martini Rosso 14-4% 1lt,12.11
2025-06-12,430907,Ramos Porto Ruby Ερυθρός Οίνος 750ml,15.50
2025-06-12,461000,Καλλικούνης Ρακόμελο Δεσποτικόν 700ml,14.99
2025-06-12,430856,Vinsanto Σαντορίνη Καραμολέγκος Γλυκός Οίνος 500ml,48.36
2025-06-12,650343,Παλυβού Νεμέα Ερυθρός Οίνος 750ml,13.04
2025-06-12,461563,Μπαμπατζίμ Τσίπουρο Χωρίς Γλυκάνισο 200ml,4.88
2025-06-12,452021,Bacardi Carta Negra Ρούμι 700ml,19.37
2025-06-12,411371,Ηβη Φρουτοποτό Ροδάκινο 1lt,2.03
2025-06-12,440027,D'Ifestia Λευκός Ημιαφρώδης Οίνος 750ml,10.90
2025-06-12,452017,Chairman's Ρούμι Spiced Reserve 700ml,28.79
2025-06-12,431522,Κτήμα Ν.Λαζαρίδη Μαγικό Βουνό Ερυθρός Οίνος 750ml,33.30
2025-06-12,431109,Μίγας Μαύρο Μοσχάτο Τυρνάβου Ερυθρός 750ml,7.30
2025-06-12,461210,Γιαννατσή Ούζο Ρετρό 700ml,13.44
2025-06-12,461964,Κατσάρος Τσίπουρο Χωρίς Γλυκάνισο 700ml,13.69
2025-06-12,440010,Ακακίες Κυρ Γιάννη Αφρώδης Οίνος 750ml,14.77
2025-06-12,431331,Κτήμα Χατζημιχάλη Alfega Ερυθρός Οίνος 750ml,15.45
2025-06-12,470712,Chivas Regal Extra Ουίσκυ 700ml,35.50
2025-06-12,452965,Havana Club Anejo Rum 7 Ετών 700ml,25.80
2025-06-12,442023,Metaxa 5* 38% Cognac 700ml,17.50
2025-06-12,442009,Metaxa 7* Αμφορέας Cognac 700ml,24.05
2025-06-12,470824,Talisker Skye Whisky 700ml,44.11
2025-06-12,440357,Bianconero Αφρώδης Οίνος Ροζέ 750ml,11.69
2025-06-12,461255,Αγιονέρι Τσίπουρο 200ml,5.85
2025-06-12,460701,Cointreau Λικέρ 700ml,23.53
2025-06-12,430214,Desir Ροζέ Οίνος 750ml,5.19
2025-06-12,430215,Dedir Λευκός Οίνος 750ml,5.19
2025-06-12,431253,Roche Mazet Gewurtraminer Οίνος 750ml,7.48
2025-06-12,431254,Valestrel Provence Οίνος Ροζέ Γαλλικός 750ml,11.14
2025-06-12,412090,Rabenhorst Χυμός 11 Βιταμίνες Bio 750ml,4.60
2025-06-12,431246,Κτήμα Παπαϊωάννου Chardonnay Λεύκος Οίνος 750ml,12.46
2025-06-12,452023,Havana Club Ρούμι Anejo Especial 700ml,19.85
2025-06-12,431235,Συρράχο Rouvalis Λευκός Ξηρός Οίνος 750ml,12.20
2025-06-12,460057,Luxardo Limoncello 27% Αλκοόλ 500ml,17.88
2025-06-12,420571,Leffe Blonde Μπίρα Φιάλη 330ml,2.97
2025-06-12,470813,Talisker Ουίσκι 700ml,44.91
2025-06-12,431761,Santo Wines Σαντορίνη Ασύρτικο Λευκός Οίνος 750ml,32.86
2025-06-12,453209,Don Julio Τεκίλα Blanco 700ml,54.13
2025-06-12,450139,Belvedere Vodka 700ml,50.94
2025-06-12,451013,Tanqueray Rangpur Gin 700ml,25.10
2025-06-12,450195,Grey Goose Premium Vodka 700ml,46.40
2025-06-12,430173,Σώκος Ασύρτικο Λευκός Οίνος 750ml,9.08
2025-06-12,430329,Fun Ερυθρός Ημίγλυκος Οίνος 750ml,4.96
2025-06-12,470023,Arran Barrel Reserve Malt Ουίσκι 700ml,38.84
2025-06-12,430029,Κτήμα Θεόπετρα Ερυθρός Οίνος 750ml,19.11
2025-06-12,440025,Μίγας Μοσχάτο Τυρνάβου Ημιαφρώδης Λευκός Οίνος 750ml,11.37
2025-06-12,431447,Μελιαστό Σπυρόπουλου Ροζέ Οίνος 750ml,9.40
2025-06-12,451025,Sailor Jerry Spiced Ρούμι 700ml,22.59
2025-06-12,650614,Vantana Tentoura Λικέρ 500ml,14.90
2025-06-12,431672,Chateau Julia Merlot Ερυθρός Οίνος 750ml,21.48
2025-06-12,431463,Κ.Λαζαρίδη Αμέθυστος Ερυθρός Οίνος 750ml,18.95
2025-06-12,461202,Βαρβαγιάννη Μπλε Ούζο 700ml,13.89
2025-06-12,470921,J & B Ουίσκι 700ml,20.62
2025-06-12,470184,Lagavulin 16 Years Old Malt Whisky 700ml,82.17
2025-06-12,412142,Omg Bubble Tea Rasberry 270ml,2.94
2025-06-12,402498,Coolvit Balance 500ml,1.90
2025-06-12,431262,Κτήμα Κόκκινος Petinos Οίνος Λευκός 750ml,10.72
2025-06-12,442013,Metaxa 12* Cognac 700ml + Δώρο Κάλτσες,33.78
2025-06-12,470038,Cutty Sark 12 ετών 700ml,30.99
2025-06-12,430207,Νασιάκου A Priori Mαντίνεια Λευκό 750ml,11.04
2025-06-12,453000,Cazadores Reposado Tequila Κίτρινη 700ml,26.67
2025-06-12,431248,Minuty M Ροζέ Ξηρός Οίνος 750ml,23.31
2025-06-12,430353,Ελληνικά Κελλάρια Αγιωργίτικο Νεμέας Ερυθρός Ξηρός Οίνος ΠΟΠ 750ml,6.25
2025-06-12,425013,42 Below Βότκα 700ml,18.15
2025-06-12,431199,Tails Passion Fruit Martini 14-9% 500ml,15.50
2025-06-12,452060,Don Papa Ρούμι 700ml,47.80
2025-06-12,650346,Καραμολέγκος Σαντορίνη Λευκός Οίνος 750ml,34.93
2025-06-12,461301,Veto Ούζο 200ml,3.99
2025-06-12,452018,Bacardi Cuatro 40% Ρούμι 4 Ετών 700ml,23.44
2025-06-12,470400,Dewar's Sp. Reserve 12 Years Ουίσκυ 700ml,27.68
2025-06-12,457105,Luxardo Aperitivo 700ml,13.31
2025-06-12,452012,Diplomatico Reserva Exclusiva Ρούμι 700ml,43.64
2025-06-12,431499,Nico Lazaridi Chateau Λευκός Οίνος 750ml,14.52
2025-06-12,470017,Plantation 3* Ρούμι 700ml,19.26
2025-06-12,461224,Δεκαράκι Μαλαγουζιά Τσίπουρο 700ml,16.99
2025-06-12,431310,Κτήμα Χατζημιχάλη Syrah Ερυθρός Οίνος 750ml,14.30
2025-06-12,453208,Don Julio Τεκίλα Reposado 700ml,59.99
2025-06-12,431762,Santo Wines Νυχτέρι Λευκός Οίνος 750ml,35.96
2025-06-12,451041,Finsbury Gin 700ml,15.99
2025-06-12,431765,Vinsanto Santo Wines Γλυκός Οίνος 500ml,43.70
2025-06-12,470511,Glenfiddich Ουίσκυ 12 ετών 700ml,43.88
2025-06-12,411344,Lipton Ice Tea Rasberry Zero 500ml,1.80
2025-06-12,461091,Κατσαρός Παλαιωμένο Τσιπούρο 200ml,14.35
2025-06-12,470039,Dewar's Japanese Ουίσκι 8 ετών 700ml,25.85
2025-06-12,453018,Patron Reposado Tequila 700ml,55.14
2025-06-12,431249,Calliga Ασύρτικο Ροδίτης 750ml,9.75
2025-06-12,412089,Rabenhorst Χυμός Detox Bio 750ml,3.98
2025-06-12,431239,Sarris Robola Κεφαλληνίας 750ml,13.89
2025-06-12,461090,Aρόδαμα Τσικουδιά 200ml,5.14
2025-06-12,470010,Clan Macgregor Ουίσκι 700ml,13.84
2025-06-12,461080,Καλαϊτζή Τσίπουρο Χωρίς Γλυκάνισο 700ml,12.02
2025-06-12,461081,Αλλοτινό Τσίπουρο Χωρίς Γλυκάνισο 40% 200ml,4.61
2025-06-12,440421,Veuve Clicquot Ponsardin Brut Champagne 750ml,64.63
2025-06-12,440804,Veuve Clicquot Rose Σαμπάνια 750ml,74.95
2025-06-12,470032,Roe & Co Whisky Ιρλανδίας 700ml,34.10
2025-06-12,430608,Απλά Ερυθρός Οίνος 750ml,13.75
2025-06-12,460006,Gratus Λικέρ 500ml,24.00
2025-06-12,461208,Γιαννατσή Ούζο Ρετρό 200ml,5.07
2025-06-12,450407,Serkova Crystal Pure Vodka 40% 700ml,21.04
2025-06-12,461971,Κατσάρος Τσίπουρο Χωρίς Γλυκάνισο 200ml,5.37
2025-06-12,451108,Monkey 47 Gin 500ml,49.40
2025-06-12,461206,Βαρβαγιάννη Πράσινο Ούζο 200ml,4.54
2025-06-12,452105,Ron Zacapa Ρούμι 700ml,57.10
2025-06-12,650427,Ούζο Μυτιλήνης 700ml,10.41
2025-06-12,451100,Tanqueray No 10 Gin 700ml,46.15
2025-06-12,440403,Moet & Chandon Rose Σαμπάνια 750ml,69.20
2025-06-12,451052,Pampero Blanco Ρούμι 700ml,19.78
2025-06-12,451051,Pampero Especial Ρούμι 700ml,21.46
2025-06-12,461264,Πιλαβά Ούζο 700ml,11.99
2025-06-12,440401,Moet & Chandon Σαμπάνια Brut 750ml,54.69
2025-06-12,461267,Πιλαβά Ούζο 2L,29.35
2025-06-12,461270,Πιλαβά Ούζο Μινιατούρα 50ml,1.34
