2025-08-01,431516,Σκούρας Αρμύρα Λευκός Οίνος 750ml,13.41
2025-08-01,460031,Malibu Λικέρ 700ml,15.50
2025-08-01,420730,ΑΛΦΑ Μπύρα Sea Salt Κουτί 500ml 4τεμ,6.52
2025-08-01,402096,Fever Tree Pink Grapefruit Σόδα 200ml,1.54
2025-08-01,420670,Mini Chic Lychee Αφρώδης Οίνος 200ml,2.52
2025-08-01,404266,Evian Μεταλλικό Νερό 6x500ml,6.54
2025-08-01,430441,Achaia Clauss Μαυροδάφνη Πατρών 375ml,4.55
2025-08-01,460980,Cinzano Prosecco Αφρώδης Οίνος 750ml,9.20
2025-08-01,402505,Red Bull Energy Drink Sugar Free 355ml,1.84
2025-08-01,411014,Ηβη Νέκταρ Πορτοκάλι-Μήλο-Βερύκοκο 1lt,1.18
2025-08-01,420307,Beck's Μπύρα Φιάλη 6x275ml,6.66
2025-08-01,431538,Μαύρο Πρόβατο Ροζέ Οίνος 750ml,14.50
2025-08-01,442165,Αμβροσία 3* Αλκοολούχο Ποτό 30% 350ml,5.32
2025-08-01,460945,Disaronno Amaretto Λικέρ 700ml,19.60
2025-08-01,430674,Αγιωργίτικο Ερυθρό Κρασί 1-5lt,5.10
2025-08-01,431244,Aria Μοσχάτο Τυρνάβου Ροζέ Οίνος 750ml,6.20
2025-08-01,452002,Bacardi Carta Blanca Ρούμι 1lt,26.47
2025-08-01,431720,Κτήμα Άλφα Ροζέ Οίνος 750ml,21.01
2025-08-01,461220,Δεκαράκι Ροδίτης Τσίπουρο 700ml,12.78
2025-08-01,411046,Ocean Spray Χυμός Cranberry 1lt,3.50
2025-08-01,420357,Kaiserdom Pilsener Premium Μπύρα Κουτί 1lt,3.90
2025-08-01,411409,Aloe Vera Pineapple 500ml,1.71
2025-08-01,442015,Metaxa 5* 38% Cognac 200ml,5.44
2025-08-01,430581,Roussos Nama Ερυθρός Οίνος 375ml,5.36
2025-08-01,431461,Κ.Λαζαρίδη Αμέθυστος Λευκός Οίνος 750ml,14.10
2025-08-01,460047,Καλλικούνης Μαστίχα Λικέρ 700ml,13.93
2025-08-01,461048,Καλαϊτζή Τσίπουρο Χωρίς Γλυκάνισο 200ml,3.98
2025-08-01,404267,Evian Μεταλλικό Νερό 6x1 lt,11.16
2025-08-01,404265,Evian Μεταλλικό Νερό 1L,1.86
2025-08-01,431456,Mostra Λευκός Οίνος 500ml,2.73
2025-08-01,430000,L'Esprit Du Lac Ροζέ Οίνος 750ml,16.77
2025-08-01,461139,Το Δεκαράκι Τσίπουρο 200ml,4.76
2025-08-01,461985,Ramazzotti Sambuca (Ιταλία) 700ml,17.84
2025-08-01,431330,Κτήμα Χατζημιχάλη Μαλαγουζιά Δρυός Λευκός Οίνος 750ml,14.88
2025-08-01,420717,Νήσος Αποκάλυψη Μπύρα Φιάλη 330ml,2.94
2025-08-01,461563,Μπαμπατζίμ Τσίπουρο Χωρίς Γλυκάνισο 200ml,4.88
2025-08-01,431645,Κτήμα Αβάντις Ροζέ Οίνος 750ml,8.00
2025-08-01,430191,Μπλε Τρακτέρ Κυρ Γιάννη Ερυθρός Οίνος 750ml,10.88
2025-08-01,430671,Μοσχοφίλερο Λευκό Κρασί Σε Ασκό 3lt,13.52
2025-08-01,431467,Τέσσερις Λίμνες Κυρ Γιάννη 750ml,17.24
2025-08-01,460078,Crodino Non Αlcoholic Spritz 3x175ml,5.35
2025-08-01,460077,Campari Soda Aperitivo 98ml 5τεμ,6.45
2025-08-01,440031,Chic Rasberry Αφρώδης Οίνος Ροζε 750ml,6.21
2025-08-01,431240,Kotsifali Βασίλισσες Ερυθρός Οίνος 750ml,9.00
2025-08-01,452023,Havana Club Ρούμι Anejo Especial 700ml,20.85
2025-08-01,430619,Σώκος Μαλαγουζιά Λευκός Οίνος 750ml,8.81
2025-08-01,461003,"12" Ούζο 700ml,10.10
2025-08-01,431181,Ρωμέικο Λευκό Κρασί Σε Ασκό 5lt,12.10
2025-08-01,430985,Νεμέα Αγιωργίτικο Ερυθρός Οίνος 750ml,3.71
2025-08-01,420718,Νήσος 7 Μποφόρ Μπύρα Φιάλη 330ml,2.99
2025-08-01,460016,Martini Bianco 1lt,12.34
2025-08-01,460512,Marie Brizard Λικέρ Triple Sec 700ml,13.73
2025-08-01,442037,Metaxa 3* Cognac 700ml,14.13
2025-08-01,470016,Plantation Grand Reserve Ρούμι 700ml,23.87
2025-08-01,470301,Cutty Sark Whisky 700ml,17.80
2025-08-01,461036,Τυρνάβου Βρυσσά Τσίπουρο Χωρίς Γλυκάνισο 700ml,12.97
2025-08-01,430352,Ελληνικά Κελλάρια Μοσχοφίλερο Λευκός Οίνος 750ml,5.64
2025-08-01,460072,Skinos Med Mastiha Spirit 250ml,2.90
2025-08-01,430197,Κτήμα Μιχαλάκη Μανδηλάρι Ροζέ Οίνος 750ml,6.44
2025-08-01,411278,Sunsweet Χυμός Με Δαμάσκηνα 500ml,6.10
2025-08-01,401673,Εψα Πορτοκαλάδα Κόκκινη 1-5lt,1.65
2025-08-01,461243,Γάτσιος Τσίπουρο Χωρίς Γλυκάνισο 700ml,12.68
2025-08-01,461823,Ζέπος Ούζο Μυτιλήνης 500ml,6.54
2025-08-01,420753,Νήσος Easy Ipa Μπίρα Φιάλη 330ml,3.16
2025-08-01,420747,La Goudale Biere Μπίρα Φιάλη 750ml,7.55
2025-08-01,402439,Chupa Chups Αναψυκτικό Strawberry & Cream 345ml,1.49
2025-08-01,430199,Κτήμα Μιχαλάκη Μοσχάτο Σπίνας Οίνος 750ml,5.97
2025-08-01,431502,Λήμνια Γη Λευκός Οίνος 750ml,9.52
2025-08-01,450122,Smirnoff North Vodka 700ml,16.73
2025-08-01,430697,Μέγα Σπήλαιο Μοσχάτο Λευκός Οίνος 750ml,8.80
2025-08-01,461201,Ηδωνικό Τσίπουρο Με Γλυκάνισο 700ml,15.75
2025-08-01,430133,Apelia Ημίγλυκο Κόκκινο Κρασί 1-5 lt,6.01
2025-08-01,402504,Red Bull White Edition Coconut Berry 250ml,1.34
2025-08-01,425021,Le Coq Coctail Sex On The Beach 330ml,2.25
2025-08-01,411339,Nutri Valley 9 Φρούτα 1lt,1.99
2025-08-01,403022,Maison Perrier Citrus Fizz 4x250ml,4.00
2025-08-01,430175,Χαρλαύτης Πεταλούδες Ροζέ Ξηρός Οίνος 750ml,9.57
2025-08-01,430604,Χνάρια Λευκός Οίνος 750ml,6.76
2025-08-01,431176,Apelia Ροζέ Οίνος Σε Ασκό 3 lt,9.98
2025-08-01,430021,Νάουσσα Μπουτάρη Ερυθρός Οίνος 750ml,11.30
2025-08-01,431504,Ν.Λαζαρίδη Ρήγας Κούπα Ερυθρός Οίνος 750ml,7.32
2025-08-01,431595,Γεροβασιλείου Viognier Λευκός Οίνος 750ml,21.84
2025-08-01,420830,Craft Lager Μπίρα Κουτί 330ml 5+1Δώρο,5.21
2025-08-01,420824,Craft Lager Μπίρα Φιάλη 330ml,1.28
2025-08-01,431301,Κτήμα Χατζημιχάλη Πολυποικιλιακός Λευκός Οίνος 750ml,9.70
2025-08-01,431751,Κτήμα Άλφα Λευκός Οίνος 750ml,20.81
2025-08-01,451010,Greenall'S Gin 700ml,18.67
2025-08-01,430987,Ημίγλυκος Ερυθρός Οίνος 750ml,4.08
2025-08-01,431460,Αβέρωφ Κατώγι Λευκός Οίνος 750ml,9.02
2025-08-01,420810,Kirki Pale Ale Μπύρα Φιάλη 330ml,2.40
2025-08-01,431252,Μαλαματίνα Μάλαμα Ρετσίνα 500ml,2.98
2025-08-01,412134,Viva Fresh Φυσικός Χύμος Μήλο 250ml 5+1 Δώρο,3.30
2025-08-01,650611,Vantana Ούζο 200ml,3.17
2025-08-01,431403,Κτήμα Γ. Παλυβού Πέτρινες Πλαγίες Λευκό 750ml,15.02
2025-08-01,430070,Μπουτάρη Αγιωργίτικο Ερυθρός Οίνος 750ml,10.04
2025-08-01,411371,Ηβη Φρουτοποτό Ροδάκινο 1lt,1.22
2025-08-01,451042,Bulldog Gin 700ml,24.18
2025-08-01,470007,MG Spirit Gin Tonic 275ml,2.10
2025-08-01,470014,MG Spirit Vodka Passion 275ml,2.10
2025-08-01,461169,Τσιλιλή Τσίπουρο 40% 200ml,4.55
2025-08-01,431459,Αβέρωφ Κατώγι Ερυθρός Οίνος 750ml,10.08
2025-08-01,431182,Ρωμέικο Κόκκινο Κρασί Σε Ασκό 5lt,12.71
2025-08-01,431275,Μάτι Fortuna Ερυθρός Οίνος 750ml,6.76
2025-08-01,412144,Bob Bubble Tea Fruit Berry 360ml,2.99
2025-08-01,420815,Budweiser Budvar Μπίρα Κουτί 330ml 5+1 Δώρο,6.50
2025-08-01,451048,Beefeater Gin 0.0% 700ml,17.52
2025-08-01,402468,Carabao Energy Drink Mixed Berry 330ml,1.29
2025-08-01,402438,Chupa Chups Αναψυκτικό Watermelon 345ml,1.49
2025-08-01,460067,Κατσαρός Λεμοντσέλο Λικέρ 700ml,14.56
2025-08-01,430705,Ν. Λαζαρίδη Ροζέ Οίνος 750ml,13.97
2025-08-01,451016,Gordon's Pink Gin 700ml,20.17
2025-08-01,430442,Achaia Clauss Μαυροδάφνη Πατρών 750ml,9.19
2025-08-01,431492,Αβέρωφ Ροζέ Οίνος 750ml,9.73
2025-08-01,461826,Ζέπος Ούζο Μυτιλήνης 40% 2lt,21.91
2025-08-01,470931,Teacher's Ουίσκυ 700ml,18.68
2025-08-01,404099,Aqua Carpatica Ανθρακούχο Νερό Αpple 4x330ml,3.60
2025-08-01,450028,Archers Peach On Beach 250ml,1.74
2025-08-01,402437,Chupa Chups Αναψυκτικό Cherry Bubble 345ml,1.49
2025-08-01,431243,Κτήμα Μιχαλάκη Κοτσιφάλι Ερυθρός Οίνος 750ml,6.43
2025-08-01,431178,Apelia Ημίγλυκος Ερυθρός Οίνος Σε Ασκό 3 lt,10.85
2025-08-01,461302,Veto Ούζο 700ml,11.49
2025-08-01,430657,Απλά Ροζέ Οίνος 750ml,14.99
2025-08-01,431596,Γεροβασιλείου Ξινόμαυρο Ροζέ Οίνος 750ml,17.28
2025-08-01,470019,Citadelle Τζιν 700ml (+Δώρο Ποτήρι),28.70
2025-08-01,430038,Whispering Angel Provence Ροζέ 750ml,28.99
2025-08-01,431445,Αγιωργίτικο Παπαϊωάννου Ερυθρός 750ml,8.72
2025-08-01,470018,Citadelle Gin 700ml,28.70
2025-08-01,431495,Σκούρας Άκρες Ερυθρός Οίνος 750ml,8.07
2025-08-01,461189,Αποστολάκη Τσίπουρο Χωρίς Γλυκάνισο 200ml,4.69
2025-08-01,450210,Absolut Vodka 500ml,14.84
2025-08-01,431754,Gancia Moscato D' Asti Αφρώδης Λευκός Οίνος 750ml,11.37
2025-08-01,425401,Strongbow Μηλίτης Με Γεύση Gold Apple Φιάλη 330ml,1.50
2025-08-01,431497,Γεροβασιλείου Ξηρός Λευκός 750ml,17.20
2025-08-01,425035,Coctel Cocktail Sex On The Beach Ready To Drink 1lt,14.89
2025-08-01,430213,Μέγα Σπήλαιο Λευκός Sauvignon Ξηρός Οίνος 750ml,11.41
2025-08-01,425010,Tanqueray Gin 0.0% Alcohol Free 700ml,21.50
2025-08-01,440027,D'Ifestia Λευκός Ημιαφρώδης Οίνος 750ml,10.90
2025-08-01,431109,Μίγας Μαύρο Μοσχάτο Τυρνάβου Ερυθρός 750ml,7.30
2025-08-01,470973,Famous Grouse Smoky Black Ουίσκι 700ml,24.80
2025-08-01,420246,Άλφα Strong Μπύρα Lager Κουτί 4x500ml,6.56
2025-08-01,420202,Άλφα Strong Μπύρα Lager Κουτί 500ml,1.64
2025-08-01,461422,Ούζο Πλωμαρίου Ισίδωρου Αρβανίτη 500ml,9.17
2025-08-01,450202,Absolut Vodka 1lt,25.40
2025-08-01,460096,Τέττερης Μαστίχα Λικέρ Χίου 500ml,10.88
2025-08-01,430910,Κτήμα Αβαντίς Lenga Λευκός Οίνος 750ml,15.41
2025-08-01,442023,Metaxa 5* 38% Cognac 700ml,16.50
2025-08-01,425032,Coctel Cocktail Strawberry Daiquiri Ready To Drink 1lt,14.89
2025-08-01,431245,Aria Μοσχάτο Τυρνάβου Λευκός Οίνος 750ml,6.05
2025-08-01,430196,Κτήμα Μιχαλάκη Κρητικός Ερυθρός Οίνος 750ml,3.88
2025-08-01,451036,Hendrick's Gin 700ml Δώρο Δοσομετρητής,38.85
2025-08-01,430605,Χνάρια Ερυθρός Οίνος 750ml,6.76
2025-08-01,431457,Mostra Ροζέ Οίνος 500ml,2.79
2025-08-01,431671,Μαντινεία Τσέλεπου Λευκός Οίνος 750ml,12.99
2025-08-01,412034,Voelker Χυμός Κομπούχα Bio 750ml,5.28
2025-08-01,431499,Nico Lazaridi Chateau Λευκός Οίνος 750ml,13.07
2025-08-01,431524,Ν.Λαζαρίδη Μαγικό Βουνό Λευκός Οίνος 750ml,18.00
2025-08-01,420600,Pils Μπύρα Φιάλη 500ml,1.02
2025-08-01,430672,Αγιωργίτικο Ερυθρό Κρασί σε Ασκό 3lt,11.93
2025-08-01,440010,Ακακίες Κυρ Γιάννη Αφρώδης Οίνος 750ml,14.77
2025-08-01,401320,Monster Energy 4x500ml,4.38
2025-08-01,461150,Τσιλιλή Τσίπουρο Με Γλυκάνισο 200ml,4.55
2025-08-01,460347,Mastic Tears Λικέρ 500ml,14.66
2025-08-01,470442,Dimple Golden Selection Ουίσκι 700ml,35.80
2025-08-01,440001,Cair Αφρώδης Οίνος Brut 750ml,12.87
2025-08-01,412146,Bob Bubble Tea Sakura Beach 360ml,2.99
2025-08-01,430216,Γόνιμος Τόπος Ημίγλυκο Ερυθρός Οίνος 500ml,1.86
2025-08-01,425029,Coctel Cocktail Mojito Ready To Drink 1lt,14.18
2025-08-01,430204,Λυραράκη Βιδιανό Βασίλισσες Λευκός 750ml,10.00
2025-08-01,412088,Rabenhorst Χυμός Κράνμπερρυ 330ml,4.97
2025-08-01,440030,Chic Lychee Αφρώδης Οίνος Λευκός 750ml,6.21
2025-08-01,431199,Tails Passion Fruit Martini 14-9% 500ml,15.50
2025-08-01,453017,Olmeca Τεκίλα Κίτρινη 35% 700ml,23.20
2025-08-01,452016,Plantation Ρούμι Dark Original 700ml,22.51
2025-08-01,451120,Beefeater Pink Gin 700ml,18.60
2025-08-01,431447,Μελιαστό Σπυρόπουλου Ροζέ Οίνος 750ml,11.06
2025-08-01,460510,Τέττερης Λικέρ Τριαντάφυλλο 500ml,9.73
2025-08-01,453010,El Jimador Τεκίλα Λευκή 700ml,25.34
2025-08-01,452965,Havana Club Anejo Rum 7 Ετών 700ml,25.80
2025-08-01,461163,Ρωμέικο Τσίπουρο Χωρίς Γλυκάνισο 200ml,3.48
2025-08-01,650615,Vantana Ούζο 700ml,9.32
2025-08-01,450701,Ursus Roter Vodka Based 700ml,16.23
2025-08-01,442024,Metaxa 5* Cognac 1lt,24.58
2025-08-01,440002,Cair Αφρώδης Οίνος Demi Sec 750ml,11.93
2025-08-01,460701,Cointreau Λικέρ 700ml,23.53
2025-08-01,412145,Bob Bubble Tea Τropical Mix 360ml,2.99
2025-08-01,425028,Coctel Coktail Cosmopolitan 1lt,14.89
2025-08-01,430208,Μέγα Σπήλαιο Ρόζε Οίνος 750ml,13.02
2025-08-01,431253,Roche Mazet Gewurtraminer Οίνος 750ml,6.78
2025-08-01,470039,Dewar's Japanese Ουίσκι 8 ετών 700ml,24.35
2025-08-01,431248,Minuty M Ροζέ Ξηρός Οίνος 750ml,23.66
2025-08-01,460003,Martini Rosso 14-4% 1lt,12.11
2025-08-01,460890,Marie Brizard Grenadine 700ml,5.20
2025-08-01,431164,Νεράιδες Ημίγλυκος Λευκός Οίνος 750ml,8.68
2025-08-01,450139,Belvedere Vodka 700ml,51.57
2025-08-01,430173,Σώκος Ασύρτικο Λευκός Οίνος 750ml,9.08
2025-08-01,430028,Κτήμα Θεόπετρα Λευκός Οίνος 750ml,14.45
2025-08-01,470017,Plantation 3* Ρούμι 700ml,19.26
2025-08-01,431311,Κτήμα Χατζημιχάλη Alfega Λευκός Οίνος 750ml,13.40
2025-08-01,431752,Κτήμα Άλφα Ερυθρός Οίνος 750ml,28.80
2025-08-01,460409,Southern Comfort Λικέρ 700ml,19.85
2025-08-01,470352,Tullamore Dew Ουίσκυ Ιρλανδίας 700ml,21.89
2025-08-01,461002,"12" Ούζο 350ml,5.97
2025-08-01,430361,Ασπρολίθι Ρούβαλη Λευκός Οίνος 750ml,7.35
2025-08-01,461270,Πιλαβά Ούζο Μινιατούρα 50ml,1.34
2025-08-01,470701,Chivas Regal 12 Years Old Deluxe Whisky 700ml,32.80
2025-08-01,450034,Metaxa Peach Spritz Ready To Drink 250ml,1.95
2025-08-01,430214,Desir Ροζέ Οίνος 750ml,5.77
2025-08-01,431262,Κτήμα Κόκκινος Petinos Οίνος Λευκός 750ml,10.72
2025-08-01,411280,Βιοαγρός Χυμός Κράνμπερι Bio 750ml,8.88
2025-08-01,425013,42 Below Βότκα 700ml,18.15
2025-08-01,431105,Βολτες Λευκός Οίνος 750ml,7.44
2025-08-01,430857,Καραμολέγκος 34 Λευκός Οίνος 750ml,40.92
2025-08-01,461224,Δεκαράκι Μαλαγουζιά Τσίπουρο 700ml,16.99
2025-08-01,461210,Γιαννατσή Ούζο Ρετρό 700ml,13.44
2025-08-01,461948,Αγιονέρι Τσίπουρο 500ml,13.27
2025-08-01,431308,Κτήμα Χατζημιχάλη Cabernet Sauvignon Ερυθρός Οίνος 750ml,18.40
2025-08-01,461205,Βαρβαγιάννη Πράσινο Ούζο 700ml,12.51
2025-08-01,430917,The Fallen Oak Κυρ-Γιάννη Ερυθρός Οίνος 750ml,13.60
2025-08-01,650454,Bushmills Ουίσκι 700ml,21.74
2025-08-01,470184,Lagavulin 16 Years Old Malt Whisky 700ml,82.17
2025-08-01,431263,Calliga Blanc Λευκός Ημίξηρος Οίνος Demi Sec 750ml,5.95
2025-08-01,430206,Κτήμα Αβάντις Μαλαγουζιά Λευκο Οίνος 750ml,14.76
2025-08-01,431219,Κτήμα Σέμελη Piccolo Mondo Λευκός Ημίγλυκος Οίνος 750ml,8.13
2025-08-01,425012,Metaxa Cognac 5* Orange 700ml,17.51
2025-08-01,461000,Καλλικούνης Ρακόμελο Δεσποτικόν 700ml,14.99
2025-08-01,431106,Βόλτες Ροζέ Οίνος 750ml,7.44
2025-08-01,650353,Bee Ημίγλυκος Ροζέ Οίνος 750ml,11.57
2025-08-01,431506,Κτήμα Ν. Λαζαρίδη Μαύρο Πρόβατο Ερυθρός Οίνος 750ml,16.33
2025-08-01,431500,Nico Lazaridi Chateau Ερυθρός Οίνος 750ml,15.73
2025-08-01,431302,Κτήμα Χατζημιχάλη Πολυποικιλιακός Ροζέ 750ml,9.70
2025-08-01,451025,Sailor Jerry Spiced Ρούμι 700ml,22.80
2025-08-01,460940,Jagermeister Λικέρ 700ml,20.00
2025-08-01,452101,Captain Morgan Rum 700ml,20.42
2025-08-01,442009,Metaxa 7* Αμφορέας Cognac 700ml,24.05
2025-08-01,460721,Drambuie Λικέρ 700ml,29.80
2025-08-01,461255,Αγιονέρι Τσίπουρο 200ml,5.85
2025-08-01,431278,Mateus Ροζέ Ημίγλυκος Οίνος 750ml,5.95
2025-08-01,411425,Amita Fun Κόκκινη Φρουτοπότο 6x250ml,4.20
2025-08-01,411345,Nutri Valley Scoobydoo Ροδάκινο 1lt,1.60
2025-08-01,450033,Cazadores Margarita Κουτί 250ml,2.37
2025-08-01,460303,Skinos Λικέρ Μαστίχα 500ml,13.69
2025-08-01,430215,Dedir Λευκός Οίνος 750ml,5.77
2025-08-01,450029,Archers Woo Woo Cranberry 250ml,1.74
2025-08-01,412090,Rabenhorst Χυμός 11 Βιταμίνες Bio 750ml,4.76
2025-08-01,431246,Κτήμα Παπαϊωάννου Chardonnay Λεύκος Οίνος 750ml,12.46
2025-08-01,431235,Συρράχο Rouvalis Λευκός Ξηρός Οίνος 750ml,12.20
2025-08-01,461083,Κατσαρού Ούζο Legendary 700ml,9.99
2025-08-01,461090,Aρόδαμα Τσικουδιά 200ml,5.14
2025-08-01,420571,Leffe Blonde Μπίρα Φιάλη 330ml,2.97
2025-08-01,470813,Talisker Ουίσκι 700ml,44.91
2025-08-01,431761,Santo Wines Σαντορίνη Ασύρτικο Λευκός Οίνος 750ml,32.86
2025-08-01,431177,Apelia Ερυθρός Οίνος Σε Ασκό 3 lt,10.42
2025-08-01,461080,Καλαϊτζή Τσίπουρο Χωρίς Γλυκάνισο 700ml,13.22
2025-08-01,650343,Παλυβού Νεμέα Ερυθρός Οίνος 750ml,13.23
2025-08-01,431404,Παλυβού Βυσσινόκηπος Ροζέ Οίνος 750ml,12.83
2025-08-01,452018,Bacardi Cuatro 40% Ρούμι 4 Ετών 700ml,23.44
2025-08-01,431458,Mostra Ερυθρός Οίνος 500ml,2.79
2025-08-01,461564,Μπαμπατζίμ Τσίπουρο Χωρίς Γλυκάνισο 700ml,14.89
2025-08-01,452021,Bacardi Carta Negra Ρούμι 700ml,19.37
2025-08-01,452012,Diplomatico Reserva Exclusiva Ρούμι 700ml,43.64
2025-08-01,452017,Chairman's Ρούμι Spiced Reserve 700ml,28.79
2025-08-01,420825,Craft Pilsner Μπίρα Φιάλη 330ml,1.49
2025-08-01,430016,Κτήμα Γεροβασιλείου Chardonnay 750ml,24.50
2025-08-01,440025,Μίγας Μοσχάτο Τυρνάβου Ημιαφρώδης Λευκός Οίνος 750ml,11.37
2025-08-01,461067,Γάτσιος Τσίπουρο Χωρίς Γλυκάνισο 40% 200ml,4.35
2025-08-01,431632,Κτήμα Θεοδωρακάκου Κυδωνίτσα Bio Λευκός Οίκος 750ml,11.37
2025-08-01,431304,Κτήμα Χατζημιχάλη Πολυποικιλιακός Ερυθρός Οίνος 750ml,9.90
2025-08-01,461206,Βαρβαγιάννη Πράσινο Ούζο 200ml,4.22
2025-08-01,650427,Ούζο Μυτιλήνης 700ml,10.41
2025-08-01,470312,Jack Daniel’s Gentleman Jack Whisky 700ml,32.50
2025-08-01,430913,Κτήμα Αβαντίς Sauvignon Blanc 750ml,13.05
2025-08-01,431122,Freixenet Carta Nevada Αφρώδης Λευκός Οίνος 750ml,11.08
2025-08-01,460401,Jack Daniel’s Tennessee Honey 700ml,27.80
2025-08-01,461202,Βαρβαγιάννη Μπλε Ούζο 700ml,13.00
2025-08-01,451049,Rumours London Τζιν 38% Vol 700ml,19.35
2025-08-01,440036,Λυραράκη Zazazu Λευκός Αφρώδης Οίνος 750ml,9.45
2025-08-01,431266,Tauro Αποστολάκη Λευκός Οίνος 750ml,6.11
2025-08-01,461091,Κατσαρός Παλαιωμένο Τσιπούρο 200ml,14.35
2025-08-01,442013,Metaxa 12* Cognac 700ml + Δώρο Κάλτσες,29.78
2025-08-01,431258,Κτήμα Κόκκινος Petinos Ερυθρός Οίνος 750ml,10.70
2025-08-01,430205,Markou Pixie Κρασί Ροζέ Ημίξηρος 750ml,10.99
2025-08-01,430207,Νασιάκου A Priori Mαντίνεια Λευκό 750ml,11.04
2025-08-01,431254,Valestrel Provence Οίνος Ροζέ Γαλλικός 750ml,10.44
2025-08-01,453000,Cazadores Reposado Tequila Κίτρινη 700ml,26.67
2025-08-01,431249,Calliga Ασύρτικο Ροδίτης 750ml,9.75
2025-08-01,442012,Alexander Μπράντυ 3* 34% 700ml,17.01
2025-08-01,412089,Rabenhorst Χυμός Detox Bio 750ml,4.97
2025-08-01,460057,Luxardo Limoncello 27% Αλκοόλ 500ml,17.88
2025-08-01,453209,Don Julio Τεκίλα Blanco 700ml,54.13
2025-08-01,430353,Ελληνικά Κελλάρια Αγιωργίτικο Νεμέας Ερυθρός Ξηρός Οίνος ΠΟΠ 750ml,5.78
2025-08-01,650346,Καραμολέγκος Σαντορίνη Λευκός Οίνος 750ml,34.93
2025-08-01,461301,Veto Ούζο 200ml,3.99
2025-08-01,451013,Tanqueray Rangpur Gin 700ml,25.10
2025-08-01,470032,Roe & Co Whisky Ιρλανδίας 700ml,34.10
2025-08-01,450195,Grey Goose Premium Vodka 700ml,46.40
2025-08-01,470400,Dewar's Sp. Reserve 12 Years Ουίσκυ 700ml,27.68
2025-08-01,457105,Luxardo Aperitivo 700ml,13.31
2025-08-01,470023,Arran Barrel Reserve Malt Ουίσκι 700ml,38.84
2025-08-01,431522,Κτήμα Ν.Λαζαρίδη Μαγικό Βουνό Ερυθρός Οίνος 750ml,29.60
2025-08-01,431310,Κτήμα Χατζημιχάλη Syrah Ερυθρός Οίνος 750ml,14.30
2025-08-01,453208,Don Julio Τεκίλα Reposado 700ml,59.99
2025-08-01,431753,Κτήμα Άλφα Ξινόμαυρο 750ml,18.10
2025-08-01,451100,Tanqueray No 10 Gin 700ml,46.15
2025-08-01,431331,Κτήμα Χατζημιχάλη Alfega Ερυθρός Οίνος 750ml,15.45
2025-08-01,430916,Κτήμα Αβαντίς Syrah Ερυθρός Οίνος 750ml,14.10
2025-08-01,451051,Pampero Especial Ρούμι 700ml,20.46
2025-08-01,461264,Πιλαβά Ούζο 700ml,11.99
2025-08-01,440401,Moet & Chandon Σαμπάνια Brut 750ml,55.51
2025-08-01,470824,Talisker Skye Whisky 700ml,44.11
2025-08-01,451041,Finsbury Gin 700ml,15.99
2025-08-01,650614,Vantana Tentoura Λικέρ 500ml,14.90
2025-08-01,431462,Κ.Λαζαρίδη Αμέθυστος Ροζέ Οίνος 750ml,14.10
2025-08-01,430676,Γόνιμος Τόπος Ροζέ Οίνος 500ml,2.90
2025-08-01,470511,Glenfiddich Ουίσκυ 12 ετών 700ml,44.41
2025-08-01,431496,Κτήμα Βιβλία Χώρα Βιολογικός Ερυθρός Οίνος 750ml,20.20
2025-08-01,430218,Summerhouse Sauvignon Blanc Λευκός Οίνος 750ml,17.24
2025-08-01,430217,I Love You To The Moon Ροζέ Οίνος 750ml,4.71
2025-08-01,440100,Rivani Λευκός Αφρώδης Οίνος 0% Αλκόολ 750ml,4.71
2025-08-01,431257,Κτήμα Κόκκινος Naoussa Xinomavro Οίνος 750ml,16.53
2025-08-01,470038,Cutty Sark 12 ετών 700ml,28.49
2025-08-01,453018,Patron Reposado Tequila 700ml,58.14
2025-08-01,461259,Πιλαβά Τσίπουρο Χωρίς Γλυκάνισο 200ml,4.98
2025-08-01,431239,Sarris Robola Κεφαλληνίας 750ml,14.59
2025-08-01,430907,Ramos Porto Ruby Ερυθρός Οίνος 750ml,16.90
2025-08-01,452060,Don Papa Ρούμι 700ml,47.80
2025-08-01,461081,Αλλοτινό Τσίπουρο Χωρίς Γλυκάνισο 40% 200ml,4.61
2025-08-01,430856,Vinsanto Σαντορίνη Καραμολέγκος Γλυκός Οίνος 500ml,48.36
2025-08-01,440421,Veuve Clicquot Ponsardin Brut Champagne 750ml,65.60
2025-08-01,440804,Veuve Clicquot Rose Σαμπάνια 750ml,76.08
2025-08-01,430608,Απλά Ερυθρός Οίνος 750ml,14.85
2025-08-01,430029,Κτήμα Θεόπετρα Ερυθρός Οίνος 750ml,19.11
2025-08-01,460006,Gratus Λικέρ 500ml,24.00
2025-08-01,461208,Γιαννατσή Ούζο Ρετρό 200ml,5.07
2025-08-01,450407,Serkova Crystal Pure Vodka 40% 700ml,21.23
2025-08-01,461971,Κατσάρος Τσίπουρο Χωρίς Γλυκάνισο 200ml,6.10
2025-08-01,451108,Monkey 47 Gin 500ml,49.40
2025-08-01,461964,Κατσάρος Τσίπουρο Χωρίς Γλυκάνισο 700ml,15.23
2025-08-01,440404,Moet & Chandon Ice Σαμπάνια 750ml,66.35
2025-08-01,431185,Ρωμέικο Ροζέ Κρασί Σε Ασκό 5lt,12.42
2025-08-01,431309,Κτήμα Χατζημιχάλη Chardonnay Λευκός Οίνος 750ml,14.00
2025-08-01,452105,Ron Zacapa Ρούμι 700ml,57.10
2025-08-01,431762,Santo Wines Νυχτέρι Λευκός Οίνος 750ml,35.96
2025-08-01,450413,Serkova Votka 1lt,17.03
2025-08-01,440403,Moet & Chandon Rose Σαμπάνια 750ml,70.24
2025-08-01,451052,Pampero Blanco Ρούμι 700ml,18.78
2025-08-01,470712,Chivas Regal Extra Ουίσκυ 700ml,35.50
2025-08-01,461267,Πιλαβά Ούζο 2L,29.35
2025-08-01,470191,Johnnie Walker Blue Label Ουίσκι 700ml,191.41
2025-08-01,440407,Dom Perignon Σαμπάνια 750ml,254.58
2025-08-01,470598,Ciroc Βότκα 700ml,48.98
2025-08-01,440357,Bianconero Αφρώδης Οίνος Ροζέ 750ml,11.69
2025-08-01,431765,Vinsanto Santo Wines Γλυκός Οίνος 500ml,43.70
2025-08-01,431672,Chateau Julia Merlot Ερυθρός Οίνος 750ml,21.48
2025-08-01,431463,Κ.Λαζαρίδη Αμέθυστος Ερυθρός Οίνος 750ml,18.95
2025-08-01,470921,J & B Ουίσκι 700ml,18.42
