2025-06-12,198028,Τομάτες Ελληνικές Ποιότητα Α΄ Τιμή Κιλού,0.36
2025-06-12,192321,Καρότα Ελληνικά Τιμή Κιλού,0.10
2025-06-12,198187,Κρεμμύδια Κόκκινα Ξερά Μέτρια Ελληνικά Ποιότητα Α,0.23
2025-06-12,198151,Αγγουράκια Ελληνικά Τιμή Κιλού,0.24
2025-06-12,198993,Κρεμμύδια Ξερά Ξανθά Ελληνικά Ποιότητα Α,0.11
2025-06-12,198027,Κολοκύθια Ελληνικά Τιμή Κιλού,0.19
2025-06-12,198026,Αγγούρια Ελληνικά Το Τεμάχιο,0.45
2025-06-12,198274,Αχλάδια Κρυστάλλια Ελληνικά Ποιότητα Α΄Τιμή Κιλού,0.31
2025-06-12,198132,Μήλα Στάρκιν Εγχώρια Ποιότητα Α' Τιμή Κιλού,0.49
2025-06-12,192066,Τοματίνια Βελανίδια Ελληνικά Ποιότητα Α',0.88
2025-06-12,198023,Πιπεριές Φλωρίνης Ελληνικές Ποιότητα Α΄ Τιμή Κιλού,0.33
2025-06-12,198081,Ακτινίδια Ελληνικά Ποιότητα Α΄ Τιμή Κιλού,0.54
2025-06-12,198085,Μπανάνες Dole Εισαγωγής Τιμή Κιλού,1.85
2025-06-12,198329,Πατάτες Εγχώριες Τιμή Κιλού,0.79
2025-06-12,192041,Μπανάνες Εισαγωγής Τιμή Κιλού,1.59
2025-06-12,198084,Φράουλες Ελληνικές Ποιότητα Α΄ Συσκευασμένες Τιμή Κιλού,1.85
2025-06-12,198039,Πιπεριές Πράσινες Ελληνικές Ποιότητα Α΄Τιμή Κιλού,0.40
2025-06-12,198095,Μήλα Σμίθ Ελληνικά Ποιότητα Α΄Τιμή Κιλού,0.52
2025-06-12,198117,Πορτοκάλια Βαλέντσια Α' Εγχώρια Τιμή Κιλού,0.27
2025-06-12,198037,Μελιτζάνες Φλάσκες Ελληνικές Τιμή Κιλού,0.73
2025-06-12,198024,Μαρούλι Τιμή Τεμαχίου,0.68
2025-06-12,198013,Κρεμμυδάκια Φρέσκα Ελληνικά Τιμή Κιλού,0.39
2025-06-12,198694,Μήλα Fuji Ελληνικά,0.81
2025-06-12,198042,Πιπεριές Ξανθές Ελληνικές Ποιότητα Α΄Τιμή Κιλού,0.23
2025-06-12,198805,Αβοκάντο Ωριμασμένο Εισαγωγής Τιμή Κιλού,1.68
2025-06-12,198040,Πιπεριές Κέρατο Ελληνικές Ποιότητα Α΄ Τιμή Κιλού,0.24
2025-06-12,198183,Σκόρδο Εισαγωγής Τεμάχιο,0.69
2025-06-12,198156,Μπρόκολο Ελληνικό Τιμή Κιλού,1.25
2025-06-12,198003,Μαιντανός Ελληνικός Ποιότητα Α΄ 100gr,0.63
2025-06-12,198014,Πράσο Ελληνικό Τιμή Κιλού,0.54
2025-06-12,198001,Άνηθος Ελληνικός Ποιότητα Α 80gr,0.70
2025-06-12,198223,Πατάτες Συσκευασμένες Ελληνικές Ποιότητα Α΄ Τιμή Κιλού,3.27
2025-06-12,198061,Νεκταρίνια Εγχώρια Ποιότητα Α' ΤΙμή Κιλού,0.67
2025-06-12,198060,Ροδάκινα Εγχώρια Ποιότητα Α΄Τιμή Κιλού,0.60
2025-06-12,198029,Τομάτες Τσαμπί Ελληνικές Ποιότητα Α΄ Τιμή Κιλού,1.32
2025-06-12,198705,Πατάτες Κύπρου Συσκευασμένες Ποιότητα Α΄ Τιμή Κιλού,4.77
2025-06-12,198791,Καρότα Συσκευασμένα Εγχώρια 500gr,0.50
2025-06-12,198291,Αχλάδια Κρυστάλλια Lux Τιμή Κιλού,0.47
2025-06-12,198012,Παντζάρια Ελληνικά Τιμή Κιλού,0.27
2025-06-12,198103,Αχλάδια Φετέλ Ελληνικά Ποιότητα Α,1.40
2025-06-12,198546,Dole Βιολογικές Μπανάνες Εισαγωγής Συσκευασία,2.19
2025-06-12,192045,Τομάτα Δράμας Πετρούσα Ποιότητα Α΄,0.43
2025-06-12,198424,Μύρτιλα Εγχώρια 125gr,2.55
2025-06-12,192355,Μύρτιλο Εισαγωγής 125gr,2.55
2025-06-12,198002,Σέλινο Ελληνικό Ποιότητα Α΄ Τιμή Κιλού,0.20
2025-06-12,192429,Μπαρμπά Στάθης Σαλάτα Δροσάτη 200gr,1.52
2025-06-12,198070,Βερύκοκα Πρώιμα Εγχώρια Τιμή Κιλού,3.43
2025-06-12,198242,Μπανάνα Chiquita Εισαγωγής Τιμή Κιλού,2.19
2025-06-12,198096,Μήλα Γκόλντεν Ελληνικά Ποιότητα Α΄ Τιμή Κιλού,0.72
2025-06-12,198038,Μελιτζάνες Τσακώνικες Ελληνικές Τιμή Κιλού,0.88
2025-06-12,198009,Σπανάκι Ελληνικό Τιμή Κιλού,0.50
2025-06-12,192445,Μπαρμπα Στάθης Σαλάτα Κλασσική 250gr,2.03
2025-06-12,198331,Πιπεριές Κόκκινες Ελληνικές Ποιότητα Α΄Τιμή Κιλού,0.86
2025-06-12,198193,Βανίλιες Εισαγωγής Ποιότητα Α΄Τιμή Κιλού,1.09
2025-06-12,192054,Φρεσκούλης Σαλάτα Ιταλική Iceberg- Μαρούλι- Ραντίτσιο 200gr,1.65
2025-06-12,198056,Πεπόνι Εγχώριο Τιμή Κιλού,3.23
2025-06-12,198233,Γκρειπ Φρουτ Κόκκινα Εγχώρια Τιμή Κιλού,0.62
2025-06-12,198598,Βιολογικές Φράουλες Ελληνικές Ποιότητα Α' 250gr,3.99
2025-06-12,198263,Άισμπεργκ Ελληνικό Τιμή Κιλού,0.79
2025-06-12,198299,Κεράσια Εγχώρια Τιμή Κιλού,2.17
2025-06-12,198036,Κουνουπίδι Ελληνικό Τιμή Κιλού,1.70
2025-06-12,198529,Καρότα Βιολογικά Ελληνικά Συσκευασμένα,2.41
2025-06-12,198207,Άρωμα Κρεμμυδάκι Φρέσκο Ματσάκι Εγχώριο 140gr,1.34
2025-06-12,198644,Πιπεριές Ανάμεικτες Ελληνικές Ποιότητα Α΄ Τιμή Συσκευασίας,2.87
2025-06-12,198179,Μανιτάρια Φρέσκα Εισαγωγής 500gr,2.55
2025-06-12,198395,Λάϊμς Εισαγωγής Ποιότητα Α,0.33
2025-06-12,198879,My Fresco Σαλάτα Φάρμα 200gr,1.63
2025-06-12,198933,Μπάρμπα Στάθης Σαλάτα Τραγανή Λάχανο & Καρότο300gr,1.79
2025-06-12,198041,Πιπεριές Καυτερές Ελληνικές Ποιότητα Α΄ Τιμή Κιλού,0.18
2025-06-12,198034,Λάχανο Ελληνικό Ποιότητα Α΄ Τιμή Κιλού,1.98
2025-06-12,192112,Φρεσκούλης Σαλάτα Λάχανο-Καρότο 300gr,1.58
2025-06-12,198030,Τομάτες Κομιντόρια Ελληνικά Ποιότητα Α΄ Τιμή Κιλού,0.26
2025-06-12,198146,Κολοκύθια Στρογγυλά Ελληνικά Τιμή Κιλού,0.90
2025-06-12,198676,Τοματίνια Βελανίδια Ελληνικά Ποιότητα Α' 250gr,1.99
2025-06-12,198881,My Fresco Σαλάτα Φαντασία 100gr,1.19
2025-06-12,198083,Ανανάς Εισαγωγής Τιμή Κιλού,2.23
2025-06-12,198452,Πορτοκάλια Βαλέντσια Δίχτυ Χυμού Τιμή Κιλού,2.18
2025-06-12,192010,Μανιτάρια Φρέσκα Εισαγωγής 250gr,1.57
2025-06-12,198330,Πιπεριές Κίτρινες Ελληνικές Ποιότητα Α,0.86
2025-06-12,204806,Αγρόκηπος Παντζάρια Πέλλας Σακούλα 500gr,2.15
2025-06-12,192230,Σαλάτα Γαλλική Σε Γλαστράκι,0.99
2025-06-12,198902,My Fresco Σαλάτα Εξοχική 160gr,1.51
2025-06-12,198925,Πορτοκάλια Ποιότητα Α΄Δίχτυ Έγχωρια Τιμή Κιλού,3.24
2025-06-12,198726,Τοματίνια Βιολογικά Ελληνικά 250gr,1.89
2025-06-12,198477,Μανιτάρια Πλευρώτους Ελληνικά 500gr,2.75
2025-06-12,198147,Δυόσμος Ελληνικός 50gr Ματσάκι,1.19
2025-06-12,198514,Βιολογικά Αγγούρια Ελληνικά Συσκευασία,2.63
2025-06-12,198810,Πιπεριές Πορτοκαλί Ελληνικές Ποιότητα Α΄ Τιμή Κιλού,0.90
2025-06-12,198645,Σκόρδα Εισαγωγής Συσκευασία 3τεμ,1.79
2025-06-12,192365,Μάνγκο Ωριμασμένο Εισαγωγής Συσκευασία 2τεμ,3.69
2025-06-12,198290,Σέλερυ Ελληνικό Τιμή Κιλού,0.99
2025-06-12,198959,Μπάρμπα Στάθης Σαλάτα Μαρουλένια 200gr,2.19
2025-06-12,198937,Μπάρμπα Στάθης Σαλάτα Ιταλική 140gr,1.89
2025-06-12,198231,Λεμόνια Εισαγωγής Ποιότητα Α Τιμή Κιλού,2.49
2025-06-12,198422,Βεζύρογλου Ρόκα Άγρια Baby Leaf 100gr,1.10
2025-06-12,192303,Πατάτες Μυρτώ Συσκευασμένες Ελληνικές Ποιότητα Α Δίχτυ Τιμή Κιλού,4.95
2025-06-12,192181,Φρεσκούλης Ιταλική Οικογενειακή 425gr,2.98
2025-06-12,192469,Μπάρμπα Στάθης Σαλάτα Δροσερή 400gr,2.53
2025-06-12,192989,Τοματίνια Που Αγαπάς Εγχώρια 250gr,2.49
2025-06-12,192134,Μανιτάρια Φρέσκα 400gr Εγχώρια,2.87
2025-06-12,198016,Φασολάκια Μπαρμπούνια Ελληνικά Τμή Κιλού,0.91
2025-06-12,198530,Πατάτες Βιολογικές Ελληνικές Δίχτυ Τιμή Κιλού,5.48
2025-06-12,198508,Μήλα Στάρκιν Βιολογικά Ελληνικά Συσκευασία,4.99
2025-06-12,192383,Φρεσκούλης Συσκευασία Σπανάκι Baby 100gr,1.19
2025-06-12,198604,Λόλα Κόκκινη Ελληνική Ποιότητα Α΄ Το Τεμάχιο,0.99
2025-06-12,198393,Τοματίνια Plum Πετρούσα Δράμας 500gr,2.98
2025-06-12,198289,Σέσκουλα Εγχώρια,0.45
2025-06-12,661089,Φρεσκούλης Σαλάτα Καπριτσιόζα 160gr,1.46
2025-06-12,198707,Μήλα Ζαγοράς Πηλίου ΠΟΠ Συσκευασμένα Ποιότητα Α,3.78
2025-06-12,192573,Lucias Πατάτες Baby Εισαγωγής 1kg,2.65
2025-06-12,192489,Σπαράγγια Εγχώρια 300gr,4.80
2025-06-12,198163,Τζίντζερ Εισαγωγής Τιμή Κιλού,1.05
2025-06-12,198534,Πιπεριές Φλωρίνης Βιολογικές Ελληνικές Συσκευασία,1.48
2025-06-12,198502,Κολοκύθια Βιολογικά Ελληνικά Συσκευασμένα Τιμή Κιλού,5.78
2025-06-12,198500,Τομάτες Βιολογικές Ελληνικές Συσκευασμένες,4.18
2025-06-12,198359,Σμέουρα Εγχώρια 125gr,3.39
2025-06-12,192024,Lucia Τοματίνια Ελληνικά Ποιότητα Α' 250gr,1.91
2025-06-12,198497,Βεζύρογλου Σαλάτα Ελληνική baby Leaf 100gr,0.99
2025-06-12,192293,Τοματίνια Τσαμπί,2.88
2025-06-12,198542,Μπρόκολο Βιολογικό Ελληνικό Τιμή Κιλού,1.81
2025-06-12,198448,Καρπούζι Ατομικό Εγχώριο,4.76
2025-06-12,198756,Χουρμάδες Εισαγωγής 250gr,3.71
2025-06-12,198035,Λάχανο Κόκκινο Ελληνικό Ποιότητα Α΄ Τιμή Κιλού,1.48
2025-06-12,198257,Πατάτες Ραγού Mini Συσκευασμένες Εισαγωγής Ποιότητα Α,3.60
2025-06-12,198007,Ραδίκια Ιταλικά Ελληνικά Τιμή Κιλού,1.99
2025-06-12,198008,Χόρτα Άγρια Τιμή Κιλού,1.99
2025-06-12,198655,Lucia Τομάτα Baby Ελληνική Ποιότητα Α' Συσκευασία 500gr,2.88
2025-06-12,204807,Αγρόκηπος Καλαμπόκι Γλυκό 400gr,3.26
2025-06-12,198506,Κρεμμύδια Βιολογικά Ξερά Ελληνικά Δίχτυ Τιμή Κιλού,4.78
2025-06-12,192218,Αλλιόν Σκόρδο Φρέσκο Ψιλοκομμένο 100gr,2.45
2025-06-12,198246,Βατόμουρα Συσκευασία 125gr,4.30
2025-06-12,198087,Μάνγκο Εισαγωγής Τιμή Κιλού,2.09
2025-06-12,192095,Μπάρμπας Στάθης Σαλάτα Σπανάκι 500gr,3.21
2025-06-12,192062,Ραπανάκια Εγχώρια 125gr Συσκευασία,0.97
2025-06-12,192521,Φρεσκούλης Σαλάτα Iceberg 200gr,1.45
2025-06-12,198512,Λάχανο Βιολογικό Ελληνικό Τιμή Κιλού,2.92
2025-06-12,192382,Φρεσκούλης Συσκευασία Ρόκα Άγρια 100gr,1.19
2025-06-12,198178,Γλυκοπατάτες Κόκκινες Εισαγωγής Ποιότητα Α΄(Τιμή Κιλού),1.20
2025-06-12,198699,Παντζάρια Βρασμένα 500gr,1.58
2025-06-12,198212,Ρόδι Εισαγωγής Τιμή Κιλού,1.89
2025-06-12,192441,Πατάτες Κύπρου Επιλεγμένες Για Τηγάνι Δίχτυ Τιμή Κιλού,5.67
2025-06-12,198916,Μανιτάρια Porto Bello Εισαγωγής 500gr,3.48
2025-06-12,198772,Μανιτάρια Φρέσκα Γίγας Εισαγωγής 500gr,2.50
2025-06-12,198046,Κρεμμύδια Στιφάδο Ελληνικά Ποιότητα Α΄ Δίχτυ Τιμή Κιλού,1.12
2025-06-12,198398,Μπανάνες Dole Baby,2.34
2025-06-12,192417,Βεζύρογλου Σαλάτα Τραγανή Baby Leaf 150gr,1.89
2025-06-12,198171,Ρόκα Ελληνική Ποιότητα Α 100gr,0.99
2025-06-12,198010,Αντίδια Ελληνικά Τιμή Κιλού,1.69
2025-06-12,192602,Φρουτοσαλάτα Εποχής 200gr,2.79
2025-06-12,198571,Βιολογικά Μήλα Σμιθ Εγχώρια,4.49
2025-06-12,198133,Φινόκιο,0.84
2025-06-12,192476,Πρασινόκοσμος Σπανάκι Baby 100gr,0.89
2025-06-12,198947,Μανιτάρια Brown Εισαγωγής Συσκευασία 500gr,3.25
2025-06-12,192481,Πρασινόκοσμος Σαλάτα Tricolore 250gr,1.63
2025-06-12,198517,Ακτινίδια Βιολογικά Ελληνικά Τιμή Κιλού,5.25
2025-06-12,192470,Μπάρμπα Στάθης Σαλάτα Ιταλική Οικογενειακή Συσκευασία 320gr,2.94
2025-06-12,198904,Φρεσκούλης Σαλάτα Σπανάκι 375gr,2.39
2025-06-12,192474,Πρασινόκοσμος Ρόκα Baby 100gr,0.97
2025-06-12,192038,Lucia Κεράσια 250gr Εγχώρια,2.49
2025-06-12,192232,Σαλάτα Λόλα Σε Γλαστράκι,0.99
2025-06-12,192523,Φρεσκούλης Σαλάτα Γεύμα COBB Με Κοτόπουλο 280gr,4.45
2025-06-12,192482,Πρασινόκοσμος Σαλάτα Ιταλική 250gr,1.60
2025-06-12,192570,Αγρόκηπος Βιολογικό Παντζάρι 400gr (+25% Δώρο),3.25
2025-06-12,192403,Φρεσκούλης Σαλάτα Καπριτσιόζα Οικογενειακή 335gr,2.75
2025-06-12,198721,Φρεσκούλης Σαλάτα Δροσερή Μαρούλι- Iceberg- Εσκαρόλ- Ραντίτσιο- Ρόκα 200gr,1.97
2025-06-12,192324,Άρωμα Δυόσμος Γλαστράκι Μεγάλο,2.65
2025-06-12,198254,Φρεσκούλης Βιολογική Σαλάτα Ιταλική 200gr,2.73
2025-06-12,198526,Βιολογικά Πεπόνι Εγχώριο,4.19
2025-06-12,198504,Πιπεριές Βιολογικές Ελληνικές Συσκευασία,2.00
2025-06-12,198438,Μανιτάρια Πλευρώτους Βιολογικά Συσκευασία 400gr,2.99
2025-06-12,192603,Φρουτοσαλάτα Mix 200gr,2.79
2025-06-12,192027,Φρεσκούλης Σαλάτα Πανδαισία 160gr,2.09
2025-06-12,192473,Πρασινόκοσμος Mix Baby Leaf 100gr,0.94
2025-06-12,198260,Σελινόριζα Εισαγωγής Τιμή Κιλού,1.78
2025-06-12,192483,Πρασινόκοσμος Σαλάτα Φάρμα 250gr,1.69
2025-06-12,198516,Βιολογικά Πορτοκάλια Βαλέντσια Εγχώρια,4.28
2025-06-12,198804,Λόλα Double Mix Ζωντανή Ρίζα,1.89
2025-06-12,192414,Βεζύρογλου Σαλάτα Πιπεράτη 150gr,1.89
2025-06-12,204037,Αγρόκηπος Κολοκύθα Στον Ατμό 400gr,3.27
2025-06-12,192261,Κόλιανδρο Κουτί 25gr Εγχώριο,1.99
2025-06-12,192335,Τομάτες Today's Τύπου Ελιά Ελληνικές 500gr,3.89
2025-06-12,198681,Μαϊντανός Ελληνικός Συσκευασία 80gr,0.99
2025-06-12,192572,Αβοκάντο Εισαγωγής Συσκευασία Τιμή Κιλού,7.34
2025-06-12,192475,Πρασινόκοσμος Βαλεριάνα Baby 100gr,1.06
2025-06-12,192081,Μανιτάρια Πλευρώτους Φιλέτο Ελληνικά 500gr,3.99
2025-06-12,192471,Μπάρμπα Στάθης Σαλάτα Φριζάτη 240gr,2.54
2025-06-12,198766,Δενδρολίβανο Ελληνικό Κουτί 25gr,1.99
2025-06-12,198234,Άρωμα Σέλινο Εγχώριο Συσκευασία 80gr,0.99
2025-06-12,198928,Θυμάρι Εισαγωγής Κουτί 25gr,1.99
2025-06-12,192408,Μπάρμπα Στάθης Σπανάκι 250gr,2.23
2025-06-12,192418,Βεζύρογλου Σαλάτα Super Mix Baby Leaf 150gr,2.15
2025-06-12,198082,Καρύδα Εισαγωγής Το Τεμάχιο,1.19
2025-06-12,198774,Άρωμα Δυόσμος Ελληνικός Κουτί 25gr,1.99
2025-06-12,192673,Σταφύλια Mix Εισαγωγής 500gr,3.99
2025-06-12,330793,Rapunzel Χουρμάδες Με Κουκούτσι Bio Σκαφάκι 250gr,2.38
2025-06-12,192385,Φρεσκούλης Συσκευασμένη Βαλεριάνα 100gr,1.19
2025-06-12,192996,Βιολογική Σαλάτα Ρόκα 125gr,2.69
2025-06-12,198283,Βιολογικά Βερίκοκα Πρώιμα Τιμή Κιλού,5.36
2025-06-12,198456,Ανανάς By Air Εισαγωγής Τιμή κιλού,11.17
2025-06-12,198488,Πατάτες Νάξου Συσκευασμένες Ελληνικές Ποιότητα Α,6.27
2025-06-12,192028,Καρπούζι Τιμή Κιλού,6.75
2025-06-12,198486,Κινέζικο Λάχανο Τιμή Κιλού,4.49
2025-06-12,198656,Καρπούζι Βιολογικό Ατομικό Εγχώριο,8.70
2025-06-12,198618,Ροδάκινα Πλατύκαρπα Ποιότητα Α,0.56
2025-06-12,192449,My Greek Pickles Φρέσκο Βιολογικό Ξινoλάχανο 250gr,3.99
2025-06-12,192107,Βιολογική Σαλάτα Gran Mix 125gr,3.99
2025-06-12,217159,Δυόσμος Vevi Σακουλάκι 40gr,1.88
2025-06-12,192138,Διρφύς Μανιτάρια Λεντινούλα Αποξηραμένα 25gr,3.55
2025-06-12,198883,Άρωμα Σχοινόπρασο Chives 25gr Εγχώριος Τιμή Τεμαχίου,1.89
2025-06-12,192195,Βιολογική Σαλάτα Sfizioso Mix 150gr,3.46
2025-06-12,198153,Καλαμπόκι Φρέσκο,1.29
2025-06-12,198769,Βασιλικός Ελληνικός Κουτί 25gr,1.99
2025-06-12,198204,Γκρέιπ Φρουτ Κίτρινα Εισαγωγής,0.74
2025-06-12,192099,Βερύκοκα Orange Red Κεσεδάκι Τιμή Κιλού,4.69
2025-06-12,198216,Ρέβα Εισαγωγής Τιμή Κιλού,2.85
2025-06-12,198352,Λωτοί Εισαγωγής Ποιότητα Α΄Τιμή Κιλού,2.06
2025-06-12,192600,Αβοκάντο 3 Μισά Καθαρισμένα Κομμάτια 180gr,5.99
2025-06-12,198063,Βερύκοκα Διαμαντοπούλου Εγχώρια,10.43
2025-06-12,192106,Βιολογική Σαλάτα Mista 200gr,3.42
2025-06-12,198169,Ραντίτσιο Εισαγωγής,1.75
2025-06-12,134069,Σπάλα Χοιρινή Ελληνική Νωπή Άνευ Οστού,1.52
2025-06-12,133733,Λάπα Βοείου Ελληνική Νωπή Άνευ Οστού,2.80
2025-06-12,134061,Χοιρινός Λαιμός Ελληνικός Με Οστό,1.48
2025-06-12,137169,Πίνδος Φτερούγες Κοτόπουλο Ελληνικές Νωπές Τιμή Κιλού,0.29
2025-06-12,133556,Σπαλομύτα Βοείου Ελληνική Νωπή Τιμή Κιλού,3.75
2025-06-12,133735,Σπάλα Βοείου Ελληνική Νωπή Άνευ Οστού,3.75
2025-06-12,134001,Σουβλάκια Χοιρινά Ελληνικής Επεξεργασίας Μαριναρισμένα Νωπά Τιμή Κιλού,0.93
2025-06-12,134004,Χοιρινός Λαιμός Ολλανδίας Με Οστό Τιμή Κιλού,1.80
2025-06-12,137307,Σουβλάκι Μπούτι Κοτόπουλου Ελληνικό Νωπό Μαριναρισμένο,1.12
2025-06-12,133741,Ελιά Βοείου Ελληνική Νωπή Άνευ Οστού,3.75
2025-06-12,137706,Αμβροσιάδης Μπούτι Κοτόπουλο Νωπό Ελληνικό Τιμή Κιλού,1.64
2025-06-12,137711,Άρτα Κοτόπουλο Ελληνικό Νωπό Xύμα,5.08
2025-06-12,133205,Ελιά Βοείου Γερμανίας Νωπή Άνευ Οστού Τιμή Κιλού,2.99
2025-06-12,137078,Το Χωρικό Φιλέτο Στήθος Κοτόπουλο Νωπό Χωρίς Κόκκαλο,5.10
2025-06-12,134203,Σπάλα Χοιρινή Ολλανδίας Νωπή Άνευ Οστού,1.90
2025-06-12,133211,Στήθος Λάπα Βοείου Γερμανίας Άνευ Οστού,3.00
2025-06-12,133228,Τουρτουγκίτα Ποντίκι Βοείου Γερμανίας Άνευ Οστού,3.01
2025-06-12,137705,Αμβροσιάδης Κοτόπουλο Νωπό Ελληνικό Τιμή Κιλού,5.08
2025-06-12,137149,Πίνδος Φιλέτο Στήθος Κοτόπουλου Ελληνικό Νωπό,5.97
2025-06-12,134062,Μπριζόλα Χοιρινή Ελληνική Νωπή Με Οστό Χωρίς Δέρμα Τιμή Κιλού,2.76
2025-06-12,134068,Πανσέτα Χοιρινή Ελληνική Νωπή Με Οστό Άνευ Δέρματος,1.45
2025-06-12,137076,Το Χωρικό Μπούτι Κοτόπουλου Νωπό Τιμή Κιλού,1.70
2025-06-12,134010,Μπριζόλα Χοιρινή Ολλανδίας Νωπή Με Οστό,2.56
2025-06-12,137735,Πίνδος Κοπανάκι Κοτόπουλο Ελληνικό Νωπό Τιμή Κιλού,0.97
2025-06-12,133055,Φάρμα Ελασσόνας Κιμάς Βόειος Νωπός 400gr,4.69
2025-06-12,134050,Χοιρινός Λαιμός Ολλανδίας Με Οστό Τιμή Κιλού,1.80
2025-06-12,137718,Άρτα Φτερούγες Κοτόπουλου Νωπές Εγχώριες Τιμή Κιλού,0.29
2025-06-12,133209,Σπάλα Βοείου Γερμανίας Νωπή Άνευ Οστού,2.99
2025-06-12,134065,Μπούτι Χοιρινό Ελληνικό Νωπό Άνευ Οστού,1.80
2025-06-12,137828,Νιτσιάκος Nuggets Ελληνικό Κοτόπουλο Τυποποιημένο 400gr -20%,3.73
2025-06-12,137898,Νιτσιάκος Nuggets Ελληνικό Κοτόπουλο 400gr -0-50€,4.16
2025-06-12,137821,Νιτσιάκος Nuggets Ελληνικό Κοτόπουλο Τυποποιημένο 400gr,4.66
2025-06-12,158501,Τσιπούρα Sparus Aurata Υδατοκαλλιέργειας Ελλάδος 0-4-0-8kg Τιμή Κιλού,5.69
2025-06-12,133734,Στήθος Βοείου Ελληνικό Νωπό Χωρίς Οστό,5.59
2025-06-12,133731,Μπούτι Βοείου Ελληνικό Νωπό Άνευ Οστού,4.00
2025-06-12,134205,Μπούτι Χοιρινό Ολλανδίας Νωπό Άνευ Οστού Άνευ Δέρμα,1.97
2025-06-12,133800,Ελιά Βοείου Πολωνίας Νωπή Άνευ Οστού Τιμή Κιλού,6.45
2025-06-12,137837,Ελαιοπουλάκι Φιλέτο Μπούτι Κοτόπουλο Δισκάκι 600gr -25%,7.43
2025-06-12,137147,Πίνδος Μπούτι Κοτόπουλο Ελληνικό Τιμή Κιλού,2.18
2025-06-12,137832,Ελαιοπουλάκι Φιλέτο Μπούτι Κοτόπουλο Νωπό Δισκάκι 600gr,9.90
2025-06-12,133994,Black Angus Ιρλανδίας Σπαλομπριζόλα Βοείου Άνευ Οστού Τιμή Κιλού,4.25
2025-06-12,137717,Άρτα Φιλέτο Στήθος Κοτόπουλο Νωπό Εγχώριο Τιμή Κιλού,3.48
2025-06-12,133635,Συκώτι Βοείου Γερμανίας Νωπό,2.84
2025-06-12,133702,Ελιά Σπάλα Μοσχάρι Γάλακτος Ολλανδίας Άνευ Οστού,4.37
2025-06-12,133045,Meatka Μπιφτέκι Κοτόπουλου Ελληνικό Νωπό 600gr,5.65
2025-06-12,137907,My Fresco Nuggets Κοτόπουλου Ελληνικό 400gr,3.57
2025-06-12,138407,Mimikos Nuggets Κοτόπουλο Ελληνικά Δισκάκια Νωπά 480gr,5.55
2025-06-12,137908,My Fresco Σνίτσελ Κοτόπουλο Ελληνικό 390gr,3.47
2025-06-12,134538,Meatka Μπιφτέκι Βόειο Ευρωπαϊκής Ένωσης Σε Δισκάκι 600gr,5.75
2025-06-12,137719,Άρτα Φιλέτο Μπούτι Κοτόπουλο Νωπό Εγχώριο,2.31
2025-06-12,134003,Πανσέτα Χοιρινή Ολλανδίας Νωπή Με οστό Άνευ Δέρματος,1.40
2025-06-12,137146,Πίνδος Κοτόπουλο Ελληνικό Νωπό Τιμή Κιλού,5.25
2025-06-12,137913,My Fresco Φιλέτο Στήθος Κοτόπουλο Ελληνικό 700gr,6.12
2025-06-12,133801,Σπάλα Βοείου Πολωνίας Νωπή Άνευ Οστού,6.45
2025-06-12,137129,Αγγελάκης Ατομικό Ρολό Κοτόπουλο Xωρις Γλουτένη Νωπό Τιμή Κιλού,3.98
2025-06-12,133056,Φάρμα Ελασσόνας Κιμάς Ανάμεικτος Νωπός 400gr,4.45
2025-06-12,137742,Άρτα Κοπανάκι Νωπό Ελληνικό Τιμή Κιλού,0.97
2025-06-12,137960,Πίνδος Κοπανάκι Κοτόπουλο Μαριναρισμένο Ελληνικό Τιμή Κιλού,0.91
2025-06-12,134017,Φιλέτο Χοιρινό Ψαρονέφρι Ολλανδίας,4.98
