2025-06-12,832787,Mitsuko Σαγιονάρες Γυναικείες Πολύχρωμες Πούα,2.80
2025-06-12,832820,Mitsuko Σαγιονάρες Aνδρικές Διχάλα Beach Surfer,2.80
2025-06-12,709186,Gillete Sensor 3+ Comfort (Δωρό 8 Ανταλλακτικές Λαβές),7.54
2025-06-12,706439,Nivea Radiance Νερό Ντεμακιγιάζ Waterproof 125ml,3.37
2025-06-12,702818,Pantene Κρέμα Mαλλιών Classic 500ml,6.55
2025-06-12,710132,Tesori Κολώνια Royal Oud 100ml,10.95
2025-06-12,765080,Garnier Olia Βαφή Μαλλιών Χωρίς Αμμωνία Ν7.0 Ξανθό 50ml,5.76
2025-06-12,765069,Olia Βαφή Μαλλιών Χωρίς Αμμωνία Νο 6.60 Έντονο Κόκκινο 60ml,5.76
2025-06-12,716383,Aromatics Nutri Care Κρέμα Σώματος Luminous Argan Oil 200ml,2.74
2025-06-12,775864,Dove Αφρόλουτρο Silk 400ml,2.91
2025-06-12,702797,Garnier Botanic Therapy Μάσκα Μαλλιών Rice Water & Starch Rituals 340ml,5.80
2025-06-12,771364,Syoss Σαμπουάν Intense Plex 440ml,3.04
2025-06-12,702793,Gliss Treatment Daily Oil Elixir 75ml,5.42
2025-06-12,716381,Dove Κρέμα Χεριών Milk Essential 75ml,2.03
2025-06-12,706381,Syoss Treatment Serum Intense Plex 100ml,6.36
2025-06-12,710127,Nivea Men Sensitive Κρέμα Gel 60gr,6.70
2025-06-12,702747,Garnier Fructis Hairfood Μάσκα Μαλλιών Pineapple 400ml,6.29
2025-06-12,702712,Gliss 4in1 Μάσκα Μαλλιών Bond Building Regeneration 400ml,5.76
2025-06-12,702698,Head & Shoulders Κρέμα Μαλλιών Derma X Pro Strength 220ml,3.61
2025-06-12,771224,Head & Shoulders 2in1 Σαμπουάν Total Care 360ml,3.89
2025-06-12,715104,L'oreal Men Expert Αφρόλουτρο Clean Carbon 400ml,4.03
2025-06-12,702689,Elvive Hydra Κρέμα Νύχτας Hyaluronic 200ml,7.02
2025-06-12,702695,Elvive Conditioner Bond Repair 150ml,6.05
2025-06-12,716217,Aroma Body Butter Papaya Mango Passiofruit 200ml,3.15
2025-06-12,766067,Syoss Oleo Βαφή Μαλλιών 7-56 Ξανθό Σαντρε Μόκα,5.31
2025-06-12,716210,Veet For Men Κρέμα Αποτρίχωσης In Shower 150ml,6.79
2025-06-12,724083,Maybelline Μανό Fast Gel 11 Red Punch 40ml,4.04
2025-06-12,653158,New Wave Ultra Effect Go Matt Clay 75ml,4.19
2025-06-12,765019,HD Color Σετ Βαφής Μαλλιών Ν.1 Μαύρος Έβενος,4.15
2025-06-12,762024,Oral-B IO Ultimate Clean Ανταλλακτικά 2τεμ,16.99
2025-06-12,757000,Nivea Men Αποσμητικό Σώματος Deep Beat Σπρευ 150ml,3.28
2025-06-12,717034,Valley Sweet Almond Αποσμητικό Σώματος Σπρέι 100ml,2.41
2025-06-12,716196,Vaseline Γαλάκτωμα Σώματος Dry Skin 400ml,4.82
2025-06-12,706766,L'OREAL Revitalift Serum Laser Retinol 30ml,16.59
2025-06-12,756425,Nivea Cellular Lumin 630 Κρέμα Ημέρας Κατά Των Κηλίδων 40ml,15.11
2025-06-12,724030,Maybelline SS Matte Ink Κραγιόν 125 Insp,15.32
2025-06-12,606320,Always Discreet Boutique Large Pants 8τεμ,10.29
2025-06-12,606869,Slipad Pants Εσώρουχα Ακράτειας Large 14τεμ,7.48
2025-06-12,755533,Noxzema Hydration Αφρόλουτρο 750ml,3.06
2025-06-12,701121,Carroten Tissue Mask After Sun 20ml,1.43
2025-06-12,701127,Nivea Sun Spray Protect & Dry Touch SPF50 200ml,10.85
2025-06-12,716319,Johnson's Oil Aloe Vera 300ml,2.97
2025-06-12,606363,Tena Pants Original Normal Medium Πάνες Ακράτειας 30τεμ,17.15
2025-06-12,710915,Sweet Candy Strawberry Kiss Eau De Toillette 100ml,11.73
2025-06-12,703802,Zan Sot Αερόβουρτσα Τετράγωνη Μικρή,4.89
2025-06-12,707157,Gillette Classic Regular Αφρός Ξυρίσματος 200ml,2.68
2025-06-12,705832,Syoss Color N1-4 Μαύρο Μπλε,4.47
2025-06-12,620600,Diana Sting Κάλτσα Ανδρική Βαμβακερή Μαύρη,3.37
2025-06-12,620409,Diana Ilium 18D Καλτσάκια Μαύρα 2τεμ,1.71
2025-06-12,620397,Diana Starlyn 15D Καλσόν Καραμελέ (XL-XXL),3.41
2025-06-12,710108,Axe After Shave Africa 100ml,9.48
2025-06-12,775130,Mea Natura Olive Wellness & Revival Ντους 300ml,2.43
2025-06-12,765394,Koleston Βαφή Μαλλιών Νο 7/3 50ml,5.99
2025-06-12,765406,Koleston Βαφή Μαλλιών Νο9/0 50ml,5.99
2025-06-12,653631,Syoss Oleo Βαφή Φυσικό Ξανθό 7-10,5.31
2025-06-12,765250,Palette Κρέμα Βαφή Μαλλιών N7.87 Χάλκινο,3.75
2025-06-12,706262,Nivea Essentials Θρεπτική Κρέμα Ημέρας SPF15 50ml,4.91
2025-06-12,706245,Nivea Visage Απαλό Gel Καθαρισμού Λιπαρές Επιδερμίδες 150ml,4.08
2025-06-12,716987,Carnaby Viso Blue Αποτριχωτική Κρέμα Προσώπου 60ml,6.19
2025-06-12,621054,BIC Avigliano Κάλτσα Unisex Μικτή Σετ 2,3.55
2025-06-12,774782,Got2b Glued Freeze Λακ Μαλλιών 300ml,5.73
2025-06-12,705593,L'OREAL Excellence Cream No 5 Καστανό Ανοιχτό 48ml,6.42
2025-06-12,620012,BIC Καλσόν Μη Ελαστικό Μαύρο 20D,1.69
2025-06-12,832824,Mitsuko Σαγιονάρες Aνδρικές Διχάλα Letters,2.80
2025-06-12,717474,Axe Αποσμητικό Σώματος Black Vanilla 72h Fresh 50ml,3.25
2025-06-12,709190,Bic Flex 5 Sensitive Ξυραφάκια Μιας Χρήσης 3τεμ,4.91
2025-06-12,775906,Old Spice Ντους Epic Legend 400ml,2.77
2025-06-12,832747,Vieri Σαγιονάρες Δίχρωμες Φοινικές Μπλε Σομον,2.75
2025-06-12,719055,Hansaplast Aqua Protec Kids 20τεμ,3.59
2025-06-12,706429,Nivea Κρέμα Ημέρας Αντιρυτιδική Q10 Power 50ml,10.40
2025-06-12,709174,Gillette Venus Fig Ανταλλακτικά 3τεμ,14.99
2025-06-12,706397,Nivea Νερό Καθαρισμού Skin Glow 1400ml,4.39
2025-06-12,712077,Sensdyne Οδοντόκρεμα Clinical Repair White 75ml,4.68
2025-06-12,765059,Excellence Nudes 2u Βαφές Μαλλιών Καστανό Σκούρο 50ml,6.97
2025-06-12,720164,Luxurious Dark Tanning Oil SPF6 200ml,4.50
2025-06-12,720112,Luxurious Αντιηλιακό Προσώπου & Σώματος SPF50 50ml,11.95
2025-06-12,702750,TRESemme Μάσκα Μαλλιών Biotin Για Ταλιπωρημένα Μαλλιά 440ml,6.99
2025-06-12,702748,Garnier Fructis Hairfood Μάσκα Μαλλιών Watermelon 400ml,6.29
2025-06-12,771310,Head & Shoulders Σαμπουάν Cool Menthol 625ml,5.57
2025-06-12,832695,Mitsuko Παντόφλες Γυναικείες Με Φάσα,7.50
2025-06-12,702710,Gliss 4in1 Μάσκα Μαλλιών Bond Building Nourishment 400ml,5.76
2025-06-12,704000,Schwarzkopf Taft Styling Gel V12,5.45
2025-06-12,717424,Axe Αποσμητικό Σώματος Stick Ice Chill 50ml,3.00
2025-06-12,756044,Nivea Men After Shave Balm Anti Age Hyaluron 100ml,5.99
2025-06-12,709088,Gillette Mach III Ξυραφάκια Ανταλλακτικά 8τεμ,19.44
2025-06-12,706141,Elvive Serum Bond Repair 150ml,7.76
2025-06-12,716228,Aroma Κρέμα Σώματος Panthenol Therapy 75ml,2.50
2025-06-12,756036,Nivea Αποσμητικό Σώματος Σπρέυ Γυναικείο Touch Fresh Rose 150ml,3.28
2025-06-12,765036,Palette Βαφή Μαλλιών Intensive Color Creme No12.21 Κατάξανθο,3.75
2025-06-12,765051,Palette Κρέμα Βαφή Μαλλιών No.6.1 Ξανθό Σκούρο Σαντρε,3.75
2025-06-12,765056,Syoss Oleo Βαφή Μαλλιών Νο5-10 Καστανό Ανοιχτό,5.31
2025-06-12,710103,Jean Marc After Shave Copacabana 100ml,5.58
2025-06-12,719693,Durex Massage Aloe Gel 200ml,10.99
2025-06-12,620319,Lotus Κάλτσα Ανδρική Βαμβακερή Κοφτή,3.45
2025-06-12,771200,HD Conditioner Διφασικό Σπρεύ Για Ξηρά Ταλαιπωρημένα Μαλλιά 150ml,5.29
2025-06-12,701193,Carroten Αντηλιακό Γαλάκτωμα SPF50 200ml,9.48
2025-06-12,702659,Pantene Μάσκα Μαλλιών Για Μπούκλες 300ml,6.79
2025-06-12,706097,Nivea Derma Skin Clear Νυχτερινό Απολέπ. Κατά Των Πόρων 40ml,5.04
2025-06-12,716143,Nivea Κρέμα Σώματος Lemongrass 400ml,4.94
2025-06-12,716104,Bioten Κρέμα Σώματος Skin Nutries Vitamin 400ml,4.46
2025-06-12,754286,New Wave Rock N Hold Gel 200ml,4.19
2025-06-12,765020,HD Color Σετ Βαφής Μαλλιών Ν10.1 Κατάξανθο Σαντρέ,4.15
2025-06-12,765025,HD Color Σετ Βαφής Μαλλιών Ν4 Καστανό,4.15
2025-06-12,765029,HD Color Σετ Βαφής Μαλλιών Ν.8.1 Ανοικτό Σαντρέ,4.15
2025-06-12,765021,HD Color Σετ Βαφής Μαλλιών Ν-Β Μαύρο Μπλέ,4.15
2025-06-12,719864,Scholl Fresh Step Αποσμητικό Υποδημάτων 150ml,6.08
2025-06-12,526414,School Πάτοι Απορρόφησης Κραδασμών,7.90
2025-06-12,720073,Piz Buin Tanprot Spray SPF 15 150ml,7.99
2025-06-12,720057,Nivea Sun Kid's Trigger Spray SPF 50+ Sensitive 270ml,12.45
2025-06-12,720058,Nivea Sun Protect & Moisture Trigger Spray SPF 30 270ML,10.83
2025-06-12,611997,Treellium Αντισηπτικο Gel Χεριών Βιοκτόνο 80ml,1.20
2025-06-12,715260,Le Petit Marseillais Κρέμα Χεριών Nutrition 75ml,2.09
2025-06-12,710472,Tesori Eau De Parfum Hammam 100ml,10.95
2025-06-12,724020,Maybelline SS Matte Ink Κραγιόν 15 Lover Blister,15.32
2025-06-12,756214,Nivea Men Sensitive Intensive Ενυδατική Κρέμα Προσώπου 50ml,6.04
2025-06-12,719092,Durex Naturals Λιπαντικό Gel Ενυδατικό 100ml,13.00
2025-06-12,704039,Tresemme Freeze Hold Λακ Μαλλιών 250ml,5.09
2025-06-12,620965,Feel Good! Καλτσάκια 20D Γραφίτης 2 ζευγάρια,1.30
2025-06-12,514990,Questo Αντιβακτηριδιακό Απολυμαντικό Αντλία 500ml,1.72
2025-06-12,526159,Ringpoint Κορδόνια Στρογγυλά Ψιλά Μαύρα 60cm,2.15
2025-06-12,710947,Feel Good! Κολώνια Άνθη Γιασεμιού 250ml,5.20
2025-06-12,716499,Nivea Aloe Hydration Body Lotion 250ml,3.74
2025-06-12,719627,Hansaplast Junior Frozern Strips 20τεμ,3.02
2025-06-12,707632,Nivea Men Sensitive Ultra Comfort Αφρός Ξυρίσματος 200ml,2.70
2025-06-12,703809,Zan Sot Klamer Χταποδάκι Classic Πολύ Μεγάλο,2.30
2025-06-12,703813,Zan Sot Klamer Καμπυλοειδές Classic Μεγάλο,2.42
2025-06-12,765778,Palette Κρέμα Βαφή Μαλλιών Ν4.66 Καστανό Έντονο Κόκκινο,3.75
2025-06-12,705824,Syoss Color N4-2 Ακαζού,4.47
2025-06-12,754999,Elvive Ολική Αναδόμηση 5 Μάσκα 300ml,7.01
2025-06-12,621310,Diana Κορμάκι Camisole Μαυρο/Λευκό,15.88
2025-06-12,620816,Diana Starlyn Καλσόν 15D Καραμελέ (S-M-L),3.23
2025-06-12,720856,Carroten Αντηλιακό Γαλάκτωμα Kids SPF50 200ml,9.73
2025-06-12,720525,Carroten Magic Tan & Protect Αντηλιακό Γαλάκτωμα Spray SPF30 200ml,9.73
2025-06-12,716037,Bioten Beloved Coconut Κρέμα Σώματος 250ml,3.78
2025-06-12,771556,Mea Natura Olive Vitality & Shine Σαμπουάν 300ml,2.95
2025-06-12,771567,Mea Natura Olive Strength & Softness Σαμπουάν Για Ξηρά 300ml,2.95
2025-06-12,765383,Koleston Βαφή Μαλλιών Νο55/46 50ml,5.99
2025-06-12,620042,BIC Molas Καλσόν Ελαστικό Μαύρο 20D Large,3.36
2025-06-12,620041,BIC Molas Καλσόν Ελαστικό Μαύρο 20D Medium,3.36
2025-06-12,620040,BIC Silhouette Καλσόν Ελαστικό Μελί 15D Large,5.62
2025-06-12,711436,Aquafresh Flex Interdental Medium Οδοντόβουρτσα,1.59
2025-06-12,662528,L'OREAL Magic Retouch Spray Κάλυψης Μαύρο 75ml,10.27
2025-06-12,710420,Nivea Men After Shave Fluid 100ml,5.55
2025-06-12,620246,BIC Vivant Καλσόν Ελαστικό Μαύρο 40D XLarge,4.20
2025-06-12,755073,Fa Shower Gel Cream & Oil Mangolia 250ml,1.54
2025-06-12,771520,Botanic Therapy Σαμπουάν Χαμομήλι & Μέλι 400ml,3.04
2025-06-12,754039,Elive Σαμπουάν Growth Booster 200ml,6.05
2025-06-12,706495,Bioten Clean Control Strip 6τεμ,2.98
2025-06-12,775911,Vidal Shower Gel Argan 2x750ml,5.49
2025-06-12,720294,Luxurius Sun Αντηλιακό Travel Σετ,13.94
2025-06-12,710162,STR8 Κολώνια Wild Beat 100ml,13.90
2025-06-12,832813,Mitsuko Σαγιονάρες Γυναικείες Διχάλα Πέτρες Στρας,11.96
2025-06-12,832825,Mitsuko Σαγιονάρες Γυναικείες Soft Δίχρωμες,7.30
2025-06-12,832804,Mitsuko Σαγιονάρες Ανδρικές Φάσα Sport,6.89
2025-06-12,709191,Bic Hybrid Flex 2 Sensitive Ξυριστική Μηχανή +2 Ανταλλακτικά,4.52
2025-06-12,832757,Vieri Σαγιονάρες Γυναικείες Δίχρωμες Χρώματα,2.85
2025-06-12,702837,Pantene Μάσκα Μαλλιών Ενυδάτωση & Λάμψη 300ml,7.66
2025-06-12,771414,Pantene Σαμπουάν Αναδόμηση & Προστασία 625ml,6.99
2025-06-12,771418,Pantene Σαμπουάν Χρώμα & Προστασία 625ml,6.99
2025-06-12,765082,Garnier Olia Βαφή Μαλλιών Χωρίς Αμμωνία Ν6.0 Ξανθό Σκούρο 50ml,5.76
2025-06-12,765076,Olia Βαφή Μαλλιών Χωρίς Αμμωνία Νο 7.13 Ξανθό Μπεζ Σαντρέ 60ml,5.76
2025-06-12,765061,Excellence Nudes 2u Βαφή Μαλλιών Καστανό Ξανθό 50ml,6.97
2025-06-12,765063,Excellence Nudes 5u Βαφή Μαλλιών Καστανό Ανοιχτό 50ml,6.97
2025-06-12,720109,Ambre Solaire Αντιηλιακή Προσώπου SFP50+ 40ml,8.57
2025-06-12,775868,Dove Αφρόλουτρο Anti-stress 400ml,2.91
2025-06-12,775846,Dove Αφρόλουτρο Fruit Nour 450ml,2.55
2025-06-12,716376,Dove Λοσιόν Σώματος Care & Glow 400ml,5.11
2025-06-12,702725,Fructis Hairfood Μάσκα Μαλλιών Papaya 400ml,7.68
2025-06-12,771316,Head & Shoulders Σαμπουάν Cool Menthol 330ml,3.90
2025-06-12,704036,Schwarzkopf Taft Λακ Μαλλιών Ultra HL4 250ml,4.64
2025-06-12,704030,Schwarzkopf Taft Ultimate HL6 250ml,4.64
2025-06-12,756043,Nivea Ορός Cellural Luminous Anti Age & Spot Serum 2 in 1 30ml,15.78
2025-06-12,709099,Gillette Venus Sugarberry Μηχανή +1 Ανταλλακτικό,12.97
2025-06-12,620320,Diana Casual Τερλίκι Λεπτές Μαύρες 5/2τεμ,2.75
2025-06-12,765052,Palette Βαφή Μαλλιών Intensive Color Creme No5.1 Καστανό Ανοιχτό Σαντρέ,3.75
2025-06-12,720093,Ambre Solaire Αντηλιακό Sensitive Antiage SPF50+ 50ml,8.57
2025-06-12,701187,Carroten Αντηλιακό Γαλάκτωμα Σπρευ Family Trigger SPF30 270ml,10.23
2025-06-12,701185,Carroten Kids Αντηλιακό Γαλάκτωμα Σπρευ Trigger SPF30 270ml,10.73
2025-06-12,719861,Scholl Κρέμα Ανάπλασης Σκασμένες Πτέρνες 60ml,12.27
2025-06-12,526413,Scholl Πάτοι Αντιμετώπισης Κακοσμίας,7.90
2025-06-12,702447,Gliss Conditioner Spray Aqua Revive 200ml,4.31
2025-06-12,702546,Gliss Μάσκα Μαλλιών Επανόρθωσης 7sec Aqua Revive 200ml,5.41
2025-06-12,620532,Diana Τερλίκι Λευκό 2τεμ,3.14
2025-06-12,762851,Colgate Plax Charcoal Στοματικό Διάλυμα 500ml,4.00
2025-06-12,705023,L'OREAL Excellence Βαφή Μαλλιών Κατανό Ανοιχτό Ψυχρό Ν.5.11,6.97
2025-06-12,754418,Feel Good! Λακ Μαλλιών Δυνατό Κράτημα 400ml,4.29
2025-06-12,712627,Feel Good! Power White Οδοντόκρεμα 75ml,1.54
2025-06-12,606870,Slipad Pants Εσώρουχα Ακράτειας X-Large 10τεμ,7.48
2025-06-12,701122,Carroten Cooling Gel After Sun 200ml,6.98
2025-06-12,706199,Diadermine Miceller Νερό Ντεμακιγιάζ 400ml,4.34
2025-06-12,620703,BIC Κολάν Basic Μαύρο Large,15.99
2025-06-12,706008,Bioten Multi Collagen Κρέμα Ημέρας 50ml,7.48
2025-06-12,611633,Zewa Υγρά Μαντήλια Fresh To Go Protection 10τεμ,1.42
2025-06-12,710917,Sweet Candry Coconut Dream Eau De Toillette 100ml,11.73
2025-06-12,720457,Mea Natura Pomegranate Αντιγηραντική & Αντιρυτιδική Κρέμα 50ml,6.43
2025-06-12,720650,Carroten Αντηλιακό Γαλάκτωμα Σώματος Sensicare SPF50 200ml,9.73
2025-06-12,653597,Syoss Oleo Βαφή Ξανθό Σκούρο 6-10,5.31
2025-06-12,710844,Old Spice Whitewater Λοσιόν Για Μετά Το Ξύρισμα 100ml,11.97
2025-06-12,620413,Diana Illum 18D Καλτσάκια Πέππερ 2τεμ,1.71
2025-06-12,703225,Πινέλο Βαφής Μαλιών Β' Ν.211/1115,0.65
2025-06-12,765393,Koleston Βαφή Μαλλιών Νο 7/1 50ml,5.99
2025-06-12,765341,Koleston Βαφή Μαλλιών Νο 10/0 50ml,5.99
2025-06-12,765594,Garnier Color Sensation No 7-0 Ξανθό 40ml,3.85
2025-06-12,765655,Garnier Color Sensation No 4.15 Παγωμένο Σοκολατί 40ml,3.85
2025-06-12,765630,Garnier Color Sensation No 8.0 Φωτεινό Ξανθό Ανοιχτό 40ml,3.85
2025-06-12,620143,Bic Vivant Καλσόν Ελαστικό Μελί 40D Large,4.20
2025-06-12,710401,Nivea Men After Shave Balsam 100ml,5.49
2025-06-12,704770,Wella Flex Αφρός Πολύ Δυνατός 200ml,3.84
2025-06-12,620026,BIC Silhouette Καλσόν Ελαστικό Μελί 15D Medium,5.62
2025-06-12,710185,Jean Marc Copacabana For Men Κολωνία 100ml,13.15
2025-06-12,716986,Carnaby Magic Blond Ξανθηντική Κρέμα 30gr,10.33
2025-06-12,720861,Carroten Αντηλιακό Γαλάκτωμα Σώματος Spray SPF30 200ml,9.48
2025-06-12,754782,Got2b Molding Gentleman Πηλός 100ml,5.76
2025-06-12,704455,L'OREAL Elnett Satin Spray Δυνατό Κράτημα 400ml,9.99
2025-06-12,720751,Carroten Intense Tanning Gel 150ml,11.48
2025-06-12,714094,Septona Dermasoft Κρεμοσάπουνο Άντλια Cotton & Milk 400ml,1.32
2025-06-12,706481,L'oreal Revitalift Filler Gel 150ml,4.36
2025-06-12,832788,Mitsuko Σαγιονάρες Γυναικείες Διχάλα Γκλίτερ,9.70
2025-06-12,720239,Carroten Sun Protection Flu Light SPD50+ 50ml,8.98
2025-06-12,705078,Syoss Color Βαφή Μαλλιών Νο 8-7 Ξανθό Ανοιχτό Χάλκινο 50ml,4.47
2025-06-12,709179,Gillette Sensor 3 Δώρο 8 Aνταλλακτικά Λαβή,7.54
2025-06-12,706432,Nivea Κρέμα Νυκτός Αντιρυτιδική Q10 Power 50ml,10.40
2025-06-12,754035,Feel Good! Pomade Extra Hold 100ml,4.09
2025-06-12,709163,Gillette Venus Fig Μηχανή & Ανταλλακτικό,16.97
2025-06-12,765077,Olia Βαφή Μαλλιών Χωρίς Αμμωνία Νο 1.10 Μαύρο Μπλέ 60ml,5.76
2025-06-12,765075,Olia Βαφή Μαλλιών Χωρίς Αμμωνία Νο 1.0 Βαθύ Μαύρο 60ml,5.76
2025-06-12,765070,Olia Βαφή Μαλλιών Χωρίς Αμμωνία Νο 6.3 Ξανθό Σκούρο Μελί 60ml,5.76
2025-06-12,716405,Dove Body Lotion Σώματος Light Care 400ml,4.94
2025-06-12,706386,Liposan Sun Protect SPF50 4-8gr,3.36
2025-06-12,720114,Luxurius Baby Invisible Sun Σπρέυ SPF50 +200ml,11.45
2025-06-12,720185,Luxurious Αντιηλιακό Για Το Πρόσωπο SPF50 200ml,7.00
2025-06-12,720105,Ambre Solaire Αντιηλιακό Παιδικό Σπρέυ SFP50+ 270ml,10.75
2025-06-12,755050,Dove Αφρόλουτρο Silky Velvet 450ml,2.58
2025-06-12,702749,Syoss Conditioner Deep Intense Plex 250ml,3.39
2025-06-12,771303,Head & Shoulders 2in1 Citrus Fresh 330ml,3.89
2025-06-12,702711,Gliss 4in1 Μάσκα Μαλλιών Bond Building Shine 400ml,5.76
2025-06-12,704044,Schwarzkopf Mousse Μαλλιών Power Cashmere 200ml,4.64
2025-06-12,717429,Αxe Αποσμητικό Σώματος Stick Dark Temptation 50ml,3.00
2025-06-12,705054,Koleston Βαφή Μαλλιών Νο 3.1 Σκούρο Καφέ 50ml,5.99
2025-06-12,702692,Fructis Μάσκαι Μαλλιών Vitamin & Strength Hair Bomb 320 ml,5.03
2025-06-12,765054,Syoss Oleo Βαφή Μαλλιών Νο5-92 Φωτεινό Κόκκινο,5.31
2025-06-12,706108,Nivea Q10 Στοχευμένος Ορός Κατά Των Ρυτίδων 15ml,10.83
2025-06-12,720076,Nivea Sun Αντηλιακή Κρέμα Προσώπου Shine Με Χρώμα Μεσαία Απόχρωση SPF50 40ml,8.40
2025-06-12,720078,Nivea Sun Protect & Bronze Trigger Spray SPF50 270ml,11.60
2025-06-12,705344,Excellence Creme Καστανό Σκούρο Βαφή Μαλλιών Ν.3,6.42
2025-06-12,712049,Colgate Οδοντόβουρτσα Max White Ultra,2.70
2025-06-12,701189,Carroten Kidsen Αντηλιακό Γαλάκτωμα Σπρευ Trigger SPF50+ 270ml,11.48
2025-06-12,718004,Septona Κρέμα Χεριών Senses Μανταρίνι 300ml,7.49
2025-06-12,724068,Maybelline Tatto Brow 36h Medium Brown 05,8.61
2025-06-12,706090,Bioten Κρέμα Ημέρας Calcium 50ml,9.82
2025-06-12,765109,HD Color Σετ Βαφής Μαλλιών Ν7.1 Ξανθο Σαντρέ,4.15
2025-06-12,717195,STR8 Ντους Gel Red Code 400ml,3.51
2025-06-12,611047,Treellium Gel Χεριών Βιοκτόνο 500ml,4.50
2025-06-12,716064,Valley Γαλάκτωμα Σώματος Sweet Almond 300ml,3.71
2025-06-12,702196,Orzene Μάσκα Μαλλιών Φθαρμένα 350ml,5.13
2025-06-12,620533,Diana Τερλίκι Μαύρο 2τεμ,3.14
2025-06-12,710860,Old Spice Shower Gel Restart 400ml,2.79
2025-06-12,756212,Nivea Men Active Age Κρέμα Προσώπου Για Ρυτίδες SPF 15 50ml,10.28
2025-06-12,710470,Tesori Body Cream Hammam 300ml,9.80
2025-06-12,832975,Mitsuko Αθλητικό Ανδρικό,12.50
2025-06-12,709285,Gillette Proglide Manual Flexball Ξυριστική Μηχανή (+ 2 Ανταλλακτικά),18.99
2025-06-12,620968,Feel Good! Καλσόν Mousse 20D Γραφίτης M/L,1.39
2025-06-12,709022,Gillette Fusion Manual Ξυριστική Μηχανή Με 2 Ανταλλακτικά,16.99
2025-06-12,706117,Bioten Bi-Phase Make-Up Remover 125ml,2.30
2025-06-12,701114,L'OREAL Men Expert Carbon Protect Αποσμητικό Spray 150ml,5.75
2025-06-12,701089,L'OREAL Men Expert Barber Club Πηλός Messy Look 75ml,7.94
2025-06-12,526170,Ringpoint Κορδόνια Φαρδιά Μαύρα 150cm,3.56
2025-06-12,702313,Syoss Oleo Intense Βαφή Μαλλιών Ξανθό Ανοιχτό Μπεζ 8-05,5.31
2025-06-12,703008,Zan Sot Λάστιχο Μαλλιών Mini,1.10
2025-06-12,756010,Nivea Hyaluron Cellular Filler Κρέμα Ημέρας SPF30 50ml,12.86
2025-06-12,710843,Old Spice After Shave Captain 100ml,11.97
2025-06-12,720038,Piz Buin Αντηλιακό Γαλάκτωμα Spf50 200ml,9.18
2025-06-12,705838,Syoss Oleo Βαφή Καστανό Χρυσό 4-60,5.62
2025-06-12,719099,Duo Extra Thin Extra Lubricated 18 τεμ,14.05
2025-06-12,706338,Nivea Q10 Plus C Αντιρυτιδική Ματιών Ανάπλασης Ενυδατική 15ml,9.63
2025-06-12,620526,Diana Κάλτσα Ανδρική Βαμβακερή Sous Bas,2.69
2025-06-12,720651,Carroten Αντηλιακό Γαλάκτωμα Spray Sensicare SPF50 200ml,10.23
2025-06-12,710183,Axe After Shave Black 100ml,9.48
2025-06-12,703803,Zan Sot Βούρτσα Στρογγυλή Ανατομική 15mm,5.48
2025-06-12,620096,Diana Boxer Ανδρικό Βαμβακερό Ελαστικό Μαύρο (S-M-L-XL),8.93
2025-06-12,720021,Nivea Sun Invisible Protect & Refresh Spray SPF50 200ml,10.85
2025-06-12,720015,Nivea Sun Anti Age Κρέμα Προσώπου SPF50 50ml,9.00
2025-06-12,620804,Diana Topaz Mousse 18D Καλσόν Καραμέλα M-L,1.69
2025-06-12,620422,Diana Starlyn 20D Καλσόν Μαύρο (S-M-L-XL),3.52
2025-06-12,620418,Diana Flert Stretch 15D Καλσόν Καραμέλα,2.39
2025-06-12,620175,BIC Medias Καλσόν Μελί 15D Medium,2.62
2025-06-12,703222,Siorfanne Μπωλ Βαφής,1.11
2025-06-12,709487,Gillette Venus Swirl Μηχανή & 1 Ανταλλακτικό,15.37
2025-06-12,765342,Koleston Βαφή Μαλλιων Νο12/0 50ml,5.99
2025-06-12,716008,Bioten Supreme Hyaluronic Body Lotion 250ml,3.54
2025-06-12,720961,Nivea Sun Protect & Bronze Oil SPF30 200ml,9.60
2025-06-12,765249,Palette Κρέμα Βαφή Μαλλιών N6.60 Ξανθό Σκούρο Χρυσό Σοκολατί,3.75
2025-06-12,620139,BIC Vivant Καλσόν Ελαστικό Μαύρο 40D Large,4.20
2025-06-12,620003,BIC Καλσόν Μη Ελαστικό Καραμελέ 20D (1-3),1.69
2025-06-12,620053,BIC Mibas Καλτσάκι 3/4 15D Μαύρο,3.21
2025-06-12,720527,Carroten Αντηλιακό Λάδι Σώματος Spray Summer Dreams SPF0 200ml,7.48
2025-06-12,710891,B.U. Trendy Κολώνια 50ml,11.21
2025-06-12,705498,L'OREAL Excellence Cream No 9.1 Ξανθό Πολύ Ανοιχτό Σαντρέ 48ml,6.42
2025-06-12,620017,BIC Silhouette Καλσόν Ελαστικό Μαύρο 15D Small,5.62
2025-06-12,620008,BIC Καλσόν Μη Ελαστικό Πέπερ 20D (4),1.69
2025-06-12,620011,BIC Καλσόν Μη Ελαστικό Καραμελέ 20D (4),1.69
2025-06-12,714093,Septona Dermasoft Κρεμοσάπουνο Cotton & Milk 750ml,1.63
2025-06-12,712097,Sensodyne Οδοντόκρεμα Clinical White 75ml,4.50
2025-06-12,713042,Palmolive Almond Milk Σαπούνι 4x90gr,2.58
2025-06-12,715126,Karavaki Papoutsanis Men 3in1 Volcanic Energy Με ενεργό Άνθρακα 550ml,4.49
2025-06-12,715125,Karavaki Men 3in1 Ocean Force Αναζωογονητικός Καθαρισμός 550ml,4.49
2025-06-12,702869,Elvive Όρος Growth Booster 102ml,10.24
2025-06-12,702868,Elvive Conditioner Growth Booster Κατά της Τριχόπτωσης 150ml,6.05
2025-06-12,755069,Noxzema Men Αφρόλουτρο Fresh Intense 750ml,3.06
2025-06-12,720254,Nivea Sun Κρέμα Προσώπου Invisible Daily Fluid SPF 50+ 40ml,9.30
