2025-08-01,232050,ΑΓΡΟΤΥΠ Φασόλια Μέτρια 500gr,1.58
2025-08-01,207954,Brava Μουστάρδα Απαλή Βαρελάκι 500gr,2.63
2025-08-01,225919,Paliria Φάβα Με Κρεμμύδια & Χυμό Λεμόνι 280gr,2.55
2025-08-01,651944,Άλτις Πάστα Ελιάς Παραδοσιακή 135gr,2.13
2025-08-01,330632,My Gusto Καρυδόψιχα Ωμή Δοχείο 150gr,4.09
2025-08-01,231002,Ben's Original Ρύζι Κινέζικο Σε 2' Λεπτά 220gr,1.72
2025-08-01,217107,My Kouzina Γαρίφαλο Ολόκληρο Φάκελος 15gr,0.77
2025-08-01,232854,Άροσις Βιολογικά Ρεβύθια Γρεβενών 500gr,3.32
2025-08-01,235006,Ben's Original Σάλτσα Γλυκόξινη 450gr,2.29
2025-08-01,202105,My Kouzina Ξίδι Κόκκινο Σε Πλαστική Φιάλη 1lt,0.86
2025-08-01,337706,ΙΟΝ Κουβερτούρα Γάλακτος 125gr,2.80
2025-08-01,330829,Karagiannis Πεκαν Καρύδια Εκτός ΕΕ 100gr,3.50
2025-08-01,275450,Canderel Γλυκαντικό σε δισκία 120τεμ,3.39
2025-08-01,208074,Kyknos Σάλτσα Barbeque 560gr,3.07
2025-08-01,217946,Συνεργασία Ρίγανη Σε Σακουλάκι 100gr,2.36
2025-08-01,280668,Oriental Express Νούντλς Πάπια Πεκίνου 87gr,0.99
2025-08-01,204715,Royal Αγγουράκι Ψιλό Εισαγωγής 350gr,2.90
2025-08-01,232007,3αλφα Φασόλια Μαυρομάτικα 500gr,2.91
2025-08-01,231038,Ήλιος Κριθαράκι Λαχανικών 500gr,1.40
2025-08-01,217699,My Kouzina Μαχλέπι Σε Φάκελο 8gr,0.79
2025-08-01,651428,Ανδρίτσαινα Τραχανάς Ξυνός 500gr,1.90
2025-08-01,225122,Zanae Γίγαντες Γιαχνί 280gr,1.70
2025-08-01,236520,Μύλοι Αγ. Γεωργίου Αλεύρι Ζυμωτό 1kg,1.89
2025-08-01,243101,Φλώρα Καλαμποκέλαιο 1lt,4.84
2025-08-01,240141,Άλτις Παραδοσιακό Εξαιρετικό Παρθένο Ελαιόλαδο 1lt,13.05
2025-08-01,217207,ΑΝΑΤΟΛΗ Θυμάρι Γυάλινο 65gr,2.08
2025-08-01,317988,My Kouzina Αμμωνία Σε Φάκελο 30gr,0.23
2025-08-01,232853,Άροσις Φακές Ψιλές Γρεβενών Βιολογικές 500gr,3.70
2025-08-01,317306,Αλλατίνη Ξηρή Μαγιά 3x27gr,0.98
2025-08-01,234084,Misko Σπαγγέτι Πρωτεΐνης 400gr,1.79
2025-08-01,230022,3αλφα Ρύζι Jasmine 500gr,2.67
2025-08-01,222728,Geisha Σαρδέλες Σε Ηλιέλαιο 125gr Στρ.Βάρος 88gr,1.69
2025-08-01,234738,Misko Αστράκι 500gr,1.02
2025-08-01,230001,3αλφα Ρύζι Γλασσέ 500gr,1.92
2025-08-01,243000,Nutria Αραβοσιτέλαιο 1lt,2.95
2025-08-01,225936,Paliria Γίγαντες Γιαχνί Σε Σάλτσα Κρεμμυδιού & Ντομάτας 200gr,2.62
2025-08-01,233752,Misko Τορτελίνι Με Τυρί 250gr,2.09
2025-08-01,236751,Akis Trofino Καλαμποκάλευρο 500gr,1.10
2025-08-01,208186,Condito Caesar's Dressing Χωρίς Γλουτένη 330gr,2.88
2025-08-01,110175,Condito Mayo Vegan Sauce Με Απαλή Μουστάρδα Χωρίς Γλουτένη 280gr,2.44
2025-08-01,233327,Melissa Σπαγγέτι Με Σπανάκι 400gr,1.31
2025-08-01,217884,Ήλιος Δάφνη Φάκελος 20gr,1.97
2025-08-01,280624,Oriental Express Noodles Ρυζιού Πλατιά Χωρίς Γλουτένη 225gr,3.08
2025-08-01,650103,Μύλοι Αγίου Γεωργίου Αλέυρι Καλάμποκιού 500gr,1.10
2025-08-01,669560,Κάλας Αλάτι Χρυσό 500gr,2.35
2025-08-01,331762,El Sabor Nacho Chips Natural 225gr,1.68
2025-08-01,221941,Dakor Corned Beef 198gr,4.32
2025-08-01,314351,Γιώτης Τρούφα Σοκολάτα Ζαχαροπλαστικής 100gr,2.26
2025-08-01,210103,Knorr Asia Noodles Cup Κοτόπουλο 65gr,1.89
2025-08-01,230741,Uncle Ben's Original Ρύζι Basmati Ινδίας-Πακιστάν 500gr,2.74
2025-08-01,112311,Ήλιδα Ελιές Θρούμπες Θάσου Φάκελος 200gr,2.82
2025-08-01,233694,Misko Μισκοτίνη Νο10 500gr,1.07
2025-08-01,240065,Medolio Εξαιρετικό Παρθένο Ελαιόλαδο Καλαμάτας Π.Ο.Π 1lt,7.40
2025-08-01,204751,Gaea Ελιές Καλαμών Χωρίς Κουκούτσι Σακουλάκι 150gr,2.84
2025-08-01,234301,Misko Mακαρούνια Χρυσή Σειρά 500gr,1.10
2025-08-01,234031,Barilla Ζυμαρικά Bucatini No9 500gr,1.74
2025-08-01,230028,Agrino Quick Deli Λευκή & Κόκκινη Κινόα 250gr,2.40
2025-08-01,211007,Knorr Ζωμός Βοδινού 24 κύβοι,3.95
2025-08-01,275122,Natreen Γλυκαντικό Βάζο 70gr,4.56
2025-08-01,236602,Μάννα Αλεύρι Χρυσό για Τσουρέκι 1kg,1.83
2025-08-01,240001,Μινέρβα Χωριό Έξτρα Παρθένο Κορωνέικο 1lt,8.10
2025-08-01,222983,Trata Σαρδέλλες Τομάτας 100gr,1.99
2025-08-01,202737,Papadimitriou Kalamata Κρέμα Balsamico 500ml,4.45
2025-08-01,227015,Kyknos Κέτσαπ Hot Πλαστική Φιάλη Top Down 560gr,2.60
2025-08-01,241269,Έπος Παρθένο Ελαιόλαδο 1lt,7.10
2025-08-01,280705,Cardinal Γάλα Καρύδας 400ml,2.05
2025-08-01,208112,Heinz Soja Sauce 150ml,2.95
2025-08-01,222888,Flokos Καλαμάρι Σε Άλμη 370gr (ΣΤΡ.ΒΑΡΟΣ 225gr),4.64
2025-08-01,234703,Misko Μακαρόνι Τρυπητό Νο 3 500gr,1.02
2025-08-01,206075,Bonduelle Μανιτάρια Τεμαχισμένα 200gr,1.99
2025-08-01,280617,Oriental Express Noodls Multi Pack 375gr,3.39
2025-08-01,235161,Hellmann's Σάλτσα BBQ Original 430ml,3.74
2025-08-01,211108,Knorr Κύβοι Λαχανικών Με Λιγότερο Αλάτι 6lt,2.69
2025-08-01,211055,Knorr Asia Chips Γαρίδας Κλασικάς 73gr,2.56
2025-08-01,210087,Knorr Pasta Snack Pot Mac & Cheese 62gr,1.89
2025-08-01,234653,Melissa Πέννες Ριγέ Πρωτεΐνης 400gr,1.82
2025-08-01,208457,Hellmann's Σάλτσα Barbeque Μέλι 250ml,3.08
2025-08-01,230751,Uncle Ben's Original Ρύζι Parboiled 10 Λεπτά Ισπανίας 1kg,3.82
2025-08-01,230403,Agrino Ρύζι Φίνο Nυχάκι Ελλάδος 500gr,2.15
2025-08-01,330562,Sunsweet Δαμάσκηνα Αποξηραμένα Απύρηνα 500gr,9.10
2025-08-01,206926,Kyknos Αρακάς Ψιλός 400gr,2.11
2025-08-01,208170,Hellmann's Caesar Dressing 6/250ml,2.71
2025-08-01,330776,Biovita Χουρμάδες Απύρηνοι Bio 150gr,2.12
2025-08-01,235039,Barilla Σάλτσα Pesto Genovese 90g,2.69
2025-08-01,217729,Health Trade Κουρκουμάς Σκόνη Bio 100gr,1.99
2025-08-01,207254,Maille Μουστάρδα Dijon 215gr,3.27
2025-08-01,330637,Συνεργασία Σουλτανίνα Σταφίδα 200gr,1.83
2025-08-01,242092,Best Price Πυρηνέλαιο 2lt,9.70
2025-08-01,271631,Ωμέγα Νισεστές 425gr,1.60
2025-08-01,201029,Special Foods Αλάτι Μεσολογγίου Χονδρό Economy Pack 650gr,1.05
2025-08-01,235081,Σάλτσα Pesto Alla Genovese De Cecco 190gr,3.49
2025-08-01,275016,Deligios Γλυκαντικό Stevia Σε Σκόνη 300gr,6.90
2025-08-01,243705,My Kouzina Αραβοσιτέλαιο 5lt,10.99
2025-08-01,226809,Pummaro Σπιτική Τομάτα 3x250gr,2.07
2025-08-01,240080,Terra Creta Π.Γ.Ε Χανιά Κρήτης Μεταλλικό Δοχείο 3lt,21.90
2025-08-01,330728,Snack Break Παπάγια Αποξηραμένη Εκτός Ε.Ε. 180gr,2.34
2025-08-01,242010,Κόρη Πυρηνέλαιο 1lt,4.45
2025-08-01,243102,Φλώρα Καλαμποκέλαιο 2lt,9.41
2025-08-01,234091,Melissa Στριφτό Με Παντζάρι 400gr,1.31
2025-08-01,330795,Όλα Bio Organic Καρύδι Βραζιλίας 100gr,2.97
2025-08-01,222011,Flokos Σκουμπρι Φιλέτο Καπνιστό 150gr,4.04
2025-08-01,236076,Caputo Αλεύρι Pizzeria 1kg,2.47
2025-08-01,330861,Ola Bio Σπόροι Chia Βιο 350gr,3.70
2025-08-01,213008,Mousline Πουρές Πατάτας Με Γάλα 125gr,1.10
2025-08-01,280749,Nissin Soba Noodles Teriyaki 110gr,1.55
2025-08-01,280748,Nissin Soba Noodles Κοτόπουλο Yakitori 110gr,1.55
2025-08-01,235116,Kyknos Κέτσαπ Πλαστική Φιάλη Χωρίς Ζάχαρη 550gr,3.28
2025-08-01,317010,Γιώτης Μαγιά Στιγμής Άνθος 21gr (3x7gr),0.81
2025-08-01,233172,Πέλλα Γη Χυλοπιτάκι 500gr,1.73
2025-08-01,275110,Γιώτης Sweet & Balance Γλυκαντικό Stevia 100 Δίσκια,2.70
2025-08-01,233037,Melissa Ρυζάκι 500gr,1.09
2025-08-01,337432,Γιώτης Κουβερτούρα Σε Νιφάδες 100gr,2.25
2025-08-01,233706,Misko Κανελλόνια Σε Κουτί 250gr,1.25
2025-08-01,217724,Υάδες Κανέλα Κευλάνης Τριμμένη ΒΙΟ 30gr,1.88
2025-08-01,330644,My Gusto Πίνατς Ψημένο Αλατισμένο Δοχείο 230gr,1.67
2025-08-01,230427,Agrino Ρύζι Basmati 10' Σακουλάκι 500gr,3.56
2025-08-01,230002,3αλφα Ρύζι Νυχάκι 500gr,2.01
2025-08-01,202149,Tο Μετοχι Ξίδι 7 Βαθμοί Πλαστική Φιάλη 3x340gr,1.88
2025-08-01,235160,Kyknos Σάλτσα Πίτσας BBQ 210gr,1.09
2025-08-01,226314,Pummaro Τομάτες Ψιλοκομμένες 370gr,0.98
2025-08-01,207470,My Gusto Μουστάρδα Απαλή 250gr,0.60
2025-08-01,110013,Kraft Μαγιονέζα 185ml,1.62
2025-08-01,315041,Γιώτης Sweet & Balance Ζελέ Φράουλα 20gr,1.97
2025-08-01,280608,Blue Dragon Σως Σόγιας 150ml,1.48
2025-08-01,234302,Misko Σπαγγετίνη Χρυσή Σειρά Νο 10 500gr,1.10
2025-08-01,235215,Knorr Σάλτσα Καρμπονάρα Οικογενειακή Συσκευασία 88gr,3.58
2025-08-01,659428,Ήλιος Κανέλλα Ξύλο Φάκελλο 50gr,2.30
2025-08-01,234556,Misko Τριβελάκι Ολικής Άλεσης 500gr,1.20
2025-08-01,232401,Agrino Φακές Ψιλές Του Κόσμου 500gr,2.25
2025-08-01,240101,Χρυσελιά Εξαιρετικό Παρθένο Ελαιόλαδο 3lt,22.50
2025-08-01,233102,Mέλισσα Χρυσή Επιλογή Σπαγγετίνι Νο 10 500gr,1.02
2025-08-01,226710,Ομοσπονδία Τοματοπολτός 28-30% 70gr,0.59
2025-08-01,230026,Agrino Quick Deli Basmati 250g,2.20
2025-08-01,202140,Vivi Verde Μηλόξιδο Biologico 500ml,2.54
2025-08-01,225434,Ο Μπαξές Φασόλια Γίγαντες Γιαχνί 280gr,1.86
2025-08-01,222187,Rio Mare Φιλέτο Σκουμπρί Με Ελαιόλαδο 120gr,3.58
2025-08-01,206105,Xenia Καλαμπόκι Γλυκό Κονσέρβα 340gr,1.97
2025-08-01,222035,Flokos Τόνος Σε Ηλιέλαιο 160gr,2.35
2025-08-01,280755,Oriental Express Noodles Μοσχαράκι Με Πιπέρι 87gr,0.99
2025-08-01,226070,Vivi Verde Τομάτες Αποφλοιωμένες Biologico 400gr,1.99
2025-08-01,207023,Kalamata Papadimitriou Μουστάρδα Πικάντικη Squeeze 300gr,2.47
2025-08-01,234304,Misko Ματσάτα Χρυσή Σειρά 500gr,1.20
2025-08-01,271176,Οlia Bio Σνακ Kαλαμποκιού Βιολογικά 50gr,1.26
2025-08-01,210015,Knorr Pasta Snack Pot Creamy Pesto 68gr,1.89
2025-08-01,110839,My Gusto Μαγιονέζα 235gr,1.68
2025-08-01,241020,Μινέρβα Ελαιόλαδο Κλασσικό 4lt,24.80
2025-08-01,651367,Άροσις Ρεβίθια Μικρόσπερμα Γρεβενών 500gr,2.71
2025-08-01,240531,Xenia Εξαιρετικό Παρθένο Ελαιόλαδο 1lt,7.80
2025-08-01,207409,Hellmann's Μουστάρδα Πικάντικη 500gr,3.53
2025-08-01,271427,Γιώτης Άνθος Αραβοσίτου Στιγμής Μπισκότο 70gr,0.99
2025-08-01,280193,Knorr Noodles Γεύσεις Teriyaki Κοτόπουλο 75gr,0.89
2025-08-01,230201,Family Farm Ρύζι Νυχάκι Μακεδονίας 500gr,1.70
2025-08-01,330653,My Gusto Αμύγδαλο Ωμό Ελληνικό 200gr,4.52
2025-08-01,330583,My Gusto Φιστίκι Κέλυφος Ψημένο Αλατισμένο Τιμή Κιλού,5.00
2025-08-01,230671,Αγροτυπ Ρύζι Γλασσέ 500gr,1.08
2025-08-01,201510,Special Foods Αλάτι Ιμαλαϊων 400gr,1.99
2025-08-01,234215,Χυλοπίτες Της Κυρά Γεωργίας 500gr,1.84
2025-08-01,330204,Super Berries Cranberries Χωρίς Ζάχαρη 180gr,2.94
2025-08-01,244002,Μινέρβα Ηλιέλαιο 2lt,5.35
2025-08-01,110035,Hellmann's Real Mayonnaise 250ml,2.22
2025-08-01,234142,Barilla Ταλιατέλες Με Αυγά Ν129 450gr,3.25
2025-08-01,204739,Gaea Λιαστές Τομάτες Σε Ηλιέλαιο Τιμή Κιλού,1.90
2025-08-01,312552,Γιώτης Μίγμα Παγωτού Καιμάκι 508gr,3.69
2025-08-01,275220,Γιώτης Sweet & Balance Γλυκαντικό Stevia Σκόνη 80gr,3.23
2025-08-01,236912,Melissa Σιμιγδάλι Χονδρό 500gr,0.92
2025-08-01,233385,Melissa Σπαγγέτι Χωρίς Γλουτένη 400gr,2.45
2025-08-01,330627,My Gusto Αμύγδαλο Ψημένο Ανάλατο Δοχείο 200gr,5.59
2025-08-01,226011,Kyknos Χυμός Τομάτας 390ml,1.10
2025-08-01,110028,Kyknos Μαγιονέζα Light Γυάλινο Βάζο 420ml,3.01
2025-08-01,202006,Kalamata Papadimitriou Κρέμα Balsamico Σύκο 250ml,3.29
2025-08-01,109278,Τρυφωνίδης Αντζούγιες Φιλέτο FAO37 Easy Open 50gr,1.95
2025-08-01,337458,Γιώτης Κουβερτούρα Λευκή 125gr,2.83
2025-08-01,280602,Oriental Express Κρέμα Καρύδας 400ml,2.78
2025-08-01,221971,Dakor Χοιρινό Κρέας 200gr,4.02
2025-08-01,235168,Misko Σάλτσα Βασιλικός & Κρασί 500gr,3.22
2025-08-01,230040,Ben's Original Ρύζι Jasmine 500gr,2.14
2025-08-01,206068,Bonduelle Ρεβύθια 80gr 2τεμ,2.28
2025-08-01,110838,My Gusto Μαγιονέζα 940gr,5.14
2025-08-01,232112,Ωμέγα Special Ρεβίθια Χονδρά 500gr,2.39
2025-08-01,204007,Εδέμ Αγγουράκι Άνθος 105gr,1.60
2025-08-01,235514,Barilla Σάλτσα Napoletana 200gr,2.07
2025-08-01,222072,Kallimanis Tόνος Καπνιστός 2x140gr,4.19
2025-08-01,207049,Condito Μουστάρδα Χωρίς Ζάχαρη & 65% Λιγότερο Αλάτι 500gr,3.22
2025-08-01,233104,Mέλισσα Χρυσή Επιλογή Πέννες Ριγέ 500gr,1.17
2025-08-01,280629,Old El Paso Tortillas Σίτου 8τεμ 326gr,2.77
2025-08-01,227914,"17" Κέτσαπ 250gr,1.44
2025-08-01,228151,Αγρόκηπος Ροδάκινο Ποτήρι 400gr,3.99
2025-08-01,232047,"3" Άλφα Φακές Ψιλές Έτοιμα Φυσικά 180gr,2.56
2025-08-01,208326,Hellmann's Σάλτσα Avocado 250ml,2.99
2025-08-01,222257,Trata Τόνος Καπνιστός Με Ρίγανη & Λεμόνι 160gr,2.79
2025-08-01,226254,Biofarma Βιολογικός Τοματοπολτός 360gr,3.01
2025-08-01,222122,Alelma Τόνος Αλονήσσου Σε Ελαιόλαδο 212gr,7.30
2025-08-01,234150,Barilla Ζυμαρικά Spaghetti Χωρίς Γλουτένη 400gr,3.54
2025-08-01,314000,Γιώτης Τρούφα Σοκολάτα Γάλακτος Ζαχαροπλαστικής 100gr,2.26
2025-08-01,330663,My Gusto Αμύγδαλο Φιλέ Ωμό Εισαγωγής 110gr,2.80
2025-08-01,217906,My Kouzina Μπαχάρι Τριμμένο 35gr,2.31
2025-08-01,221102,Zwan Luncheon Meat 340gr,4.99
2025-08-01,203407,Best Price Lemon Dressing 330ml,0.34
2025-08-01,234147,Barilla Ζυμαρικά Casarecce 500gr,2.25
2025-08-01,234350,Misko Σπαγγέτι Νο 6 1kg,1.43
2025-08-01,280188,Maggi Asia Γλυκόξυνη Σάλτσα 355gr,3.48
2025-08-01,244705,My Kouzina Ηλιέλαιο 5lt,9.65
2025-08-01,233836,Ανδρίτσαινα Χυλοπίτες Χωριάτικες 500gr,1.90
2025-08-01,232036,3αλφα Ρεβύθια Χονδρά Ελληνικά 500gr,3.54
2025-08-01,313101,Γιώτης Ζελατίνη Σε Φύλλα 10gr,1.33
2025-08-01,228002,Delmonte Κομπόστα Ανανάς Σε Σιρόπι 570gr,3.67
2025-08-01,234181,Barilla Ζυμαρικά Pennette Rigate Integrale 500gr,1.93
2025-08-01,227294,Heinz Bio Κέτσαπ Top Down 580gr,3.37
2025-08-01,235162,Kyknos Σάλτσα Τομάτας Για Πίτσα Πικάντικη 195gr,1.09
2025-08-01,227036,Hellmann's Κετσαπ Στέβια 520gr,4.70
2025-08-01,280095,Maggi Magic Asia Noodles Duck Cup 63gr,1.59
2025-08-01,330656,My Gusto Ηλιόσπορος Ανάλατος Από Όλον Τον Κόσμο 110gr,0.66
2025-08-01,225436,Ο Μπαξές Φασόλια Μέτρια Γιαχνί 280gr,1.45
2025-08-01,228101,Ο Μπαξές Κομπόστα Ανανάς Σε Φέτες 565gr (Στραγ. Βάρος 340gr),2.86
2025-08-01,234421,De Cecco Spaghetti No 12 500gr,2.65
2025-08-01,211009,Knorr Ζωμός Λαχανικών 6 κύβοι 3lt,1.44
2025-08-01,230029,Agrino Quick Deli Ταμπουλέ & Κινόα 250gr,2.40
2025-08-01,235038,Cook At Home Σάλτσα Κοτόπουλο Λεμονάτο Φούρνου 265gr,3.12
2025-08-01,217927,My kouzina Μοσχοκάρυδο Τριμμένο 40g,2.31
2025-08-01,330717,Εύπορη Γη Κράνμπερι Αποξηραμένο Εκτός Ε.Ε. Φάκελος 250gr,2.44
2025-08-01,217895,Ήλιος Πάπρικα Καπνιστή Γυάλινο 35gr,2.50
2025-08-01,234423,De Cecco Linguine 500gr,2.65
2025-08-01,217214,ΑΝΑΤΟΛΗ Μιξ Για Κοτόπουλα Μεταλλικό 55gr,2.03
2025-08-01,660948,Biovita Κάσιους Εισαγωγής 150gr,3.96
2025-08-01,230411,Agrino Ρύζι Σουπέ Γλασσέ Για Σούπες Και Γλυκά Ελλάδος 1kg,3.85
2025-08-01,112312,Ήλιδα Ελιές Καλαμών Φάκελος 250gr,2.98
2025-08-01,235503,Barilla Σάλτσα Bolognese 400gr,3.63
2025-08-01,233176,Πέλλα Γη Κους Κους 500g,1.89
2025-08-01,211023,Knorr Asia Noodles Αυγού 250gr,3.45
2025-08-01,225853,Paliria On Your Side Φακές 200gr,3.20
2025-08-01,222104,Rio Mare Intalatissime Φακές Με Καρότα Ντοματίνια 160gr,3.32
2025-08-01,233053,Melissa Αστράκι 500gr,1.07
2025-08-01,271425,Γιώτης Άνθος Αραβοσίτου Φράουλα Στιγμής 62gr,1.05
2025-08-01,221061,Tulip Luncheon Meat 200gr,2.90
2025-08-01,217155,Υάδες Κανέλα Κεϋλάνης Bio Σε Βάζο 40gr,2.13
2025-08-01,240076,Terra Creta Εξαιρετικό Παρθένο Ελαιόλαδο 1lt,8.90
2025-08-01,222089,Rio Mare Insalatissime Sicily 160gr,3.32
2025-08-01,110030,Kyknos Μαγιονέζα Vegan Γυάλινο Βάζο 250ml,2.55
2025-08-01,275024,Ζωγράφος Σιρόπι Αγαύης Βιολογικό 350gr,4.58
2025-08-01,330612,Εύπορη Γη Χουρμάδες Απύρηνοι Αποξηραμένοι Εκτός Ε.Ε. Φάκελος 250gr,1.46
2025-08-01,275210,Ζωγράφος Slim Line Stevia Δισκία 100τεμ 5-5gr,3.07
2025-08-01,236028,Schar Μείγμα Αλεύρων Για Ψωμί Χωρίς Γλουτένη 1kg,5.33
2025-08-01,315042,Γιώτης Sweet & Balance Ζελέ Κεράσι 20gr,1.97
2025-08-01,211097,Knorr Βιολογικός Ζωμός Κότας 6 κύβοι,1.77
2025-08-01,275213,Ζωγράφος Γλυκαντική Σκόνη Slim Line 90gr,3.61
2025-08-01,244303,Sanola Ηλιέλαιο 2lt,3.85
2025-08-01,227001,Kyknos Κέτσαπ 330gr,2.50
2025-08-01,275048,Canderel Γλυκαντικό Ταμπλέτες 300τεμ,6.98
2025-08-01,233123,Μελίσσα Χρυσή Επιλογή Λαζάνια 500gr,2.33
2025-08-01,217892,Ήλιος Κάρυ Γυάλινο 30gr,1.82
2025-08-01,233487,Melissa Κριθαράκι Μέτριο Βιολογικό 500gr,1.73
2025-08-01,208014,"17" French Dressing 250gr,2.08
2025-08-01,230056,3αλφα Ρύζι Άγριο Parboiled 500gr,3.27
2025-08-01,206919,Εδέμ Καλαμπόκι Γλυκό Οικογενειακή Συσκευασία 3x170gr,3.88
2025-08-01,232054,Olo Bio Φακές Ψιλές Ελληνικές Bio 500gr,2.95
2025-08-01,234085,Misko Πέννες Ριγέ Πρωτεΐνης 400gr,1.79
2025-08-01,235129,Cook At Home Σάλτσα Για Κοτόπουλο Αλα Κρεμ 260gr,3.45
2025-08-01,275026,Slim Fix Γλυκαντικό Υγρό Με Stevia 500ml,10.57
2025-08-01,222105,Rio Mare Isalatissime Kinoa Με Ρεβύθια Φασολια Καρότα 160gr,3.32
2025-08-01,280040,Oriental Express Panko Φρυγανιά Παναρίσματος 200gr,2.64
2025-08-01,207039,Brava Μουστάρδα Πικαντική 430gr,2.51
2025-08-01,207032,Kalamata Μουστάρδα Απαλή Squeeze 520gr,3.73
2025-08-01,330597,Snack Break Μπανάνα Τσιπς Αποξηραμένη Εκτός Ε.Ε. 120gr,1.23
2025-08-01,330714,My Gusto Mix Ξηρών Καρπών Καλαμπόκι Εισαγωγής 200gr,1.92
2025-08-01,241102,Άλτις Κλασικό Ελαιόλαδο 2lt,23.50
2025-08-01,202558,My Gusto Ξίδι Βαλσάμικο Λευκό 500ml,2.46
2025-08-01,280713,Cardinal Sweet Chili Sauce Squeeze 555gr,4.37
2025-08-01,112009,Xenia Ελιές Πράσινες Σε Φέτες 355gr,2.12
2025-08-01,280106,El Sabor Mild Cheese Dip 300gr,2.26
2025-08-01,230673,Αγροτύπ Ρύζι Basmati 500gr,1.45
2025-08-01,234717,Misko Τριβελάκι Τρικολόρε 500gr,1.81
2025-08-01,204039,Εδέμ Αγγουράκι Μέτριο 355gr,2.93
2025-08-01,202130,ΠΑΝ Βαλσαμικό Ξίδι Με Μέλι 250ml,3.31
2025-08-01,232114,Ωμέγα Special Φασόλια Γίγαντες Εγχώρια 500gr,4.58
2025-08-01,280124,Santa Maria Fajita Spice Mix 28gr,1.28
2025-08-01,230712,Uncle Ben's Original Ρύζι Καστανό Ισπανίας Parboiled 500gr,2.30
2025-08-01,232406,Agrino Φασόλια Γίγαντες Καστοριάς 500gr,5.87
2025-08-01,225025,Bonduelle Ρεβύθια Σε Άλμη 310gr Στραγγιστό Βάρος 265gr,2.30
2025-08-01,222991,Trata Τόνος Με Φασόλια & Σπανάκι 140gr,2.13
2025-08-01,235147,Από Το Περιβόλι Του Παππού Σάλτσα Τομάτας Με Βασιλικό 300gr,2.23
2025-08-01,330790,My Gusto Κρόκερ Εισαγωγής 250gr,1.92
2025-08-01,330815,Karagiannis Μίγμα Ξηρών Καρπών Για Γιαούρτι Εκτός ΕΕ 100gr,1.84
2025-08-01,225852,Paliria On Your Side Ρεβύθια 200gr,3.20
2025-08-01,227032,My Gusto Κέτσαπ Πλαστική Φιάλη 490gr,2.10
2025-08-01,217737,Εκλεκτές Γεύσεις Άνθος Ρίγανη Μάνη 40gr,2.53
2025-08-01,207035,Kyknos Μουστάρδα Με Μέλι Πλαστική Φυάλη 250gr,2.16
2025-08-01,234048,Misko Σπαγγέτι Χωρίς Γλουτένη 400gr,2.15
2025-08-01,210060,Knorr Πουρές Snack Pot Μπέικον Κρεμμύδι 51gr,1.89
2025-08-01,232564,Biodynamic Φακές Κόκκινες Βιο 500gr,3.26
2025-08-01,234613,ΜΑΚΒΕΛ Παστίτσιο Νο2 500gr,1.23
2025-08-01,235047,Ben's Original Σάλτσα Γλυκόξινη Χωρίς Ζάχαρη 440gr,2.29
2025-08-01,335103,Bonomi Σαβαγιάρ 200gr,2.52
2025-08-01,233485,Melissa Σπαγγέτι Βιολογικό 500gr,1.73
2025-08-01,312549,Γιώτης Μίγμα Παγωτού Cookies & Cream 497gr,3.97
2025-08-01,232407,Agrino Φασόλια Μαυρομάτικα 500gr,2.69
2025-08-01,210038,Knorr Snack Pot 4 τυριά 66gr,1.89
2025-08-01,275059,Canderel Υγρό Γλυκαντικό Stevia 200ml,3.99
2025-08-01,236103,Αλλατίνη Φαρίνα 500gr Οικογενειακή Συσκευασίσ 3τεμ,2.68
2025-08-01,275047,Canderel Stevia Σε Ταμπλέτες 120τεμ 10.20gr,4.35
2025-08-01,110047,Heinz Mayomust 400ml,4.09
2025-08-01,227009,Hellmann's Κέτσαπ Top Down 273gr,1.80
2025-08-01,330525,My Gusto Κάσιους Ψημένο Αλατισμένο Τιμή Κιλού,5.22
2025-08-01,208013,Tabasco Σάλτσα Κόκκινης Πιπεριάς 60ml,3.38
2025-08-01,651946,Άλτις Ελιές Γεμιστές Με Πιπεριά 510gr,4.75
2025-08-01,651404,Geisha Τόνος Σε Ηλιέλαιο 2Χ160gr (Στρ.Βαρ 210gr),6.34
2025-08-01,317152,Vahine Φυσικό Εκχύλισμα Βανίλιας 20ml,4.65
2025-08-01,330964,Σταφίδα Ξανθιά Σουλτανίνα Σαιγιίου 200gr,2.64
2025-08-01,235169,Misko Σάλτσα Πιπεριές & Ελιές 500gr,3.22
2025-08-01,211076,Knorr Κύβοι Κοτόπουλο Με Λιγότερο Αλάτι 6lt,2.69
2025-08-01,222000,Πυροφάνι Φιλέτα Σκουμπρί Με Σάλτσα Τομάτας 170gr,2.16
2025-08-01,232000,"3" Άλφα Ρεβύθια Έτοιμα Φυσικά Χοντρά 180gr,2.99
2025-08-01,330843,Almanda Κάσιους Ωμό Σε Πλαστικό Δοχείο 250gr,5.31
2025-08-01,112001,Xenia Ελιές Καλαμών Βάζο 360gr,3.82
2025-08-01,222123,Alelma Πάστα Τόνου Αλονήσσου 212gr,4.03
2025-08-01,201016,Κάλας Αλάτι Πλαστική Φιάλη 750gr,2.44
2025-08-01,208169,Hellamann's Thousand Island Dressing 250ml,2.87
2025-08-01,232120,Family Farm Φασόλια Μέτρια Λαμίας 500gr,3.33
2025-08-01,330075,My Gusto Picanto Κίνας Τιμή Κιλού,2.36
2025-08-01,273330,Evergreen Bran Sticks Bio Χωρίς Ζάχαρη 250gr,2.14
2025-08-01,217208,ΑΝΑΤΟΛΗ Mix 4 Πιπεριών Φάκελος 40gr,2.31
2025-08-01,271698,My Kouzina Κρέμα Αραβοσίτου Βανίλια 150gr,0.96
2025-08-01,233170,Πέλλα Γη Χυλοπίτες 500gr,1.79
2025-08-01,228015,Delmonte Κομπόστα Φρουτοσαλάτα 420gr,2.24
2025-08-01,315001,Γιώτης Κρέμα Καραμελέ 112gr,1.44
2025-08-01,233708,Misko Φιδές Χονδρός 500gr,1.61
2025-08-01,112310,Ήλιδα Ελιές Άμφισσας Φάκελος 250gr,2.29
