2024-08-12,27588,Trata Σαρδέλα Καπνιστή Σε Φυτικό Λάδι 100 gr,2.18
2024-08-12,43237,Trata Σαρδέλες Σε Ελαιόλαδο 100 gr,2.22
2024-08-12,6399,Trata Σαρδέλες Σε Σάλτσα Τομάτας 100 gr,2.1
2024-08-12,37063,Trata Γαύρος Ριγανάτος 100 gr,2.1
2024-08-12,198799,Trata Ρέγγα Φιλέτο Καπνιστή 150 gr,3.08
2024-08-12,153154,Rio Mare Φιλέτο Σκουμπρί Στην Σχάρα Με Ελαιόλαδο 120 gr,3.98
2024-08-12,153155,Rio Mare Φιλέτο Σκουμπρί Στην Σχάρα Natural 120 gr,3.98
2024-08-12,6435,Geisha Σκουμπρί Σε Σάλτσα Τομάτας 155 gr,1.65
2024-08-12,133854,Safcol Σκουμπρί Σε Σάλτσα Τομάτας 155 gr,1.65
2024-08-12,194799,Flokos Σκουμπρί Φιλέτο Καπνιστό 150 gr,3.76
2024-08-12,194800,Flokos Σκουμπρί Φιλέτο Σε Σάλτσα Τομάτας 150 gr,3.76
2024-08-12,165596,Portola Καλαμάρι Σε Φυσικό Χυμό 370 gr,4.98
2024-08-12,6502,Rio Mare Φιλέτο Σολομού Σε Λάδι 150 gr,7.88
2024-08-12,118210,Flokos Καλαμάρι Καλιφόρνιας Σε Άλμη 370 gr,4.75
2024-08-12,174489,Paliria Ντολμαδάκια Γιαλαντζί Vegan 200 gr ,2.98
2024-08-12,196812,Ελληνική Γη Σάλτσα Για Ζυμαρικά 370 gr,2.77
2024-08-12,174479,Paliria Γίγαντες Γιαχνί Vegan 200 gr,2.6
2024-08-12,168513,Paliria Φάβα Με Κρεμμύδια &amp; Χυμό Λεμονιού Vegan 280 gr,2.56
2024-08-12,6576,Ζαναέ Μπάμιες Ψιλές Σε Χυμό Τομάτας 800 gr,6.1
2024-08-12,6528,Ζαναέ Κεφτεδάκια 280 gr,3.35
2024-08-12,6365,Dakor Χοιρινό Κρέας 200 gr,3.7
2024-08-12,6374,Midland Χοιρινό Λάντσιον Μητ Δανίας 200 gr,2.02
2024-08-12,116970,Tulip Luncheon Meat Χοιρινό 200 gr,2.28
2024-08-12,39737,Tulip Luncheon Meat Κοτόπουλο 200 gr,2.24
2024-08-12,6389,Zwan Luncheon Meat 200 gr,3.48
2024-08-12,18753,Zwan Luncheon Meat 340 gr,5.06
2024-08-12,6361,Zwan Luncheon Meat Light 200 gr,3.73
2024-08-12,6388,Zwan Luncheon Meat Με Αρωματικά Χορταρικά 200 gr,3.73
2024-08-12,162371,Εδέμ Καλαμπόκι Γλυκό Vegan 340 gr,2.44
2024-08-12,162405,Εδέμ Καλαμπόκι Γλυκό Vegan 2 x 170 gr + 1 Δώρο,3.98
2024-08-12,28564,Xenia Καλαμπόκι Γλυκό 340 gr,2.05
2024-08-12,134183,Bio Farma Καλαμπόκι Γλυκό Βιολογικό 340 gr -20% Φθηνότερα,2.4
2024-08-12,122179,Bonduelle Αρακάς Πολύ Ψιλός 400 gr,2.62
2024-08-12,185940,Bonduelle Αρακάς Ψιλοκομμένος &amp; Καρότο 400 gr,2.93
2024-08-12,161998,Εδέμ Μανιτάρια Τεμαχισμένα Vegan 2 x 185 gr + 1 Δώρο,4.74
2024-08-12,132376,Limburg Μανιτάρια Κομμένα 230 gr,1.28
2024-08-12,132375,Limburg Μανιτάρια Ολόκληρα 230 gr,1.73
2024-08-12,142952,Bonduelle Μανιτάρια Κομμένα 200 gr,1.98
2024-08-12,122180,Bonduelle Μανιτάρια Κομμένα 400 gr,3.18
2024-08-12,64848,Bio Farma Μανιτάρια Βιολογικά Κομμένα 170 gr,3.48
2024-08-12,1969,Κύκνος Κομπόστα Ροδάκινο 825 gr,3.45
2024-08-12,1951,Del Monte Κομπόστα Ροδάκινο Μισό Σε Σιρόπι 825 gr,2.24
2024-08-12,1953,Del Monte Κομπόστα Ανανάς Σε Φέτες 840 gr,4.35
2024-08-12,1952,Del Monte Κομπόστα Ανανάς Σε Φέτες 570 gr,3.37
2024-08-12,165196,Maggi Magic Asia Pot Noodles Πάπια 63 gr,1.58
2024-08-12,179561,Maggi Noodles Με Γεύση Λαχανικών 59.2 gr,0.75
2024-08-12,117267,Maggi Noodles Με Γεύση Βοδινό 59.2 gr,0.75
2024-08-12,117268,Maggi Noodles Με Γεύση Κοτόπουλο 59.2 gr,0.75
2024-08-12,117269,Maggi Noodles Με Γεύση Μανιτάρι 59.2 gr,0.75
2024-08-12,165195,Maggi Magic Asia Pot Noodles Κοτόπουλο 63 gr,1.58
2024-08-12,179562,Maggi Magic Asia Pot Noodles Saucy Teriyaki 75 gr,1.8
2024-08-12,165197,Maggi Magic Asia Pot Noodles Κάρυ 63 gr,1.58
2024-08-12,191653,Maggi Fusian Oriental Noodles Κλασικά 121 gr,2.48
2024-08-12,105214,Oriental Express Noodles Ασιατικά Λαχανικά 3΄ Vegan 87 gr,0.98
2024-08-12,191347,Oriental Express Noodles Με Μοσχαράκι 3΄ Vegan 87 gr,0.98
2024-08-12,105213,Oriental Express Noodles Ψητή Γαρίδα 3΄ Vegan 87 gr,0.98
2024-08-12,105212,Oriental Express Noodles Με Πάπια Πεκίνου 3΄ Vegan 87 gr,0.98
2024-08-12,182819,Soba Noodles Cup Τεριγιάκι 90 gr,2.19
2024-08-12,182821,Soba Noodles Cup Κλασική Γεύση 90 gr,2.19
2024-08-12,190560,Soba Noodles Cup Τσίλι 92 gr,2.19
2024-08-12,133486,Oriental Express Noodles Vegan 5 x 75 gr,3.25
2024-08-12,134371,Oriental Express Noodles Αυγών 300 gr,2.48
2024-08-12,133232,Oriental Express Noodles Ρυζιού Πλατιά Vegan Χωρίς Γλουτένη 225 gr,2.9
2024-08-12,133231,Oriental Express Noodles Ρυζιού Stir Fry Vegan Χωρίς Γλουτένη 225 gr,2.9
2024-08-12,191966,Cardinal Oriental Style Noodles 4 x 50 gr,2.37
2024-08-12,102942,De Cecco Νιόκι Από Πατάτα 500 gr,2.19
2024-08-12,192197,Lee Kum Kee Σάλτσα Πάπια Πεκίνου 383 gr,4.68
2024-08-12,192195,Lee Kum Kee Σάλτσα Τσίλι &amp; Σκόρδο 368 gr,4.6
2024-08-12,158017,Tipiak Κινόα Πλιγούρι 250 gr,3.46
2024-08-12,85982,Tipiak Κους Κους 500 gr,2.76
2024-08-12,170958,Oriental Express Ασιατικά Λαχανικά Με Ανανά Vegan Χωρίς Γλουτένη 330 gr,2.25
2024-08-12,104416,Oriental Express Γάλα Καρύδας Vegan Χωρίς Γλουτένη 400 ml,2.28
2024-08-12,105209,Oriental Express Κρέμα Καρύδας Vegan Χωρίς Γλουτένη 400 ml,2.46
2024-08-12,194395,Go Tan Sriracha Hot Chilli Μαγιονέζα 215 ml,3.84
2024-08-12,152859,Land Krone Λάδι Καρύδας Ψυχρής Έκθλιψης Vegan Βιολογικό 200 gr,8.43
2024-08-12,123014,Biona Organic Λάδι Καρύδας Ψυχρής Έκθλιψης Βιολογικό Vegan 400 gr,14.66
2024-08-12,182817,Oriental Express Φρυγανιά Παναρίσματος Panko Vegan 200 gr,2.5
2024-08-12,182818,Oriental Express Tempura Batter Mix Vegan 150 gr,2.37
2024-08-12,182898,Oriental Express Ρύζι Για Σούσι Vegan 500 gr,3.38
2024-08-12,183386,Oriental Express Πολτός Wasabi 43 gr,2.49
2024-08-12,183253,Oriental Express Σούσι Τζίντζερ Vegan Χωρίς Γλουτένη 190 gr,3.6
2024-08-12,183389,Oriental Express Nori Για Σούσι 5 Φύλλα Χωρίς Γλουτένη Vegan 14 gr,2.08
2024-08-12,191346,Oriental Express Bamboo Chopsticks 8 Ζέυγη,1.88
2024-08-12,191345,Oriental Express Sushi Bamboo Mat 24 x 24 cm,1.68
2024-08-12,178317,Oriental Express Φύτρες Φασολιών Vegan Χωρίς Γλουτένη 330 gr,2.2
2024-08-12,58371,Maggi Κύβοι Ζωμού Λαχανικών 6 x 11 gr,1.15
2024-08-12,56285,Maggi Κύβοι Ζωμού Λαχανικών 12 x 11 gr,2.48
2024-08-12,198085,Maggi Κύβοι Ζωμού Λαχανικών Με Λιγότερο Αλάτι 80 gr,1.75
2024-08-12,3398,Knorr Κύβοι Ζωμού Λαχανικών 6 x 10 gr,1.3
2024-08-12,3403,Knorr Κύβοι Ζωμού Λαχανικών 12 x 10 gr,2.68
2024-08-12,6287,Maggi Νοστιμιά Λαχανικά &amp; Μπαχαρικά Σε Σκόνη 130 gr,2.52
2024-08-12,183388,Maggi Υγρός Ζωμός Βοδινού 160 gr,2.48
2024-08-12,3420,Maggi Κύβοι Ζωμού Κότας 6 x 11 gr,1.15
2024-08-12,3423,Maggi Κύβοι Ζωμού Κότας 12 x 11 gr,2.48
2024-08-12,144120,Maggi Κύβοι Ζωμού Κότας 16 x 11 gr,3.16
2024-08-12,198219,Maggi Ζωμός Κότας Με Λιγότερο Αλάτι 80 gr,1.75
2024-08-12,3397,Knorr Κύβοι Ζωμού Κότας 6 x 10 gr,1.3
2024-08-12,3401,Knorr Κύβοι Ζωμού Κότας 12 x 10 gr,2.68
2024-08-12,195070,Maggi Κύβοι Ζωμού Βοδινού 6 x 10 gr,1.05
2024-08-12,195069,Maggi Κύβοι Ζωμού Βοδινού 16 x 10 gr,2.88
2024-08-12,3399,Knorr Κύβοι Ζωμού Βοδινού 6 x 10 gr,1.3
2024-08-12,3402,Knorr Κύβοι Ζωμού Βοδινού 12 x 10 gr,2.68
2024-08-12,195068,Maggi Κύβοι Ζωμού Βοδινού 12 x 10 gr,2.26
2024-08-12,188382,Knorr Κύβοι Ζωμού Για Ζυμαρικά 12 x 10 gr,2.68
2024-08-12,3421,Maggi Κύβοι Ζωμού Για Ζυμαρικά 12 x 11 gr,2.4
2024-08-12,42688,Knorr Πουρές Πατάτας Με Γάλα 291 gr -0-50€,3.15
2024-08-12,3335,Knorr Πουρές Πατάτας Χωρίς Γλουτένη 250 gr -0-50€,2.85
2024-08-12,93454,Γιώτης Πουρές Πατάτας Διπλή Συσκευασία 2 x 125 gr,2.09
2024-08-12,189101,Γιώτης Πουρές Πατάτας Με Γλυκοπατάτα &amp; Καρότο Vegan 125 gr,2.6
2024-08-12,189102,Γιώτης Πουρές Πατάτας Με Μανιτάρι &amp; Τρούφα Vegan 125 gr,2.6
2024-08-12,183089,Knorr Σουπα Με Φιδέ &amp; Κοτόπουλο 69 gr,2.15
2024-08-12,182468,Knorr Βελουτέ Μανιταρόσουπα 85 gr,2.23
2024-08-12,183580,Knorr Βελουτέ Τοματόσουπα Με Μοτσαρέλα 96 gr,2.23
2024-08-12,183737,Knorr Quick Σούπα Λαχανικών 3 x 17 gr,2.02
2024-08-12,183008,Knorr Σούπα Με Ζυμαρικά ABC &amp; Λαχανικά Vegan 82 gr,2.15
2024-08-12,183387,Knorr Quick Σούπα Τομάτα 3 x 20 gr,2.02
2024-08-12,183185,Knorr Quick Σούπα Μανιταριών 3 x 15 gr,2.02
2024-08-12,184105,Knorr Quick Κοτόσουπα 3 x 17 gr,2.02
2024-08-12,197312,3Αλφα Έτοιμα Σπιτικά Σούπα Οσπρ&#039;ιων Με Ζυμαρικά Vegan 300 gr,3.15
2024-08-12,197311,3Αλφα Έτοιμα Σπιτικά Σούπα Οσπρίων Με Δημητριακά &amp; Λαχανικά Vegan 300 gr,3.15
2024-08-12,197310,3Αλφα Έτοιμα Σπιτικά Σούπα Μινεστρόνε Vegan Χωρίς Γλουτένη 300 gr,3.15
2024-08-12,2942,Fytro Κιμάς Από Σόγια Vegan 400 gr,3.06
2024-08-12,2943,Fytro Σόγια Κεμπάπ Vegan 400 gr,3.06
2024-08-12,6527,Ζαναέ Ντολμαδάκια Vegan 280 gr,3.02
2024-08-12,198491,Le Veneziane Νιόκι Από Πατάτα Vegan Χωρίς Γλουτένη 500 gr,4.1
2024-08-12,198715,Villa Grimelli Κρέμα Βαλσάμικου Modena IGP 250 ml,2.53
2024-08-12,199146,Nestle Dessert Κουβερτούρα Λευκή 170 gr,2.7
2024-08-12,177261,Ινάτι Κρασί Λευκό Ασκός 3 lt,11.16
2024-08-12,177260,Ινάτι Κρασί Ερυθρό Ασκός 3 lt,11.16
2024-08-12,106580,Boutari Syrah Κρασί Ερυθρό 750 ml,10.61
2024-08-12,136824,Boutari Cabernet Sauvignon Κρασί Ερυθρό 750 ml,10.61
2024-08-12,106579,Boutari Merlot Κρασί 750 ml,10.49
2024-08-12,173606,Άλφα Μπίρα Lager Φιάλη 12 x 250 ml,6.95
2024-08-12,812,Famous Grouse Ουίσκι 700 ml,16.95
2024-08-12,127443,Grey Goose Βότκα 700 ml,45.9
2024-08-12,93086,Smirnoff Red Βότκα 700 ml,14.75
2024-08-12,186408,Bacardi Anejo Cuatro 700 ml,22.7
2024-08-12,81815,Μιχαλάκη Μοσχοφίλερο Κρασί Λευκό 750 ml,5.25
2024-08-12,172905,Μ3 Στον Κύβο Κρασί Λευκό 750 ml,6.1
2024-08-12,183264,Μ2 Στο Τετράγωνο Κρασί Λευκό Ημίγλυκο 750 ml,6.35
2024-08-12,81862,Μιχαλάκη Αγιωργίτικο Κρασί Ερυθρό 750 ml,5.25
2024-08-12,172903,Μ3 Στον Κύβο Κρασί Ερυθρό 750 ml,6.1
2024-08-12,183404,Μ2 Στο Τετράγωνο Κρασί Ερυθρό Ημίγλυκο 750 ml,6.35
2024-08-12,183265,Μ2 Στο Τετράγωνο Κρασί Ροζέ Ημίγλυκο 750 ml,6.35
2024-08-12,183403,Μ3 Στον Κύβο Κρασί Ροζέ 750 ml,6.1
2024-08-12,98482,Stella Artois Μπίρα Lager Κουτί 6 x 330 ml,6.12
2024-08-12,88970,Alexakis Κρασί Κοτσιφάλι Syrah Ερυθρό Ξηρό 750 ml ,8.48
2024-08-12,194666,Le Monferrine Asti Dolce Αφρώδης Οίνος Λευκό Γλυκό 750 ml,4.19
2024-08-12,96565,Gordon&#039;s Gin 700 ml,14.95
2024-08-12,163461,Gordon&#039;s Gin Pink 700 ml,17.28
2024-08-12,173092,Alexakis Κρασί Χατίρι Λευκό Ξηρό 750 ml,8.1
2024-08-12,173093,Alexakis Κρασί Μοσχάτο Σπίνας Λευκό Ξηρό 750 ml,8.0
2024-08-12,820,Johnnie Walker Red Label Ουίσκι 700 ml,17.25
2024-08-12,790,Absolut Βότκα 700 ml,15.8
2024-08-12,901,Disaronno Amaretto Λικέρ 700 ml,16.9
2024-08-12,99009,Strataridakis Μοσχάτο Σπίνας Κρασί Λευκό 750 ml,9.92
2024-08-12,88971,Alexakis Κρασί Βιδιανό Λευκό Ξηρό 750 ml,7.25
2024-08-12,172858,Δασκαλάκη Τιτομιχελάκη Κρασί Ερυθρό Ξηρό 3 lt,7.16
2024-08-12,120387,Henkell Trocken Αφρώδης Οίνος Ξηρός 3 x 200 ml,9.34
2024-08-12,96494,Nico Lazaridi Μαύρο Πρόβατο Κρασί Ερυθρό 750 ml,13.22
2024-08-12,758,Henkell Trocken Αφρώδης Οίνος Ξηρός 750 ml,9.18
2024-08-12,152094,Οινοποιείο Ιερωνυμάκη Porfyra Κρασί Ερυθρό Βιολογικό 750 ml,9.02
2024-08-12,106575,Boutari Demi Sec Κρασί Ροζέ 750 ml,6.6
2024-08-12,618,Lyrarakis Μοσχάτο Σπίνας Βιδιανό Κρασί Λευκό Vegan 750 ml,8.34
2024-08-12,761,Freixenet Carta Nevada Αφρώδης Οίνος Λευκός 750 ml,7.9
2024-08-12,152093,Οινοποιείο Ιερωνυμάκη Priamos Κρασί Ερυθρό Βιολογικό 750 ml,8.22
2024-08-12,183788,Alexakis Κρασί Κοτσιφάλι Ερυθρό Ξηρό 750 ml,6.05
2024-08-12,784,Beefeater Gin 700 ml,17.98
2024-08-12,184102,Olmeca Τεκίλα Silver 700 ml,20.85
2024-08-12,183541,Olmeca Τεκίλα Reposado 700 ml,21.9
2024-08-12,898,Malibu Λικέρ 700 ml,14.5
2024-08-12,198445,Disaronno Amaretto Λικέρ Velvet 700 ml,17.88
2024-08-12,51489,Κτήμα Μιχαλάκη Κρασί Gold Cuvee Λευκό 750 ml,9.35
2024-08-12,106583,Boutari Chardonnay Κρασί Λευκό 750 ml,11.5
2024-08-12,51490,Κτήμα Μιχαλάκη Κρασί Gold Cuvee Ερυθρό 750 ml,9.98
2024-08-12,173575,Μ2 Στο Τετράγωνο Κρασί Ροζέ Γλυκό 500 ml,5.36
2024-08-12,147501,Nico Lazaridi Μαύρο Πρόβατο Κρασί Λευκό 750 ml,11.31
2024-08-12,174343,Lyrarakis Βιδιανό Κρασί Λευκό Βιολογικο Vegan 750 ml,7.92
2024-08-12,191159,Lyrarakis Βηλάνα Κρασί Λευκό Vegan 750 ml,7.92
2024-08-12,190868,Lyrarakis Λιάτικο Κρασί Ερυθρό Vegan 750 ml,7.92
2024-08-12,42732,Mythos Μπίρα Lager Κουτί 4 x 500 ml,4.62
2024-08-12,191158,Lyrarakis Κοτσιφάλι Κρασί Ερυθρό Vegan 750 ml,7.92
2024-08-12,152092,Οινοποιείο Ιερωνυμάκη Lykios Κρασί Λευκό Βιολογικό 750 ml,7.84
2024-08-12,120040,Aperol Απεριτίφ 700 ml,14.9
2024-08-12,69934,Guinness Μπίρα Κουτί 4 x 440 ml,10.54
2024-08-12,198076,Athivoli Τσικουδιά 500 ml,16.65
2024-08-12,159694,Costa Lazaridi Αμέθυστος Κρασί Ερυθρό 750 ml,16.6
2024-08-12,173274,Pepsi Zero Cola Αναψυκτικό Χωρίς Ζάχαρη 6 x 330 ml,3.39
2024-08-12,87460,Skinos Λικέρ 700 ml,16.9
2024-08-12,187048,Ζαγόρι Ανθρακούχο Νερό Λεμόνι 6 x 330 ml,1.8
2024-08-12,174511,Pepsi Cola Αναψυκτικό 6 x 330 ml,3.32
2024-08-12,153180,Riondo Αφρώδης Οίνος Prosecco Extra Dry Λευκός 750 ml,7.08
2024-08-12,134505,Green Cola 0% Αναψυκτικό 4 x 500 ml,1.74
2024-08-12,106577,Boutari Κρητικός Κρασί Ερυθρό 750 ml,5.18
2024-08-12,161620,Έζα Μπίρα Pilsener Κουτί 6 x 330 ml -2-00€,5.03
2024-08-12,454,Boutari Κρητικός Κρασί Λευκό 750 ml,4.91
2024-08-12,127506,Maragakis Winery Symphonia Κρασί Malvazia Λευκό 750 ml,6.5
2024-08-12,127507,Maragakis Winery Symphonia Κρασί Syrah Ερυθρό 750 ml,6.5
2024-08-12,919,Ούζο 12 1 lt,12.88
2024-08-12,650,Κρητικός Vin De Crete Κρασί Λευκό 750 ml,3.82
2024-08-12,589,Κρητικός Vin De Crete Κρασί Ερυθρό Ξηρό 750 ml,3.94
2024-08-12,198180,Βίκος Αναψυκτικό Βυσσινάδα 6 x 330 ml - 10% Φθηνότερα,3.7
2024-08-12,51349,Ένωση Πεζών Το Κρασί Της Παρέας Ερυθρό 3 lt,8.89
2024-08-12,155367,Picollo Mondo Κρασί Ερυθρό Ημίγλυκο 750 ml,6.2
2024-08-12,195223,Picollo Mondo Κρασί Ροζέ Ημίγλυκο 750 ml,6.2
2024-08-12,126901,Alexakis Καρίκι Κρασί Ερυθρό Ξηρό 750 ml,4.59
2024-08-12,199291,Nutri Valley Pj Masks Χυμός Φυσικός Μήλο Πορτοκάλι Αχλάδι 6 x 250 ml ,2.85
2024-08-12,190755,Alexakis Καρίκι Κρασί Λιάτικο Ροζέ 750 ml,4.56
2024-08-12,51348,Ένωση Πεζών Το Κρασί Της Παρέας Λευκό 3 lt,8.59
2024-08-12,55283,Bombay Sapphire Gin 700 ml,21.75
2024-08-12,101864,Finlandia Βότκα 700 ml,14.8
2024-08-12,791,Serkova Βότκα 700 ml,13.3
2024-08-12,166508,Serkova Crystal Pure Βότκα 700 ml,18.48
2024-08-12,776,Jose Cuervo Τεκίλα Especial 700 ml,24.25
2024-08-12,951,Campari Bitter Απεριτίφ 700 ml,20.75
2024-08-12,191417,Tails Cocktails Whisky Sour 500 ml,13.78
2024-08-12,191418,Tails Cocktails Passion Fruit Martini Cocktail 500 ml,13.78
2024-08-12,191419,Tails Cocktails Gin Gimlet 500 ml,13.78
2024-08-12,191420,Tails Cocktails Espresso Martini Coctail 500 ml,13.78
2024-08-12,191421,Tails Cocktails Rum Daiquiri 500 ml,13.78
2024-08-12,489,Κτήμα Χατζημιχάλη Πολυποικιλιακός Κρασί Ερυθρό 750 ml,9.7
2024-08-12,197279,Life Tsai Ice Tea Earl Gray Κεϋλάνης Ροδάκινο Χωρίς Ζάχαρη 1-5 lt,1.49
2024-08-12,197280,Life Tsai Ice Tea Earl Gray Λεμόνι Χωρίς Ζάχαρη 1-5 lt,1.49
2024-08-12,458,Εκάβη Ρετσίνα 1-5 lt,5.82
2024-08-12,126900,Alexakis Καρίκι Κρασί Λευκό Ξηρό 750 ml,4.32
2024-08-12,172960,Toplou Κράσι Μονή Τοπλού Λευκό Βιολογικό 750 ml,8.06
2024-08-12,172962,Toplou Κράσι Μονή Τοπλού Ερυθρό Βιολογικό 750 ml,8.06
2024-08-12,172961,Toplou Κρασί Μονή Τοπλού Ροζέ Βιολογικό 750 ml,8.06
2024-08-12,173604,Candia Μπίρα Lager Κουτί 4 x 500 ml + 2 Δώρο,5.6
2024-08-12,150623,Φιξ Ελλάς Άνευ Μπίρα Χωρίς Αλκοόλ Κουτί 5 x 330 ml + 1 Δώρο,2.95
2024-08-12,159692,Costa Lazaridi Αμέθυστος Κρασί Λευκό 750 ml,12.56
2024-08-12,159693,Costa Lazaridi Αμέθυστος Κρασί Ροζέ 750 ml,12.56
2024-08-12,167805,Σουρωτή Ανθρακούχο Νερό Με Λεμόνι 6 x 330 ml,3.19
2024-08-12,152502,Μαλαματίνα Ρετσίνα 3 lt -0-50€,7.57
2024-08-12,20768,Domenico Θραψαθήρι Κρασί Λευκό 750 ml,7.41
2024-08-12,920,Ούζο 12 700 ml,9.3
2024-08-12,191785,Faxe Μπίρα Strong 10% Κουτί 1 lt,3.86
2024-08-12,48104,Φιξ Ελλάς Μπίρα Lager Κουτί 5 x 330 ml + 1 Δώρο,3.98
2024-08-12,27275,Lato Παραδοσιακό Κρασί Ερυθρό Ξηρό 5 lt,11.34
2024-08-12,192691,Βίκος Αναψυκτικό Pink Grapefruit 6 x 330 ml,2.94
2024-08-12,124741,Acquesi Moscato D&#039;Asti Αφρώδης Οίνος Casarito 750 ml,7.9
2024-08-12,118142,Lipton Ice Tea Κρύο Τσάι Ροδάκινο Χωρίς Ζάχαρη 1-5 lt,2.28
2024-08-12,103714,Lipton Ice Tea Κρύο Τσάι Πράσινο Λεμόνι Χωρίς Ζάχαρη 1.5 lt,2.28
2024-08-12,152339,Pils Hellas Μπίρα Pilsener Κουτί 5 x 330 ml + 1 Δώρο,3.6
2024-08-12,27274,Lato Παραδοσιακό Κρασί Λευκό Ξηρό 5 lt,10.53
2024-08-12,96667,Άμστελ Μπίρα Lager Κουτί 5 x 330 ml + 1 Δώρο,4.1
2024-08-12,198312,Life Joy Φυσικός Χυμός Με 9 Φρούτα &amp; 7 Βιταμίνες 1 lt,1.14
2024-08-12,198179,Βίκος Αναψυκτικό Πορτοκαλάδα 6 x 330 ml - 10% Φθηνότερα,2.65
2024-08-12,165839,Alexakis Sail Κρασί Ερυθρό 750 ml,3.36
2024-08-12,182261,Οινοποιείο Μεταξάρη Παλιός Μύλος Κρασί Ροζέ Syrah 750 ml,10.04
2024-08-12,173602,Candia Μπίρα Lager Κουτί 5 x 330 ml + 1 Δώρο,4.48
2024-08-12,178398,Ήβη Λεμονάδα Αναψυκτικό 5 x 330 ml + 1 Δώρο,2.63
2024-08-12,178400,Ήβη Πορτοκαλάδα Αναψυκτικό Με Ανθρακικό 5 x 330 ml + 1 Δώρο ,2.63
2024-08-12,178399,Ήβη Πορτοκαλάδα Αναψυκτικό Χωρίς Ανθρακικό 5 x 330 ml + 1 Δώρο ,2.63
2024-08-12,191919,Βίκος Cola Zero Αναψυκτικό 5 x 330 ml + 1 Δώρο,2.59
2024-08-12,182260,Οινοποιείο Μεταξάρη Παλιός Μύλος Κρασί Λευκό Βιδιανό 750 ml,9.72
2024-08-12,165838,Alexakis Sail Κρασί Rose 750 ml,3.24
2024-08-12,21773,Lipton Ice Tea Κρύο Τσάι Ροδάκινο 1.5 lt,2.02
2024-08-12,21772,Lipton Ice Tea Κρύο Τσάι Λεμόνι 1-5 lt,2.02
2024-08-12,75850,Lipton Ice Tea Κρύο Τσάι Πράσινο Λεμόνι 1-5 lt,2.02
2024-08-12,156589,Βίκος Αναψυκτικό Λεμονάδα 5 x 330 ml + 1 Δώρο,2.45
2024-08-12,156585,Βίκος Cola Αναψυκτικό 5 x 330 ml + 1 Δώρο,2.45
2024-08-12,165837,Alexakis Sail Κρασί Λευκό 750 ml,3.11
2024-08-12,191788,Faxe Μπίρα Premium 5% Κουτί 1 lt,3.11
2024-08-12,178396,Ήβη Σόδα Λεμόνι Αναψυκτικό Sleek 5 x 330 ml + 1 Δώρο,2.38
2024-08-12,198060,Zubrowka Biala Βότκα 700 ml,14.5
2024-08-12,786,Stolichnaya Βότκα 700 ml,17.05
2024-08-12,198059,Larios Gin 700 ml,14.6
2024-08-12,808,Bacardi Ρούμι 700 ml,18.2
2024-08-12,197067,Havana Club Ρούμι Especial 700 ml,19.98
2024-08-12,164002,Havana Club Ρούμι 3 Ετών 700 ml,18.0
2024-08-12,869,Southern Comfort Λικέρ 700 ml,18.95
2024-08-12,183437,Rossi D&#039;asiago Λικέρ Limoncello 700 ml,15.94
2024-08-12,68237,Alexandrion 5* Κονιάκ 700 ml,13.74
2024-08-12,855,Metaxa 5* Κονιάκ 700 ml,16.2
2024-08-12,26105,Ισιδώρου Αρβανίτου Ούζο Πλωμαρίου 700 ml,11.2
2024-08-12,192695,Aperol Spritz 3 x 200 ml,8.9
2024-08-12,196615,Campari Soda 5 x 98 ml,4.9
2024-08-12,667,Boutari Μοσχοφίλερο Κρασί Λευκό 750 ml,8.5
2024-08-12,33506,Lato Κρασί Λευκό Ημίγλυκο 750 ml,3.32
2024-08-12,33507,Lato Κρασί Ερυθρό Ημίγλυκο 750 ml,3.64
2024-08-12,186845,Κλιάφα Αναψυκτικό Λεμονάδα 5 x 330 ml + 1 Δώρο,2.31
2024-08-12,190621,Κλιάφα Αναψυκτικό Πορτοκαλάδα 5 x 330 ml + 1 Δώρο,2.31
2024-08-12,190620,Κλιάφα Αναψυκτικό Πορτοκαλάδα Χωρίς Ανθρακικό 5 x 330 ml + 1 Δώρο,2.31
2024-08-12,154698,La Farra Αφρώδης Οίνος Prosecco Treviso Extra Dry 750 ml,8.7
2024-08-12,177268,Schweppes Αναψυκτικό Πορτοκαλάδα Με Ανθρακικό Χωρίς Ζάχαρη 6 x 330 ml,3.89
2024-08-12,177496,Schweppes Αναψυκτικό Pink Grapefruit 6 x 330 ml,3.89
2024-08-12,177497,Schweppes Αναψυκτικό Λεμόνι Περγαμόντο &amp; Ιβίσκος Χωρίς Ζάχαρη 6 x 330 ml,3.89
2024-08-12,191836,Schweppes Αναψυκτικό Mango Lime 6 x 330 ml,3.89
2024-08-12,41425,Ένωση Πεζών Το Κρασί Της Παρέας Ερυθρό 1 lt,2.88
2024-08-12,105392,Kaiser Μπίρα Pils Κουτί 5 x 330 ml + 1 Δώρο,5.95
2024-08-12,41424,Ένωση Πεζών Το Κρασί Της Παρέας Λευκό 1 lt,2.79
2024-08-12,57104,Mythos Μπίρα Lager Κουτί 6 x 330 ml + 2 Δώρο,5.85
2024-08-12,186138,Sol Μπίρα Lager Φιάλη 330 ml,1.69
2024-08-12,178397,Ήβη Σόδα Αναψυκτικό Sleek 5 x 330 ml + 1 Δώρο,2.14
2024-08-12,189302,Φήμη Ανθρακούχο Νερό Με Λεμόνι 6 x 330 ml,1.37
2024-08-12,629,Κουρτάκης Vin De Crete Κρασί Ερυθρό 750 ml,5.08
2024-08-12,192766,Fanta Πορτοκαλάδα Zero 6 x 330 ml ,3.55
2024-08-12,191515,Schweppes Αναψυκτικό Biter Lemon 6 x 330 ml,3.55
2024-08-12,190678,Schweppes Αναψυκτικό Mojito 6 x 330 ml,3.55
2024-08-12,191874,Schweppes Αναψυκτικό Ginger Ale 6 x 330 ml,3.55
2024-08-12,628,Κουρτάκης Vin De Crete Κρασί Ροζέ 750 ml,5.02
2024-08-12,192272,Μαλαματίνα Φίλιωμα Μοσχοφίλερο Κρασί Λευκό 750 ml,4.89
2024-08-12,189300,Φήμη Ανθρακούχο Νερό 6 x 330 ml,1.3
2024-08-12,627,Κουρτάκης Vin De Crete Κρασί Λευκό 750 ml,4.83
2024-08-12,137016,Claudio Sangria Αφρώδης Οίνος 1.5 lt,4.85
2024-08-12,198313,Life Joy Φρουτοποτό Βύσσινο 1 lt,0.85
2024-08-12,198310,Life Joy Φυσικός Χυμός Πορτοκάλι 1 lt,0.84
2024-08-12,189954,Schweppes Αναψυκτικό Indian Tonic 6 x 330 ml,3.26
2024-08-12,161453,Schweppes Σόδα Λεμόνι 6 x 330 ml ,3.26
2024-08-12,197127,Άλφα Μπίρα Με Θαλασσινό Αλάτι 5 x 330 ml + 1 Δώρο,4.95
2024-08-12,161545,Άμστελ Free Μπίρα Κουτί 5 x 330 ml + 1 Δώρο,3.45
2024-08-12,184505,Tuborg Mixer Αναψυκτικό Pink Grapefruit &amp; Σαγκουίνι 6 x 330 ml,3.17
2024-08-12,157596,Coca Cola Zero Αναψυκτικό 6 x 330 ml,4.39
