2024-08-12,8533,Αβέα Oliva Σαπούνι Λευκό Με Ελαιόλαδο &amp; Μέλι 125 gr,1.62
2024-08-12,105806,Αβέα Σαπούνι Πράσινο Από Λάδι Ελιάς 4 x 150 gr,3.42
2024-08-12,185662,Cretan Beauty Σαπούνι Από Έξτρα Παρθένο Ελαιόλαδο 100 gr,2.0
2024-08-12,96908,Cretan Beauty Σαπούνι Ελαιολάδου 100 gr,1.1
2024-08-12,24450,Karavaki Σαπούνι Χαμομήλι 125 gr,0.7
2024-08-12,116988,Παπουτσάνης Σαπούνι Πράσινο Με Ελαιόλαδο Vegan 125 gr,0.61
2024-08-12,196753,Karavaki Σαπούνι Χαμομήλι Vegan 4 x 125 gr,2.56
2024-08-12,197008,Karavaki Σαπούνι Μασσαλίας 4 x 125 gr,2.56
2024-08-12,116989,Παπουτσάνης Σαπούνι Πράσινο Με Ελαιόλαδο Vegan 250 gr,1.17
2024-08-12,184873,Παπουτσάνης Aromatics Σαπούνι Tabac 100 gr,0.62
2024-08-12,187206,Παπουτσάνης Aromatics Σαπούνι Love Vegan 100 gr,0.62
2024-08-12,187207,Παπουτσάνης Aromatics Σαπούνι Hope Vegan 100 gr,0.62
2024-08-12,185136,Παπουτσάνης Aromatics Σαπούνι Lavender 100 gr,0.62
2024-08-12,196751,Παπουτσάνης Aromatics Σαπούνι Lavender 4 x 100 gr,2.56
2024-08-12,185551,Παπουτσάνης Aromatics Σαπούνι Musk 100 gr,0.62
2024-08-12,196752,Παπουτσάνης Aromatics Σαπούνι Musk 4 x 100 gr,2.56
2024-08-12,102905,Palmolive Σαπούνι Naturals Ελιά 3 x 90 gr + 1 Δώρο,2.37
2024-08-12,102906,Palmolive Σαπούνι Naturals Γάλα Αμυγδάλου 3 x 90 gr + 1 Δώρο,2.37
2024-08-12,160303,Herbolive Σαπούνι Donkey Milk 90 gr,2.9
2024-08-12,112357,Dettol Σαπούνι Αντιβακτηριδιακό Κλασικό 100 gr,1.0
2024-08-12,112358,Dettol Σαπούνι Αντιβακτηριδιακό Για Ευαίσθητες Επιδερμίδες 100 gr,1.0
2024-08-12,106103,Dettol Σαπούνι Αντιβακτηριδιακό Για Ευαίσθητες Επιδερμίδες 3 x 100 gr + 100 gr Δώρο,3.0
2024-08-12,187836,Dove Σαπούνι Coconut 90 gr,0.96
2024-08-12,187838,Dove Σαπούνι Απολέπισης 90 gr,0.96
2024-08-12,186290,Dove Σαπούνι Argan Oil 90 gr,0.96
2024-08-12,19950,Atrix Κρέμα Χεριών Εντατική Ενυδάτωση 150 ml,4.05
2024-08-12,9217,Vaseline Βαζελίνη Original 100 gr,3.7
2024-08-12,122989,Nivea Roll On Talc Sensation 50 ml,4.98
2024-08-12,192215,Nivea Αποσμητικό Roll On Black Pearl &amp; Beauty 50 ml,4.98
2024-08-12,69241,Nivea Αποσμητικό Roll On Pearl &amp; Beauty 50 ml,4.98
2024-08-12,192214,Nivea Αποσμητικό Roll On Fresh Sensation 50 ml,4.98
2024-08-12,96610,Nivea Αποσμητικό Roll On Black &amp; White Original 50 ml,4.98
2024-08-12,163608,Nivea Αποσμητικό Roll On Black &amp; White Silky Smooth 50 ml,4.98
2024-08-12,174786,Nivea Αποσμητικό Roll On Black &amp; White Ultra 50 ml,4.98
2024-08-12,174055,Nivea Αποσμητικό Roll On Black &amp; White Invisible Ultimate Impact 50 ml,4.98
2024-08-12,191853,L&#039;oreal Men Expert Αποσμητικό Roll On Barber Club 50 ml,5.28
2024-08-12,179109,Nivea Men Αποσμητικό Roll On Cool Kick Fresh 50 ml,4.98
2024-08-12,10150,Nivea Men Αποσμητικό Roll On Dry Impact 50 ml,4.59
2024-08-12,160907,Nivea Men Αποσμητικό Roll On Deep 50 ml,4.98
2024-08-12,192213,Nivea Men Αποσμητικό Roll On Fresh Sensation 50 ml,4.98
2024-08-12,96608,Nivea Men Αποσμητικό Roll On Black &amp; White Power 50 ml,4.98
2024-08-12,195000,Nivea Αποσμητικό Spray Fresh Cherry 150 ml,5.38
2024-08-12,96611,Nivea Αποσμητικό Spray Black &amp; White Clear 150 ml,5.38
2024-08-12,192435,Nivea Αποσμητικό Spray Black Pearl &amp; Beauty 150 ml,5.38
2024-08-12,10149,Nivea Men Αποσμητικό Spray Dry Impact 150 ml,5.38
2024-08-12,96609,Nivea Men Αποσμητικό Spray Black &amp; White Power 150 ml,5.38
2024-08-12,198607,Nivea Men Αποσμητικό Spray Deep Sport 150 ml,5.38
2024-08-12,162019,Nivea Men Αποσμητικό Spray Deep 150 ml,5.38
2024-08-12,174483,Nivea Αποσμητικό Spray Anti-Perspirant Black &amp; White Ultimate Impact 150 ml,5.38
2024-08-12,193267,Nivea Men Αποσμητικό Spray Fresh Sensation 150 ml,5.38
2024-08-12,193352,Nivea Αποσμητικό Spray Fresh Sensation 150 ml,5.2
2024-08-12,191854,L&#039;oreal Men Expert Αποσμητικό Spray Barber Club 150 ml,5.38
2024-08-12,9992,Μυρτώ Άρωμα Λεμόνι 200 ml,6.75
2024-08-12,114451,Elode So Lovely Eau De Parfum 100 ml,7.98
2024-08-12,151871,B.U. Absolute Eau De Toilette 50 ml,10.98
2024-08-12,177794,B.U. Fairy Secret Eau De Toilette 50 ml,10.98
2024-08-12,59137,B.U. Trendy Eau De Toilette 50 ml,10.98
2024-08-12,188825,B.U. One Love Eau De Toilette 50 ml,10.98
2024-08-12,78291,B.U. Heartbeat Eau De Toilette 50 ml,10.98
2024-08-12,184621,Elode Bold Men Eau De Toilette 100 ml,7.98
2024-08-12,165928,Str8 Original Eau De Toilette 100 ml,13.9
2024-08-12,165929,Str8 Red Code Eau De Toilette 100 ml,13.9
2024-08-12,165931,Str8 Ahead Eau De Toilette 100 ml,13.9
2024-08-12,165933,Str8 Rise Eau De Toilette 100 ml,13.9
2024-08-12,191131,Str8 Game Eau De Toilette 100 ml,13.9
2024-08-12,178534,Str8 Fr34k Eau De Toilette 100 ml,13.9
2024-08-12,191412,Axe Dark Temptation Eau De Toilette 100 ml,13.48
2024-08-12,185981,Axe Wild Mojito Eau De Toilette 100 ml,13.48
2024-08-12,132792,Multy Σφουγγάρι Σώματος Ν5 + 1 Δώρο,0.95
2024-08-12,11185,Multy Σφουγγάρι Σώματος Fitness Ν102 + 1 Τεμάχιο Δώρο,1.42
2024-08-12,11346,Multy Σφουγγάρι Σώματος Ν107 + 1 Τεμάχιο Δώρο,1.2
2024-08-12,11183,Multy Σφουγγάρι Σώματος Ν107/S,2.27
2024-08-12,152124,Γίφα Σφουγγάρι Σώματος Με Σιλικόνη Γίγας 70 gr,2.07
2024-08-12,174623,Σφουγγάρι Μπάνιου Με Μικροϊνες,2.85
2024-08-12,174625,Σφουγγάρι Μπάνιου Mousse,4.6
2024-08-12,39356,Zan Sot Σφουγγάρι Σώματος Με Τούλι Μεγάλο,1.7
2024-08-12,112399,Zan Sot Τριχολαβίδα Στενή Λοξή ,2.62
2024-08-12,194130,Zan Sot Τριχολαβίδα Ίσια,3.15
2024-08-12,11704,Assim Ψαλίδι Νυχιών 2124 Ασημένιο,4.5
2024-08-12,80822,Zan Sot Ψαλιδάκι Νυχιών,4.8
2024-08-12,72910,Zan Sot Νυχοκόπτης Classic Μεσαίος ,2.28
2024-08-12,83326,Zan Sot Νυχοκόπτης Classic Μεγάλος ,2.98
2024-08-12,151385,Zan Sot Ξύλινη Ράσπα Ποδιών,4.5
2024-08-12,118731,Scholl Λίμα Αφαίρεσης Σκληρού Δέρματος,9.9
2024-08-12,125928,Scholl Velvet Ηλεκτρική Λίμα Ποδιών -10-00€,39.9
2024-08-12,118725,Scholl Κρέμα Ανάπλασης Για Σκασμένες Πτέρνες 60 ml,13.9
2024-08-12,134146,Hansaplast Επιθέματα Για Κάλους 10 Τεμάχια,4.57
2024-08-12,118729,Scholl Fresh Step Αποσμητικό Υποδημάτων Spray 150 ml -2-€,5.9
2024-08-12,30039,Hansaplast Αποσμητικό Spray Ποδιών &amp; Προστασία Από Μύκητες 150 ml,6.2
2024-08-12,87657,Hansaplast Αποσμητικό Spray Ποδιών Silver Active 150 ml,6.2
2024-08-12,193268,Liposan Ενυδατικό Χειλιών Βατόμουρο Vegan 4-8 gr,3.08
2024-08-12,9407,Liposan Ενυδατικό Χειλιών Λευκό 4-8 gr,3.08
2024-08-12,198743,Liposan Ενυδατικό Χειλιών Caring Beauty Nude Pink 4.8 gr,3.92
2024-08-12,9406,Liposan Ενυδατικό Χειλιών Κεράσι Vegan 4-8 gr,3.08
2024-08-12,190527,Liposan Ενυδατικό Χειλιών Soft Rose 4-8 gr,3.09
2024-08-12,191911,Le Petit Marseillais Ενυδατικό Stick Χειλιών Θρέψης Καριτέ- Γλυκό Αμύγδαλο &amp; Έλαιο Argan 4-9 gr,2.98
2024-08-12,147673,Garnier Skin Active Μάσκα Προσώπου Moisture Bomb Υφασμάτινη Vegan 32 gr,2.58
2024-08-12,158044,Garnier Skin Active Μάσκα Προσώπου Pure Charcoal BlackΥφασμάτινη Vegan 28 gr,2.58
2024-08-12,178600,Garnier Skin Active Μάσκα Προσώπου Hydra Bomb Υφασμάτινη Vegan 28 gr,2.58
2024-08-12,198604,Nivea Men Ορός Προσώπου Anti Age 30 ml,21.3
2024-08-12,197292,Nivea Men Κρέμα Gel Προσώπου Sensitive 50 ml,10.75
2024-08-12,178612,Garnier Skin Naturals Hyaluronic Aloe Jelly Ενυδατική Κρέμα Για Κανονική Επιδερμίδα 50 ml,7.75
2024-08-12,197557,Garnier PureActive Κρέμα Ημέρας 3 Σε 1 Με Άνθρακα 50 ml,8.78
2024-08-12,183335,Nivea Men Κρεμα Προσώπου Ultra Calming 75 ml,13.4
2024-08-12,183574,Garnier Skin Naturals Hyaluronic Aloe Super Serum Ορός Προσώπου 30 ml,11.48
2024-08-12,155073,Johnson&#039;s Face Care Gel Καθαρισμού Daily Essentials Κανονική Επιδερμίδα 150 ml - 50% Φθηνότερα,3.2
2024-08-12,174448,Johnson&#039;s Gel Καθαρισμού Προσώπου Exfoliating 150 ml - 50% Φθηνότερα ,3.2
2024-08-12,178613,Garnier Skin Naturals Gel Καθαρισμού Προσώπου Hyaluronic Aloe Vegan 200 ml,6.25
2024-08-12,124078,Garnier Νερό Ντεμακιγιάζ Micellar 400 ml,7.58
2024-08-12,150317,Garnier Νερό Διφασικό Ντεμακιγιάζ Micellaire Όλα Σε 1 400 ml,7.58
2024-08-12,172973,Garnier Νερό Ντεμακιγιάζ Micellaire Με Ροδόνερο 400 ml,7.58
2024-08-12,155428,Garnier Νερό Ντεμακιγιάζ Micellaire 100 ml,2.75
2024-08-12,158260,Garnier Skin Active Διφασικό Micellaire Όλα σε 1 Ντεμακιγιάζ 100 ml,2.75
2024-08-12,155076,Johnson&#039;s Face Care Μαντηλάκια Καθαρισμού Daily Essentials 25 Τεμάχια - 50% Φθηνότερα,2.25
2024-08-12,89656,Johnson&#039;s Face Care Μαντηλάκια Καθαρισμού Daily Essentials 25 Τεμάχια,2.25
2024-08-12,113320,Maybelline Μολύβι Ματιών Expression Kajal Black ,3.7
2024-08-12,180393,Maybelline Κονσίλερ Instant Anti-Age Eraser Nude 6 ml,13.1
2024-08-12,180394,Maybelline Κονσίλερ Instant Anti-Age Eraser Light 6 ml,13.1
2024-08-12,180395,Maybelline Μολύβι Ματιών Tattoo Liner Gel Για Μεγάλη Διάρκεια ,7.45
2024-08-12,156985,Maybelline Κονσίλερ Instant Age Rewind Light 6 ml,13.18
2024-08-12,156986,Maybelline Κονσίλερ Instant Age Rewind Medium 6 ml,13.18
2024-08-12,85871,Maybelline Μάσκαρα Colossal 100% Black ,12.07
2024-08-12,180398,Maybelline Μάσκαρα Colossal 100% Black,11.28
2024-08-12,184172,Maybelline Μάσκαρα Colossal 36h Αδιάβροχη Για Όγκο Black ,11.28
2024-08-12,184708,Maybelline Μάσκαρα Colossal Curl Bounce Black ,15.78
2024-08-12,129251,Maybelline Μάσκαρα Colossal Go Extreme Black ,12.07
2024-08-12,80280,Maybelline Μάσκαρα Colossal Volume Express ,12.07
2024-08-12,180396,Maybelline Μάσκαρα Colossal Volume Express Black ,9.0
2024-08-12,94658,Maybelline Μάσκαρα Falsies Black Drama,15.75
2024-08-12,173433,Maybelline Μάσκαρα Falsies Lash Lift ,14.7
2024-08-12,191965,Maybelline Μάσκαρα Falsies Surreal Blister,17.0
2024-08-12,139306,Maybelline Μάσκαρα Lash Sensational Black,14.2
2024-08-12,180184,Maybelline Μάσκαρα Lash Sensational Sky High Για Μήκος &amp; Όγκο ,15.78
2024-08-12,10491,Maybelline Μάσκαρα Volum Express Για Όγκο,9.63
2024-08-12,180388,Maybelline Κραγιόν Super Stay Matte Ink No10 Dreamer 5 ml,13.07
2024-08-12,171969,Maybelline Κραγιόν Super Stay Matte Ink No10 Dreamer Blister 5 ml,13.5
2024-08-12,171964,Maybelline Κραγιόν Super Stay Matte Ink No118 Dancer 5 ml,13.5
2024-08-12,171963,Maybelline Κραγιόν Super Stay Matte Ink No120 Artist 5 ml,13.5
2024-08-12,180392,Maybelline Κραγιόν Super Stay Matte Ink No125 Inspiper 5 ml,13.07
2024-08-12,171962,Maybelline Κραγιόν Super Stay Matte Ink No125 Inspiper Blister 5 ml,13.5
2024-08-12,180389,Maybelline Κραγιόν Super Stay Matte Ink No15 Lover 5 ml,13.07
2024-08-12,171968,Maybelline Κραγιόν Super Stay Matte Ink No15 Lover Blister 5 ml,13.5
2024-08-12,171966,Maybelline Κραγιόν Super Stay Matte Ink No35 Creator 5 ml,13.5
2024-08-12,171967,Maybelline Κραγιόν Super Stay Matte Ink No65 Pioneer 5 ml,13.5
2024-08-12,180390,Maybelline Κραγιόν Super Stay Matte Ink No65 Pioneer Blister 5 ml,13.07
2024-08-12,180391,Maybelline Κραγιόν Super Stay Matte Ink No65 Seductres 5 ml,13.07
2024-08-12,171965,Maybelline Κραγιόν Super Stay Matte Ink No65 Seductres Blister 5 ml,13.5
2024-08-12,9258,Best Ασετόν 100 ml,0.93
2024-08-12,59086,Tai Ασετόν Oil 85% 140 ml,1.33
2024-08-12,59085,Tai Ασετόν 85% 140 ml,1.35
2024-08-12,189528,Tai Ασετόν 85% Με Βαλβίδα Pump 200 ml,2.88
2024-08-12,189529,Tai Ασετόν Oil Με Βαλβίδα Pump 200 ml,2.88
2024-08-12,100758,Norina Ασετόν Με Λάδι Και Βιταμίνες 100 ml + 20 ml Δώρο,1.84
2024-08-12,124452,Οδοντόκρεμα Aloe Vera Propoline 75 ml,4.35
2024-08-12,158668,Oral B Οδοντόκρεμα 3D White Arctic Fresh 75 ml + 1 Δώρο,3.77
2024-08-12,163866,Parodontax Οδοντόκρεμα Complete Protection Extra Fresh 75 ml,4.5
2024-08-12,184224,Parodontax Οδοντόκρεμα Gum &amp; Breath Original 75 ml,4.5
2024-08-12,193074,Parodontax Οδοντόκρεμα Active Gum Repair 75 ml,4.5
2024-08-12,184226,Parodontax Οδοντόκρεμα Gum &amp; Breath White 75 ml,4.5
2024-08-12,163868,Parodontax Οδοντόκρεμα Extra Fresh 75 ml,4.02
2024-08-12,172550,Parodontax Οδοντόκρεμα Complete Protection Original 75 ml,4.5
2024-08-12,163867,Parodontax Οδοντόκρεμα Complete Protection Whitening 75 ml,4.5
2024-08-12,121086,Sensodyne Οδοντόκρεμα Complete Protection 75 ml,4.28
2024-08-12,94522,Sensodyne Οδοντόκρεμα Repair &amp; Protect 75 ml,4.37
2024-08-12,105356,Sensodyne Οδοντόκρεμα Repair &amp; Protect Whitening 75 ml,4.37
2024-08-12,122891,Sensodyne Οδοντόκρεμα Repair &amp; Protect Extra Fresh 75 ml,4.37
2024-08-12,148381,Sensodyne Οδοντόκρεμα Gentle Whitening 75 ml,3.55
2024-08-12,153207,Sensodyne Οδοντόκρεμα Rapid Action 75 ml,4.28
2024-08-12,168263,Sensodyne Οδοντόκρεμα Sensitivite &amp; Gum 75 ml,4.28
2024-08-12,172549,Sensodyne Οδοντόκρεμα Sensitivite &amp; Gum Whitening 75 ml,4.28
2024-08-12,167899,Sensodyne Οδοντόκρεμα Extra Fresh 75 ml,3.49
2024-08-12,184839,Sensodyne Οδοντόκρεμα Nourish Gently Soothing 75 ml,3.95
2024-08-12,185580,Sensodyne Οδοντόκρεμα Nourish Healthy White 75 ml,3.86
2024-08-12,170957,Colgate Οδοντόκρεμα Protection Caries 90 ml + 1 Δώρο,3.72
2024-08-12,162431,Colgate Οδοντόκρεμα Family Action 100 ml,2.28
2024-08-12,182879,Periogard Οδοντόκρεμα Προστασία Ούλων 75 ml,4.46
2024-08-12,182880,Periogard Οδοντόκρεμα Προστασία Ούλων &amp; Λεύκανση 75 ml,4.46
2024-08-12,187227,Periogard Οδοντόκρεμα Προστασία Ούλων &amp; Ευαισθησία 75 ml,4.46
2024-08-12,122892,Sensodyne Οδοντόβουρτσα Complete Protection Μαλακή,3.9
2024-08-12,96604,Colgate Οδοντόβουρτσα Extra Clean Μέτρια 2 Τεμάχια,1.96
2024-08-12,182877,Periogard Στοματικό Διάλυμα Προστασία Ούλων 400 ml,5.98
2024-08-12,106003,Corega Καθαριστικά Δισκία 3 Minutes Για Οδοντοστοιχίες 48 Τεμάχια,7.1
2024-08-12,106004,Corega Κρέμα Στήριξης Οδοντοστοιχιών Neutral 70 gr,7.98
2024-08-12,191027,Corega Κρέμα Στήριξης Οδοντοστοιχιών Max Seal 70 gr,9.18
2024-08-12,115812,Corega Κρέμα Στήριξης Οδοντοστοιχιών Super 70 gr,7.98
2024-08-12,166992,Corega Καθαριστικά Δισκία Whitening Για Οδοντοστοιχίες 48 Τεμάχια,7.55
2024-08-12,191891,Fixodent Στερεωτική Κρεμα Τεχνητής Οδοντοστοιχίας Για Δυνατό Κράτημα 60 gr,7.98
2024-08-12,9685,Bic Astor Stainless Ξυραφάκια Λεπίδες 5 Τεμάχια,1.75
2024-08-12,48335,Bic 1 Ξυραφάκια Μιας Χρήσης Classic 10 Τεμάχια,2.72
2024-08-12,9604,Bic 2 Ξυραφάκια Μιας Χρήσης Sensitive 5 Τεμάχια,1.84
2024-08-12,55079,Bic 3 Ξυραφάκια Μιας Χρήσης Sensitive 4 Τεμάχια + 2 Δώρο,3.48
2024-08-12,9575,Bic Twin Ξυραφάκια Μιας Χρήσης Easy 5 Τεμάχια,2.38
2024-08-12,48336,Bic Ξυραφάκια Μιας Χρήσης Metal 10 Τεμάχια,4.4
2024-08-12,194129,Wilkinson Hydro5 For Men Ξυριστική Μηχανή + 1 Ανταλλακτικό Δώρο,8.65
2024-08-12,9588,Gillette Blue 2 Ξυραφάκια Μιας Χρήσης 5 Τεμάχια,3.58
2024-08-12,24565,Gillette Blue 2 Ξυραφάκια Μιας Χρήσης Plus Slalom 5 Τεμάχια,5.98
2024-08-12,9585,Gillette Blue 2 Ξυραφάκια Μιας Χρήσης Slalom 5 Τεμάχια,4.68
2024-08-12,175278,Gillette Mach 3 Turbo Ανταλλακτικές Κεφαλές 5 Τεμάχια,16.98
2024-08-12,188008,Gillette Mach 3 Ανταλλακτικές Κεφαλές 5 Τεμάχια,14.98
2024-08-12,66058,Gillette Fusion 5 Ανταλλακτικές Κεφαλές 4 Τεμάχια,17.48
2024-08-12,183006,Gillette Proglide Ανταλλακτικές Κεφαλές 4 Τεμάχια,19.48
2024-08-12,66059,Gillette Fusion 5 Power Ανταλλακτικές Κεφαλές 4 Τεμάχια,20.98
2024-08-12,183005,Gillette Proglide Power Ανταλλακτικές Κεφαλές 4 Τεμάχια,22.98
2024-08-12,34229,Bic Twin Ξυραφάκια Μιας Χρήσης Lady 5 Τεμάχια,2.58
2024-08-12,68598,Bic Pure 3 Ξυραφάκια Μιας Χρήσης Lady 4 Τεμάχια + 2 Δώρο,3.58
2024-08-12,178171,Bic Click Soleil 3 Ξυριστική Μηχανή Sensitive + 2 Ανταλλακτικές Κεφαλές ,3.88
2024-08-12,178172,Bic Click Soleil 3 Ανταλλακτικές Κεφαλές Sensitive 4 Τεμάχια,5.46
2024-08-12,88741,Gillette Simply Venus 2 Ξυραφάκια Μιας Χρήσης Agilite 4 Τεμάχια + 4 Δώρο,5.88
2024-08-12,25435,Gillette Venus Smooth Ανταλλακτικές Κεφαλές 4 Τεμάχια,12.48
2024-08-12,96783,Gillette Venus Comfortglide Spa Breeze Ανταλλακτικές Κεφαλές 4 Τεμάχια,14.68
2024-08-12,69437,Nivea Men Αφρός Ξυρίσματος Sensitive 250 ml,5.1
2024-08-12,195260,Nivea Men Αφρός Ξυρίσματος Sensitive 200 ml,4.3
2024-08-12,195262,Nivea Men Αφρός Ξυρίσματος Protect &amp; Care Με Αλόη 200 ml,3.98
2024-08-12,192530,Gillette Series Αφρός Ξυρίσματος Conditioning 200 ml + 200 ml Δώρο,5.68
2024-08-12,145493,Gillette Series Gel Ξυρίσματος Moisturizing 200 ml + 200 ml Δώρο,6.38
2024-08-12,188009,Gillette Αφρός Gel Ξυρίσματος Sensitive Aloe 75 ml,3.28
2024-08-12,88729,Gillette Satin Care Γυναικείο Gel Ξυρίσματος Sensitive 200 ml,6.38
2024-08-12,9617,Nivea Men Gel Ξυρίσματος Sensitive 200 ml,5.78
2024-08-12,9661,Nivea Men Gel Ξυρίσματος Fresh Kick 200 ml,5.8
2024-08-12,179912,Nivea Men Gel Ξυρίσματος Deep 200 ml,5.8
2024-08-12,101038,Nivea Men Κρέμα Ξυρίσματος Sensitive 100 ml,2.8
2024-08-12,44810,Nivea Men Κρέμα Ξυρίσματος Απαλή 100 ml,2.8
2024-08-12,9619,Veet Ταινίες Αποτρίχωσης Προσώπου Κρύο Κερί Για Κανονικές Επιδερμίδες 20 Τεμάχια,6.9
2024-08-12,9631,Veet Ταινίες Αποτρίχωσης Ποδιών Κρύο Κερί Για Κανονικές Επιδερμίδες 20 Τεμάχια,8.98
2024-08-12,178483,Veet Expert Ταινίες Αποτρίχωσης Για Πόδια &amp; Σώμα 20 Τεμάχια ,8.98
2024-08-12,174834,Veet Ταινίες Αποτρίχωσης Ποδιών Κρύο Κερί 16 Τεμάχια,8.98
2024-08-12,88918,Veet Ταινίες Αποτρίχωσης Για Ευαίσθητες Επιδερμίδες 16 Τεμάχια,6.68
2024-08-12,153092,Veet Pure Κρέμα Αποτρίχωσης Για Ευαίσθητες Επιδερμίδες 100 ml,5.5
2024-08-12,88692,Veet Pure Κρέμα Αποτρίχωσης Για Ευαίσθητες Επιδερμίδες 400 ml,11.98
2024-08-12,173394,Veet Pure Κρέμα Αποτρίχωσης Για Κανονικές Επιδερμίδες 100 ml,5.5
2024-08-12,191111,Veet Men Αποτριxωτικό Κιτ Για Ευαίσθητη Επιδερμίδα 150 ml,9.98
2024-08-12,94637,Axe After Shave Dark Temptation 100 ml,9.25
2024-08-12,160908,Nivea Men After Shave Deep Comfort Lotion 100 ml,9.55
2024-08-12,180585,Nivea Men After Shave Cool Kick Fluid 100 ml,9.77
2024-08-12,10189,Nivea Men After Shave Sensitive Balm 100 ml,8.88
2024-08-12,180842,Nivea Men After Shave Fresh Kick Balm 100 ml,9.65
2024-08-12,9960,Nivea Men After Shave Protect &amp; Care Moisturizing Balm 100 ml,9.36
2024-08-12,174943,Gillette After Shave Cool Wave Sensitive Protection Balm 100 ml,7.98
2024-08-12,183196,Nivea Men After Shave Sensitive Pro Ultra Calming Facial Balm 150 ml,11.2
2024-08-12,166063,Always Maxi Night Σερβιέτες Profresh 9 Τεμάχια,3.57
2024-08-12,166062,Always Maxi Σερβιέτες Long 12 Τεμάχια,3.57
2024-08-12,127774,Everyday All Cotton Σερβιετάκια Normal 40 Τεμάχια + 20 Δώρο,4.38
2024-08-12,128723,Everyday All Cotton Σερβιετάκια Large 34 Τεμάχια + 16 Δώρο,4.58
2024-08-12,127852,Everyday All Cotton Σερβιετάκια Extra Long 30 Τεμάχια + 14 Δώρο,5.08
2024-08-12,127773,Everyday Extra Dry Σερβιετάκια Normal 40 Τεμάχια + 20 Δώρο,4.2
2024-08-12,147646,Everyday Extra Dry Σερβιετάκια Large 34 Τεμάχια + 16 Δώρο,4.27
2024-08-12,158030,Everyday Extra Dry Σερβιετάκια Extra Long 30 Τεμάχια + 14 Δώρο,4.6
2024-08-12,185764,Everyday Σερβιετάκια Normal Fresh 40 Τεμάχια + 20 Δώρο,4.2
2024-08-12,193618,Everyday Natura Σερβιετάκια Normal 40 Τεμάχια + 20 Δώρο,4.7
2024-08-12,186470,Bic Hybrid Flex 5 Ξυριστική Μηχανή + 2 Ανταλλακτικές Κεφαλές ,6.95
2024-08-12,186471,Bic Hybrid Flex 5 Ανταλλακτικές Κεφαλές 4 Τεμάχια,9.98
2024-08-12,183792,Sette Lady Σερβιέτες Ακράτειας Normal 10 Τεμάχια,1.55
2024-08-12,183793,Sette Lady Σερβιέτες Ακράτειας Super 10 Τεμάχια,2.18
2024-08-12,183794,Sette Lady Σερβιέτες Ακράτειας Extra 10 Τεμάχια,2.28
2024-08-12,47911,Sani Sensitive Πάνες Ακράτειας Ν2 Medium 15 Τεμάχια,8.98
2024-08-12,47910,Sani Sensitive Πάνες Ακράτειας Ν3 Large 12 Τεμάχια,8.98
2024-08-12,95364,Sani Sensitive Πάνες Ακράτειας Ν4 Extra Large 10 Τεμάχια,8.98
2024-08-12,47654,Tena Slip Πάνες Ακράτειας Super Medium 25 Τεμάχια,18.62
2024-08-12,47614,Tena Slip Πάνες Ακράτειας Super Large 25 Τεμάχια,21.66
2024-08-12,183753,Sette Comfort Slip Πάνες Ακράτειας Νο2 Medium 15 Τεμάχια,6.45
2024-08-12,183754,Sette Comfort Slip Πάνες Ακράτειας Νο3 Large 12 Τεμάχια,6.45
2024-08-12,183755,Sette Comfort Slip Πάνες Ακράτειας Νο4 Extra Large 10 Τεμάχια,6.45
2024-08-12,183795,Sette Comfort Pants Εσώρουχα Ακράτειας Νο2 Medium 14 Τεμάχια,6.45
2024-08-12,183796,Sette Comfort Pants Εσώρουχα Ακράτειας Νο3 Large 14 Τεμάχια,6.6
2024-08-12,154000,Sani Sensitive Maximizers Ενισχυτικό Επίθεμα Ακράτειας One Size 20 Τεμάχια,6.3
2024-08-12,127555,Sani Sensitive Υποσέντονα Χωρίς Άρωμα Maxi Plus 90 x 60 15 Τεμάχια,4.8
2024-08-12,158029,Sani Sensitive Fresh Υποσέντονα Maxi Plus 90 x 60 15 Τεμάχια,6.1
2024-08-12,168791,Sette Υποσέντονα Comfort 60 x 90 15 Τεμάχια,3.48
2024-08-12,168792,Sette Υποσέντονα Comfort 90 x 180 15 Τεμάχια,6.25
2024-08-12,146245,Best Χαρτοβάμβακας 50 Φύλλα 320 gr,3.06
2024-08-12,159030,Lactacyd Υγρό Καθαρισμού Ευαίσθητης Περιοχής 200 ml,3.64
2024-08-12,161427,Lactacyd Intimate Wipes Υγρά Μαντηλάκια Καθαρισμού Ευαίσθητης Περιοχής 15 Τεμάχια,2.96
2024-08-12,198184,Everyday Chamomile Care Υγρά Μαντηλάκια Καθαρισμού Περιοχής 15 Τεμάχια + 15 Τεμάχια Δώρο,1.42
2024-08-12,176099,Best Αντισηπτικό Gel 70% Αιθυλική Αλκοόλη 500 ml ,3.5
2024-08-12,176100,Best Αντισηπτικό Gel 70% Αιθυλική Αλκοόλη 1 lt,6.15
2024-08-12,85834,Dettol Αντισηπτικό Gel Για Τα Χέρια 50 ml,2.29
2024-08-12,180073,Παπουτσάνης Natura Αντισηπτικό Spray Χεριών 100 ml,1.35
2024-08-12,183172,Μάσκες Προστασίας FFP2 Μαύρες 10 Τεμάχια,1.2
2024-08-12,77685,Septona Υγρομάντηλα Πράσινο Μήλο 15 Τεμάχια,0.47
2024-08-12,176515,Septona Υγρομάντηλα Αντιβακτηριακά Λεμόνι 15 Τεμάχια,0.47
