2025-08-19,186666,Το Μάννα Λαδοπαξίμαδα Ολικής Άλεσης Από Πετρόμυλο 350 gr,2.44
2025-08-19,109888,Regina Χορτοπιτάκια Τηγανιού 1 kg,6.16
2025-08-19,20769,Domenico Βιδιανό Κρασί Λευκό 750 ml,7.78
2025-08-19,181628,El Greco Μέλι Θυμαρίσιο Squeeze 480 gr,5.44
2025-08-19,141398,Χιωτάκης Μπουγάτσα Με Πηχτόγαλο Χανίων 700 gr,4.96
2025-08-19,84720,Αρτοποιία Τσατσάκης Παξιμάδι Κριθαροκουλουρίτσα 600 gr,2.28
2025-08-19,198309,Αρτοποιία Τσατσάκης Μπουκίτσες Ελαιόλαδου Τύπου Κυθήρων Vegan 400 gr,2.24
2025-08-19,23801,Χιωτάκης Πίτες Σφακιανές 4 Τεμάχια 500 gr,4.78
2025-08-19,156935,Οικογένεια Βαράκλα Μέλι Από Θυμάρι &amp; Άγρια Βότανα Squeeze 470 gr,5.57
2025-08-19,182955,Φάρμα Αντωνάκη Λουκάνικο Καπνιστό Ξυδάτο Χωρίς Γλουτένη 350 gr,5.5
2025-08-19,188680,Άγριο Δάσος Μέλι Πεύκου 450 gr,4.89
2025-08-19,170832,Green &amp; Yellows Ντολμαδάκια Vegan 250 gr,3.26
2025-08-19,131385,Χιωτάκης Φύλλο Κρητικό Χωριάτικο Με Ελαιόλαδο 540 gr,3.16
2025-08-19,129369,Χιωτάκης Φύλλο Κρούστας Με Ελαιόλαδο 450 gr,2.96
2025-08-19,141640,Φυσικός Χυμός Ρόδι Βιολογικός 100% 500 ml,4.22
2025-08-19,109892,Regina Πίτσα Μαργαρίτα 340 gr,2.76
2025-08-19,151636,Το Μάννα Παξιμάδι Μίνι Κριθαροκουλούρα 400 gr,2.58
2025-08-19,176415,Αρτοποιία Τσατσάκης Κρουτόν Διπλοφουρνιστά Με Ελαιόλαδο &amp; Σκόρδο Vegan 150 gr,1.16
2025-08-19,86790,Μύλοι Κρήτης Αλεύρι Ολικής Άλεσης Για Ψωμί 1 kg,1.88
2025-08-19,72687,Πατεράκης Family Κρητικό Σύγκλινο Χωρίς Γλουτένη 250 gr,3.46
2025-08-19,206248,Pasteli Michel Σισαμόπιτα Με Φυστικόψιχα 160 gr,3.32
2025-08-19,202333,Το Μάννα Παξιμάδια Κριθαρένια Mini Αφράτα 220 gr,1.74
2025-08-19,136394,Φάρμα Αντωνάκη Παραδοσιακό Καπνιστό Απάκι Κρήτης Χωρίς Γλουτένη 200 gr,3.27
2025-08-19,149569,Cretan Nectar Κρέμα Βαλσάμικο Με Θυμαρίσιο Μέλι 200 ml,3.03
2025-08-19,196416,Τα Μερακλίδικα Βάση Για Πίτσα Με Ελαιόλαδο 2 x 220 gr,2.04
2025-08-19,147904,Σαλάτες Οικονομάκη Μαγιονέζα Χωρίς Γλουτένη 500 ml,2.89
2025-08-19,117605,Katrin&#039;s Marmelades Μαρμελάδα Βερύκοκο 300 gr,2.02
2025-08-19,117604,Katrin&#039;s Marmelades Μαρμελάδα Πορτοκάλι Μήλο 300 gr,2.02
2025-08-19,117607,Katrin&#039;s Marmelades Μαρμελάδα Φράουλα 300 gr,2.02
2025-08-19,163766,Cretan Nectar Κρέμα Βαλσαμικού Ρόδι &amp; Αρώνια 200 ml,2.86
2025-08-19,6094,Δανδάλη Ελληνικός Καφές 100 gr,1.9
2025-08-19,188684,Σαλάτες Οικονομάκη Ροζ Σως Κόκτειλ Χωρίς Γλουτένη 530 ml,2.7
2025-08-19,201366,Zaro&#039;s Sparkling Ανθρακούχο Μεταλλικό Νερό Grapefruit Yuzu 6 x 330 ml,2.7
2025-08-19,191392,Το Μάννα Δαγκωτό Παξιμαδάκια Με Ελιά &amp; Λιαστή Τομάτα 110 gr,1.43
2025-08-19,153156,Cretan Nectar Λευκό Βαλσάμικο Με Μέλι &amp; Μουστάρδα 250 ml,2.58
2025-08-19,190750,Big Taste Τσουρέκι Στριφτό 280 gr,1.58
2025-08-19,173513,Φυσικός Χυμός Ρόδι Βιολογικός 100% 250 ml,2.27
2025-08-19,126955,Σαλάτες Οικονομάκη Μουστάρδα Χωρίς Γλουτένη 500 gr,2.17
2025-08-19,5083,Παπάζογλου Τυροσαλάτα 250 gr,2.07
2025-08-19,143073,Cretan Nectar Ξίδι Βαλσάμικο 250 ml,2.07
2025-08-19,126957,Σαλάτες Οικονομάκη Κέτσαπ Χωρίς Γλουτένη 500 gr,2.13
2025-08-19,179600,Ζώμινθος Κρέμα Σοκολάτα Βανίλια 170 gr,0.98
2025-08-19,179486,Ζώμινθος Κρέμα Σοκολάτας 170 gr,0.98
2025-08-19,169369,Ζώμινθος Παραδοσιακή Κρέμα Βανίλια 170 gr,0.98
2025-08-19,167903,Ζώμινθος Παραδοσιακό Ρυζόγαλο 170 gr,0.98
2025-08-19,170998,Zaro&#039;s Sparkling Ανθρακούχο Μεταλλικό Νερό Λεμόνι 6 x 330 ml,1.79
2025-08-19,184453,Βετεράνο Παξιμαδάκια Ολικής Άλεσης 400 gr ,2.52
2025-08-19,115120,Φάρμα Σελλιά Κρέμα Βανίλια Χωρίς Γλουτένη 220 gr,0.92
2025-08-19,179606,Φάρμα Σελλιά Κρέμα Σοκολάτα Βανίλια Χωρίς Γλουτένη 220 gr,0.92
2025-08-19,127865,Φάρμα Σελλιά Κρέμα Σοκολάτα Χωρίς Γλουτένη 220 gr,0.92
2025-08-19,171000,Zaro&#039;s Sparkling Ανθρακούχο Μεταλλικό Νερό 6 x 330 ml,1.53
2025-08-19,192632,Big Taste Κρουασάν Με Πραλίνα Φουντουκιού 150 gr,1.0
2025-08-19,201424,Βετεράνο Μπισκοτάκι Χαρουπιού Με Αμύγδαλο &amp; Σταφίδα 250 gr,3.58
2025-08-19,82865,Μύλοι Κρήτης Φαρίνα 500 gr,0.88
2025-08-19,190749,Big Taste Κρουασάν Με Γέμιση Κρέμα Μιλφέιγ 100 gr,0.78
2025-08-19,23805,Χιωτάκης Κρουασάν Πραλίνα Φουντουκιού 90 gr,0.8
2025-08-19,134579,Pasteli Michel Παστέλι Με Σησάμι 65 gr,1.05
2025-08-19,104240,Λαχανόκοσμος Σαλάτα Ανοιξιάτικη Κρήτης 330 gr,2.27
2025-08-19,51840,Λαχανόκοσμος Σαλάτα Ιταλική Κρήτης 330 gr,2.27
2025-08-19,121852,Λαχανόκοσμος Σαλάτα Λαχανόκοσμου Κρήτης 330 gr,2.27
2025-08-19,186078,Λαχανόκοσμος Σαλάτα Πανδαισία Κρήτης 330 gr,2.27
2025-08-19,121854,Λαχανόκοσμος Σαλάτα Τρικολόρε Κρήτης 330 gr,2.27
2025-08-19,26463,Αγγουράκια Βιολογικά Ελληνικά,4.13
2025-08-19,5274,Αγγουράκια Μικρά Ελληνικά,0.78
2025-08-19,5302,Ατζούρια Κρήτης,0.78
2025-08-19,112839,Ξυλάγγουρα Κρήτης,1.05
2025-08-19,76662,Βασιλικός Συσκευασμένος Κρήτης 25 gr ,1.11
2025-08-19,76661,Δενδρολίβανο Συσκευασμένος Κρήτης 25 gr,1.11
2025-08-19,76664,Δυόσμος Συσκευασμένο Κρήτης 25 gr ,1.05
2025-08-19,76663,Θυμάρι Συσκευασμένο Κρήτης 25 gr ,1.11
2025-08-19,38492,Κόλλιανδρος Συσκευασμένο Κρήτης 25 gr,1.11
2025-08-19,94682,Ρίγανη Συσκευασμένο 25 gr,1.11
2025-08-19,172922,Σχοινόπρασο Συσκευασμένο Κρήτης 25 gr,1.1
2025-08-19,118448,Καρότα Βιολογικά Ελληνικά,2.39
2025-08-19,19330,Κολοκύθια Μικρά Βιολογικά Κρήτης,2.65
2025-08-19,2597,Κουκιά Ξερά Χύμα Κρήτης,2.49
2025-08-19,63787,Κρεμμύδια Ξερά Κρήτης,0.64
2025-08-19,66630,Σαλάτα Κατσαρή Κόκκινη Ελληνική Τεμάχιο,0.95
2025-08-19,66631,Σαλάτα Κατσαρή Πράσινη Ελληνική Τεμάχιο,0.95
2025-08-19,5216,Μελιτζάνες Φλάσκες Ελληνικές,0.63
2025-08-19,5303,Μπάμιες Ελληνικές,2.74
2025-08-19,5231,Πιπεριές Κέρατο Κρήτης,0.98
2025-08-19,19262,Πιπεριές Πράσινες Βιολογικές Ελληνικές,1.94
2025-08-19,5222,Πιπεριές Πράσινες Κρήτης,0.98
2025-08-19,71902,Πιπεριές Φλωρίνης Βιολογικές Ελληνικές,2.24
2025-08-19,5321,Πιπεριές Φλωρίνης Κρήτης,1.43
2025-08-19,5243,Σέλινο Μάτσο Ελληνικό,0.7
2025-08-19,169641,Τομάτες Α&#039; Κρητης,0.88
2025-08-19,115108,Τοματίνια Βελανίδια Βιολογικά Κρητης 500 gr,3.95
2025-08-19,86360,Τοματίνια Βελανίδια Κρήτης 500 gr,1.78
2025-08-19,156796,Τοματίνια Βελανίδια Κόκκινα Σε Ποτήρι Κρήτης 250 gr,2.35
2025-08-19,5383,Τοματίνια Τσέρι Κρήτης 500 gr,2.65
2025-08-19,5289,Φασόλια Μπαρμπούνια Ελληνικά,2.28
2025-08-19,5288,Βλήτα Κρήτης,0.79
2025-08-19,118439,Ρόκα Ελληνική Σε Φύλλα 100 gr,1.2
2025-08-19,48203,Καρπούζι Mini Ελληνικό,3.84
2025-08-19,5309,Πεπόνι Μουλκέικο Κρήτης,4.62
2025-08-19,5282,Πεπόνια Ελληνικά,1.53
2025-08-19,5284,Πορτοκάλια Α  Κρήτης,0.69
2025-08-19,93618,Σταφύλι Άσπρο Ελληνικό,2.18
2025-08-19,22884,Φραγκόσυκα Κρήτης,1.8
2025-08-19,5152,Αρνί Κρήτης,12.5
2025-08-19,62430,Αρνίσιο Συκώτι Κρήτης,3.9
2025-08-19,5176,Κατσίκι Κρήτης,13.5
2025-08-19,62431,Κατσικίσιο Συκώτι Κρήτης,3.9
2025-08-19,134887,Γίδα Ελληνική,6.9
2025-08-19,134888,Πρόβατο Ελληνικό,6.9
2025-08-19,5156,Κουνέλι Κρήτης,14.33
2025-08-19,156692,Φάρμα Αντωνάκη Λουκάνικα Ρεθύμνου,3.98
2025-08-19,156694,Φάρμα Αντωνάκη Λουκάνικα Χοιρινά Χωριάτικα,3.43
2025-08-19,46874,Κοτόπουλο 70% Ν Κρήτης,4.68
2025-08-19,163833,Κοτόπουλο Ρολό Γεμιστό Κρήτης,18.36
2025-08-19,122213,Πετεινός 84% Κρήτης,6.93
2025-08-19,185637,Fresh Snack Cheese Burger 190 gr,1.46
2025-08-19,104176,Fresh Snack Double Burger 280 gr,2.28
2025-08-19,187864,Fresh Snack Texas Burger 240 gr,2.28
2025-08-19,187865,Fresh Snack Texas Chicken Burger 240 gr,2.28
2025-08-19,103011,Fresh Snack Αράβικη Πίτα Με Καπνιστή Γαλοπούλα &amp; Τυρί Edam 185 gr,2.16
2025-08-19,104442,Fresh Snack Αράβικη Πίτα Με Κοτόπουλο 210 gr,2.28
2025-08-19,206151,Fresh Snack Κρουασάν Με Καπνιστή Γαλοπούλα Edam &amp; Μαγιονέζα 150 gr,1.84
2025-08-19,103008,Fresh Snack Σάντουιτς Special 240 gr,2.16
2025-08-19,189340,Fresh Snack Σάντουιτς Time Out 230 gr,1.88
2025-08-19,201968,Fresh Snack Ψωμί Πολύσπορο Γαλοπούλα &amp; Μοτσαρέλα 150 gr,1.3
2025-08-19,103010,Fresh Snack Σάντουιτς Με Καπνιστή Γαλοπούλα &amp; Τυρί Edam 220 gr,2.16
2025-08-19,109522,Fresh Snack Σάντουιτς Με Κοτόπουλο 230 gr,2.28
2025-08-19,195451,Fresh Snack Τοστ Με Φιλέτο Γαλοπούλα Τυρί 150 gr,1.2
2025-08-19,6105,Αρχοντάκη Ελληνικός Καφές,5.53
2025-08-19,6095,Δανδάλη Ελληνικός Καφές 200 gr,4.2
2025-08-19,6089,Δανδάλη Ελληνικός Καφές 500 gr,9.98
2025-08-19,153330,Δανδάλη Ελληνικός Καφές Decafeine 100 gr,2.82
2025-08-19,6150,Δανδάλη Φρεσκοαλεσμένος Ελληνικός Καφές,5.71
2025-08-19,129973,Τσιρογαλάκη Ελληνικός Καφές 100 gr,1.92
2025-08-19,6090,Δανδάλη Καφές Φίλτρου 250 gr,6.42
2025-08-19,62015,Mamascafe Frappe Καφές Σε Σέικερ,0.43
2025-08-19,148535,Cretamel Μαντολάτο Mini Με Φυστίκι Ξηρούς Καρπούς &amp; Μέλι 200 gr,4.26
2025-08-19,197482,Orino Nougat Μαντολάτο Με Αμύγδαλο 70 gr,0.99
2025-08-19,132823,Pasteli Michel Μαντολάτο Αμυγδάλου 65 gr,2.15
2025-08-19,174372,Cretamel Παστέλι Με Μέλι &amp; Αμύγδαλα 45 gr,1.16
2025-08-19,79428,Cretamel Παστέλι Με Μέλι &amp; Σουσάμι 45 gr,0.67
2025-08-19,79343,Cretamel Παστέλι Με Μέλι &amp; Σουσάμι 70 gr,0.99
2025-08-19,90076,Cretamel Παστέλι Με Μέλι &amp; Φυστίκι 70 gr,0.95
2025-08-19,68836,Orino Παστέλι Με Μέλι &amp; Σουσάμι 100 gr,1.28
2025-08-19,24225,Pasteli Michel Mix Μάντολα 160 gr,4.45
2025-08-19,134581,Pasteli Michel Παστέλι Mix Με Μάντολα 65 gr,2.05
2025-08-19,134580,Pasteli Michel Παστέλι Με Αμύγδαλο 65 gr,2.23
2025-08-19,134582,Pasteli Michel Παστέλι Με Φυστίκι 65 gr,1.44
2025-08-19,24223,Pasteli Michel Σισαμόπιτα 160 gr,3.02
2025-08-19,120911,Creta Carob Χαρουπόμελο Χωρίς Γλουτένη 350 gr,5.19
2025-08-19,174365,Cretamel Orino Μέλι Από Κωνοφόρα Δέντρα &amp; Άγρια Βότανα Squeeze 470 gr,8.6
2025-08-19,106694,Cretamel Μέλι Orino Από Θυμάρι &amp; Άγρια Βότανα 400 gr,7.35
2025-08-19,186406,El Greco Μέλι Από Θυμάρι &amp; Κωνοφόρα Δέντρα 450 gr,5.1
2025-08-19,181191,El Greco Μέλι Με Θυμάρι 900 gr,11.98
2025-08-19,200525,Koutantos Family Μέλι Από Άγρια Βότανα &amp; Κωνοφόρα Δέντρα 700 gr,8.94
2025-08-19,191973,Koutantos Family Μέλι Από Θυμάρι &amp; Βότανα 250 gr,4.08
2025-08-19,191972,Koutantos Family Μέλι Από Θυμάρι &amp; Βότανα 400 gr,6.67
2025-08-19,191971,Koutantos Family Μέλι Από Θυμάρι &amp; Βότανα 700 gr,8.32
2025-08-19,191974,Koutantos Family Μέλι Από Θυμάρι &amp; Βότανα Squeeze 500 gr,5.88
2025-08-19,115768,Melirryto Μέλι Σητείας Θυμαρίσιο 950 gr,13.2
2025-08-19,170297,Melirryto Μέλι Σητείας Θυμαρίσιο Squeeze 230 gr,4.12
2025-08-19,170298,Melirryto Μέλι Σητείας Θυμαρίσιο Squeeze 470 gr,6.85
2025-08-19,153047,Orino Μέλι Από Άγρια Βότανα &amp; Κωνοφόρα Δέντρα Squeeze 250 gr,5.25
2025-08-19,176955,Αροδαμός Μέλι Ελληνικών Δασών Αγριοβότανα Θρούμπι &amp; Θυμάρι 450 gr,4.03
2025-08-19,176956,Αροδαμός Μέλι Ελληνικών Δασών Αγριοβότανα Θρούμπι &amp; Θυμάρι 800 gr,6.99
2025-08-19,176953,Αροδαμός Μέλι Ελληνικών Δασών Πεύκο &amp; Θυμάρι Squeeze 500 gr,4.6
2025-08-19,176954,Αροδαμός Μελίγυρις Μέλι Ελληνικών Δασών Αγριοβότανα Θρούμπι &amp; Θυμάρι Squeeze 500 gr,4.6
2025-08-19,165699,Ηδύοσμος Μέλι Από Άγριο Θυμάρι &amp; Άγρια Βότανα Squeeze 470 gr,5.99
2025-08-19,91237,Ηδύοσμος Μέλι Από Άγριο Θυμάρι &amp; Άγρια Βότανα Κρήτης 450 gr,5.8
2025-08-19,91236,Ηδύοσμος Μέλι Από Θυμάρι &amp; Άγρια Βότανα Κρήτης 970 gr,11.04
2025-08-19,179143,Μέλι Ανώπολης Σφακίων Θυμαρίσιο 450 gr,6.65
2025-08-19,179142,Μέλι Ανώπολης Σφακίων Θυμαρίσιο 950 gr,12.88
2025-08-19,118063,Μέλι Της Κρήτης Από Κωνοφόρα &amp; Θυμάρι 250 gr,3.8
2025-08-19,119384,Μέλι Της Κρήτης Από Κωνοφόρα &amp; Θυμάρι 450 gr,6.3
2025-08-19,170553,Μέλι Της Κρήτης Από Κωνοφόρα &amp; Θυμάρι 950 gr,12.74
2025-08-19,175182,Μέλι Της Κρήτης Από Κωνοφόρα Δέντρα &amp; Θυμάρι 500 gr,6.68
2025-08-19,118062,Μέλι Της Κρήτης Από Κωνοφόρα Δέντρα &amp; Θυμάρι Μεταλλική Συσκευασία 250 gr,3.8
2025-08-19,118061,Μέλι Της Κρήτης Από Κωνοφόρα Δέντρα &amp; Θυμάρι Μεταλλική Συσκευασία 450 gr,6.3
2025-08-19,122001,Μελίγυρις Μέλι Δάσους Θυμαριού &amp; Αγριοβοτάνων Βιολογικό 450 gr,5.67
2025-08-19,154001,Οικογένεια Βαράκλα Μέλι Από Θυμάρι &amp; Άγρια Βότανα 450 gr,6.2
2025-08-19,153895,Οικογένεια Βαράκλα Μέλι Από Θυμάρι &amp; Άγρια Βότανα 950 gr,12.45
2025-08-19,133995,Συνεργασία Μέλι Κρήτης Με Βασιλικό Πολτό 450 gr,8.6
2025-08-19,93676,Συνεργασία Χρυσή Κρήτη Μέλι Θυμαρίσιο 450 gr,6.75
2025-08-19,93671,Συνεργασία Χρυσή Κρήτη Μέλι Θυμαρίσιο 900 gr,12.78
2025-08-19,131386,Ψηλορείτης Μέλι Από Θυμάρι Βότανα &amp; Κωνοφόρα Κρήτης 250 gr,4.85
2025-08-19,129274,Συνεργασία Γλυκό Κουταλιού Βύσσινο 370 gr,7.0
2025-08-19,129273,Συνεργασία Γλυκό Κουταλιού Κεράσι 370 gr,5.54
2025-08-19,118246,Γεύσεις Γιαγιάς Σταφίδα Σουλτανίνα Κρήτης 170 gr,2.84
2025-08-19,182930,Nut Nutter Πραλίνα Φυστίκι Αιγίνης 250 gr,6.45
2025-08-19,200394,Nut Nutter Crunchy Φυστικοβούτυρο Χωρίς Ζάχαρη Vegan 250 gr,2.95
2025-08-19,200389,Nut Nutter Αμυγδαλοβούτυρο Χωρίς Ζάχαρη Vegan 190 gr,5.1
2025-08-19,182929,Nut Nutter Φυστικοβούτυρο Χωρίς Ζάχαρη Vegan 250 gr,2.95
2025-08-19,112693,Anna Herbs Δίχταμος Έρωντας 15 gr,1.08
2025-08-19,112701,Anna Herbs Μαλοτήρα Τσάι Του Βουνού 20 gr,1.08
2025-08-19,112708,Anna Herbs Σαρανταδέντρι Καρτεράκι 30 gr,1.08
2025-08-19,112715,Anna Herbs Φασκόμηλο 25 gr,1.08
2025-08-19,112717,Anna Herbs Χαμόμηλο 25 gr,1.08
2025-08-19,177191,Thamma Αφέψημα Cretan Daylight Βιολογικό Vegan Χωρίς Γλουτένη 12 x 1-5 gr,3.88
2025-08-19,202558,Thamma Αφέψημα Earl Grey Tea Βιολογικό Vegan 12 x 2 gr,2.95
2025-08-19,177195,Thamma Αφέψημα Gentle Evening Βιολογικό Vegan Χωρίς Γλουτένη 12 x 1 gr,3.88
2025-08-19,177194,Thamma Αφέψημα Louisa Darling Βιολογικό Vegan Χωρίς Γλουτένη 12 x 1-5 gr,3.88
2025-08-19,202559,Thamma Αφέψημα Pure Green Tea Βιολογικό Vegan 12 x 2 gr,2.95
2025-08-19,160641,Καρτεράκι Βοτανικό Αφέψημα Κρητικό Παραδοσιακό Τσάι 10 x 1 gr,1.53
2025-08-19,160643,Καρτεράκι Βοτανικό Αφέψημα Κρητικό Πράσινο Τσάι 10 x 1-2 gr,1.53
2025-08-19,160642,Καρτεράκι Βοτανικό Αφέψημα Κρητικό Τσάι 10 x 1 gr,1.53
2025-08-19,182816,Κοπέλι Κοκτέιλ Βοτάνων Αφέψημα 20 x 1-2 gr,2.32
2025-08-19,184608,Κοπέλι Τσάι Βαλεριάνα &amp; Μελισσόχορτο Παραδοσιακό Κρητικό Αφέψημα 20 x 1-5 gr,2.32
2025-08-19,118969,Κοπέλι Τσάι Του Βουνού Μαλοτήρα Με Ματζουράνα Παραδοσιακό Κρητικό Αφέψημα 20 x 1 gr,2.32
2025-08-19,183540,Κοπέλι Τσάι Του Βουνού Παραδοσιακό Κρητικό Αφέψημα 20 x 1-2 gr,2.32
2025-08-19,182815,Κοπέλι Χαμόμηλο Στιγμιαίο Αφέψημα 20 x 1-2 gr,1.65
2025-08-19,132896,Κοπέλι Πράσινο Τσάι 20 x 2 gr,1.8
2025-08-19,160922,Κοπέλι Πράσινο Τσάι Με Βότανα 20 x 1-8 gr,2.32
2025-08-19,106239,Χαλκιαδάκης Κριτσίνια Με Ηλιόσπορο 360 gr,2.58
2025-08-19,192443,Χαλκιαδάκης Κριτσίνια Πολύσπορα 250 gr,1.6
2025-08-19,192444,Χαλκιαδάκης Μακεδονικά Κριτσίνια Με Σουσάμι 300 gr,1.85
2025-08-19,128631,Χαλκιαδάκης Παξιμάδι Κρητικοφουρνιές 400 gr,2.58
2025-08-19,106242,Χαλκιαδάκης Παξιμάδι Κριθαρένιο 600 gr,2.58
2025-08-19,106241,Χαλκιαδάκης Παξιμάδι Κριθαροκουλουρίτσα 600 gr,2.58
2025-08-19,106240,Χαλκιαδάκης Παξιμάδι Κριθαροκουλούρα 600 gr,2.58
2025-08-19,106243,Χαλκιαδάκης Παξιμαδάκι Κριθαρένιο 400 gr,2.25
2025-08-19,124797,Χαλκιαδάκης Παξιμαδάκι Τύπου Κυθήρων 400 gr,2.27
2025-08-19,185691,Grand&#039;s Cookies Βουτήματα Μπιάνκα Γεμιστά 300 gr,4.18
2025-08-19,206529,Grand&#039;s Cookies Choco Αμυγδαλωτό 300 gr,4.85
2025-08-19,106681,Grand&#039;s Cookies Μουστοκούλουρα 400 gr,2.72
2025-08-19,174918,Tsiknakis Οικογένεια Τσικνάκη Γλυκιά Μπουκιά Με Χαρούπι &amp; Cranberries 400 gr,4.26
2025-08-19,174916,Tsiknakis Οικογένεια Τσικνάκη Γλυκιά Μπουκιά Με Χαρούπι &amp; Αμύγδαλο 400 gr,4.26
2025-08-19,174917,Tsiknakis Οικογένεια Τσικνάκη Γλυκιά Μπουκιά Με Χαρούπι 400 gr,4.02
2025-08-19,68773,Αγροτικός Οικοτεχνικός Συνεταιρισμός Γυναικών Κρουσώνα Κουλουράκια Πορτοκαλιού 400 gr,4.84
2025-08-19,91348,Αγροτικός Οικοτεχνικός Συνεταιρισμός Γυναικών Κρουσώνα Λαδοκούλουρα 400 gr,4.84
2025-08-19,68772,Αγροτικός Οικοτεχνικός Συνεταιρισμός Γυναικών Κρουσώνα Παξιμαδάκια Αμύγδαλου 400 gr,4.84
2025-08-19,191778,Αρτώ Λαδοκούλουρα 270 gr,1.79
2025-08-19,35869,Ασιτιανά Παραδοσιακά Εδέσματα Βουτήματα Μπίρας 400 gr,4.2
2025-08-19,121992,Ασιτιανά Παραδοσιακά Εδέσματα Βουτήματα Πορτοκαλιού 400 gr,4.2
2025-08-19,121994,Ασιτιανά Παραδοσιακά Εδέσματα Κουλουράκια Κανέλας 400 gr,4.35
2025-08-19,35870,Ασιτιανά Παραδοσιακά Εδέσματα Μπισκότα Μαρμελάδα 400 gr,4.35
2025-08-19,35871,Ασιτιανά Παραδοσιακά Εδέσματα Μπισκότα Πεταλάκια 400 gr,4.35
2025-08-19,121993,Ασιτιανά Παραδοσιακά Εδέσματα Παξιμαδάκι Κακάο 400 gr,4.2
2025-08-19,203314,Βετεράνο Βουτήματα Σταφιδωτά 350 gr ,4.35
2025-08-19,165494,Δερμίσης Μουστοκούλουρα 200 gr,0.99
2025-08-19,121989,Ιδαία Γη Βουτήματα Κακάο 300 gr,3.35
2025-08-19,121990,Ιδαία Γη Βουτήματα Κρασάτα 300 gr,3.35
2025-08-19,121991,Ιδαία Γη Βουτήματα Λαδερά 300 gr,3.35
2025-08-19,198650,Κρητών Άρτος Μικιό Μπισκοτάκι Με Αμύγδαλο &amp; Μέλι 80 gr,1.2
2025-08-19,198651,Κρητών Άρτος Μικιό Μπισκοτάκι Σοκολάτας 80 gr,1.2
2025-08-19,94485,Μίνθη Κουλουράκια Κρασάτα 330 gr,3.55
2025-08-19,94486,Μίνθη Κουλουράκια Λαδερά Με Σουσάμι 330 gr,3.55
2025-08-19,94487,Μίνθη Κουλουράκια Σταφιδωτά 330 gr,3.55
2025-08-19,149393,Μελόσπιτο Κουλούρι Κανέλας 100 gr,0.6
2025-08-19,179536,Ντουρουντούς Μπισκότα Με Βρώμη &amp; Cranberries 220 gr,3.34
2025-08-19,194332,Ντουρουντούς Μπισκότα Με Μέλι &amp; Καρύδι 150 gr,3.14
2025-08-19,64610,Περράκης Cretan Bakery Βουτήματα Πορτοκαλιού 350 gr,3.62
2025-08-19,64611,Περράκης Cretan Bakery Λαδοκούλουρα Κανέλας 350 gr,3.62
2025-08-19,89579,Περυσινάκης Βουτήματα Σταφιδωτά 500 gr ,4.62
2025-08-19,186402,Το Μάννα Biscotti Αμύγδαλο 160 gr,2.6
2025-08-19,186401,Το Μάννα Biscotti Πορτοκάλι 160 gr,2.37
2025-08-19,186664,Το Μάννα Κουλουράκια Λαδιού Χωρίς Ζάχαρη 170 gr,3.16
2025-08-19,206149,Οικογένεια Μαυροφρύδη Cake Donut Με Επικάλυψη Σοκολάτας 90 gr,1.25
2025-08-19,206148,Οικογένεια Μαυροφρύδη Cake Donut Με Επικάλυψη Φράουλας 90 gr,1.25
2025-08-19,206147,Οικογένεια Μαυροφρύδη Cake Donut Με Λευκή Επικάλυψη Cookies 90 gr,1.25
2025-08-19,158174,Οικογένεια Μαυροφρύδη Γλυκό Καρύδας 120 gr,1.08
2025-08-19,181103,Big Taste Κρουασάν Κρέμα Κακάο Με Φουντούκι 90 gr,0.7
2025-08-19,179327,Big Taste Κρουασάν Με Γέμιση Φράουλα 85 gr,0.7
2025-08-19,206488,Big Taste Κρουασάν Με Πραλίνα Φουντουκιού 90 gr,0.78
2025-08-19,191416,Choco Big Κρουασάν Με Πραλίνα Φουντουκιού ION 250 gr,1.9
2025-08-19,150135,Μελόσπιτο Κρουασανάκια Γεμιστά Με Πραλίνα ΙΟΝ NuCrema 6 Τεμάχια 180 gr,2.5
2025-08-19,190751,Big Taste Τσουρεκάκι Στριφτό 125 gr,0.98
2025-08-19,158177,Sweet &amp; Fresh Τσουρέκι Πολίτικο 450 gr,3.2
2025-08-19,89577,Περυσινάκης Κουλούρι Προζυμένιο Vegan 500 - 550 gr,3.63
2025-08-19,199109,Περυσινάκης Μπαλίτσα Σοκολάτας 500 gr,4.2
2025-08-19,89578,Περυσινάκης Τσουρεκάκι Σμυρνέικο 500 - 550 gr,4.2
2025-08-19,185636,Οικογένεια Μαυροφρύδη Τσουρεκάκι Πραλίνας 100 gr,1.2
2025-08-19,206249,Οικογένεια Μαυροφρύδη Τσουρεκάκι Μιλφέϊγ 100 gr,1.2
