2025-08-19,203997,Άροσις Φασόλια Γιγάντες Δυτικής Μακεδονίας 500 gr,6.98
2025-08-19,172201,Άροσις Φασόλια Μέτρια Καστοριάς Βιολογικά 500 gr,4.28
2025-08-19,94158,Κανάκης Φασόλια Μέτρια 1 kg,3.4
2025-08-19,186375,Κανάκης Φασόλια Μαυρομάτικα Εισαγωγής 500 gr,2.45
2025-08-19,161241,Ωμέγα Special Φασόλια Μέτρια 500 gr,1.96
2025-08-19,161243,Ωμέγα Special Φασόλια Μαυρομάτικα 500 gr,2.1
2025-08-19,153893,Alati Mou Αλάτι Θαλασσινό Κρήτης 250 gr,4.0
2025-08-19,161785,Herbs Spices Ανθός Θαλασσινού Αλατιού 200 gr,2.42
2025-08-19,152886,Olea Secret Ανθός Θαλασσινού Αλατιού Μύλος 200 gr,5.45
2025-08-19,130980,Special Foods Αλάτι Ιμαλαίων Αλάτι Ροζ 250 gr,1.48
2025-08-19,145180,Special Foods Αλάτι Μεσολογγίου Αλάτι 250 gr,1.28
2025-08-19,3293,Ήρα Αλάτι Ημίχονδρο 5 kg,3.17
2025-08-19,3292,Ήρα Αλάτι Κλασικό Θαλασσινό Ιωδιούχο Ψιλό 1 kg ,1.99
2025-08-19,202416,Ήρα Αλάτι Κλασικό Θαλασσινό Ιωδιούχο Ψιλό 3 x 500 gr,2.12
2025-08-19,3332,Ήρα Αλάτι Κλασικό Θαλασσινό Ιωδιούχο Ψιλό 5 kg,3.18
2025-08-19,3295,Ήρα Αλάτι Κλασικό Θαλασσινό Ιωδιούχο Ψιλό 500 gr,1.02
2025-08-19,58993,Κάλας Αλάτι Light 375 gr,2.04
2025-08-19,55556,Κάλας Αλάτι Κλασικό Θαλασσινό Ιωδιούχο 250 gr,1.18
2025-08-19,203443,Κάλας Αλάτι Κλασικό Θαλασσινό Ιωδιούχο 3 x 400 gr ,3.62
2025-08-19,3294,Κάλας Αλάτι Κλασικό Θαλασσινό Ιωδιούχο 400 gr,1.76
2025-08-19,3322,Κάλας Χρυσό Αλάτι Θαλασσινό Ιωδιούχο Αλάτι 500 gr,2.28
2025-08-19,174848,Κοραλλί Αλάτι 400 gr,0.82
2025-08-19,174804,Κοραλλί Μαγειρικό Αλάτι Ψιλό 1000 gr,0.8
2025-08-19,205336,Κοραλλί Μαγειρικό Αλάτι Ψιλό 500 gr,0.34
2025-08-19,202535,Χιών Αλάτι Crystal Θαλασσινό Ιωδιούχο Ψιλό 400 gr,1.32
2025-08-19,203138,Χιών Αλάτι Crystal Θαλασσινό Ιωδιούχο Ψιλό 500 gr ,0.82
2025-08-19,203139,Χιών Αλάτι Θαλασσινό Χωρίς Πρόσθετα Χονδρό 1000 gr,1.63
2025-08-19,198576,Χιών Αλάτι Θαλασσινό Χωρίς Πρόσθετα Χονδρό 850 gr,2.3
2025-08-19,206978,Knorr Aromat Μίγμα Λαχανικών &amp; Μυρωδικών 88 gr,2.23
2025-08-19,177431,4Vita Κανέλα Τριμμένη 80 gr,1.63
2025-08-19,177432,4Vita Κύμινο Τριμμένο 100 gr,3.28
2025-08-19,177433,4Vita Πιπέρι Μαύρο Τριμμένο 100 gr,3.63
2025-08-19,177434,4Vita Ρίγανη 40 gr,1.43
2025-08-19,112685,Anna Herbs Αρισμαρί Δεντρολίβανο 35 gr,1.08
2025-08-19,112694,Anna Herbs Δάφνη 15 gr,1.08
2025-08-19,112697,Anna Herbs Θυμάρι 30 gr,1.08
2025-08-19,112707,Anna Herbs Ρίγανη 35 gr,1.08
2025-08-19,116120,Captain&#039;s Κουρκουμάς 33 gr,2.09
2025-08-19,6190,Captain&#039;s Πιπέρι Μαύρο Τριμμένο 50 gr,2.04
2025-08-19,29423,Captain’s Γαρύφαλλο Ολόκληρο 10 gr,1.15
2025-08-19,6345,Captain’s Γαρύφαλλο Τριμένο 10 gr,1.3
2025-08-19,6192,Captain’s Κανέλλα Ξύλο 50 gr,2.38
2025-08-19,6191,Captain’s Κανέλλα Τριμμένη 50 gr,1.48
2025-08-19,6305,Captain’s Κύμινο Τριμμένο 25 gr,1.6
2025-08-19,6193,Captain’s Κύμινο Τριμμένο 50 gr,1.56
2025-08-19,102481,Captain’s Μπούκοβο 50 gr,1.63
2025-08-19,6313,Captain’s Πιπέρι Μαύρο 34 gr,2.15
2025-08-19,29418,Captain’s Πιπέρι Μαύρο Τριμμένο 30 gr,1.85
2025-08-19,6349,Captain’s Ρίγανη 50 gr,1.3
2025-08-19,187180,Cretan Beauty Μείγμα Μπαχαρικών 3 x 50 gr,4.2
2025-08-19,179955,Cretan Beauty Ρίγανη Βιολογική 100 gr,3.25
2025-08-19,117342,Cretan Beauty Σετ Καφασάκι Μικρό,5.88
2025-08-19,185659,Cretan Beauty Σετ Τελαράκι Μεσαίο,11.65
2025-08-19,185661,Cretan Beauty Σετ Τελαράκι Μικρό,8.55
2025-08-19,149363,Evergreen Κανέλα Κεϋλάνης Αλεσμένη Βιολογική 50 gr,2.15
2025-08-19,152860,Evergreen Κουρκουμάς Βιολογικός 100 gr,2.17
2025-08-19,147755,Health Trade Κανέλλα Κεϋλάνης Τριμμένη Βιολογική 50 gr,1.85
2025-08-19,161786,Herbs Spices Μείγμα Πιπεριών 80 gr,2.42
2025-08-19,171003,Mc Cormick Καπνιστό Σκόρδο 48 gr,4.47
2025-08-19,152836,Mc Cormick Κολιανδρο Τριμμένο 24 gr,3.75
2025-08-19,171002,Mc Cormick Κουρκουμάς 37 gr,4.28
2025-08-19,33979,Mc Cormick Κρεμμύδι Τριμμένο 40 gr,4.57
2025-08-19,40598,Mc Cormick Μείγμα 4 Πιπεριών &amp; Κόλιανδρο Μύλος 24 gr,5.18
2025-08-19,118854,Mc Cormick Πάπρικα Γλυκία 34 gr,3.74
2025-08-19,177385,Mc Cormick Πάπρικα Καπνιστή 40 gr,4.28
2025-08-19,185872,Mc Cormick Πάπρικα Καυτερή 34 gr,3.78
2025-08-19,50609,Mc Cormick Πιπέρι Καγιέν 33 gr,3.75
2025-08-19,54410,Mc Cormick Πιπέρι Μαύρο 33 gr,3.75
2025-08-19,40599,Mc Cormick Πιπέρι Μαύρο Μύλος 35 gr,5.18
2025-08-19,163342,Mc Cormick Σκόρδο Τριμμένο 47 gr,4.47
2025-08-19,6251,Mc Cormick Τζίντζερ Τριμμένο 26 gr,4.08
2025-08-19,47890,Mc Cormick Τσίλι Σκόνη Μέτρια 38 gr,3.75
2025-08-19,152889,Olea Secret Μείγμα Πιπεριών Μύλος 80 gr,6.6
2025-08-19,6350,Ήλιος Γαρύφαλλο Ολόκληρο 15 gr,1.17
2025-08-19,6351,Ήλιος Γαρύφαλλο Τριμμένο 15 gr,1.18
2025-08-19,34310,Ήλιος Κάρδαμο Πράσινο 25 gr,5.1
2025-08-19,6259,Ήλιος Κάρυ 30 gr,1.66
2025-08-19,6258,Ήλιος Κακουλέ 5 gr,1.35
2025-08-19,6231,Ήλιος Κανέλλα Ξύλο 50 gr,1.82
2025-08-19,6230,Ήλιος Κανέλλα Τριμμένη 100 gr,2.12
2025-08-19,6220,Ήλιος Κανέλλα Τριμμένη 50 gr,1.1
2025-08-19,6209,Ήλιος Καρίνο Για Κοτόπουλο 50 gr,1.68
2025-08-19,6216,Ήλιος Κύμινο Τριμμένο 35 gr,2.05
2025-08-19,6201,Ήλιος Κύμινο Τριμμένο 50 gr,1.78
2025-08-19,127832,Ήλιος Μείγμα Για Μπάρμπεκιου 40 gr,2.08
2025-08-19,6206,Ήλιος Μοσχοκάρυδο Τριμμένο 15 gr,1.38
2025-08-19,6205,Ήλιος Μοσχοκάρυδο Χονδρό 25 gr,1.37
2025-08-19,34118,Ήλιος Μπούκοβο 50 gr,1.5
2025-08-19,6228,Ήλιος Πάπρικα Γλυκιά 50 gr,1.1
2025-08-19,127833,Ήλιος Πάπρικα Καπνιστή 35 gr,1.78
2025-08-19,26478,Ήλιος Πάπρικα Καυτερή 100 gr,2.32
2025-08-19,107085,Ήλιος Πιπέρι Ανάμικτο 50 gr,2.28
2025-08-19,83206,Ήλιος Πιπέρι Ανάμικτο Μύλος 25 gr,3.35
2025-08-19,83205,Ήλιος Πιπέρι Μαύρο Ολόκληρο Μύλος 40 gr,3.44
2025-08-19,29306,Ήλιος Πιπέρι Μαύρο Τριμμένο 100 gr,3.27
2025-08-19,6356,Ήλιος Πιπέρι Μαύρο Τριμμένο 40 gr,2.05
2025-08-19,6352,Ήλιος Πιπέρι Μαύρο Τριμμένο 50 gr,1.7
2025-08-19,27146,Ήλιος Ρίγανη 50 gr,1.46
2025-08-19,6215,Ήλιος Σκόρδο Τριμμένο 50 gr,2.65
2025-08-19,186350,Ακάλλη Ρίγανη 25 gr,1.22
2025-08-19,179439,Ανατολή Κακουλέ Ολόκληρο 5 gr,1.15
2025-08-19,70578,Ανατολή Μείγμα 4 Πιπεριών Μύλος 35 gr,3.75
2025-08-19,155283,Ανατολή Πιπέρι Μαύρο Μύλος 45 gr,3.7
2025-08-19,179446,Ανατολή Πιπέρι Μαύρο Ολόκληρο 50 gr,2.43
2025-08-19,190571,Καγιά Γαρύφαλλο Ολόκληρο 10 gr,1.08
2025-08-19,189737,Καγιά Γαρύφαλλο Τριμμένο 10 gr,1.08
2025-08-19,189220,Καγιά Κακουλέ Τριμμένο 5 gr,2.16
2025-08-19,189736,Καγιά Κανέλλα Ξύλο 50 gr,1.75
2025-08-19,189739,Καγιά Κύμινο Τριμμένο 30 gr,2.1
2025-08-19,189225,Καγιά Μοσχοκάρυδο Ολόκληρο 10 gr,1.65
2025-08-19,189735,Καγιά Μοσχοκάρυδο Τριμμένο 10 gr,1.65
2025-08-19,189228,Καγιά Πιπέρι Μέιγμα 4 Πιπεριών Μύλος 46 gr,4.78
2025-08-19,189738,Καγιά Πιπέρι Μαύρο Τριμμένο 100 gr,3.58
2025-08-19,189231,Καγιά Πιπέρι Μαύρο Τριμμένο 50 gr,1.95
2025-08-19,189230,Καγιά Πιπέρι Ροζ Μύλος 26 gr,4.78
2025-08-19,71226,Bio Farma Αλεύρι Ολικής Βιολογικό 1 kg,3.44
2025-08-19,205453,Caputo Αλεύρι Για Όλες Τις Χρήσεις Manitoba Oro 1 kg,3.54
2025-08-19,156166,Creta Carob Ωμό Χαρουπάλευρο Χωρίς Γλουτένη 300 gr,2.18
2025-08-19,179099,Αλλατίνη Αλεύρι Bread You Love Αγιορείτικο 1 kg,1.98
2025-08-19,179098,Αλλατίνη Αλεύρι Bread You Love Ηπειρώτικα Ζυμώματα 1 kg,1.95
2025-08-19,179097,Αλλατίνη Αλεύρι Bread You Love Ιταλικά Ζυμώματα 1 kg,1.92
2025-08-19,52076,Αλλατίνη Αλεύρι Για Τσουρέκι 1 kg,2.86
2025-08-19,3219,Γιώτης Αλεύρι Για Όλες Τις Χρήσεις 1 kg,1.64
2025-08-19,179166,Μάννα Αλεύρι Για Όλες Τις Χρήσεις 1 kg,1.68
2025-08-19,100971,Μύλοι Αγίου Γεωργίου Αλεύρι Για Όλες Τις Χρήσεις 1 kg,0.96
2025-08-19,204052,Μύλοι Αγίου Γεωργίου Αλεύρι Για Όλες Τις Χρήσεις 3 x 1 kg ,4.16
2025-08-19,98383,Μύλοι Αγίου Γεωργίου Αλεύρι Για Όλες Τις Χρήσεις Βιολογικό 1 kg,2.72
2025-08-19,66350,Μύλοι Αγίου Γεωργίου Αλεύρι Για Όλες Τις Χρήσεις Ολικής Άλεσης Πετρόμυλου 1 kg,2.29
2025-08-19,59056,Μύλοι Αγίου Γεωργίου Αλεύρι Για Αρτοσκευάσματα Σκληρό Νο1 1 kg,2.28
2025-08-19,67806,Μύλοι Αγίου Γεωργίου Αλεύρι Για Τσουρέκι 1 kg,3.1
2025-08-19,3197,Μύλοι Αγίου Γεωργίου Αλεύρι Ζαχαροπλαστικής Μαλακό Νο2 1 kg,2.28
2025-08-19,94539,Μύλοι Αγίου Γεωργίου Αλεύρι Καλαμποκιού 500 gr,1.08
2025-08-19,204354,Μύλοι Αγίου Γεωργίου Αλεύρι Ολικής Άλεσης Ντίνκελ 500 gr ,1.98
2025-08-19,194608,Μύλοι Αγίου Γεωργίου Αλεύρι Σίκαλης Για Όλες Τις Χρήσεις 1 kg,2.3
2025-08-19,44021,Μύλοι Κρήτης Αλεύρι Βιολογικής Καλλιέργειας 1 kg,2.85
2025-08-19,3188,Μύλοι Κρήτης Αλεύρι Για Όλες Τις Χρήσεις 1 kg ,1.44
2025-08-19,103524,Μύλοι Κρήτης Αλεύρι Για Τσουρέκι 1 kg,2.7
2025-08-19,88322,Μύλοι Κρήτης Αλεύρι Μίγμα Για Βάση Πίτσας 1 kg,2.2
2025-08-19,88320,Μύλοι Κρήτης Αλεύρι Μίγμα Για Χωριάτικο Ψωμί 1 kg,2.5
2025-08-19,3187,Μύλοι Κρήτης Αλεύρι Μαλακό 1 kg,1.95
2025-08-19,3186,Μύλοι Κρήτης Αλεύρι Σκληρό 1 kg,1.95
2025-08-19,163297,Γιώτης 1-2-Bake Μίγμα Για Muffins Σοκολάτας 500 gr,2.24
2025-08-19,160866,Γιώτης 1-2-Bake Μίγμα Για Pancakes &amp; Βάφλες 300 gr,1.13
2025-08-19,199821,Γιώτης 1-2-Bake Μίγμα Για Red Velvet Cake 520 gr,2.49
2025-08-19,175529,Γιώτης 1-2-Bake Μίγμα Για Κρέπες 300 gr,1.03
2025-08-19,163697,Γιώτης 1-2-Bake Μίγμα Για Σοκολατόπιτα &amp; Brownies 500 gr,1.9
2025-08-19,2399,Γιώτης Μίγμα Για Λουκουμάδες 255 gr,1.82
2025-08-19,192368,Μύλοι Αγίου Γεωργίου Μείγμα Για Brownies Easy Bake 500 gr,2.08
2025-08-19,136742,Μύλοι Αγίου Γεωργίου Μείγμα Για Muffin Easy Bake 500 gr,2.04
2025-08-19,161444,Μύλοι Αγίου Γεωργίου Μείγμα Για Pancakes Easy Bake 300 gr,1.23
2025-08-19,144670,Μύλοι Αγίου Γεωργίου Μείγμα Για Κρέπες Easy Bake 300 gr,1.1
2025-08-19,196670,Μύλοι Αγίου Γεωργίου Μείγμα Για Λουκουμάδες Easy Bake 250 gr,1.0
2025-08-19,136740,Μύλοι Αγίου Γεωργίου Μείγμα Για Πίτσα Easy Bake 500 gr,1.0
2025-08-19,3212,Melissa Σιμιγδάλι Χονδρό 500 gr,1.14
2025-08-19,3213,Melissa Σιμιγδάλι Ψιλό 500 gr,1.2
2025-08-19,175988,Αλλατίνη Φαρίνα 500 gr ,1.04
2025-08-19,72719,Γιώτης Φαρίνα Ολικής Άλεσης 500 gr,1.59
2025-08-19,3182,Γιώτης Φαρίνα Παρτοκάλι 500 gr,1.48
2025-08-19,184483,Μύλοι Αγίου Γεωργίου Φαρίν απ Ολικής Άλεσης 500 gr,1.78
2025-08-19,204054,Μύλοι Αγίου Γεωργίου Φαρινάπ 3 x 500 gr,2.5
2025-08-19,3180,Μύλοι Αγίου Γεωργίου Φαρινάπ 500 gr,0.54
2025-08-19,201095,Knorr Asia Noodles Pot Λαχανικών 65 gr,1.32
2025-08-19,180346,Knorr Asia Noodles Pot Με Γεύση Κοτόπουλο 65 gr,1.32
2025-08-19,144631,Knorr Asia Noodles Αυγού 250 gr,2.24
2025-08-19,199259,Knorr Asia Noodles Λαχανικών 70 gr,0.62
2025-08-19,198274,Knorr Asia Noodles Με Γεύση Κοτόπουλο 70 gr,0.62
2025-08-19,179989,Knorr Pasta Snack Pot Bolognese 60 gr,1.32
2025-08-19,186289,Knorr Pasta Snack Pot Creamy Pesto 68 gr,1.32
2025-08-19,180343,Knorr Pasta Snack Pot Mac &amp; Cheese 62 gr,1.32
2025-08-19,180344,Knorr Pasta Snack Pot XXL Καρμπονάρα 92 gr,1.67
2025-08-19,179407,Knorr Pasta Snack Pot Ζυμαρικά Με Μανιτάρια 59 gr,1.32
2025-08-19,178217,Knorr Pasta Snack Pot Καρμπονάρα 55 gr,1.32
2025-08-19,165197,Maggi Magic Asia Noodles Cup Κάρυ 63 gr,1.19
2025-08-19,165195,Maggi Magic Asia Noodles Cup Κοτόπουλο 63 gr,1.19
2025-08-19,165196,Maggi Magic Asia Noodles Cup Πάπια 63 gr,1.19
2025-08-19,117267,Maggi Noodles Με Γεύση Βοδινό 59.2 gr,0.56
2025-08-19,117268,Maggi Noodles Με Γεύση Κοτόπουλο 59.2 gr,0.56
2025-08-19,179561,Maggi Noodles Με Γεύση Λαχανικών 59.2 gr,0.56
2025-08-19,117269,Maggi Noodles Με Γεύση Μανιτάρι 59.2 gr,0.56
2025-08-19,179560,Maggi Saucy Noodles Sweet Chili 75 gr,1.35
2025-08-19,179562,Maggi Saucy Noodles Teriyaki 75 gr,1.35
2025-08-19,105214,Oriental Express Noodles Ασιατικά Λαχανικά 3΄ Vegan 87 gr,0.78
2025-08-19,191347,Oriental Express Noodles Με Μοσχαράκι 3΄ Vegan 87 gr,0.78
2025-08-19,105212,Oriental Express Noodles Με Πάπια Πεκίνου 3΄ Vegan 87 gr,0.78
2025-08-19,105213,Oriental Express Noodles Ψητή Γαρίδα 3΄ Vegan 87 gr,0.78
2025-08-19,202703,Reeva Noodles Bowl Με Γεύση Βοδινό 75 gr,1.7
2025-08-19,202710,Reeva Noodles Bowl Με Γεύση Κοτόπουλο 75 gr,1.7
2025-08-19,202699,Reeva Noodles Με Γεύση Βοδινό 60 gr,0.45
2025-08-19,202689,Reeva Noodles Με Γεύση Κότοπουλο 5 x 60 gr,1.8
2025-08-19,202694,Reeva Noodles Με Γεύση Κότοπουλο 60 gr,0.45
2025-08-19,202697,Reeva Noodles Με Γεύση Τυρί &amp; Μπέικον 60 gr,0.45
2025-08-19,182821,Soba Noodles Cup Κλασική Γεύση 90 gr,2.32
2025-08-19,182819,Soba Noodles Cup Τεριγιάκι 90 gr,2.32
2025-08-19,190560,Soba Noodles Cup Τσίλι 92 gr,2.32
2025-08-19,133486,Oriental Express Noodles Vegan 5 x 75 gr,3.25
2025-08-19,134371,Oriental Express Noodles Αυγών 300 gr,2.52
2025-08-19,133231,Oriental Express Noodles Ρυζιού Stir Fry Vegan Χωρίς Γλουτένη 225 gr,2.9
2025-08-19,133232,Oriental Express Noodles Ρυζιού Πλατιά Vegan Χωρίς Γλουτένη 225 gr,2.9
2025-08-19,182898,Oriental Express Ρύζι Για Σούσι Vegan 500 gr,3.38
2025-08-19,123014,Biona Organic Λάδι Καρύδας Ψυχρής Έκθλιψης Βιολογικό Vegan 400 gr,14.66
2025-08-19,200385,Kikkoman Panko Japanese Style Crispy Bread Crumbs  227 gr,3.98
2025-08-19,160256,Knorr Asia Σάλτσα Σόγιας 175 ml,2.75
2025-08-19,152859,Land Krone Λάδι Καρύδας Ψυχρής Έκθλιψης Vegan Βιολογικό 200 gr,7.17
2025-08-19,192197,Lee Kum Kee Σάλτσα Πάπια Πεκίνου 383 gr,4.68
2025-08-19,192195,Lee Kum Kee Σάλτσα Τσίλι &amp; Σκόρδο 368 gr,4.6
2025-08-19,201427,Maggi Σάλτσα Sweet &amp; Sour 355 gr,3.48
2025-08-19,191346,Oriental Express Bamboo Chopsticks 8 Ζέυγη,1.88
2025-08-19,183389,Oriental Express Nori Για Σούσι 5 Φύλλα Χωρίς Γλουτένη Vegan 14 gr,2.42
2025-08-19,191345,Oriental Express Sushi Bamboo Mat 24 x 24 cm,1.68
2025-08-19,182818,Oriental Express Tempura Batter Mix Vegan 150 gr,2.37
2025-08-19,170958,Oriental Express Ασιατικά Λαχανικά Με Ανανά Vegan Χωρίς Γλουτένη 330 gr,2.29
2025-08-19,104416,Oriental Express Γάλα Καρύδας Vegan Χωρίς Γλουτένη 400 ml,2.4
2025-08-19,105209,Oriental Express Κρέμα Καρύδας Vegan Χωρίς Γλουτένη 400 ml,2.52
2025-08-19,183386,Oriental Express Πολτός Wasabi 43 gr,2.49
2025-08-19,183253,Oriental Express Σούσι Τζίντζερ Vegan Χωρίς Γλουτένη 190 gr,3.67
2025-08-19,182817,Oriental Express Φρυγανιά Παναρίσματος Panko Vegan 200 gr,2.5
2025-08-19,178317,Oriental Express Φύτρες Φασολιών Vegan Χωρίς Γλουτένη 330 gr,2.2
2025-08-19,158017,Tipiak Κινόα Πλιγούρι 250 gr,3.46
2025-08-19,85982,Tipiak Κους Κους 500 gr,2.85
2025-08-19,117758,Chrisopigi Έξτρα Παρθένο Ελαιόλαδο 1 lt,12.5
2025-08-19,147110,Chrisopigi Έξτρα Παρθένο Ελαιόλαδο 250 ml,4.1
2025-08-19,179528,Lasitia Έξαιρετικό Παρθένο Ελαιόλαδο 0.3 ΠΟΠ 750 ml,8.6
2025-08-19,206044,Lasitia Έξαιρετικό Παρθένο Ελαιόλαδο ΠΟΠ 750 ml,7.65
2025-08-19,191535,Lasitia Έξαιρετικό Παρθένο Ελαιόλαδο ΠΟΠ 250 ml,2.68
2025-08-19,191536,Lasitia Έξαιρετικό Παρθένο Ελαιόλαδο ΠΟΠ 500 ml,5.25
2025-08-19,99121,Lyrakis Family Εξαιρετικό Παρθένο Ελαιόλαδο 1 lt,10.4
2025-08-19,99123,Lyrakis Family Εξαιρετικό Παρθένο Ελαιόλαδο 2 lt,19.45
2025-08-19,189577,Molon Lave Εξαιρετικό Παρθένο Ελαιόλαδο 1 lt,8.32
2025-08-19,189576,Molon Lave Εξαιρετικό Παρθένο Ελαιόλαδο 4 lt,29.98
2025-08-19,192697,Molon Lave Εξαιρετικό Παρθένο Ελαιόλαδο 500 ml,5.35
2025-08-19,203313,Εκλεκτό Έξτρα Παρθένο Ελαιόλαδο 1 lt,6.9
2025-08-19,5962,Μινέρβα Ελαιόλαδο Κλασικό 1 lt,6.97
2025-08-19,66566,Μινέρβα Ελαιόλαδο Κλασικό 750 ml,8.46
2025-08-19,158758,Χρυσελιά Ελαιόλαδο Κλασικό 1 lt,7.2
2025-08-19,77405,Χωριό Ελαιόλαδο Βιολογικό 750 ml,11.2
2025-08-19,66565,Χωριό Παρθένο Ελαιόλαδο 750 ml,9.21
2025-08-19,177471,Ωμέγα Ζάχαρη Άχνη 400 gr,0.65
2025-08-19,203678,Canderel Sugarly Υποκατάστατο Ζάχαρης Υγρό Γλυκαντικό Vegan Χωρίς Γλουτένη 205 ml,3.28
2025-08-19,95789,Canderel Υποκατάστατο Ζάχαρης 120 Δισκία 10-2 gr,3.58
2025-08-19,202014,Canderel Υποκατάστατο Ζάχαρης 300 Δισκία 25-5 gr,6.95
2025-08-19,203677,Canderel Υποκατάστατο Καστανής Ζάχαρης Υγρό Γλυκαντικό Vegan Χωρίς Γλουτένη 55 ml,3.48
2025-08-19,205447,Freevia Γλυκαντικό Με Stevia Σε Sticks 50 Τεμάχια ,3.2
2025-08-19,201670,Freevia Υγρό Γλυκαντικό Με Stevia 60 ml,3.48
2025-08-19,205448,Freevia Υγρό Γλυκαντικό Με Stevia Υγρό Σε Sticks 50 Τεμάχια,2.98
2025-08-19,34089,Hai Σιρόπι Γλυκόζης 400 gr,2.36
2025-08-19,202948,Isostevia Γλυκαντικό Με Stevia Σε Σκόνη Vegan Χωρίς Γλουτένη 150 gr,4.4
2025-08-19,183164,Isostevia Υγρό Γλυκαντικό Με Stevia Vegan Χωρίς Γλουτένη 60 ml,3.16
2025-08-19,183993,Natreen Υποκατάστατο Ζάχαρης 120 Δισκία 7-6 gr,4.38
2025-08-19,2998,Natreen Υποκατάστατο Ζάχαρης Βάζο 70 gr,4.98
2025-08-19,168488,Slim Fix Υγρό Γλυκαντικό Stevia 60 ml,3.8
2025-08-19,160091,Γιώτης Sweet &amp; Balance Γλυκαντικό Με Stevia 100 Δισκία 6-5 gr,3.65
2025-08-19,120099,Γιώτης Sweet &amp; Balance Γλυκαντικό Με Stevia 80 gr,4.15
2025-08-19,178014,Γιώτης Sweet &amp; Balance Γλυκαντικό Με Stevia Σε Κρυσταλλική Μορφή 500 gr,7.28
2025-08-19,178420,Ζωγράφος Slim Line Γλυκαντικό Stevia Σε Σκόνη 150 gr,3.56
2025-08-19,72080,Ζωγράφος Slim Line Γλυκαντικό Επιτραπέζιο Σε Σκόνη 90 gr,3.53
2025-08-19,117588,Ζωγράφος Slim Line Γλυκαντικό Σε Δισκία 100 Τεμάχια 5.5 gr,2.95
2025-08-19,178419,Ζωγράφος Slim Line Υγρό Γλυκαντικό Stevia 125 ml,3.2
2025-08-19,2900,Ζωγράφος Φρουκτόζη Χωρίς Γλουτένη 400 gr,2.58
2025-08-19,71231,Bio Farma Ζάχαρη Από Ζαχαροκάλαμο Βιολογική 500 gr,2.24
2025-08-19,142261,Bio Vita Ζάχαρη Ακατέργαστη Βιολογική 500 gr,2.2
2025-08-19,149359,Evergreen Ζάχαρη Καρύδας Βιολογική Vegan 250 gr,2.2
2025-08-19,153168,Fytro Καστανή Ζάχαρη Ακατέργαστη Vegan 500 gr ,1.58
2025-08-19,153169,Fytro Μαύρη Ζάχαρη Vegan 500 gr,2.26
2025-08-19,147752,Health Trade Natural Καστανή Ζάχαρη Demerara 500 gr,1.34
2025-08-19,120485,Minos Ζάχαρη Brown Σε Sticks 250 gr,3.45
2025-08-19,23171,Ζωγράφος Καστανή Ζάχαρη Vegan Χωρίς Γλουτένη 500 gr ,1.55
2025-08-19,163600,Diamant Λευκή Κρυσταλλική Ζάχαρη 1 kg,0.75
2025-08-19,98497,Poem Ζάχαρη Λευκή Σε Sticks 50 Τεμάχια 175 gr,2.4
2025-08-19,162479,Barilla Τορτελίνια Με 3 Τυριά 500 gr,5.95
2025-08-19,2834,Barilla Τορτελίνια Με Προσούτο &amp; Τυρί 250 gr,3.58
2025-08-19,2841,Barilla Τορτελίνια Με Τυρί 250 gr,3.58
2025-08-19,51835,Melissa Τορτελίνια Με 5 Τυριά 250 gr,2.1
2025-08-19,192787,Melissa Τορτελίνια Με 5 Τυριά 500 gr,3.86
2025-08-19,65339,Melissa Τορτελίνια Με Φέτα 250 gr,2.1
2025-08-19,134843,Melissa Τορτελίνια Ολικής Άλεσης Με Γέμιση Τυριών 250 gr,2.13
2025-08-19,189147,Melissa Τορτελίνια Τρικολόρε Με Τυριά 250 gr,2.1
2025-08-19,2896,Misko Τορτελίνια Με Τυριά 250 gr,2.07
2025-08-19,79817,Misko Τορτελίνια Με Τυριά 500 gr,3.8
2025-08-19,188659,Misko Τορτελίνια Με Τυριά Ολικής Άλεσης 250 gr,2.08
2025-08-19,194458,Misko Τορτελίνια Τρικολόρε Με Τυριά 250 gr,2.13
2025-08-19,196642,Ήλιος Τορτελίνια Με 3 Τυριά 250 gr,1.39
2025-08-19,199312,Ήλιος Τορτελίνια Με 3 Τυριά 500 gr,2.64
2025-08-19,36536,Barilla Ζυμαρικά Λιγκουίνι Ν13 500 gr,1.72
2025-08-19,187208,Barilla Ζυμαρικά Integrale Spaghettini Ν3 500 gr,1.71
2025-08-19,174336,Barilla Ζυμαρικά Λιγκουϊνι Ολικής Άλεσης 500 gr,2.04
2025-08-19,72102,Barilla Μακαρόνια Integrale Spaghetti Ολικής Άλεσης Ν5 500 gr,1.71
2025-08-19,149909,Barilla Μακαρόνια Spaghetti Χωρίς Γλουτένη Ν5 400 gr,3.66
2025-08-19,33959,Barilla Μακαρόνια Για Παστίτσιο Ν10 500 gr,1.85
2025-08-19,2784,Barilla Μακαρόνια Ν3 Σπαγγετίνη 500 gr,1.51
2025-08-19,2778,Barilla Μακαρόνια Ν5 Σπαγγέτι 500 gr,1.51
2025-08-19,2779,Barilla Μακαρόνια Ν7 Σπαγγετόνι 500 gr,1.51
2025-08-19,2783,Barilla Σπαγγετίνη Capellini Ν1 500 gr,1.8
2025-08-19,205452,De Cecco Μακαρόνια Linguine N7 500 gr,1.72
2025-08-19,101385,De Cecco Μακαρόνια Ν12 500 gr,1.72
2025-08-19,2830,Melissa Μακαρόνια Για Παστίτσιο Ν2 500 gr,1.02
2025-08-19,180872,Melissa Μακαρόνια Λιγκουίνι Ολικής Άλεσης 500 gr,1.23
2025-08-19,198488,Melissa Μακαρόνια Σπαγγέτι High Protein 400 gr,1.68
2025-08-19,135455,Melissa Μακαρόνια Σπαγγέτι Βιολογικά 500 gr,1.74
2025-08-19,176803,Melissa Μακαρόνια Σπαγγέτι Καρότο Vegan 400 gr,1.22
2025-08-19,2811,Melissa Μακαρόνια Σπαγγέτι Ν6 500 gr,0.75
2025-08-19,180734,Melissa Μακαρόνια Σπαγγέτι Ολικής Άλεσης Ν10 500 gr,1.02
2025-08-19,76474,Melissa Μακαρόνια Σπαγγέτι Ολικής Άλεσης Ν6 500 gr,1.02
2025-08-19,176801,Melissa Μακαρόνια Σπαγγέτι Σπανάκι Vegan 400 gr,1.22
