2025-08-19,57790,Παυλίδης Σοκολάτα Υγείας Με Φουντούκια 100 gr,2.85
2025-08-19,112693,Anna Herbs Δίχταμος Έρωντας 15 gr,1.08
2025-08-19,112701,Anna Herbs Μαλοτήρα Τσάι Του Βουνού 20 gr,1.08
2025-08-19,112708,Anna Herbs Σαρανταδέντρι Καρτεράκι 30 gr,1.08
2025-08-19,112715,Anna Herbs Φασκόμηλο 25 gr,1.08
2025-08-19,112717,Anna Herbs Χαμόμηλο 25 gr,1.08
2025-08-19,179954,Cretan Beauty Δίκταμος Βιολογικός 50 gr,3.25
2025-08-19,203518,Iliostasio Αφέψημα Αντιστρές Βιολογικό 20 gr,1.85
2025-08-19,189198,Iliostasio Αφέψημα Μαλοτήρα 15 gr,1.85
2025-08-19,191918,Iliostasio Τσάι Μαλοτήρα Βιολογικό 10 x 1 gr,1.98
2025-08-19,191916,Iliostasio Τσάι Πρωινό Βιολογικό 10 x 1 gr,1.98
2025-08-19,191917,Iliostasio Τσάι Χαμομήλι Βιολογικό 10 x 1 gr,1.88
2025-08-19,123201,Krocus Kozanis Ρόφημα Με Κρόκο Κοζάνης &amp; Μέλι Χωρίς Γλουτένη 10 x 1-8 gr,3.03
2025-08-19,123200,Krocus Kozanis Ρόφημα Με Κρόκο Κοζάνης &amp; Πιπερόριζα Χωρίς Γλουτένη 10 x 1-8 gr,3.03
2025-08-19,158734,Krocus Kozanis Ρόφημα Με Κρόκο Κοζάνης- Κανέλλα &amp; Γαρύφαλλο Χωρίς Γλουτένη 10 x 1-8 gr,3.03
2025-08-19,85185,Lipton Αφέψημα Μήλο Κανέλα 20 x 2.2 gr,3.22
2025-08-19,2219,Lipton Χαμομήλι Αφέψημα 10 x 1 gr,0.88
2025-08-19,36829,Lipton Χαμομήλι Αφέψημα 20 x 1 gr,1.74
2025-08-19,177191,Thamma Αφέψημα Cretan Daylight Βιολογικό Vegan Χωρίς Γλουτένη 12 x 1-5 gr,3.88
2025-08-19,202558,Thamma Αφέψημα Earl Grey Tea Βιολογικό Vegan 12 x 2 gr,2.95
2025-08-19,177195,Thamma Αφέψημα Gentle Evening Βιολογικό Vegan Χωρίς Γλουτένη 12 x 1 gr,3.88
2025-08-19,177194,Thamma Αφέψημα Louisa Darling Βιολογικό Vegan Χωρίς Γλουτένη 12 x 1-5 gr,3.88
2025-08-19,202559,Thamma Αφέψημα Pure Green Tea Βιολογικό Vegan 12 x 2 gr,2.95
2025-08-19,160641,Καρτεράκι Βοτανικό Αφέψημα Κρητικό Παραδοσιακό Τσάι 10 x 1 gr,1.53
2025-08-19,160643,Καρτεράκι Βοτανικό Αφέψημα Κρητικό Πράσινο Τσάι 10 x 1-2 gr,1.53
2025-08-19,160642,Καρτεράκι Βοτανικό Αφέψημα Κρητικό Τσάι 10 x 1 gr,1.53
2025-08-19,203672,Καρτεράκι Βοτανικό Αφέψημα Τσάι Του Βουνού 10 x 1 gr,1.92
2025-08-19,182816,Κοπέλι Κοκτέιλ Βοτάνων Αφέψημα 20 x 1-2 gr,2.32
2025-08-19,190635,Κοπέλι Πράσινο Τσάι Ιβίσκος &amp; Κανέλα 20 x 1.8 gr,2.32
2025-08-19,194617,Κοπέλι Στιγμιαίο Αφέψημα Τσάι Με Λουίζα &amp; Μέντα 20 x 1-2 gr,2.32
2025-08-19,184608,Κοπέλι Τσάι Βαλεριάνα &amp; Μελισσόχορτο Παραδοσιακό Κρητικό Αφέψημα 20 x 1-5 gr,2.32
2025-08-19,118969,Κοπέλι Τσάι Του Βουνού Μαλοτήρα Με Ματζουράνα Παραδοσιακό Κρητικό Αφέψημα 20 x 1 gr,2.32
2025-08-19,183540,Κοπέλι Τσάι Του Βουνού Παραδοσιακό Κρητικό Αφέψημα 20 x 1-2 gr,2.32
2025-08-19,182815,Κοπέλι Χαμόμηλο Στιγμιαίο Αφέψημα 20 x 1-2 gr,1.65
2025-08-19,179951,Cretan Beauty Τσάι Mix Του Παππού Βιολογικό 50 gr,3.25
2025-08-19,179953,Cretan Beauty Τσάι Του Βουνού Βιολογικό 50 gr,3.25
2025-08-19,98256,Lipton Green Tea Classic 20 x 1.3 gr,2.7
2025-08-19,104840,Lipton Green Tea Mint Πυραμίδες 20 x 1-6 gr,3.48
2025-08-19,36827,Lipton Green Tea Orient 20 x 1-3 gr,2.65
2025-08-19,201320,Lipton Orange Arancia Μαύρο Τσάι Με Πορτοκάλι Πυραμίδες 20 x 1.7 gr,3.38
2025-08-19,52509,Lipton Tea Μαύρο Τσάι Forest Fruits Πυραμίδες 20 x 1.7 gr,3.38
2025-08-19,52197,Lipton Tea Μαύρο Τσάι Vanilla Caramel Πυραμίδες 20 x 1.7 gr,3.38
2025-08-19,2106,Lipton Yellow Label Μαύρο Τσάι 10 x 1-5 gr,1.24
2025-08-19,2102,Lipton Yellow Label Μαύρο Τσάι 100 x 1-5 gr,8.35
2025-08-19,2109,Lipton Yellow Label Μαύρο Τσάι 20 x 1-5 gr,2.0
2025-08-19,197830,Lipton Αφέψημα Γκρέιπφρουτ &amp; Πορτοκάλι 20 x 1.7 gr,2.85
2025-08-19,69728,Twinings Earl Grey Πράσινο Τσάι 25 x 1-6 gr ,6.4
2025-08-19,2166,Twinings Earl Grey Τσάι 10 x 2 gr,3.08
2025-08-19,19458,Twinings Earl Grey Τσάι 25 x 2 gr,5.32
2025-08-19,2228,Twinings English Breakfast Μαύρο Τσάι 10 x 2 gr,2.93
2025-08-19,30774,Twinings English Breakfast Μαύρο Τσάι 25 x 2 gr,5.5
2025-08-19,53009,Twinings Pure Πράσινο Τσάι 25 x 2 gr,5.88
2025-08-19,189106,Twinings Superblends Τσάι Energy 18 x 2 gr,5.18
2025-08-19,189105,Twinings Superblends Τσάι Focus 18 x 1-5 gr ,5.18
2025-08-19,30773,Twinings Πράσινο Τσάι &amp; Λεμόνι 25 x 1-6 gr,5.93
2025-08-19,145432,Twinings Πράσινο Τσάι Jasmine 10 x 1-8 gr,3.88
2025-08-19,132896,Κοπέλι Πράσινο Τσάι 20 x 2 gr,1.8
2025-08-19,160922,Κοπέλι Πράσινο Τσάι Με Βότανα 20 x 1-8 gr,2.32
2025-08-19,114601,Chupa Chups Γλειφιτζούρι Melody Pop 15 gr,0.49
2025-08-19,72077,Chupa Chups Γλειφιτζούρι Μύλος Διάφορα Φρούτα 12 gr,0.4
2025-08-19,191138,Fruities Ζελεδάκια Μίνι Με Διάφορα Φρούτα 350 gr,2.2
2025-08-19,191137,Fruities Ζελεδάκια Με Διάφορα Φρούτα 400 gr,2.2
2025-08-19,167327,Greek Recipes Discover Καραμέλες 200 gr ,2.0
2025-08-19,167328,Greek Recipes Discover Καραμέλες Ούζου 200 gr,2.0
2025-08-19,193152,Halls Καραμέλες Citrus Mix Χωρίς Ζάχαρη 32 gr,0.95
2025-08-19,137007,Halls Καραμέλες Extra Strong Χωρίς Ζάχαρη 32 gr,0.95
2025-08-19,36529,Halls Καραμέλες Original Χωρίς Ζάχαρη 28 gr,1.1
2025-08-19,148586,Halls Καραμέλες Original Χωρίς Ζάχαρη 32 gr,0.95
2025-08-19,137008,Halls Καραμέλες Κανέλα Χωρίς Ζάχαρη 32 gr,0.95
2025-08-19,184221,Halls Καραμέλες Καρπούζι Χωρίς Ζάχαρη 32 gr,0.95
2025-08-19,34450,Halls Καραμέλες Κεράσι Χωρίς Ζάχαρη 28 gr,1.1
2025-08-19,148902,Halls Καραμέλες Κεράσι Χωρίς Ζάχαρη 32 gr,0.95
2025-08-19,153335,Halls Καραμέλες Μέλι &amp; Λεμόνι Χωρίς Ζάχαρη 32 gr,0.95
2025-08-19,148901,Halls Καραμέλες Φράουλα Με Βιταμίνη C Χωρίς Ζάχαρη 32 gr,0.95
2025-08-19,187375,Haribo Ζελεδάκια Berries 175 gr,1.58
2025-08-19,198414,Haribo Ζελεδάκια Dragibus 180 gr,1.67
2025-08-19,189578,Haribo Ζελεδάκια Frizzi Mix 100 gr,1.0
2025-08-19,168027,Haribo Ζελεδάκια Happy Cherries 200 gr,1.67
2025-08-19,168028,Haribo Ζελεδάκια Happy Cola 200 gr,1.67
2025-08-19,198413,Haribo Ζελεδάκια Mallow Mania 175 gr,2.03
2025-08-19,191858,Haribo Ζελεδάκια Miami Fizz 85 gr,1.0
2025-08-19,190389,Haribo Ζελεδάκια Pasta Fruit Vegan 160 gr,1.58
2025-08-19,168032,Haribo Ζελεδάκια Star Mix 200 gr,1.67
2025-08-19,205571,Haribo Ζελεδάκια Tropifrutti 175 gr,1.67
2025-08-19,168035,Haribo Ζελεδάκια Worms 200 gr,1.67
2025-08-19,198412,Haribo Ζελεδάκια Καρπούζι 160 gr,1.67
2025-08-19,205198,Haribo Ζελεδάκια Φράουλα Erdbeeren 175 gr,1.67
2025-08-19,175042,Haribo Ζελεδάκια Χρυσά Αρκουδάκια 100 gr,1.0
2025-08-19,168030,Haribo Ζελεδάκια Χρυσά Αρκουδάκια Γεύσεις Φρούτων 200 gr,1.67
2025-08-19,152045,Haribo Καραμέλες Mao Mix 135 gr,1.67
2025-08-19,173557,Mentos Καραμέλες Clean Breath Winter Green 2 Ώρες Χωρίς Ζάχαρη Χωρίς Γλουτένη 21 gr,1.38
2025-08-19,204366,Mentos Καραμέλες Clean Breath Λεμόνι &amp;  Μελισσόχορτο Χωρίς Ζάχαρη Χωρίς Γλουτένη 21 gr,1.38
2025-08-19,1346,Mentos Καραμέλες Μέντα 38 gr,0.9
2025-08-19,1347,Mentos Καραμέλες Φρούτα 38 gr,0.9
2025-08-19,206107,Skittles Crazy Sours Καραμέλες Με Γεύση Φρούτων 38 gr,0.88
2025-08-19,197318,Skittles Crazy Sours Καραμέλες Με Γεύση Φρούτων Vegan 136 gr,1.98
2025-08-19,206108,Skittles Fruits Καραμέλες Με Γεύση Φρούτων 38 gr,0.88
2025-08-19,197229,Skittles Fruits Καραμέλες Με Γεύση Φρούτων Vegan 136 gr,1.98
2025-08-19,101489,Tic Tac Καραμέλες Πορτοκάλι 18 gr,0.99
2025-08-19,170220,Viap Mentel Παστίλιες Αρωματικές 60 gr,1.75
2025-08-19,170219,Viap Mentel Παστίλιες Ευκάλυπτος &amp; Μεντα 60 gr,1.75
2025-08-19,191579,Werthers Original Καραμέλες Creamy Filling 135 gr,1.98
2025-08-19,1302,Werthers Original Καραμέλες Βουτύρου 50 gr,1.08
2025-08-19,197474,Λάβδας Gum On Ζελεδάκια Bacon &amp; Eggs 80 gr,1.16
2025-08-19,197475,Λάβδας Gum On Ζελεδάκια Burger Combo 80 gr,1.16
2025-08-19,197477,Λάβδας Gum On Ζελεδάκια Chilli Peppers 80 gr,1.16
2025-08-19,167548,Λάβδας Gum On Ζελεδάκια Jelly Beans 90 gr,1.16
2025-08-19,197476,Λάβδας Gum On Ζελεδάκια Slay Snakes 80 gr,1.16
2025-08-19,205468,Λάβδας Καραμέλες Με Γεύσεις Φρούτων 250 gr,1.77
2025-08-19,192517,Λαβδάς Jelly Pops Καραμέλες Ζελεδάκια Με Χυμό Φρούτων 350 gr ,3.38
2025-08-19,189108,Λαβδάς Pic Nic Καραμέλες Σε Γεύσεις Φρούτων &amp; Βουτύρου 250 gr,2.2
2025-08-19,91890,Bubbaloo Τσίχλες Φράουλα 38 gr,0.65
2025-08-19,181283,Chupa Chups Big Babol Τσίχλες Magic Cubes 41 Τεμάχια 86 gr,2.98
2025-08-19,103649,Chupa Chups Big Babol Τσίχλες Γεύση Φρούτων 6 Τεμάχια 27-6 gr,0.65
2025-08-19,172989,Chupa Chups Big Babol Τσίχλες Γεύση Φρούτων Χωρίς Ζάχαρη 16 Τεμάχια 64 gr,2.0
2025-08-19,204361,Chupa Chups Bubble Gum Fruit Mix 80 gr,1.48
2025-08-19,204363,Chupa Chups Bubble Gum Play Tennis 18 Τεμάχια 90 gr,2.5
2025-08-19,204362,Chupa Chups Bubble Gum Watermelon 80 gr,1.48
2025-08-19,143159,Dentyne Fire Τσίχλες Κανέλα Χωρίς Ζάχαρη 12 Τεμάχια 16-8 gr,1.2
2025-08-19,189770,Dentyne Fire Τσίχλες Κανέλα Χωρίς Ζάχαρη 58 Τεμάχια 81-2 gr,2.98
2025-08-19,145268,Dentyne Ice Τσίχλες Δυόσμος Χωρίς Ζάχαρη 12 Τεμάχια 16-8 gr,1.2
2025-08-19,153151,Dentyne Ice Τσίχλες Μέντα Χωρίς Ζάχαρη 12 Τεμάχια 16-8 gr,1.2
2025-08-19,189771,Dentyne Τσίχλες Δυόσμος Χωρίς Ζάχαρη 58 Τεμάχια 81-2 gr,2.98
2025-08-19,154875,Mentos 45 Min Τσίχλες Δυόσμος Χωρίς Ζάχαρη 12 Τεμάχια 18 gr,1.1
2025-08-19,122701,Mentos Pure Fresh Τσίχλες Bubble Fresh Χωρίς Ζάχαρη 28 gr,1.38
2025-08-19,147900,Mentos Pure Fresh Τσίχλες Bubble Fresh Χωρίς Ζάχαρη 30 gr,1.2
2025-08-19,172991,Mentos Pure Fresh Τσίχλες Bubble Fresh Χωρίς Ζάχαρη 30 Τεμάχια 60 gr,2.48
2025-08-19,84417,Mentos Pure Fresh Τσίχλες Wintergreen Χωρίς Ζάχαρη 28 gr,1.38
2025-08-19,147899,Mentos Pure Fresh Τσίχλες Δυόσμος Χωρίς Ζάχαρη 30 gr,1.2
2025-08-19,100725,Mentos Pure Fresh Τσίχλες Λεμόνι Χωρίς Ζάχαρη 28 gr,1.38
2025-08-19,147898,Mentos Pure Fresh Τσίχλες Φρέσκια Μέντα Χωρίς Ζάχαρη 30 gr,1.2
2025-08-19,83305,Mentos Pure White Τσίχλες Δυόσμος 45 Τεμάχια 90 gr,3.28
2025-08-19,204364,Mentos Storming Τσίχλες Tropical Χωρίς Ζάχαρη 12 Τεμάχια 33 gr,1.2
2025-08-19,116579,Mentos Storming Τσίχλες Δυόσμος Χωρίς Ζάχαρη 12 Τεμάχια 33 gr,1.2
2025-08-19,199315,Mentos Vitamins Τσίχλες Berry Mix Χωρίς Ζάχαρη 45 Τεμάχια 90 gr,3.48
2025-08-19,186762,Mentos Vitamins Τσίχλες Εσπεριδοειδή Χωρίς Ζάχαρη 45 Τεμάχια 90 gr,3.48
2025-08-19,66844,Orbit Professional White Τσίχλες Δυόσμος Χωρίς Ζάχαρη 46 Τεμάχια 64 gr,2.98
2025-08-19,178671,Orbit Refresher&#039;s Τσίχλες Bubblemint Χωρίς Ζάχαρη 30 Τεμάχια 67 gr,2.98
2025-08-19,186106,Orbit Refresher&#039;s Τσίχλες Tropical Χωρίς Ζάχαρη 30 Τεμάχια 67 gr,2.98
2025-08-19,178673,Orbit Refresher&#039;s Τσίχλες Δυόσμος Χωρίς Ζάχαρη 30 Τεμάχια 67 gr,2.98
2025-08-19,178670,Orbit Refresher&#039;s Τσίχλες Δυόσμος Χωρίς Ζάχαρη 7 Τεμάχια 15-6 gr,0.99
2025-08-19,203937,Orbit Refresher&#039;s Τσίχλες Καρπούζι Ράσμπερι Χωρίς Ζάχαρη 30 Τεμάχια 67 gr,2.98
2025-08-19,190515,Orbit Refresher&#039;s Τσίχλες Μέντα Χωρίς Ζάχαρη 30 Τεμάχια 67 gr,2.98
2025-08-19,191155,Orbit Refresher&#039;s Τσίχλες Φράουλα &amp; Λεμόνι Χωρίς Ζάχαρη 30 Τεμάχια 67 gr,2.98
2025-08-19,164826,Orbit White Τσίχλες Citrus 46 Τεμάχια 64 gr,2.98
2025-08-19,153944,Orbit Τσίχλες Bubblemint Bottle Χωρίς Ζάχαρη 46 Τεμάχια 64 gr,2.98
2025-08-19,193908,Orbit Τσίχλες Bubblemint Χωρίς Ζάχαρη 10 Τεμάχια 14 gr,0.78
2025-08-19,193907,Orbit Τσίχλες Strawberry Χωρίς Ζάχαρη 10 Τεμάχια 14 gr,0.78
2025-08-19,100206,Orbit Τσίχλες Sweet Mint Χωρίς Ζάχαρη 10 Τεμάχια 14 gr,0.78
2025-08-19,193296,Orbit Τσίχλες Για Παιδιά Χωρίς Ζάχαρη 7 Τεμάχια 14-4 gr,0.88
2025-08-19,154202,Orbit Τσίχλες Δυόσμος 21 Τεμάχια 29 gr,0.99
2025-08-19,100205,Orbit Τσίχλες Δυόσμος Χωρίς Ζάχαρη 10 Τεμάχια 14 gr,0.78
2025-08-19,66843,Orbit Τσίχλες Δυόσμος Χωρίς Ζάχαρη 46 Τεμάχια 64 gr,2.98
2025-08-19,153880,Orbit Τσίχλες Φράουλα Χωρίς Ζάχαρη 46 Τεμάχια 64 gr,2.98
2025-08-19,192011,Trident Long Τσίχλες Μέντα Χωρίς Ζάχαρη 10 Τεμάχια 22 gr,1.2
2025-08-19,53300,Trident Max Splash Τσίχλες Βανίλια Μέντα Χωρίς Ζάχαρη 10 Τεμάχια 22 gr,1.2
2025-08-19,67503,Trident Max Splash Τσίχλες Δυόσμος Χωρίς Ζάχαρη 10 Τεμάχια 22 gr ,1.2
2025-08-19,76199,Trident Max Splash Τσίχλες Δυόσμος Χωρίς Ζάχαρη 23 Τεμάχια 50.6 gr,2.0
2025-08-19,55391,Trident Max Splash Τσίχλες Φράουλα Λάιμ Χωρίς Ζάχαρη 10 Τεμάχια 22 gr,1.2
2025-08-19,168510,Trident Max Τσίχλες Δυόσμος Χωρίς Ζάχαρη 14 Τεμάχια 27 gr,1.2
2025-08-19,168507,Trident Max Τσίχλες Ροδάκινο &amp; Καρπούζι Χωρίς Ζάχαρη 14 Τεμάχια 27 gr,1.2
2025-08-19,188152,Trident Oral-B Τσίχλες White Δυόσμος Χωρίς Ζάχαρη 10 Τεμάχια 17 gr,1.2
2025-08-19,189769,Trident Oral-B Τσίχλες White Δυόσμος Χωρίς Ζάχαρη 40 Τεμάχια 68 gr,2.98
2025-08-19,172699,Trident Oral-B Τσίχλες Δυόσμος Χωρίς Ζάχαρη 10 Τεμάχια 17 gr,1.2
2025-08-19,181490,Trident Oral-B Τσίχλες Δυόσμος Χωρίς Ζάχαρη 40 Τεμάχια 68 gr,2.98
2025-08-19,172701,Trident Oral-B Τσίχλες Μέντα Χωρίς Ζάχαρη 10 Τεμάχια 17 gr,1.2
2025-08-19,181491,Trident Oral-B Τσίχλες Μέντα Χωρίς Ζάχαρη 40 Τεμάχια 68 gr,2.98
2025-08-19,204365,Trident Senses Τσίχλες Tropical Χωρίς Ζάχαρη 14 Τεμάχια 27 gr,1.2
2025-08-19,168344,Trident Senses Τσίχλες Δυόσμος Χωρίς Ζάχαρη 14 Τεμάχια 27 gr,1.2
2025-08-19,168345,Trident Senses Τσίχλες Καρπούζι Χωρίς Ζάχαρη 14 Τεμάχια 27 gr,1.2
2025-08-19,168343,Trident Senses Τσίχλες Φράουλα Χωρίς Ζάχαρη 14 Τεμάχια 27 gr,1.2
2025-08-19,148752,Trident White Τσίχλες Χωρίς Ζάχαρη 16 Τεμάχια 23.8 gr,1.2
2025-08-19,148587,Trident Τσίχλες Φράουλα Χωρίς Ζάχαρη 16 Τεμάχια 23-8 gr,1.2
2025-08-19,190497,Έλμα Τσίχλες Soft Sticks Με Μαστίχα Χίου &amp; Μαστιχέλαιο Χωρίς Γλουτένη Χωρίς Ζάχαρη 31 gr,1.8
2025-08-19,199220,Έλμα Τσίχλες Soft Με Μαστίχα Χίου &amp; Μαστιχέλαιο Χωρίς Ζάχαρη 13 gr,0.98
2025-08-19,30300,Έλμα Τσίχλες Με Μαστίχα Χίου 13 gr,0.92
2025-08-19,72188,Έλμα Τσίχλες Με Μαστίχα Χίου Δυόσμος Χωρίς Ζάχαρη 13 gr,0.82
2025-08-19,145201,Έλμα Τσίχλες Με Μαστίχα Χίου Λεμόνι Χωρίς Ζάχαρη 13 gr,0.82
2025-08-19,30196,Έλμα Τσίχλες Με Μαστίχα Χίου Χωρίς Ζάχαρη 13 gr,0.92
2025-08-19,179189,Old El Paso Τορτίγιες Mini Soft 12 Τεμάχια 145 gr ,2.24
2025-08-19,168937,Old El Paso Τορτίγιες Χωρίς Γλουτένη 6 Τεμάχια 216 gr,2.04
2025-08-19,160470,Old El Paso Τορτίγιες Ολικής Άλεσης 6 Τεμαχίων 350 gr,1.83
2025-08-19,186666,Το Μάννα Λαδοπαξίμαδα Ολικής Άλεσης Από Πετρόμυλο 350 gr,2.44
2025-08-19,84720,Αρτοποιία Τσατσάκης Παξιμάδι Κριθαροκουλουρίτσα 600 gr,2.28
2025-08-19,198309,Αρτοποιία Τσατσάκης Μπουκίτσες Ελαιόλαδου Τύπου Κυθήρων Vegan 400 gr,2.24
2025-08-19,152866,Santa Maria Τορτίγιες Soft Τορτίγιες Ολικής Άλεσης Medium 8 Τεμάχια 320 gr,2.24
2025-08-19,134757,Mestemacher Ψωμί Protein Bread 250 gr,3.5
2025-08-19,187407,Το Μάννα Λαδοκούλουρο Με Χυμό Πορτοκαλιού &amp; Κανέλα 290 gr,2.54
2025-08-19,135578,Santa Maria Τορτίγιες Soft Τορτίγιες 8 Τεμάχια 320 gr,2.0
2025-08-19,181272,Tsanos Μουστοκούλουρα Με Σταφίδες &amp; Καρύδια Χωρίς Λακτόζη Vegan 300 gr,3.34
2025-08-19,181271,Tsanos Μουστοκούλουρα Μαλακά 350 gr,3.28
2025-08-19,118853,Mestemacher Ψωμί Με Λιναρόσπορο Βιολογικό 500 gr,3.12
2025-08-19,199382,Brioche Gourmet Μίνι Μπριός Με Κρέμα &amp; Σοκολάτα 300 gr,3.02
2025-08-19,3655,Mestemacher Ψωμί Σικάλεως Με Βρώμη 500 gr,3.02
2025-08-19,3778,Mestermacher Ψωμί Με 3 Δημητριακά 500 gr,3.02
2025-08-19,3779,Mestermacher Ψωμί Σικάλεως 500 gr,3.02
2025-08-19,195518,Το Μάννα Παξιμάδια Κριθαρένια Διπλοφουρνιστά Ολικής Άλεσης Χωρίς Αλάτι 300 gr ,1.99
2025-08-19,151636,Το Μάννα Παξιμάδι Μίνι Κριθαροκουλούρα 400 gr,2.58
2025-08-19,181273,Tsanos Κουλούρια Με Καρότο Χωρίς Ζάχαρη Χωρίς Λακτόζη Vegan 200 gr,2.48
2025-08-19,176415,Αρτοποιία Τσατσάκης Κρουτόν Διπλοφουρνιστά Με Ελαιόλαδο &amp; Σκόρδο Vegan 150 gr,1.16
2025-08-19,202333,Το Μάννα Παξιμάδια Κριθαρένια Mini Αφράτα 220 gr,1.74
2025-08-19,206931,Nutri Valley Κρουασάν Scooby Doo Με Γέμιση Κρέμα Κακάο 3 x 70 gr,1.61
2025-08-19,181255,Παπαδοπούλου Thins Φρυγανιές Ολικής Άλεσης Vegan 250 gr,1.96
2025-08-19,205210,Παπαδοπούλου Thins Φρυγανιές Σίκαλης Vegan 250 gr,1.96
2025-08-19,191392,Το Μάννα Δαγκωτό Παξιμαδάκια Με Ελιά &amp; Λιαστή Τομάτα 110 gr,1.43
2025-08-19,87068,Leimer Κρουτόν 100 gr,1.65
2025-08-19,100484,Leimer Κρουτόν Με Γεύση Σκόρδο &amp; Κρεμμύδι 100 gr,1.65
2025-08-19,190750,Big Taste Τσουρέκι Στριφτό 280 gr,1.58
2025-08-19,193342,Tsanos Κριτσίνια Με Ελαιόλαδο Ολικής Άλεσης Vegan 120 gr,1.58
2025-08-19,193341,Tsanos Κριτσίνια Πολύσπορα Με Ελαιόλαδο Vegan 120 gr,1.58
2025-08-19,175079,Έβγα Μηλόπιτα 80 gr,0.6
2025-08-19,184453,Βετεράνο Παξιμαδάκια Ολικής Άλεσης 400 gr ,2.52
2025-08-19,192632,Big Taste Κρουασάν Με Πραλίνα Φουντουκιού 150 gr,1.0
2025-08-19,199221,Champion Κρουασάν Super Με Γέμιση Πραλίνας Φουντουκιού 110 gr,0.75
2025-08-19,30211,Παπαδοπούλου Φρυγανιές Σταρένιες Vegan 255 gr,1.0
2025-08-19,201424,Βετεράνο Μπισκοτάκι Χαρουπιού Με Αμύγδαλο &amp; Σταφίδα 250 gr,3.58
2025-08-19,156930,Champion Κρουασάν Με Διπλή Γέμιση Κακάo 100 gr,0.65
2025-08-19,190749,Big Taste Κρουασάν Με Γέμιση Κρέμα Μιλφέιγ 100 gr,0.78
2025-08-19,23805,Χιωτάκης Κρουασάν Πραλίνα Φουντουκιού 90 gr,0.8
2025-08-19,202717,Jaffa Bakery Donut Choco Cream 75 gr,1.06
2025-08-19,206281,Oreo Κέικ Choco Coated 24 gr,0.45
2025-08-19,106239,Χαλκιαδάκης Κριτσίνια Με Ηλιόσπορο 360 gr,2.58
2025-08-19,192443,Χαλκιαδάκης Κριτσίνια Πολύσπορα 250 gr,1.6
2025-08-19,192444,Χαλκιαδάκης Μακεδονικά Κριτσίνια Με Σουσάμι 300 gr,1.85
2025-08-19,128631,Χαλκιαδάκης Παξιμάδι Κρητικοφουρνιές 400 gr,2.58
2025-08-19,106242,Χαλκιαδάκης Παξιμάδι Κριθαρένιο 600 gr,2.58
2025-08-19,106241,Χαλκιαδάκης Παξιμάδι Κριθαροκουλουρίτσα 600 gr,2.58
2025-08-19,106240,Χαλκιαδάκης Παξιμάδι Κριθαροκουλούρα 600 gr,2.58
2025-08-19,106243,Χαλκιαδάκης Παξιμαδάκι Κριθαρένιο 400 gr,2.25
2025-08-19,124797,Χαλκιαδάκης Παξιμαδάκι Τύπου Κυθήρων 400 gr,2.27
2025-08-19,185691,Grand&#039;s Cookies Βουτήματα Μπιάνκα Γεμιστά 300 gr,4.18
2025-08-19,206529,Grand&#039;s Cookies Choco Αμυγδαλωτό 300 gr,4.85
2025-08-19,106681,Grand&#039;s Cookies Μουστοκούλουρα 400 gr,2.72
2025-08-19,174918,Tsiknakis Οικογένεια Τσικνάκη Γλυκιά Μπουκιά Με Χαρούπι &amp; Cranberries 400 gr,4.26
2025-08-19,174916,Tsiknakis Οικογένεια Τσικνάκη Γλυκιά Μπουκιά Με Χαρούπι &amp; Αμύγδαλο 400 gr,4.26
2025-08-19,174917,Tsiknakis Οικογένεια Τσικνάκη Γλυκιά Μπουκιά Με Χαρούπι 400 gr,4.02
2025-08-19,68773,Αγροτικός Οικοτεχνικός Συνεταιρισμός Γυναικών Κρουσώνα Κουλουράκια Πορτοκαλιού 400 gr,4.84
2025-08-19,91348,Αγροτικός Οικοτεχνικός Συνεταιρισμός Γυναικών Κρουσώνα Λαδοκούλουρα 400 gr,4.84
2025-08-19,68772,Αγροτικός Οικοτεχνικός Συνεταιρισμός Γυναικών Κρουσώνα Παξιμαδάκια Αμύγδαλου 400 gr,4.84
2025-08-19,191778,Αρτώ Λαδοκούλουρα 270 gr,1.79
2025-08-19,35869,Ασιτιανά Παραδοσιακά Εδέσματα Βουτήματα Μπίρας 400 gr,4.2
2025-08-19,121992,Ασιτιανά Παραδοσιακά Εδέσματα Βουτήματα Πορτοκαλιού 400 gr,4.2
2025-08-19,121994,Ασιτιανά Παραδοσιακά Εδέσματα Κουλουράκια Κανέλας 400 gr,4.35
2025-08-19,35870,Ασιτιανά Παραδοσιακά Εδέσματα Μπισκότα Μαρμελάδα 400 gr,4.35
2025-08-19,35871,Ασιτιανά Παραδοσιακά Εδέσματα Μπισκότα Πεταλάκια 400 gr,4.35
2025-08-19,121993,Ασιτιανά Παραδοσιακά Εδέσματα Παξιμαδάκι Κακάο 400 gr,4.2
2025-08-19,203314,Βετεράνο Βουτήματα Σταφιδωτά 350 gr ,4.35
2025-08-19,165494,Δερμίσης Μουστοκούλουρα 200 gr,0.99
2025-08-19,121989,Ιδαία Γη Βουτήματα Κακάο 300 gr,3.35
2025-08-19,121990,Ιδαία Γη Βουτήματα Κρασάτα 300 gr,3.35
2025-08-19,121991,Ιδαία Γη Βουτήματα Λαδερά 300 gr,3.35
2025-08-19,198650,Κρητών Άρτος Μικιό Μπισκοτάκι Με Αμύγδαλο &amp; Μέλι 80 gr,1.2
2025-08-19,198651,Κρητών Άρτος Μικιό Μπισκοτάκι Σοκολάτας 80 gr,1.2
2025-08-19,94485,Μίνθη Κουλουράκια Κρασάτα 330 gr,3.55
2025-08-19,94486,Μίνθη Κουλουράκια Λαδερά Με Σουσάμι 330 gr,3.55
2025-08-19,94487,Μίνθη Κουλουράκια Σταφιδωτά 330 gr,3.55
2025-08-19,179536,Ντουρουντούς Μπισκότα Με Βρώμη &amp; Cranberries 220 gr,3.34
2025-08-19,194332,Ντουρουντούς Μπισκότα Με Μέλι &amp; Καρύδι 150 gr,3.14
