2024-08-12,166417,Ερωφίλη Αυγενάκης Παξιμάδι Χαρουπιού Χωρίς Μαγιά &amp; Ζάχαρη 350 gr,3.58
2024-08-12,139814,Κρητών Άρτος Παξιμάδι Ολικής Άλεσης Με 4 Δημητριακά &amp; Χαρούπι 350 gr,3.4
2024-08-12,186332,Krambals Bruschetta Τομάτα &amp; Mozzarella 70 gr,1.05
2024-08-12,186333,Krambals Bruschetta Cream Cheese 70 gr,1.05
2024-08-12,192443,Χαλκιαδάκης Κριτσίνια Πολύσπορα 250 gr,1.6
2024-08-12,106239,Χαλκιαδάκης Κριτσίνια Με Ηλιόσπορο 360 gr,2.58
2024-08-12,192444,Χαλκιαδάκης Μακεδονικά Κριτσίνια Με Σουσάμι 300 gr,1.85
2024-08-12,196822,Elite Kritsi Snack Μεσογειακά Κριτσίνια Με Σουσάμι Λιναρόσπορος &amp; Παπαρουνόσπορος 125 gr,1.75
2024-08-12,196821,Elite Kritsi Snack Μεσογειακά Κριτσίνια Με Ντομάτα &amp; Ρίγανη 125 gr,1.75
2024-08-12,189160,Αρτοποιία Τσατσάκης Κριτσίνια Ευ Ζην Ολικής Με Ηλιόσπορο 30% Λιγότερο Αλάτι &amp; Ζάχαρη Vegan 200 gr,1.98
2024-08-12,189161,Αρτοποιία Τσατσάκης Κριτσίνια Ευ Ζην Πολύσπορα 30% Λιγότερο Αλάτι &amp; Ζάχαρη Vegan 200 gr,1.98
2024-08-12,198645,Κρητών Άρτος Κριτσίνι Με Ηλιόσπορο 180 gr,2.18
2024-08-12,198646,Κρητών Άρτος Κριτσίνι Με Σουσάμι Χωρίς Προσθήκη Ζάχαρης 180 gr,2.18
2024-08-12,198647,Κρητών Άρτος Κριτσίνι Μακεδονικό Ολικής Άλεσης Με Σουσάμι 180 gr,2.18
2024-08-12,198652,Κρητών Άρτος Μικιό Κριτσινάκι Τυριού 80 gr,1.2
2024-08-12,143190,Μελιστάλακτη Κριτσίνια Με Ηλιόσπορο 300 gr,3.24
2024-08-12,143191,Μελιστάλακτη Κριτσίνια Χαρουπάλευρου 300 gr,3.56
2024-08-12,186400,Το Μάννα Κριτσίνια Ποντιακά 250 gr,3.28
2024-08-12,186399,Το Μάννα Κριτσίνια Με Χαρούπι &amp; Νιφάδες Καλαμποκιού 170 gr,2.77
2024-08-12,186398,Το Μάννα Κριτσίνι Με Χαρούπι 170 gr,2.77
2024-08-12,191818,Grand&#039;s Cookies Κριτσίνια Κρίκος Σουσάμι 290 gr,3.6
2024-08-12,143100,Grand&#039;s Cookies Κριτσίνια Κρίκος Καλαμποκιού 290 gr,3.6
2024-08-12,143099,Grand&#039;s Cookies Κριτσίνια Κρίκος Ολικής Άλεσης 290 gr,3.6
2024-08-12,143098,Grand&#039;s Cookies Κριτσίνια Κρίκος Κανέλας 290 gr,3.6
2024-08-12,172673,Mulino Bianco Friabili Κριτσίνια Κλασικά 300 gr,3.15
2024-08-12,30211,Παπαδοπούλου Φρυγανιές Σταρένιες Vegan 255 gr,1.18
2024-08-12,146247,Παπαδοπούλου Φρυγανιές Χωρίς Γλουτένη Vegan 165 gr,3.62
2024-08-12,188493,Παπαδοπούλου Φρυγανιές Στρογγυλές Ολικής Άλεσης 140 gr,1.62
2024-08-12,190837,Παπαδοπούλου Χωριάτικες Φρυγανιές Με Χαρούπι Vegan 240 gr -0-30€,1.9
2024-08-12,185971,Παπαδοπούλου Φρυγανιές Σταρένιες Χωρίς Προσθήκη Αλατιού &amp; Ζάχαρης Vegan 4 x 80 gr -0-30€,1.7
2024-08-12,185972,Παπαδοπούλου Φρυγανιές Σίκαλης Χωρίς Προσθήκη Αλατιού &amp; Ζάχαρης Vegan 4 x 80 gr -0-30€,1.79
2024-08-12,194380,Elite Melba Toast Φρυγανιές Ολικής Άλεσης Vegan 100 gr,2.09
2024-08-12,192564,Elite Status Φρυγανιές Στρογγυλές Σταρένιες 125 gr,2.08
2024-08-12,192565,Elite Status Φρυγανιές Στρογγυλές Ολικής Άλεσης 125 gr,2.16
2024-08-12,89547,Elite Vita Φρυγανιές Ολικής Άλεσης 180 gr,1.28
2024-08-12,89548,Elite Vita Φρυγανιές Ολικής Άλεσης 3 x 90 gr + 1 Δώρο,2.16
2024-08-12,171955,Elite Vita Φρυγανιές Με Χαρούπι 250 gr,2.1
2024-08-12,78388,Forma Φρυγανιές Σταρένιες 3 x 125 gr + 1 Δώρο,1.8
2024-08-12,124001,Forma Φρυγανιές Σικάλεως 4 x 90 gr -0-50€,1.7
2024-08-12,192266,Βοσινάκη Φρυγανιές Χωριάτικες Σταρένιες 240 gr,2.08
2024-08-12,192267,Βοσινάκη Φρυγανιές Χωριάτικες Ολικής Άλεσης 240 gr,2.08
2024-08-12,113943,Σαμαριά Παξιμαδοφρυγανιές Σταρένιες 250 gr,2.66
2024-08-12,113944,Σαμαριά Παξιμαδοφρυγανιές Σικάλεως 250 gr,2.66
2024-08-12,178227,Σαμαριά Παξιμαδοφρυγανιές Με Μέλι Σταφίδες &amp; Αμύγδαλα 180 gr,2.45
2024-08-12,113945,Σαμαριά Παξιμαδοφρυγανιές Με Χαρούπι 250 gr,2.66
2024-08-12,132508,Μαράτα Φρυγανιές Σταρένιες 4 x 125 gr,1.36
2024-08-12,132509,Μαράτα Φρυγανιές Σικάλεως 4 x 90 gr,1.36
2024-08-12,181256,Παπαδοπούλου Thins Φρυγανιές Κλασικές Vegan 250 gr,2.28
2024-08-12,181255,Παπαδοπούλου Thins Φρυγανιές Ολικής Άλεσης Vegan 250 gr,2.28
2024-08-12,187008,Wasa Crackers Σίτου Με Γέμιση Τυρί Τομάτα &amp; Βασιλικό 40 gr,1.18
2024-08-12,61502,Wasa Φρυγανιές Original 275 gr,2.78
2024-08-12,177483,Wasa Φρυγανιές Ολικής Άλεσης 260 gr,2.93
2024-08-12,192110,Wasa Φρυγανιές Σίτου Με Γέμιση Τυρί &amp; Σχοινόπρασο 37 gr,1.18
2024-08-12,176404,Αρτοποιία Τσατσάκης Κρουτόν Διπλοφουρνιστά Σταρένια Vegan 150 gr,1.78
2024-08-12,176411,Αρτοποιία Τσατσάκης Κρουτόν Διπλοφουρνιστά Κρίθινα Ολικής Άλεσης 150 gr,1.78
2024-08-12,176415,Αρτοποιία Τσατσάκης Κρουτόν Διπλοφουρνιστά Με Ελαιόλαδο &amp; Σκόρδο Vegan 150 gr,1.78
2024-08-12,176414,Αρτοποιία Τσατσάκης Κρουτόν Διπλοφουρνιστά Με Ελιά Καλαμών Vegan 150 gr,1.78
2024-08-12,186662,Το Μάννα Κρητωνάκια Κρίθινα 100 gr +25% Δωρεάν Προϊόν,1.64
2024-08-12,186663,Το Μάννα Κρητωνάκια Σταρένια 100 gr +25% Δωρεάν Προϊόν ,1.64
2024-08-12,158018,Tipiak Κρουτόν Για Σαλάτα Caesar 50 gr,0.99
2024-08-12,87068,Leimer Κρουτόν 100 gr,2.06
2024-08-12,100484,Leimer Κρουτόν Με Γεύση Σκόρδο &amp; Κρεμμύδι 100 gr,2.06
2024-08-12,143198,Μελιστάλακτη Κρουτόν Κρίθινο Με Ρίγανη 400 gr,3.16
2024-08-12,147027,Μελόσπιτο Τρίμμα Φρυγανιάς 500 gr,1.38
2024-08-12,3574,Elite Φρυγανιά Τριμμένη Σίτου Με Σίκαλη 180 gr,1.04
2024-08-12,94059,Elite Φρυγανιά Τριμμένη Σίτου Με Σίκαλη 360 gr,1.56
2024-08-12,3891,Καραμολέγκος Τρίμμα Γαλέτας 370 gr,1.33
2024-08-12,198279,Serenata Κρουασάν Με Γέμιση Κρέμα Κακάο 5 x 70 gr + 1 Δώρο,2.95
2024-08-12,178322,Joker Κρουασάν Με Γέμιση Κρέμα Κακάο 70 gr,0.37
2024-08-12,178249,Joker Κρουασάν Με Γέμιση Κρέμα Κακάο 4 x 70 gr,1.35
2024-08-12,28168,7 Days Κρουασάν Με Κρέμα Κακάο 5 x 37 gr,2.28
2024-08-12,120269,7 Days Κρουασάν Με Κρέμα Κακάο 3 x 70 gr,1.5
2024-08-12,156926,7 Days Κρουασάν Hazelnut Με Πραλίνα Φουντουκιού 3 x 70 gr,1.5
2024-08-12,166532,7 Days Κρουασάν Double Κακάο Βανίλια 3 x 70 gr,1.5
2024-08-12,184478,Chipicao Κρουασάν Με Κρέμα Κακάο 60 gr,0.67
2024-08-12,181103,Big Taste Κρουασάν Κρέμα Κακάο Με Φουντούκι 90 gr,0.7
2024-08-12,177267,Big Taste Κρουασάν Με Πραλίνα Σοκολάτας Nucrema ION 85 gr,0.78
2024-08-12,192632,Big Taste Κρουασάν Με Πραλίνα Φουντουκιού 150 gr ΤΠ 1-30€,1.25
2024-08-12,190749,Big Taste Κρουασάν Με Γέμιση Κρέμα Μιλφέιγ 100 gr,0.98
2024-08-12,191416,Choco Big Κρουασάν Με Πραλίνα Φουντουκιού 250 gr ΤΠ 2-00€,1.9
2024-08-12,165607,Champion Κρουασάν Με Γέμιση Πραλίνας Φουντουκιού 4 x 70 gr,2.18
2024-08-12,156930,Champion Κρουασάν Με Διπλή Γέμιση Κακάo 100 gr,0.86
2024-08-12,161654,Praleda Κρουασάν Hazelnut 80 gr + 50% Δωρεάν Προϊόν,1.04
2024-08-12,198428,Folie Κρουασάν Με Γέμιση Πραλίνα 2 x 80 gr + 1 Δώρο,2.3
2024-08-12,174877,Folie Κρουασάν Black Velvet 100 gr -0-20€,1.12
2024-08-12,121284,Folie Κρουασάν Με Κακάο 80 gr + 25% Δωρεάν Προϊόν,1.15
2024-08-12,190869,Folie Κρουασάν Με Γέμιση Salted Caramel 80 gr,1.15
2024-08-12,179276,Οικογένεια Στεργίου Κρουασάν Με Πραλίνα 105 gr,1.06
2024-08-12,179275,Οικογένεια Στεργίου Κρουασάν Βιεννέζικο Με Κρέμα Σοκολάτα 120 gr,1.06
2024-08-12,179327,Big Taste Κρουασάν Με Γέμιση Φράουλα 85 gr,0.7
2024-08-12,188573,Folie Κρουασάν Red Velvet 3 x 100 gr ,3.59
2024-08-12,174878,Folie Κρουασάν Red Velvet 100 gr ,1.32
2024-08-12,192775,Folie Κρουασάν Lemon Pie 80 gr -0-20€,0.95
2024-08-12,150135,Μελόσπιτο Κρουασανάκια Γεμιστά Με Πραλίνα ΙΟΝ NuCrema 6 Τεμάχια 180 gr,2.5
2024-08-12,128942,Tottis Κρουασανάκια Χωρίς Γέμιση 260 gr -0-30€,2.55
2024-08-12,128943,Tottis Κρουασανάκια Κρέμα Κακάο 300 gr -0-30€,2.68
2024-08-12,174885,Tottis Κρουασανάκια Μιλφέιγ 300 gr -0-30€,2.68
2024-08-12,194626,Tottis Κρουασανάκια Κρέμα Κακάο 130 gr,1.39
2024-08-12,179277,Οικογένεια Στεργίου Κρουασανάκια 260 gr,2.54
2024-08-12,179278,Οικογένεια Στεργίου Κρουασανάκια Με Πραλίνα 300 gr,2.72
2024-08-12,186122,7 Days Mini Κρουασάν Με Κρέμα Κακάο 103 gr,1.58
2024-08-12,187267,7 Days Κρουασάν Μίνι Μίλφειγ 103 gr,1.58
2024-08-12,186121,7 Days Κρουασάν Μίνι Μίλφειγ 300 gr,3.78
2024-08-12,179273,Οικογένεια Στεργίου Strudel Μήλο &amp; Κανέλα 125 gr,1.06
2024-08-12,179281,Οικογένεια Στεργίου Φέτα Κέικ Ανάμικτο 80 gr,1.06
2024-08-12,179282,Οικογένεια Στεργίου Φέτα Κέικ Πορτοκάλι 80 gr,1.06
2024-08-12,186073,Οικογένεια Στεργίου Φέτα Κέικ Με Κανέλα &amp; Καρύδι 85 gr,1.06
2024-08-12,189234,Οικογένεια Στεργίου Κέικ Πορτοκάλι 400 gr,3.7
2024-08-12,179283,Οικογένεια Στεργίου Κέικ Ανάμικτο 400 gr,3.72
2024-08-12,191989,Αλλατίνη Κέικ Βανίλια Με Κακάο 375 gr,3.59
2024-08-12,191990,Αλλατίνη Κέικ Κακάο Με Κομμάτια Σοκολάτας 375 gr,3.59
2024-08-12,192264,Αλλατίνη Κέικ Βρώμης Μπανάνα &amp; Κομμάτια Μαύρης Σοκολάτας 375 gr,3.8
2024-08-12,154223,Gecchele Κέικ Με Κακάο Τετράγωνο 400 gr,3.25
2024-08-12,191704,Gecchele Κέικ Ανάμικτο 300 gr,2.7
2024-08-12,191705,Gecchele Κέικ Με Κομμάτια Σοκολάτας 300 gr,2.7
2024-08-12,191706,Gecchele Κέικ Σοκολάτας Με Κομμάτια Brownies 300 gr,3.25
2024-08-12,2066,Kuchenmeister Κέικ Κορμός Marble Marmor 400 gr,5.58
2024-08-12,2080,Kuchenmeister Κέικ Κορμός Στρατσιατέλα 400 gr,5.58
2024-08-12,122407,Lacta Cakes Choco Heart 175 gr,2.46
2024-08-12,133857,Lacta Cakes Choco Bomb 175 gr,2.46
2024-08-12,186054,Lacta Cakes Brownie 150 gr,2.46
2024-08-12,2095,Kinder Delice Κέικ 39 gr,0.7
2024-08-12,153159,Kinder Delice Κέικ 10 x 39 gr,5.25
2024-08-12,176487,7 Days Cake Bar Με Κρέμα Βανίλια 5 x 32 gr,2.38
2024-08-12,176486,7 Days Cake Bar Με Κρέμα Κακάο 5 x 32 gr,2.38
2024-08-12,55452,7 Days Swiss Roll Με Κακάο 200 gr,1.44
2024-08-12,154222,Gecchele Roll Με Λεμόνι 400 gr,3.25
2024-08-12,150037,Gecchele Roll Με Φράουλα 400 gr,3.25
2024-08-12,158174,Sweet &amp; Fresh Γλυκό Καρύδα 120 gr,1.08
2024-08-12,158176,Sweet &amp; Fresh Ρολό Κανέλας 140 gr,1.2
2024-08-12,185553,Οικογένεια Στεργίου Muffin Με Πραλίνα Σοκολάτας 120 gr,1.06
2024-08-12,175079,Έβγα Μηλόπιτα 80 gr,0.94
2024-08-12,179272,Οικογένεια Στεργίου Μηλόπιτα 105 gr,0.88
2024-08-12,179288,Οικογένεια Στεργίου Τσουρέκι Με Μαστίχα Χίου 380 gr,2.56
2024-08-12,180847,Οικογένεια Στεργίου Τσουρεκάκια Με Πραλίνα 360 gr,2.88
2024-08-12,179289,Οικογένεια Στεργίου Τσουρεκάκια Με Μαστίχα Χίου 300 gr,2.63
2024-08-12,180848,Οικογένεια Στεργίου Σταφιδόψωμα Vegan 290 gr + 60 gr Δωρεάν Προϊόν,2.34
2024-08-12,158177,Sweet &amp; Fresh Τσουρέκι Πολίτικο 450 gr,3.2
2024-08-12,190750,Big Taste Τσουρέκι Στριφτό 280 gr,1.98
2024-08-12,190751,Big Taste Τσουρεκάκι Στριφτό 125 gr,0.98
2024-08-12,187268,7 Days Τσουρέκι Κλασικό 380 gr,3.34
2024-08-12,89578,Περυσινάκης Τσουρεκάκι Σμυρνέικο 500 - 550 gr,4.06
2024-08-12,89577,Περυσινάκης Κουλούρι Προζυμένιο Vegan 500 - 550 gr,3.48
2024-08-12,179279,Οικογένεια Στεργίου Λουκουμάδες 4 Τεμάχια 340 gr,2.6
2024-08-12,179280,Οικογένεια Στεργίου Λουκουμάδες Με Πραλίνα 4 Τεμάχια 360 gr,3.0
2024-08-12,68772,Αγροτικός Οικοτεχνικός Συνεταιρισμός Γυναικών Κρουσώνα Παξιμαδάκια Αμύγδαλου 400 gr,4.2
2024-08-12,91348,Αγροτικός Οικοτεχνικός Συνεταιρισμός Γυναικών Κρουσώνα Λαδοκούλουρα 400 gr,4.2
2024-08-12,68773,Αγροτικός Οικοτεχνικός Συνεταιρισμός Γυναικών Κρουσώνα Κουλουράκια Πορτοκαλιού 400 gr,4.2
2024-08-12,94486,Μίνθη Κουλουράκια Λαδερά Με Σουσάμι 330 gr,3.55
2024-08-12,94485,Μίνθη Κουλουράκια Κρασάτα 330 gr,3.55
2024-08-12,94487,Μίνθη Κουλουράκια Σταφιδωτά 330 gr,3.55
2024-08-12,64611,Περράκης Cretan Bakery Λαδοκούλουρα Κανέλας 350 gr,3.62
2024-08-12,64610,Περράκης Cretan Bakery Βουτήματα Πορτοκαλιού 350 gr,3.62
2024-08-12,89579,Περυσινάκης Σταφιδωτό 500 gr ,4.62
2024-08-12,121994,Ασιτιανά Παραδοσιακά Εδέσματα Κουλουράκια Κανέλας 400 gr,4.35
2024-08-12,121992,Ασιτιανά Παραδοσιακά Εδέσματα Βουτήματα Πορτοκάλι 400 gr,4.2
2024-08-12,35869,Ασιτιανά Παραδοσιακά Εδέσματα Βουτήματα Μπίρας 400 gr,4.2
2024-08-12,35871,Ασιτιανά Παραδοσιακά Εδέσματα Μπισκότα Πεταλάκια 400 gr,4.35
2024-08-12,35870,Ασιτιανά Παραδοσιακά Εδέσματα Μπισκότα Μαρμελάδα 400 gr,4.35
2024-08-12,121991,Ιδαιά Γη Βουτήματα Λαδερά 300 gr,3.2
2024-08-12,121990,Ιδαιά Γη Βουτήματα Κρασάτα 300 gr,3.2
2024-08-12,121989,Ιδαιά Γη Βουτήματα Κακάο 300 gr,3.2
2024-08-12,157663,Κοινωνική Συνεταιριστική Επιχείρηση Γυναικών Ζωνιανών Βουτήματα Πτι-Φουρ Μαρμελάδα Βερίκοκο 400 gr,4.37
2024-08-12,149393,Μελόσπιτο Κουλούρι Κανέλας 100 gr,0.6
2024-08-12,157660,Κοινωνική Συνεταιριστική Επιχείρηση Γυναικών Ζωνιανών Κρασοκούλουρα 300 gr,3.65
2024-08-12,54976,Παπαδοπούλου Γλυκοκεράσματα Μπισκότα &amp; Γκοφρετίνια 400 gr,2.84
2024-08-12,185059,Παπαδοπούλου Γλυκοκεράσματα Μπισκότα Βουτύρου 330 gr,3.02
2024-08-12,165494,Δερμίσης Μουστοκούλουρα 200 gr,0.99
2024-08-12,106681,Grand&#039;s Cookies Βουτήματα Μουστοκούλουρα 400 gr,2.72
2024-08-12,122977,Grand&#039;s Cookies Βουτήματα Μπιάνκα Γεμιστά 380 gr,4.98
2024-08-12,186401,Το Μάννα Biscotti Πορτοκάλι 160 gr,2.37
2024-08-12,186402,Το Μάννα Biscotti Αμύγδαλο 160 gr,2.6
2024-08-12,186664,Το Μάννα Κουλουράκια Λαδιού Χωρίς Ζάχαρη 170 gr,3.16
2024-08-12,194332,Ντουρουντούς Μπισκότα Με Μέλι &amp; Καρύδι 150 gr,3.14
2024-08-12,179536,Ντουρουντούς Μπισκότα Με Βρώμη &amp; Cranberries 220 gr,3.34
2024-08-12,194860,Ντουρουντούς Μπισκότα Με Πολύσπορο &amp; Χαρουπόμελο 180 gr,3.16
2024-08-12,174916,Tsiknakis Οικογένεια Τσικνάκη Γλυκιά Μπουκιά Με Χαρούπι &amp; Αμύγδαλο 400 gr,4.26
2024-08-12,174917,Tsiknakis Οικογένεια Τσικνάκη Γλυκιά Μπουκιά Με Χαρούπι 400 gr,4.02
2024-08-12,174918,Tsiknakis Οικογένεια Τσικνάκη Γλυκιά Μπουκιά Με Χαρούπι &amp; Cranberries 400 gr,4.26
2024-08-12,198650,Κρητών Άρτος Μικιό Μπισκοτάκι Με Αμύγδαλο &amp; Μέλι 80 gr,1.2
2024-08-12,198651,Κρητών Άρτος Μικιό Μπισκοτάκι Σοκολάτας 80 gr,1.2
2024-08-12,199221,Champion Κρουασάν Super Με Γέμιση Πραλίνας Φουντουκιού 110 gr,1.0
2024-08-12,134721,Κρητών Άρτος Κρητικά Παξιμάδια Κριθαρένια ΠΓΕ 600 gr,3.86
2024-08-12,199109,Περυσινάκης Μπαλίτσα Σοκολάτας 500 gr,4.06
2024-08-12,178383,Μακεδονικός Χαλβάς Βανίλια Bitter Σοκολάτα,4.07
2024-08-12,172064,Μακεδονικός Χαλβάς Με Σοκολάτα &amp; Φουντούκια,4.07
2024-08-12,178324,Μακεδονικός Χαλβάς Με Σοκολάτα &amp; Πορτοκάλι Με Επικάλυψη Σοκολάτας,4.07
2024-08-12,189866,Μακεδονικός Χαλβάς Με Βανίλια Κομμάτια Σοκολάτας Με Επικάλυψη Ruby &amp; Αμύγδαλα,4.0
2024-08-12,189868,Μακεδονικός Χαλβάς Μαργαρίτα Σοκολάτας Ολόκληρα Φουντούκια &amp; Κροκάν Με Επικάλυψη Λευκής Σοκολάτας,4.0
2024-08-12,3985,Μακεδονικός Χαλβάς Με Αμύγδαλα Vegan Χωρίς Γλουτένη,3.05
2024-08-12,3995,Μακεδονικός Χαλβάς Βανίλια Vegan Χωρίς Γλουτένη,2.93
2024-08-12,3997,Μακεδονικός Χαλβάς Κακάο Vegan Χωρίς Γλουτένη,2.93
2024-08-12,3996,Μακεδονικός Χαλβάς Με Φυστίκια Vegan Χωρίς Γλουτένη,2.93
2024-08-12,150009,Creta Farms Εν Ελλάδι Γαλοπούλα Καπνιστή Με Ελαιόλαδο Σε Φέτες Χωρίς Γλουτένη 300 gr -0-60€,3.78
2024-08-12,186256,Tostaki Μπέικον Καπνιστό Σε Φέτες Χωρίς Γλουτένη 300 gr ,2.3
2024-08-12,189113,Creta Farms Λουκάνικα Χωριάτικα Με Γραβιέρα Χωρίς Γλουτένη 400 gr,3.36
2024-08-12,112849,Creta Farms Λουκάνικα Χωριάτικα Με Μυρωδικά Χωρίς Γλουτένη 400 gr,3.26
2024-08-12,184048,Όλυμπος Χαλβάς Με Βανίλια Φυστίκια &amp; Κομμάτια Σοκολάτας,5.04
2024-08-12,106254,Creta Farms Εν Ελλάδι Λουκάνικα Σφακιανά Χωριάτικα Με Ελαιόλαδο Χωρίς Γλουτένη 340 gr,3.18
2024-08-12,184049,Όλυμπος Χαλβάς Με Κακάο Φουντούκι &amp; Μπισκότο,4.87
2024-08-12,184047,Όλυμπος Χαλβάς Με Σοκολάτα Υγείας Αμύγδαλα Με Επικάλυψη,4.87
2024-08-12,184046,Όλυμπος Χαλβάς Μπανάνα Με Σοκολάτα Υγείας Φουντούκι,4.87
2024-08-12,112850,Creta Farms Λουκάνικα Χωριάτικα Με Πράσο Χωρίς Γλουτένη 400 gr,3.11
2024-08-12,45373,Όλυμπος Χαλβάς Με Αμύγδαλα Χωρίς Γλουτένη 400 gr,4.42
2024-08-12,167181,Πασσιάς Χωριάτικα Λουκάνικα Grill 380 gr,2.82
2024-08-12,159394,Ifantis Fouantre Γαλοπούλα Καπνιστή Σε Φέτες 1% Χωρίς Γλουτένη 300 gr,4.39
2024-08-12,79463,Creta Farms Εν Ελλάδι Φιλέτο Γαλοπούλα Καπνιστή Με Ελαιόλαδο Χωρίς Γλουτένη,1.78
2024-08-12,4003,Όλυμπος Χαλβάς Με Βανίλια Χωρίς Γλουτένη 400 gr,4.18
2024-08-12,45372,Όλυμπος Χαλβάς Με Κακάο Χωρίς Γλουτένη 400 gr,4.18
2024-08-12,160567,Πασσιάς Σαλάμι Αέρος Special Χωρίς Γλουτένη 200 gr,2.64
2024-08-12,178514,Πασσιάς Κορυφαίο Γαλοπούλα Ψητή Χωρίς Γλουτένη,2.13
2024-08-12,164803,Creta Farms &quot;Χωρίς&quot; Γαλοπούλα Ψητή Σε Φέτες 0-3% Χωρίς Γλουτένη 200 gr,3.11
2024-08-12,184045,Όλυμπος Χαλβάς Σοκολάτα Υγείας Με Αλμυρή Καραμέλα Χωρίς Γλουτένη 300 gr,3.91
2024-08-12,29517,Ifantis Fouantre Γαλοπούλα Καπνιστή 1% Χωρίς Γλουτένη,2.39
2024-08-12,149974,Πασσιάς Κορυφαίο Γαλοπούλα Στήθος Χωρίς Γλουτένη,2.4
2024-08-12,149981,Πασσιάς Σαλάμι Σκορδάτο Βραστό Χωρίς Γλουτένη 330 gr,2.37
2024-08-12,191168,Ifantis Γαλοπούλα Καπνιστή &amp; Τυρί Gouda Νουνού Σε Φέτες 280 gr,4.39
2024-08-12,191166,Ifantis Γαλοπούλα Καπνιστή &amp; Τυρί Milner Σε Φέτες 280 gr,4.39
2024-08-12,90793,Creta Farms Εν Ελλάδι Γαλοπούλα Βραστή Με Ελαιόλαδο Σε Φέτες Χωρίς Γλουτένη 160 gr -0-40€,2.15
2024-08-12,96519,Creta Farms Εν Ελλάδι Γαλοπούλα Καπνιστή Με Ελαιόλαδο Σε Φέτες Χωρίς Γλουτένη 160 gr -0-40€,2.15
2024-08-12,178513,Πασσιάς Κορυφαίο Χοιρομέρι Ψητό Χωρίς Γλουτένη,2.12
2024-08-12,149972,Πασσιάς Γαλοπούλα Καπνιστή Χωρίς Γλουτένη,2.01
2024-08-12,141323,Ifantis Καπνιστή Γαλοπούλα Φιλέτο Σε Φέτες Χωρίς Γλουτένη 160 gr -0-20€,1.97
2024-08-12,164910,Όλυμπος Έδεσμα Σουσαμιού Σοκολάτα Με Στέβια Χωρίς Γλουτένη 250 gr,3.01
2024-08-12,171881,Όλυμπος Χαλβάς Με Σοκολάτα Αμύγδαλο Χωρίς Γλουτένη 250 gr,2.88
2024-08-12,189324,Ifantis Τα Λουκάνικα Της Μάρως Χωριάτικα Χωρίς Γλουτένη 340 gr,3.35
2024-08-12,159393,Ifantis Fouantre Ζαμπόν Μπούτι Καπνιστό Σε Φέτες 4% Χωρίς Γλουτένη 300 gr,4.4
2024-08-12,171101,Πασσιάς Μπέικον Σε Φέτες Χωρίς Γλουτένη 140 gr,1.95
2024-08-12,112791,Tostaki Φιλέτο Γαλοπούλας Βραστή Χωρίς Γλουτένη,1.55
2024-08-12,112792,Tostaki Φιλέτο Γαλοπούλας Καπνιστή Χωρίς Γλουτένη,1.55
2024-08-12,170539,Πασσιάς Μορταδέλα Ιταλίας,1.53
2024-08-12,183055,Esti Φυτικό Λουκάνικο Vegan Χωρίς Γλουτένη 200 gr,3.82
2024-08-12,26012,Creta Farms Εν Ελλάδι Πάριζα Με Ελαιόλαδο 5% Χωρίς Γλουτένη,1.06
2024-08-12,26614,Ifantis Παριζάκι Χωρίς Γλουτένη 330 gr -0-20€,2.76
2024-08-12,96757,Πατεράκης Family Απάκι Κρήτης Σε Φέτες Χωρίς Γλουτένη 250 gr,3.62
2024-08-12,4236,Ifantis Fouantre Ζαμπόν Μπούτι Χοιρινό Χωρίς Γλουτένη,2.7
2024-08-12,149977,Πασσιάς Πάριζα,1.2
2024-08-12,194373,Ifantis Τα Κτόπουλα Της Μάρως Ψητό Κοτόπουλο Χωρίς Γλουτένη,2.39
2024-08-12,188881,Creta Farms &quot;Χωρίς&quot; Πάριζα Με 30% Λιγότερα Λιπαρά Χωρίς Γλουτένη,1.18
2024-08-12,112643,Ifantis Σαλάμι Σκορδάτο Βραστό Χωρίς Γλουτένη 370 gr,3.12
2024-08-12,175584,Πασσιάς Λουκάνικα Hot Dog Χωρίς Γλουτένη 300 gr,2.25
2024-08-12,162407,Εδέμ Αγγουράκι Μέτριο Vegan 355 gr,2.2
2024-08-12,194372,Ifantis Τα Κτόπουλα Της Μάρως Ψητό Κοτόπουλο Σε Φέτες Χωρίς Γλουτένη 160 gr,2.15
