2025-08-19,179192,Pampers Pants Πάνες Βρεφών Ν6 15+ kg 48 Τεμάχια,14.2
2025-08-19,199076,Pampers Pants Πάνες Βρεφών Ν7 17+ kg 22 Τεμάχια,7.72
2025-08-19,167528,Pampers Premium Care Pants Πάνες Βρεφών Ν3 6-11 kg 48 Τεμάχια,12.09
2025-08-19,167529,Pampers Premium Care Pants Πάνες Βρεφών Ν4 9-15 kg 38 Τεμάχια,12.09
2025-08-19,167530,Pampers Premium Care Pants Πάνες Βρεφών Ν5 12-17 kg 34 Τεμάχια,12.09
2025-08-19,201891,Pampers Premium Care Pants Πάνες Βρεφών Ν5 12-17 kg 52 Τεμάχια,16.89
2025-08-19,167531,Pampers Premium Care Pants Πάνες Βρεφών Ν6 15+ kg 31 Τεμάχια,11.63
2025-08-19,201890,Pampers Premium Care Pants Πάνες Βρεφών Ν6 15+ kg 42 Τεμάχια,14.79
2025-08-19,191763,Pampers Premium Care Pants Πάνες Βρεφών Ν7 15+ kg 27 Τεμάχια,11.63
2025-08-19,191856,Pampers Premium Care Πάνες Βρεφών Ν1 2-5 kg 50 Τεμάχια,10.44
2025-08-19,166834,Pampers Premium Care Πάνες Βρεφών Ν2 4-8 kg 46 Τεμάχια,10.44
2025-08-19,153121,Pampers Premium Care Πάνες Βρεφών Ν3 6-10 kg 60 Τεμάχια,13.63
2025-08-19,153123,Pampers Premium Care Πάνες Βρεφών Ν4 9-14 kg 52 Τεμάχια,13.63
2025-08-19,201889,Pampers Premium Care Πάνες Βρεφών Ν4 9-14 kg 68 Τεμάχια,16.89
2025-08-19,153124,Pampers Premium Care Πάνες Βρεφών Ν5 11-16 kg 44 Τεμάχια,13.63
2025-08-19,201888,Pampers Premium Care Πάνες Βρεφών Ν5 11-16 kg 58 Τεμάχια,16.89
2025-08-19,171408,Pampers Premium Care Πάνες Βρεφών Ν6 13+ kg 38 Τεμάχια,13.63
2025-08-19,199106,Septona Calm N&#039; Care Πάνες Βρεφών Extra Large Ν6 13-20 kg 38 Τεμάχια,8.9
2025-08-19,199097,Septona Calm N&#039; Care Πάνες Βρεφών Junior Ν5 10-16 kg 42 Τεμάχια,9.9
2025-08-19,199105,Septona Calm N&#039; Care Πάνες Βρεφών Junior Ν5 11-16 kg 44 Τεμάχια,8.9
2025-08-19,199096,Septona Calm N&#039; Care Πάνες Βρεφών Maxi Ν4 7-13 kg 48 Τεμάχια,9.9
2025-08-19,199104,Septona Calm N&#039; Care Πάνες Βρεφών Maxi Ν4 8-13 kg 52 Τεμάχια,8.9
2025-08-19,199101,Septona Calm N&#039; Care Πάνες Βρεφών Midi Ν3 4-9 kg 28 Τεμάχια,5.98
2025-08-19,206273,Adelco Kids Spray Μαλλιών Για Εύκολο Χτένισμα &amp; Κρέμα μαλλιών 200 ml,3.3
2025-08-19,165661,Johnson&#039;s Baby Βρεφικό Λάδι Aloe Vera 300 ml,2.7
2025-08-19,165663,Johnson&#039;s Baby Βρεφικό Λάδι Bedtime 300 ml,2.7
2025-08-19,165664,Johnson&#039;s Baby Βρεφικό Λάδι Regular 300 ml,2.7
2025-08-19,205436,Johnson&#039;s Baby Κρέμα Συγκάματος 100 ml,2.97
2025-08-19,193841,Johnson&#039;s Baby Πούδρα Με Aloe &amp; Vitamine E 100 gr,1.98
2025-08-19,161287,Otrisalin Παιδικός Φυσιολογικός Ορός Παιδικός 18 x 5 ml,4.46
2025-08-19,147897,Septona Baby Calm N&#039; Care Βρεφικό Λάδι Βάλσαμο &amp; Ελαιόλαδο 200 ml,2.13
2025-08-19,170263,Septona Kids Calm N&#039; Care Μαλακτική Για Κορίτσια 3+ Ετών 200 ml,2.89
2025-08-19,174627,Σφουγγάρι Μπάνιου Baby Soft 2 Τεμάχια ,3.7
2025-08-19,174622,Σφουγγάρι Μπάνιου Παιδικό Με Ήρωες,4.5
2025-08-19,165657,Johnson&#039;s Baby Shiny Drops Conditioner Spray 200 ml,2.68
2025-08-19,165656,Johnson&#039;s Baby Κρέμα Shiny Drops 500 ml,3.0
2025-08-19,165676,Johnson&#039;s Baby Λοσιόν Bed Time 300 ml,2.58
2025-08-19,165678,Johnson&#039;s Baby Λοσιόν Soft Pink 300 ml,2.58
2025-08-19,130029,Septona Baby Calm N&#039; Care Ενυδατική Κρέμα Βάλσαμο &amp; Λεβάντα 150 ml,3.24
2025-08-19,130027,Septona Baby Calm N&#039; Care Κρέμα Συγκάματος Βάλσαμο &amp; Πανθενόλη 100 ml,3.02
2025-08-19,178584,Septona Baby Calm N&#039; Care Κρέμα Συγκάματος Βάλσαμο &amp; Πανθενόλη 250 ml,5.84
2025-08-19,176402,Agnotis Αφρόλουτρο Παιδικό 400 ml,3.63
2025-08-19,165670,Johnson&#039;s Baby Αφρόλουτρο Bedtime 500 ml,2.5
2025-08-19,165671,Johnson&#039;s Baby Αφρόλουτρο Blue 750 ml,2.86
2025-08-19,174294,Johnson&#039;s Baby Αφρόλουτρο Bubble 750 ml,2.86
2025-08-19,165650,Johnson&#039;s Baby Σαμπουάν Bedtime 500 ml,2.5
2025-08-19,165643,Johnson&#039;s Baby Σαμπουάν Gold 300 ml,1.78
2025-08-19,165644,Johnson&#039;s Baby Σαμπουάν Gold 500 ml,2.5
2025-08-19,165645,Johnson&#039;s Baby Σαμπουάν Gold 750 ml ,2.54
2025-08-19,165649,Johnson&#039;s Baby Σαμπουάν No More Tangles 500 ml,2.5
2025-08-19,165651,Johnson&#039;s Baby Σαμπουάν Shiny Drops 500 ml,2.5
2025-08-19,165646,Johnson&#039;s Baby Σαμπουάν Χαμομήλι 300 ml,1.78
2025-08-19,165648,Johnson&#039;s Baby Σαμπουάν Χαμομήλι 750 ml,2.54
2025-08-19,205464,Palmolive Kids Αφρόλουτρο Sea Creatures 750 ml,2.65
2025-08-19,130252,Palmolive Αφρόλουτρο Για Παιδιά Με Αντλία Vegan 750 ml,2.39
2025-08-19,135435,Proderm Kids Σαμπουάν 500 ml ,5.48
2025-08-19,135234,Proderm Σαμπουάν &amp; Αφρόλουτρο 0-12 Μηνών 400 ml,4.31
2025-08-19,135307,Proderm Σαμπουάν &amp; Αφρόλουτρο 1 - 3 Ετών 400 ml,4.31
2025-08-19,135440,Proderm Σαμπουάν &amp; Αφρόλουτρο 3+ Ετών 700 ml,5.14
2025-08-19,179512,Sanex Αφρόλουτρο Zero% Παιδικό Vegan 475 ml,2.76
2025-08-19,179598,Sanex Αφρόλουτρο Παιδικό Vegan 475 ml,2.76
2025-08-19,172911,Sanex Αφρόλουτρο Παιδικό Με Αντλία Vegan 750 ml,3.52
2025-08-19,178585,Septona Baby Calm N&#039; Care Αφρόλουτρο Με Βάλσαμο &amp; Πανθενόλη 500 ml ,2.63
2025-08-19,130030,Septona Baby Calm N&#039; Care Σαμπουάν &amp; Αφρόλουτρο Βάλσαμο &amp; Αλόη 500 ml,3.02
2025-08-19,130028,Septona Baby Calm N&#039; Care Σαμπουάν &amp; Αφρόλουτρο Βάλσαμο &amp; Λεβάντα 500 ml,3.04
2025-08-19,178586,Septona Baby Calm N&#039; Care Σαμπουάν &amp; Αφρόλουτρο Βάλσαμο &amp; Χαμομήλι 500 ml,3.04
2025-08-19,170264,Septona Kids Calm N&#039; Care Αφρόλουτρο Για Κορίτσια 3+ Ετών 750 ml,3.0
2025-08-19,173818,Septona Kids Calm N&#039; Care Σαμπουάν &amp; Αφρόλουτρο Για Αγόρια &amp; Κορίτσια 3+ Ετών 750 ml,3.08
2025-08-19,170262,Septona Kids Calm N&#039; Care Σαμπουάν &amp; Αφρόλουτρο Για Αγόρια 3+ Ετών 750 ml,3.6
2025-08-19,170265,Septona Kids Calm N&#039; Care Σαμπουάν Για Κορίτσια 3+ Ετών 500 ml,3.34
2025-08-19,125928,Scholl Velvet Ηλεκτρική Λίμα Ποδιών,31.92
2025-08-19,198541,Excellence Creme Βαφή Μαλλιών 5U Καστανό Ανοιχτό,7.54
2025-08-19,198539,Excellence Creme Βαφή Μαλλιών 5UR Φυσικό Κόκκινο,7.54
2025-08-19,198537,Excellence Creme Βαφή Μαλλιών 7U Φυσικό Ξανθό,7.54
2025-08-19,198540,Excellence Creme Βαφή Μαλλιών 7UR Φυσικό Χάλκινο,7.54
2025-08-19,198538,Excellence Creme Βαφή Μαλλιών 6U Φυσικό Ξανθό Σκούρο,7.42
2025-08-19,191065,Garnier Skin Active Κρέμα Ματιών Vitamine C 15 ml,7.13
2025-08-19,183574,Garnier Skin Naturals Hyaluronic Aloe Super Serum Ορός Προσώπου 30 ml,7.05
2025-08-19,185469,Garnier Ορός Λάμψης Με Vitamin C 30 ml,7.05
2025-08-19,36807,Excellence Creme Βαφή Μαλλιών N1 Μαύρο 48 ml ,6.94
2025-08-19,142194,Excellence Creme Βαφή Μαλλιών N10.21 Κατάξανθο Περλέ Σαντρέ 48 ml,6.94
2025-08-19,36808,Excellence Creme Βαφή Μαλλιών N5 Καστανό Ανοιχτό 48 ml,6.94
2025-08-19,36810,Excellence Creme Βαφή Μαλλιών N6 Ξανθό Σκούρο 48 ml,6.94
2025-08-19,114430,Excellence Creme Βαφή Μαλλιών N6.7 Σοκολατί 48 ml,6.94
2025-08-19,36811,Excellence Creme Βαφή Μαλλιών N7 Ξανθό 48 ml,6.94
2025-08-19,37414,Excellence Creme Βαφή Μαλλιών N7.1 Ξανθό Σαντρέ 48 ml,6.94
2025-08-19,199342,Excellence Creme Βαφή Μαλλιών N7.7 Καστανό Μελί 48 ml,6.94
2025-08-19,37769,Excellence Creme Βαφή Μαλλιών N8 Ξανθό Ανοιχτό 48 ml,6.94
2025-08-19,36973,Excellence Creme Βαφή Μαλλιών N8.1 Ξανθό Ανοιχτό Σαντρέ 48 ml,6.94
2025-08-19,36812,Excellence Creme Βαφή Μαλλιών N9 Ξανθό Πολύ Ανοιχτό 48 ml,6.94
2025-08-19,43513,Excellence Creme Βαφή Μαλλιών N9.1 Ξανθό Πολύ Ανοιχτό Σαντρέ 48 ml,6.94
2025-08-19,105412,Excellence Pure Blonde Βαφή Μαλλιών N1 Υπέρ Ξανθό Φυσικό 48 ml,6.94
2025-08-19,142258,Magic Retouch Spray Κάλυψης Brown 75 ml,6.21
2025-08-19,142259,Magic Retouch Spray Κάλυψης Dark Blonde 75 ml,6.21
2025-08-19,142257,Magic Retouch Spray Κάλυψης Dark Brown 75 ml,6.21
2025-08-19,142256,Magic Retouch Spray Κάλυψης Ρίζας Black 75 ml,6.21
2025-08-19,142260,Magic Retouch Spray Κάλυψης Ρίζας Blonde 75 ml,6.21
2025-08-19,152527,Magic Retouch Spray Κάλυψης Mahogany Brown 75 ml,6.04
2025-08-19,92781,Elnett Λακ Extra Δυνατό Κράτημα 400 ml,5.84
2025-08-19,93885,Elnett Λακ Satin Κανονικά Μαλλιά 400 ml,5.84
2025-08-19,178612,Garnier Skin Naturals Hyaluronic Aloe Jelly Ενυδατική Κρέμα Για Κανονική Επιδερμίδα 50 ml,4.97
2025-08-19,184708,Maybelline Μάσκαρα Colossal Curl Bounce Black ,12.62
2025-08-19,180184,Maybelline Μάσκαρα Lash Sensational Sky High Για Μήκος &amp; Όγκο ,12.62
2025-08-19,94658,Maybelline Μάσκαρα Falsies Black Drama,12.6
2025-08-19,150317,Garnier Νερό Διφασικό Ντεμακιγιάζ Micellaire Όλα Σε 1 400 ml,4.65
2025-08-19,172973,Garnier Νερό Ντεμακιγιάζ Micellaire Με Ροδόνερο 400 ml,4.65
2025-08-19,124078,Garnier Νερό Ντεμακιγιάζ Micellar 400 ml,4.65
2025-08-19,173433,Maybelline Μάσκαρα Falsies Lash Lift ,11.98
2025-08-19,196866,Fructis Μάσκα Μαλλιών Hair Food 3 Σε 1 Banana Ξηρά Vegan 400 ml,5.56
2025-08-19,204153,Fructis Μάσκα Μαλλιών Keratin Sleek 370 ml,5.56
2025-08-19,171969,Maybelline Κραγιόν Super Stay Matte Ink No10 Dreamer Blister 5 ml,11.64
2025-08-19,171964,Maybelline Κραγιόν Super Stay Matte Ink No118 Dancer 5 ml,11.64
2025-08-19,171963,Maybelline Κραγιόν Super Stay Matte Ink No120 Artist 5 ml,11.64
2025-08-19,171962,Maybelline Κραγιόν Super Stay Matte Ink No125 Inspiper Blister 5 ml,11.64
2025-08-19,171968,Maybelline Κραγιόν Super Stay Matte Ink No15 Lover Blister 5 ml,11.64
2025-08-19,171966,Maybelline Κραγιόν Super Stay Matte Ink No35 Creator 5 ml,11.64
2025-08-19,171967,Maybelline Κραγιόν Super Stay Matte Ink No65 Pioneer 5 ml,11.64
2025-08-19,171965,Maybelline Κραγιόν Super Stay Matte Ink No65 Seductres Blister 5 ml,11.64
2025-08-19,139306,Maybelline Μάσκαρα Lash Sensational Black,11.36
2025-08-19,180388,Maybelline Κραγιόν Super Stay Matte Ink No10 Dreamer 5 ml,11.28
2025-08-19,180392,Maybelline Κραγιόν Super Stay Matte Ink No125 Inspiper 5 ml,11.28
2025-08-19,180389,Maybelline Κραγιόν Super Stay Matte Ink No15 Lover 5 ml,11.28
2025-08-19,180390,Maybelline Κραγιόν Super Stay Matte Ink No65 Pioneer Blister 5 ml,11.28
2025-08-19,180391,Maybelline Κραγιόν Super Stay Matte Ink No65 Seductres 5 ml,11.28
2025-08-19,156985,Maybelline Κονσίλερ Instant Age Rewind Light 6 ml,10.96
2025-08-19,156986,Maybelline Κονσίλερ Instant Age Rewind Medium 6 ml,10.96
2025-08-19,93884,Elnett Λακ Satin Κανονικά Μαλλιά 200 ml,4.11
2025-08-19,180393,Maybelline Κονσίλερ Instant Anti Age Eraser Nude 6 ml,10.86
2025-08-19,180394,Maybelline Κονσίλερ Instant Antin Age Eraser Light 6 ml,10.86
2025-08-19,33407,Fructis Κερί Μαλλιών Για Δυνατό Κράτημα 75 ml,4.04
2025-08-19,178613,Garnier Skin Naturals Gel Καθαρισμού Προσώπου Hyaluronic Aloe Vegan 200 ml,3.84
2025-08-19,103882,Garnier Color Sensation Βαφή Μαλλιών Ν1.0 Μαύρο Vegan 40 ml,3.83
2025-08-19,168240,Garnier Color Sensation Βαφή Μαλλιών Ν10.1 Κατάξανθο Σαντρέ Vegan 40 ml,3.83
2025-08-19,103892,Garnier Color Sensation Βαφή Μαλλιών Ν110 Κατάξανθο Φυσικό Vegan 40 ml,3.83
2025-08-19,188505,Garnier Color Sensation Βαφή Μαλλιών Ν2.10 Μαύρο Μπλε Vegan 40 ml,3.83
2025-08-19,103887,Garnier Color Sensation Βαφή Μαλλιών Ν3.0 Καστανό Σκούρο Vegan 40 ml,3.83
2025-08-19,103884,Garnier Color Sensation Βαφή Μαλλιών Ν4.0 Καστανό Vegan 40 ml,3.83
2025-08-19,103891,Garnier Color Sensation Βαφή Μαλλιών Ν4.15 Παγωμένο Σοκολατί Vegan 40 ml,3.83
2025-08-19,103886,Garnier Color Sensation Βαφή Μαλλιών Ν5.0 Φωτεινό Καστανό Ανοιχτό Vegan 40 ml,3.83
2025-08-19,103883,Garnier Color Sensation Βαφή Μαλλιών Ν6.0 Ξανθό Σκούρο Vegan 40 ml,3.83
2025-08-19,103890,Garnier Color Sensation Βαφή Μαλλιών Ν6.60 Έντονο Κόκκινο Vegan 40 ml,3.83
2025-08-19,103881,Garnier Color Sensation Βαφή Μαλλιών Ν7.0 Ξανθό Vegan 40 ml,3.83
2025-08-19,103885,Garnier Color Sensation Βαφή Μαλλιών Ν8.0 Φωτεινό Ξανθό Ανοιχτό Vegan 40 ml,3.83
2025-08-19,103888,Garnier Color Sensation Βαφή Μαλλιών Ν9.13 Κρυστάλλινο Ξανθό Vegan 40 ml,3.83
2025-08-19,201731,Tesori D&#039;Oriente Αφρόλουτρο Byzantium 500 ml,4.54
2025-08-19,201125,Tesori D&#039;Oriente Αφρόλουτρο Hammam 500 ml,4.54
2025-08-19,121742,Tesori D&#039;Oriente Αφρόλουτρο White Musk 500 ml,4.54
2025-08-19,85871,Maybelline Μάσκαρα Colossal 100% Black ,9.66
2025-08-19,129251,Maybelline Μάσκαρα Colossal Go Extreme Black ,9.66
2025-08-19,80280,Maybelline Μάσκαρα Colossal Volume Express ,9.66
2025-08-19,118725,Scholl Κρέμα Ανάπλασης Για Σκασμένες Πτέρνες 60 ml,9.52
2025-08-19,204152,Fructis Μαλακτική Μαλλιών Keratin Sleek 200 ml,4.21
2025-08-19,180398,Maybelline Μάσκαρα Colossal 100% Black,9.02
2025-08-19,184172,Maybelline Μάσκαρα Colossal 36h Αδιάβροχη Για Όγκο Black ,9.02
2025-08-19,9642,Noxzema Men Αφρός Ξυρίσματος Sensitive 300 ml,3.18
2025-08-19,9643,Noxzema Αφρός Ξυρίσματος Classic 300 ml,3.18
2025-08-19,10491,Maybelline Μάσκαρα Volum Express Για Όγκο,7.86
2025-08-19,204151,Fructis Σαμπουάν Keratin Sleek Vegan 200 ml,3.56
2025-08-19,191239,Garnier Botanic Therapy Μάσκα Μαλλιών Charcoal Vegan 340 ml,4.88
2025-08-19,180396,Maybelline Μάσκαρα Colossal Volume Express Black ,7.34
2025-08-19,158043,Fructis Σαμπουάν Aloe Hydra Bomb Vegan 400 ml,3.08
2025-08-19,151958,Fructis Σαμπουάν Δύναμη &amp; Λάμψη Vegan 400 ml,3.08
2025-08-19,151985,Fructis Σαμπουάν Εντατικής Επανόρθωσης Damage Eraser Vegan 400 ml,3.08
2025-08-19,185573,Fructis Σαμπουάν Μαλλιών Vitamine &amp; Strength Vegan 400 ml,3.08
2025-08-19,118729,Scholl Fresh Step Αποσμητικό Υποδημάτων Spray 150 ml,6.32
2025-08-19,180395,Maybelline Μολύβι Ματιών Tattoo Liner Gel Για Μεγάλη Διάρκεια ,5.96
2025-08-19,190687,Wash &amp; Go Σαμπουάν 2 In 1 Anti-Dandruff 360 ml,3.29
2025-08-19,190689,Wash &amp; Go Σαμπουάν 2 In 1 Classic 360 ml,3.29
2025-08-19,190688,Wash &amp; Go Σαμπουάν 2 In 1 Sport 360 ml ,3.29
2025-08-19,190835,Wash &amp; Go Σαμπουάν Ενδυνάμωσης &amp; Conditioner Για Όλα Τα Μαλλιά 360 ml ,3.29
2025-08-19,190686,Wash &amp; Go Σαμπουάν Κανονικά Μαλλιά 360 ml ,3.29
2025-08-19,176842,Garnier Botanic Therapy Σαμπουάν Avocado Oil &amp; Shea Butter 400 ml,3.18
2025-08-19,191238,Garnier Botanic Therapy Σαμπουάν Charcoal Vegan 400 ml,3.18
2025-08-19,145651,Garnier Botanic Therapy Σαμπουάν Honey Treasures 400 ml,3.18
2025-08-19,153875,Garnier Botanic Therapy Σαμπουάν Maple Healer 400 ml,3.18
2025-08-19,196577,Garnier Botanic Therapy Σαμπουάν Rice Water &amp; Strach Rituals Vegan 400 ml,3.18
2025-08-19,158260,Garnier Skin Active Διφασικό Micellaire Όλα σε 1 Ντεμακιγιάζ 100 ml,1.69
2025-08-19,155428,Garnier Νερό Ντεμακιγιάζ Micellaire 100 ml,1.69
2025-08-19,170375,Lifoplus Ξύλινη Βούρτσα Πλάτης,6.31
2025-08-19,147673,Garnier Skin Active Μάσκα Προσώπου Moisture Bomb Υφασμάτινη Vegan 32 gr,1.61
2025-08-19,158044,Garnier Skin Active Μάσκα Προσώπου Pure Charcoal BlackΥφασμάτινη Vegan 28 gr,1.61
2025-08-19,204480,Liposan Ενυδατικό Χειλιών Sun Protect SPF 50,3.11
2025-08-19,120481,Maybelline Express Manicure Ξεβαφτικό Νυχιών Με Έλαιο Αβοκάντο 125 ml,4.0
2025-08-19,120482,Maybelline Express Manicure Ξεβαφτικό Νυχιών Με Έλαιο Αμυγδάλου 125 ml,4.0
2025-08-19,176843,Garnier Botanic Therapy Κρέμα Μαλλιών Avocando Oil &amp; Shea Butter 200 ml,2.58
2025-08-19,191237,Garnier Botanic Therapy Κρέμα Μαλλιών Charcoal Vegan 200 ml,2.58
2025-08-19,145652,Garnier Botanic Therapy Κρέμα Μαλλιών Honey Treasures Για Φθαρμένα 200 ml,2.58
2025-08-19,196578,Garnier Botanic Therapy Κρέμα Μαλλιών Rice Water &amp; Strach Rituals 200 ml,2.58
2025-08-19,113320,Maybelline Μολύβι Ματιών Expression Kajal Black ,2.96
2025-08-19,114062,Lifoplus Γάντι Μπάνιου Λούφας Διπλής Όψεως,3.55
2025-08-19,198743,Liposan Ενυδατικό Χειλιών Caring Beauty Nude Pink 4.8 gr,3.33
2025-08-19,190527,Liposan Ενυδατικό Χειλιών Soft Rose 4-8 gr,2.72
2025-08-19,193268,Liposan Ενυδατικό Χειλιών Βατόμουρο Vegan 4-8 gr,2.72
2025-08-19,9406,Liposan Ενυδατικό Χειλιών Κεράσι Vegan 4-8 gr,2.72
2025-08-19,9407,Liposan Ενυδατικό Χειλιών Λευκό 4-8 gr,2.72
2025-08-19,114061,Lifoplus Γάντι Μπάνιου Λούφας Classic,2.25
2025-08-19,196262,Lifoplus Σφουγγάρι Σώματος Με Τούλι ,2.01
2025-08-19,114060,Lifoplus Γάντι Μπάνιου Λούφας Mini,1.9
2025-08-19,174629,Lifoplus Ακατέργαστη Λούφα Με Κορδόνι ,1.84
2025-08-19,104745,Carroten Protect &amp; Shine Αντηλιακό Spray Μαλλιών Vegan 150 ml,7.48
2025-08-19,206460,Pantene Pro V Αντηλιακό Spray Μαλλιών Sunkiss Glow 200 ml,6.59
2025-08-19,190702,Ambre Solaire Kids Αντηλιακό Γαλάκτωμα SPF 50+ 175 ml,9.4
2025-08-19,190706,Ambre Solaire Sensitive Advanced Trigger Αντηλιακό Spray SPF 50 270 ml,12.35
2025-08-19,190715,Carroten Kids Face &amp; Body Αντηλιακό Γαλάκτωμα Spray SPF 50 Vegan 200 ml,9.73
2025-08-19,190724,Carroten Kids Protect Plus Face &amp; Body Αντηλιακό Γαλάκτωμα Spray SPF 30 Vegan 270 ml,10.73
2025-08-19,190720,Carroten Kids Protect Plus Face &amp; Body Αντηλιακό Γαλάκτωμα Spray SPF 50 Vegan 270 ml,11.23
2025-08-19,190721,Carroten Kids Sensitive Face &amp; Body Αντηλιακό Γαλάκτωμα Spray SPF 50+ Vegan 270 ml,11.48
2025-08-19,185264,Nivea Sun Babies &amp; Kids Sensitive Protect Αντηλιακή Λοσιόν SPF 50+ 200 ml,10.68
2025-08-19,185262,Nivea Sun Babies &amp; Kids Sensitive Protect Αντηλιακό Spray SPF 50+ 270 ml,12.45
2025-08-19,159577,Nivea Sun Kids Protect &amp; Care Αντηλιακή Λοσιόν SPF 50+ 200 ml,10.28
2025-08-19,173211,Nivea Sun Kids Protect &amp; Care Αντηλιακό Roll On SPF 50+ 50 ml,5.3
2025-08-19,81784,Nivea Sun Kids Protect &amp; Care Αντηλιακό Spray SPF 50+ 200 ml,10.85
2025-08-19,185266,Nivea Sun Kids Protect &amp; Care Αντηλιακό Spray SPF 50+ 270 ml,11.9
2025-08-19,204159,Carroten Illuminating UV Fluid Αντηλιακή Λοσιόν Προσώπου SPF 50+ 50 ml,8.98
2025-08-19,185219,Carroten Anti Age Spot Αντηλιακή Κρέμα Προσώπου SPF 50 50 ml,8.48
2025-08-19,133333,Carroten CC Αντηλιακή Κρέμα Προσώπου SPF50 50 ml,8.48
2025-08-19,133342,Carroten Sensitive Αντηλιακή Κρέμα Προσώπου SPF 50+ 50 ml,8.48
2025-08-19,96635,Carroten Νερό Προσώπου Spray 150 ml,4.48
2025-08-19,159572,Nivea Sun Anti Age Αντηλιακή Κρέμα Προσώπου Q10 Κανονική/Ξηρή Επιδερμίδα SPF 50 50 ml,8.99
2025-08-19,159570,Nivea Sun Mat Look Αντηλιακή Κρέμα Προσώπου SPF 50 50 ml,8.24
2025-08-19,190601,Nivea Sun Mat Look Αντηλιακή Κρέμα Προσώπου Κανονική/Μικτή Επιδερμίδα SPF 50 50 ml,8.39
2025-08-19,190602,Nivea Sun Spot Control Luminous 630 Αντηλιακή Κρέμα Προσώπου SPF 50+ 40 ml ,9.79
2025-08-19,166399,Piz Buin Sensitive Αντηλιακή Κρέμα Προσώπου SPF 50+ 50 ml,7.33
2025-08-19,185234,Ambre Solaire Αντηλιακό Λάδι Προστασίας SPF 30 150 ml,9.98
2025-08-19,46813,Ambre Solaire Αντηλιακό Λάδι Προστασίας Τροπικό Μαύρισμα SPF 2 200 ml,6.53
2025-08-19,179198,Carroten Coconut Dreams Αντηλιακό Διάφανο Spray SPF30 Vegan 200 ml,9.48
2025-08-19,179199,Carroten Coconut Dreams Αντηλιακό Διάφανο Spray SPF50 Vegan 200 ml,10.23
2025-08-19,173198,Carroten Coconut Dreams Αντηλιακό Λάδι Spray SPF 30 Vegan 150 ml,9.48
2025-08-19,190722,Carroten Family Face &amp; Body Αντηλιακό Γαλάκτωμα Spray SPF 30 Vegan 270 ml,10.23
2025-08-19,190717,Carroten Family Face &amp; Body Αντηλιακό Γαλάκτωμα Spray SPF 50 Vegan 270 ml,10.73
2025-08-19,159591,Carroten Gold Intensive Taning Gel Για Πολύ Έντονο Μαύρισμα SPF 0 Vegan 150 ml,11.48
2025-08-19,159582,Carroten Intense Tan Αντηλιακό Λάδι Καρύδας Spray SPF 0 Vegan 200 ml,7.48
2025-08-19,159583,Carroten Intense Tan Αντηλιακό Λάδι Καρύδας Spray SPF 6 Vegan 200 ml,7.48
2025-08-19,159592,Carroten Intensive Tanning Gel Για Πολύ Έντονο Μαύρισμα SPF 0 150 ml,11.48
2025-08-19,204158,Carroten Protect &amp; Tan Αντηλιακό Γαλάκτωμα Spray SPF 50 Vegan 270 ml,11.23
2025-08-19,159605,Carroten Protect &amp; Hydrate Αντηλιακό Γαλάκτωμα SPF 30 Vegan 200 ml,8.98
2025-08-19,190713,Carroten Protect &amp; Hydrate Αντηλιακό Γαλάκτωμα SPF 50 Vegan 200 ml,9.48
2025-08-19,87813,Carroten Protect &amp; Hydrate Αντηλιακό Γαλάκτωμα Spray SPF 30 Vegan 200 ml,9.48
2025-08-19,144527,Carroten Protect &amp; Tan Αντηλιακό Γαλάκτωμα Spray SPF 30 Vegan 200 ml,9.73
2025-08-19,190716,Carroten Protect &amp; Tan Αντηλιακό Γαλάκτωμα Spray SPF 30 Vegan 270 ml,10.73
2025-08-19,190718,Carroten Protect &amp; Tan Αντηλιακό Λάδι Spray SPF 20 Vegan 150 ml,8.98
2025-08-19,190719,Carroten Protect &amp; Tan Αντηλιακό Λάδι Spray SPF 30 Vegan 150 ml,9.48
2025-08-19,166197,Carroten Sensitive Αντηλιακό Γαλάκτωμα SPF 50+ Vegan 200 ml,9.73
2025-08-19,133337,Carroten Sensitive Αντηλιακό Γαλάκτωμα Spray SPF 50+ Vegan 200 ml,10.23
2025-08-19,177568,Nivea Cellular Luminous 630 Κρέμα Ημέρας Κατά Των Κηλίδων SPF 50 40 ml,14.66
2025-08-19,75242,Nivea Sun Intense Bronze Αντηλιακή Λοσιόν Με Καροτίνη SPF 6 200 ml,7.09
2025-08-19,144514,Nivea Sun Intense Bronze Λάδι Με Καροτίνη Spray SPF 0 200 ml,7.38
2025-08-19,144513,Nivea Sun Intense Bronze Λάδι Με Καροτίνη Spray SPF 6 200 ml,7.38
2025-08-19,185259,Nivea Sun Protect &amp; Bronze Αντηλιακό Spray SPF 20 270 ml,10.6
2025-08-19,104657,Nivea Sun Protect &amp; Bronze Αντηλιακό Spray SPF 30 200 ml,10.39
2025-08-19,185260,Nivea Sun Protect &amp; Bronze Αντηλιακό Spray SPF 30 270 ml,11.18
2025-08-19,190599,Nivea Sun Protect &amp; Bronze Αντηλιακό Spray SPF 50 270 ml,11.59
2025-08-19,132866,Nivea Sun Protect &amp; Bronze Αντηλιακό Λάδι SPF 20 200 ml,9.0
2025-08-19,132867,Nivea Sun Protect &amp; Bronze Λάδι Spray SPF 30 200 ml,9.6
2025-08-19,173208,Nivea Sun Protect &amp; Dry Touch Αντηλιακό Sport Spray SPF 50 200 ml,10.85
2025-08-19,159573,Nivea Sun Protect &amp; Dry Touch Αντηλιακό Spray SPF 50 200 ml,10.85
2025-08-19,15877,Nivea Sun Protect &amp; Moisture Αντηλιακή Λοσιόν SPF 20 200 ml,9.19
2025-08-19,81785,Nivea Sun Protect &amp; Moisture Αντηλιακή Λοσιόν SPF 30 200 ml,9.73
2025-08-19,81786,Nivea Sun Protect &amp; Moisture Αντηλιακή Λοσιόν SPF 50+ 200 ml,10.25
2025-08-19,25463,Nivea Sun Protect &amp; Moisture Αντηλιακό Spray SPF 30 200 ml,10.25
2025-08-19,185257,Nivea Sun Protect &amp; Moisture Αντηλιακό Spray SPF 30 270 ml,10.83
2025-08-19,60808,Nivea Sun Protect &amp; Moisture Αντηλιακό Spray SPF 50+ 200 ml,10.84
2025-08-19,185258,Nivea Sun Protect &amp; Moisture Αντηλιακό Spray SPF 50+ 270 ml,11.34
